answer_five,answer_four,answer_seven,polarity,sentiment_gs,tweet,tweet_tokens,absa_token_weights_3389,absa_sentiment_3389,absa_scores_3389,absa_token_weights_3392,absa_sentiment_3392,absa_scores_3392,absa_token_weights_3412,absa_sentiment_3412,absa_scores_3412,absa_token_weights_3414,absa_sentiment_3414,absa_scores_3414,absa_token_weights_3419,absa_sentiment_3419,absa_scores_3419,absa_token_weights_3430,absa_sentiment_3430,absa_scores_3430,absa_token_weights_3431,absa_sentiment_3431,absa_scores_3431,absa_token_weights_3434,absa_sentiment_3434,absa_scores_3434,absa_token_weights_3435,absa_sentiment_3435,absa_scores_3435,absa_token_weights_3436,absa_sentiment_3436,absa_scores_3436,absa_token_weights_3441,absa_sentiment_3441,absa_scores_3441,absa_token_weights_3450,absa_sentiment_3450,absa_scores_3450,absa_token_weights_3459,absa_sentiment_3459,absa_scores_3459,absa_token_weights_3466,absa_sentiment_3466,absa_scores_3466,absa_token_weights_3467,absa_sentiment_3467,absa_scores_3467,absa_token_weights_3472,absa_sentiment_3472,absa_scores_3472,absa_token_weights_3475,absa_sentiment_3475,absa_scores_3475,absa_token_weights_3477,absa_sentiment_3477,absa_scores_3477,absa_token_weights_3478,absa_sentiment_3478,absa_scores_3478,absa_token_weights_3479,absa_sentiment_3479,absa_scores_3479,sentiment_tb
100.0,100.0,86.0,0.7,neutral,RT @alliance_F: Wichtiger Entscheid: NR stimmt mit 113:80 Stimmen der Vorlage über die Finanzhilfen für familienergänzende Kinderbetreuung…,wichtig entscheid nr stimmen stimmen vorlage finanzhilfen familienergänzende kinderbetreuung,"{'Wichtiger': 0.05, 'Entscheid': 0.07, 'NR': 0, 'stimmt': 0, 'mit': 0, '113:80': 0, 'Stimmen': 0, 'der': 0.14, 'Vorlage': 0, 'über': 0, 'die': 0.14, 'Finanzhilfen': 0, 'für': 1.0, 'familienergänzende': 0.16, 'Kinderbetreuung': 0.95, '…': 0}",neutral,"[0.73629427, 0.04285193, 0.22085379]",,,,,,,,,,,,,,,,,,,,,,,,,,,,,,,,,,,,,,,,,,,,,,,,,,,,,,,,,,positive
75.0,75.0,71.0,0.35,neutral,"Krankenkassen sollen #Cannabis-Medis zahlen http://t.co/tvy2OS07Hz Legalisieren! Auch als Genussmittel, doch viel mehr als Arznei! #wahlch15",krankenkassen sollen cannabis medis zahlen legalisieren genussmittel mehr arznei wahlch15,,,,"{'Krankenkassen': 0.095, 'sollen': 0.03, 'Cannabis-Medis': 0, 'zahlen': 0, 'Legalisieren': 0.08, 'Auch': 0.04, 'als': 0.04, 'Genussmittel': 0.06, 'doch': 0, 'viel': 0.03, 'mehr': 0.03, 'Arznei': 0, 'wahlch15': 1.0}",positive,"[0.3061187, 0.044333503, 0.64954776]",,,,,,,,,,,,,,,,,,,,,,,,,,,,,,,,,,,,,,,,,,,,,,,,,,,,,,,positive
25.0,25.0,28.0,-0.3333333333333333,neutral,http://t.co/t15LDCMrYn 14-Jährige koksen. Eine höchst beunruhigende Entwicklung. Dennoch kriminalisieren konservative lieber #Cannabis.,jährige koksen höchst beunruhigend entwicklung dennoch kriminalisieren konservative lieb cannabis,,,,"{'14-Jährige': 0.035, 'koksen': 0.05, 'Eine': 0, 'höchst': 0, 'beunruhigende': 0, 'Entwicklung': 0.07, 'Dennoch': 0, 'kriminalisieren': 1.0, 'konservative': 0, 'lieber': 0, 'Cannabis': 0.29}",neutral,"[0.60201377, 0.04594562, 0.35204053]",,,,,,,,,,,,,,,,,,,,,,,,,,,,,,,,,,,,,,,,,,,,,,,,,,,,,,,negative
100.0,100.0,100.0,1.0,neutral,"Der Nationalrat stimmt grossmehrheitlich JA zu ""Cannabis für Schwerkranke"" #SVP mehrheitlich dagegen, #CVP gespalten. #wahlch15 Gut so!",nationalrat stimmen grossmehrheitlich ja cannabis schwerkranke svp mehrheitlich dagegen cvp spalten wahlch15 gut,,,,"{'Der': 0.08, 'Nationalrat': 0.075, 'stimmt': 0, 'grossmehrheitlich': 0.06, 'JA': 0, 'zu': 0.19, 'Cannabis': 1.0, 'für': 0.14, 'Schwerkranke': 0.07, 'SVP': 0, 'mehrheitlich': 0, 'dagegen': 0.08, 'CVP': 0.02, 'gespalten': 0.03, 'wahlch15': 0.05, 'Gut': 0, 'so': 0}",positive,"[0.0028779379, 0.0014660639, 0.995656]",,,,,,,,,,,,,,,,,,,,,,,,,,,,,,,,,,,,,,,,,,,,,,,,,,,,,,,positive
75.0,75.0,71.0,0.2333333333333333,neutral,"@PhTschopp Ich befürworte eine Angleichung des Rentenalters, doch wenn man sich die Zahlen ansieht, zweifle ich ob das reichen wird.",befürworten angleichung rentenalters zahlen ansehen zweifeln reich,,,,,,,"{'Ich': 0.03, 'befürworte': 0, 'eine': 0, 'Angleichung': 0, 'des': 0, 'Rentenalters': 0.35, 'doch': 0, 'wenn': 0.05, 'man': 0, 'sich': 0, 'die': 0.07, 'Zahlen': 0.33, 'ansieht': 0.05, 'zweifle': 0.07, 'ich': 0.03, 'ob': 0, 'das': 0.06, 'reichen': 0, 'wird': 0.04}",positive,"[0.20094566, 0.007009702, 0.79204464]",,,,,,,,,,,,,,,,,,,,,,,,,,,,,,,,,,,,,,,,,,,,,,,,,,,,neutral
50.0,75.0,57.0,0.0,neutral,"RT @JakobKreu3fe1d: „430 Millionen für Vaterschaftsurlaub ist zu viel“ sagt der Bundesrat. 

9 Milliarden für neue Kampfjets
Jährlich 1,8 M…",millionen vaterschaftsurlaub sagen bundesrat milliarden neue kampfjets jährlich m,,,,,,,,,,"{'„': 0, '430': 0, 'Millionen': 0, 'für': 0, 'Vaterschaftsurlaub': 0, 'ist': 0, 'zu': 0, 'viel': 0, '“': 0, 'sagt': 0, 'der': 0, 'Bundesrat': 0, '9': 0, 'Milliarden': 0, 'neue': 0, 'Kampfjets': 0, 'Jährlich': 0, '1,8': 0, 'M': 0, '…': 0}",negative,"[0.023329955, 0.9311047, 0.045565344]",,,,,,,,,,,,,,,,,,,,,,,,,,,,,,,,,,,,,,,,,,,,,,,,,neutral
50.0,75.0,57.0,0.0,neutral,Mit der Ablehnung des #Vaterschaftsurlaub verpasst der Bundesrat eine Chance. Die Schweiz bleibt eines der wenigen Länder ohne @papizeit.,ablehnung vaterschaftsurlaub verpasst bundesrat chance schweiz bleiben wenig länder,,,,,,,,,,"{'Mit': 0.15, 'der': 0.03, 'Ablehnung': 0.52, 'des': 0, 'Vaterschaftsurlaub': 0.59, 'verpasst': 0, 'Bundesrat': 0.09, 'eine': 0.03, 'Chance': 0, 'Die': 0.03, 'Schweiz': 0.08, 'bleibt': 0.04, 'eines': 0.03, 'wenigen': 0.03, 'Länder': 0.04, 'ohne': 0.01}",negative,"[0.18669838, 0.52672005, 0.28658152]",,,,,,,,,,,,,,,,,,,,,,,,,,,,,,,,,,,,,,,,,,,,,,,,,neutral
75.0,100.0,86.0,0.5,neutral,"RT @Emei21: 1 Mrd. für #sion2026=Finanzierung für 2,5 Jahre #Vaterschaftsurlaub Nein zu den absurden Prioritäten des #BR 👉🏼 https://t.co/EM…",mrd sion2026 finanzierung jahre vaterschaftsurlaub nein absurd prioritäten br,,,,,,,,,,"{'1': 0, 'Mrd.': 0.07, 'für': 0.11, 'sion2026=Finanzierung': 0.20500000000000002, '2,5': 0, 'Jahre': 0.33, 'Vaterschaftsurlaub': 0.45, 'Nein': 0.29, 'zu': 0.1, 'den': 0.08, 'absurden': 0.29, 'Prioritäten': 0.06, 'des': 0, 'BR': 0.07}",positive,"[0.018261716, 0.037164707, 0.9445736]",,,,,,,,,,,,,,,,,,,,,,,,,,,,,,,,,,,,,,,,,,,,,,,,,positive
0.0,0.0,0.0,-1.0,negative,Wird wohl vorläufig nix mit dem Vaterschaftsurlaub. Schade. @papizeit #ParlCH,wohl vorläufig nix vaterschaftsurlaub schaden parlch,,,,,,,,,,"{'Wird': 0, 'wohl': 0, 'vorläufig': 0, 'nix': 0, 'mit': 0.11, 'dem': 0.05, 'Vaterschaftsurlaub': 0.345, 'Schade': 0, 'ParlCH': 0.18}",neutral,"[0.48875532, 0.42629248, 0.08495216]",,,,,,,,,,,,,,,,,,,,,,,,,,,,,,,,,,,,,,,,,,,,,,,,,negative
50.0,75.0,57.0,0.0,neutral,RT @papizeit: Fakt bleibt: Schweiz = Sonderfall #Vaterschaftsurlaub #OECD Ländervergleich #srfarena http://t.co/utHQFYexJf,fakt bleiben schweiz sonderfall vaterschaftsurlaub oecd ländervergleich srfarena,,,,,,,,,,"{'Fakt': 0.08, 'bleibt': 0.07, 'Schweiz': 0.17, 'Sonderfall': 0.36, 'Vaterschaftsurlaub': 1.0, 'OECD': 0.23, 'Ländervergleich': 0.12, 'srfarena': 0.17}",positive,"[0.08931875, 0.011766611, 0.8989147]",,,,,,,,,,,,,,,,,,,,,,,,,,,,,,,,,,,,,,,,,,,,,,,,,neutral
50.0,75.0,57.0,0.0,neutral,"RT @Akadierin: Körperliche Unversehrtheit gelte auch nach dem Tod. 
Sagen die Organspende-Gegner. 
Ob die sich mal vorgestellt haben, wie u…",körperlich unversehrtheit gelten tod sagen organspende gegner mal vorstellen u,,,,,,,,,,,,,"{'Körperliche': 0.12, 'Unversehrtheit': 0.15, 'gelte': 0, 'auch': 0.11, 'nach': 0.08, 'dem': 0.06, 'Tod': 0, 'Sagen': 0.11, 'die': 0.06, 'Organspende-Gegner': 0.21500000000000002, 'Ob': 0, 'sich': 0, 'mal': 0, 'vorgestellt': 0, 'haben': 0, 'wie': 0.89, 'u': 0.94, '…': 0}",neutral,"[0.9401629, 0.017540643, 0.04229658]",,,,,,,,,,,,,,,,,,,,,,,,,,,,,,,,,,,,,,,,,,,,,,neutral
100.0,100.0,100.0,1.0,neutral,"RT @KilianBrogli: Heute ist #Sonnenwende. Ideal für Zeichensetzung #Wende in vielen Punkten #Asylrecht.
Happy birthday @couragesnowden
http…",heute sonnenwende ideal zeichensetzung wenden punkten asylrecht happy birthday http,,,,,,,,,,,,,,,,"{'Heute': 0.06, 'ist': 0.07, 'Sonnenwende': 0, 'Ideal': 0.26, 'für': 0.13, 'Zeichensetzung': 0.22, 'Wende': 0, 'in': 0.29, 'vielen': 0.45, 'Punkten': 0.85, 'Asylrecht': 0.77, 'Happy': 0.26, 'birthday': 0.13, 'http': 0.34, '…': 0}",positive,"[0.010487236, 0.0014790366, 0.9880337]",,,,,,,,,,,,,,,,,,,,,,,,,,,,,,,,,,,,,,,,,,,positive
50.0,75.0,57.0,0.0,neutral,"RT @KaelinIrene: Das Asylrecht für Menschen, welche an Leib und Leben bedroht werden, sollte auch im #Aargau eine humanitäre Selbstverständ…",asylrecht menschen welch leib leben bedrohen sollen aargau humanitär selbstverständ,,,,,,,,,,,,,,,,"{'Das': 0.03, 'Asylrecht': 1.0, 'für': 1.0, 'Menschen': 0.32, 'welche': 0, 'an': 0, 'Leib': 0, 'und': 0.05, 'Leben': 0.08, 'bedroht': 0.22, 'werden': 0, 'sollte': 0.53, 'auch': 0.12, 'im': 0, 'Aargau': 0.04, 'eine': 0, 'humanitäre': 0.11, 'Selbstverständ': 0.2, '…': 0}",positive,"[0.07645713, 0.02500463, 0.89853823]",,,,,,,,,,,,,,,,,,,,,,,,,,,,,,,,,,,,,,,,,,,neutral
100.0,100.0,100.0,0.75,neutral,"Die heutigen Resultate sind mehrheitlich erfreulich, wenn auch nicht wirklich überraschend. Weniger erfreulich stimmt mich ein Satz aus der @AargauerZeitung bezüglich des kantonalen Einbürgerungsgesetzes : ""Die Stimmbeteiligung betrug 37,98 Prozent"". 

Uff.",heutig resultate mehrheitlich erfreulich wirklich überraschen wenig erfreulich stimmen satz bezüglich kantonalen einbürgerungsgesetzes stimmbeteiligung betragen prozent uff,,,,,,,,,,,,,,,,,,,"{'Die': 0.05, 'heutigen': 0.03, 'Resultate': 0.12, 'sind': 0.01, 'mehrheitlich': 0.01, 'erfreulich': 0, 'wenn': 0.01, 'auch': 0, 'nicht': 0.01, 'wirklich': 0.01, 'überraschend': 0, 'Weniger': 0, 'stimmt': 0, 'mich': 0.05, 'ein': 0.04, 'Satz': 0.08, 'aus': 0, 'der': 0.05, 'bezüglich': 0, 'des': 0.05, 'kantonalen': 0.35, 'Einbürgerungsgesetzes': 1.0, 'Stimmbeteiligung': 0.08, 'betrug': 0, '37,98': 0, 'Prozent': 0.05, 'Uff': 0.04}",positive,"[0.2944138, 0.024685552, 0.68090063]",,,,,,,,,,,,,,,,,,,,,,,,,,,,,,,,,,,,,,,,positive
0.0,0.0,0.0,-1.0,negative,"https://t.co/Lm4A3kmTWw Kannste dir nicht ausdenken. Das ist dermassen absurd, nicht einmal Monty Python würde daraus einen Sketch machen. #Raclette #FrissOderStirb #Einbürgerung",kannste ausdenken dermassen absurd monty python daraus sketch raclette frissoderstirb einbürgerung,,,,,,,,,,,,,,,,,,,"{'Kannste': 0.08, 'dir': 0, 'nicht': 0.03, 'ausdenken': 0, 'Das': 0, 'ist': 0, 'dermassen': 0.07, 'absurd': 0.13, 'einmal': 0, 'Monty': 0.02, 'Python': 0.06, 'würde': 0.02, 'daraus': 0.03, 'einen': 0.04, 'Sketch': 0.08, 'machen': 0, 'Raclette': 0.11, 'FrissOderStirb': 0, 'Einbürgerung': 1.0}",neutral,"[0.82545865, 0.02007492, 0.15446636]",,,,,,,,,,,,,,,,,,,,,,,,,,,,,,,,,,,,,,,,negative
100.0,100.0,100.0,0.85,neutral,"RT @watson_news: Wer eingebürgert wird, integriert sich schneller und besser http://t.co/jhS4JvEMsY #SNF #Einbürgerung #SchweizerPass",wer einbürgern integrieren schnell gut snf einbürgerung schweizerpass,,,,,,,,,,,,,,,,,,,"{'Wer': 0.06, 'eingebürgert': 0.07, 'wird': 0, 'integriert': 0, 'sich': 0, 'schneller': 0, 'und': 0.12, 'besser': 0.1, 'SNF': 0.41, 'Einbürgerung': 1.0, 'SchweizerPass': 0}",positive,"[0.16326323, 0.020167595, 0.8165692]",,,,,,,,,,,,,,,,,,,,,,,,,,,,,,,,,,,,,,,,positive
50.0,75.0,57.0,0.0,neutral,RT @alinetrede: Frauen übergeben Bundespräsidentin Sommaruga das #Lohngleichheitsmanifest cc #MayaGraf @GrueneCH http://t.co/JEqA07H9Sc,frauen übergeben bundespräsidentin sommaruga lohngleichheitsmanifest cc mayagraf,,,,,,,,,,,,,,,,,,,,,,"{'Frauen': 0.8, 'übergeben': 0, 'Bundespräsidentin': 0.22, 'Sommaruga': 0.33, 'das': 0, 'Lohngleichheitsmanifest': 0.14, 'cc': 0.08, 'MayaGraf': 0.18}",neutral,"[0.62010497, 0.023713302, 0.35618177]",,,,,,,,,,,,,,,,,,,,,,,,,,,,,,,,,,,,,neutral
0.0,0.0,14.0,-0.7,neutral,Heute ist #Weltfrauentag passend dazu war gestern die Demo für #Lohngleichheit . Wir haben noch einen weiten Weg bis zur Gleichberechtigung!,heute weltfrauentag passen gestern demo lohngleichheit weit gleichberechtigung,,,,,,,,,,,,,,,,,,,,,,"{'Heute': 0.06, 'ist': 0.03, 'Weltfrauentag': 0, 'passend': 0, 'dazu': 0.27, 'war': 0, 'gestern': 0.04, 'die': 0.08, 'Demo': 0.12, 'für': 0.07, 'Lohngleichheit': 0, 'Wir': 0.13, 'haben': 0.18, 'noch': 0.21, 'einen': 0.09, 'weiten': 0, 'Weg': 0, 'bis': 0, 'zur': 0.17500000000000002, 'Gleichberechtigung': 0}",positive,"[0.07863599, 0.013342314, 0.90802175]",,,,,,,,,,,,,,,,,,,,,,,,,,,,,,,,,,,,,negative
100.0,100.0,100.0,0.85,neutral,RT @UniaSchweiz: Erfolgreiche Demonstration in Bern: Das Thema Lohngleichheit bewegt die Gemüter nach wie vor. http://t.co/BAoxcBAZWL,erfolgreich demonstration bern thema lohngleichheit bewegen gemüter,,,,,,,,,,,,,,,,,,,,,,"{'Erfolgreiche': 0.45, 'Demonstration': 0.71, 'in': 0.17, 'Bern': 0.22, 'Das': 0.68, 'Thema': 0, 'Lohngleichheit': 0.71, 'bewegt': 0, 'die': 0.68, 'Gemüter': 0, 'nach': 0, 'wie': 0, 'vor': 0}",negative,"[0.012707124, 0.9824082, 0.004884594]",,,,,,,,,,,,,,,,,,,,,,,,,,,,,,,,,,,,,positive
100.0,100.0,86.0,0.7,neutral,"So, auf dem Weg nach Bern zur Lohngleichheitsdemo! Wird cool ;) #bern #unia",bern lohngleichheitsdemo cool bern unia,,,,,,,,,,,,,,,,,,,,,,"{'So': 0.12, 'auf': 0.11, 'dem': 0.295, 'Weg': 0, 'nach': 0, 'Bern': 0.18, 'zur': 0.295, 'Lohngleichheitsdemo': 0.9924999999999999, 'Wird': 0.48, 'cool': 0.48, 'bern': 0.18, 'unia': 0}",positive,"[0.01354794, 0.0020058402, 0.9844462]",,,,,,,,,,,,,,,,,,,,,,,,,,,,,,,,,,,,,positive
50.0,75.0,57.0,0.075,negative,Auch wenn ich bezüglich Sterbehilfe eine andere Meinung als @LilianStuder habe stimme ich ihr zu dass der Hype schon ziemlich übertrieben wirkt (siehe unten). So gut wie jede Zeitung hat mehrere Artikel dazu veröffentlicht. Warum? Verdächtige das Sommerloch als Übeltäter. https://t.co/3CgrfWMMDL,bezüglich sterbehilfe meinung stimme hype schon ziemlich übertreiben wirken siehe unten gut jed zeitung mehrer artikel veröffentlichen warum verdächtigen sommerloch übeltäter,,,,,,,,,,,,,,,,,,,,,,,,,"{'Auch': 0, 'wenn': 0.06, 'ich': 0.05, 'bezüglich': 0, 'Sterbehilfe': 1.0, 'eine': 0, 'andere': 0, 'Meinung': 0.08, 'als': 0.01, 'habe': 0.02, 'stimme': 0, 'ihr': 0.07, 'zu': 0, 'dass': 0.03, 'der': 0.02, 'Hype': 0.1, 'schon': 0, 'ziemlich': 0.01, 'übertrieben': 0.03, 'wirkt': 0, 'siehe': 0, 'unten': 0.02, 'So': 0, 'gut': 0, 'wie': 0, 'jede': 0.01, 'Zeitung': 0.04, 'hat': 0, 'mehrere': 0.01, 'Artikel': 0, 'dazu': 0, 'veröffentlicht': 0, 'Warum': 0.01, 'Verdächtige': 0, 'das': 0.03, 'Sommerloch': 0.05, 'Übeltäter': 0}",positive,"[0.4484216, 0.0096768895, 0.5419016]",,,,,,,,,,,,,,,,,,,,,,,,,,,,,,,,,,neutral
0.0,0.0,0.0,-1.0,neutral,"RT @krick68: Es ist schwierig, die leichtfertigen Steuersenkungen der fetten Jahre auszutarieren http://t.co/ukMGLmxmyM via @AargauerZeitun…",schwierig leichtfertig steuersenkungen fetten jahre austarieren via,,,,,,,,,,,,,,,,,,,,,,,,,,,,"{'Es': 0.41, 'ist': 0.41, 'schwierig': 1.0, 'die': 0.1, 'leichtfertigen': 0.34, 'Steuersenkungen': 0.27, 'der': 0.1, 'fetten': 0.13, 'Jahre': 0.2, 'auszutarieren': 0.58, 'via': 0.24, '…': 0}",negative,"[0.019700248, 0.66577107, 0.3145287]",,,,,,,,,,,,,,,,,,,,,,,,,,,,,,,negative
50.0,75.0,57.0,0.0,negative,"RT @heuteshow: Corona-Maßnahme: Wirtschaftspolitiker der Union fordern, den #Mindestlohn zu senken. 
Denn wenn wir eins aus der Krise geler…",corona maßnahme wirtschaftspolitiker union fordern mindestlohn senken eins krise geler,,,,,,,,,,,,,,,,,,,,,,,,,,,,,,,"{'Corona-Maßnahme': 0.085, 'Wirtschaftspolitiker': 0.09, 'der': 0.07, 'Union': 0.1, 'fordern': 0, 'den': 0.07, 'Mindestlohn': 0.585, 'zu': 0.26, 'senken': 0, 'Denn': 0, 'wenn': 0.07, 'wir': 0, 'eins': 0, 'aus': 0.03, 'Krise': 0.14, 'geler': 0, '…': 0}",negative,"[0.21456604, 0.7474318, 0.038002197]",,,,,,,,,,,,,,,,,,,,,,,,,,,,neutral
50.0,75.0,57.0,0.0,neutral,"RT @OomenBerlin: Der Anbau von Erdbeeren wird ins Ausland verlagert, weil es dort keinen #Mindestlohn gibt? Dann ist in erster Linie der Tr…",anbau erdbeeren ausland verlagern mindestlohn geben erst linie tr,,,,,,,,,,,,,,,,,,,,,,,,,,,,,,,"{'Der': 0.03, 'Anbau': 0.06, 'von': 0, 'Erdbeeren': 0.06, 'wird': 0, 'ins': 0, 'Ausland': 0.07, 'verlagert': 0.09, 'weil': 0.39, 'es': 0.03, 'dort': 0.32, 'keinen': 0, 'Mindestlohn': 0.735, 'gibt': 0, 'Dann': 0.08, 'ist': 0.03, 'in': 0, 'erster': 0.03, 'Linie': 0, 'der': 0.03, 'Tr': 0, '…': 0}",negative,"[0.34985092, 0.63516015, 0.014988936]",,,,,,,,,,,,,,,,,,,,,,,,,,,,neutral
0.0,0.0,14.0,-0.7,neutral,@PhTschopp @rmm1963 Die Erbschaftssteuer mit Mindestlohn und 1:12 zu vergleichen ist extrem naiv. Sinn und Zweck unterscheiden sich gewaltig,erbschaftssteuer mindestlohn vergleichen extrem naiv sinn zweck unterscheiden gewaltig,,,,,,,,,,,,,,,,,,,,,,,,,,,,,,,"{'Die': 0.11, 'Erbschaftssteuer': 0.05, 'mit': 0.04, 'Mindestlohn': 0.05, 'und': 0.15, '1:12': 0, 'zu': 0, 'vergleichen': 0, 'ist': 0.06, 'extrem': 0.15, 'naiv': 0.32, 'Sinn': 0, 'Zweck': 0.24, 'unterscheiden': 0, 'sich': 0, 'gewaltig': 0}",neutral,"[0.6021514, 0.02731409, 0.37053457]",,,,,,,,,,,,,,,,,,,,,,,,,,,,negative
0.0,0.0,0.0,-1.0,neutral,RT @ClausHecking: #Energiewende auf afrikanisch:#Äthiopien will Industriestaat werden - nur mit Erneuerbaren.Utopisch? Jetzt @DIEZEIT https…,energiewende afrikanisch äthiopien industriestaat erneuerbaren utopisch https,,,,,,,,,,,,,,,,,,,,,,,,,,,,,,,,,,"{'Energiewende': 0.07, 'auf': 0, 'afrikanisch:#Äthiopien': 0.115, 'will': 0, 'Industriestaat': 0.31, 'werden': 0, 'nur': 1.0, 'mit': 0.71, 'Erneuerbaren': 1.0, 'Utopisch': 0, 'Jetzt': 0.09, 'https': 0.11, '…': 0}",neutral,"[0.72148776, 0.021908985, 0.25660324]",,,,,,,,,,,,,,,,,,,,,,,,,negative
100.0,100.0,86.0,0.7,negative,http://t.co/vmLCuarBOp Erneuerbare Energien zu stark subventioniert? Das ich nicht lache! #AKW's rentieren nicht! #energiewende2015,erneuerbare energien stark subventioniert lache akw s rentieren energiewende2015,,,,,,,,,,,,,,,,,,,,,,,,,,,,,,,,,,"{'Erneuerbare': 0.07, 'Energien': 0.05, 'zu': 0, 'stark': 0, 'subventioniert': 0.1, 'Das': 0, 'ich': 0.02, 'nicht': 0.05, 'lache': 0, ""AKW's"": 0, 'rentieren': 0, 'energiewende2015': 1.0}",negative,"[0.02793905, 0.9532259, 0.018835114]",,,,,,,,,,,,,,,,,,,,,,,,,positive
50.0,75.0,57.0,0.0,neutral,"RT @JUSOAargau: Gemeinsam mit @JFAargau, @jungegrueneAG und @jsvpaargau lancieren wir eine Petition für einen Nothalt beim E-Voting. Jetzt…",gemeinsam lancieren petition nothalt beim e voting,,,,,,,,,,,,,,,,,,,,,,,,,,,,,,,,,,,,,"{'Gemeinsam': 0.17, 'mit': 0.11, 'und': 0, 'lancieren': 0.31, 'wir': 0, 'eine': 0, 'Petition': 0.19, 'für': 0.08, 'einen': 0.07, 'Nothalt': 0, 'beim': 0, 'E-Voting': 0, 'Jetzt': 1.0, '…': 0}",neutral,"[0.6403017, 0.18558267, 0.17411558]",,,,,,,,,,,,,,,,,,,,,,neutral
50.0,75.0,57.0,0.0,neutral,"RT @sixtus: Anzunehmen, Verkehrswende hieße, Verbrenner-PKW durch E-PKW zu ersetzen, ist wie zu glauben, Digitalisierung sei das Austausche…",annehmen verkehrswende heißen verbrenner pkw e pkw ersetzen glauben digitalisierung austausche,,,,,,,,,,,,,,,,,,,,,,,,,,,,,,,,,,,,,,,,"{'Anzunehmen': 0, 'Verkehrswende': 0.08499999999999999, 'hieße': 0, 'Verbrenner-PKW': 0.04, 'durch': 0, 'E-PKW': 0, 'zu': 0, 'ersetzen': 0, 'ist': 0.58, 'wie': 0, 'glauben': 0, 'Digitalisierung': 0, 'sei': 0, 'das': 0.38, 'Austausche': 0, '…': 0}",neutral,"[0.61567813, 0.36781204, 0.016509809]",,,,,,,,,,,,,,,,,,,neutral
100.0,100.0,100.0,0.85,positive,"https://t.co/808qUeTb8j Freue mich riesig über die Berichterstattung der AZ von der diesjährigen #Jugendsession. Die Leitung der Gruppe Digitalisierung war spannend, noch spannender aber waren die Diskussionen und Vorstösse die erarbeitet wurden! Danke an alle TeilnehmerInnen!",freuen riesig berichterstattung az diesjährig jugendsession leitung gruppe digitalisierung spannen spannend diskussionen vorstösse erarbeiten danke all teilnehmerinnen,,,,,,,,,,,,,,,,,,,,,,,,,,,,,,,,,,,,,,,,"{'Freue': 0.02, 'mich': 0, 'riesig': 0, 'über': 0, 'die': 0.06, 'Berichterstattung': 0, 'der': 0.06, 'AZ': 0.06, 'von': 0, 'diesjährigen': 0.035, 'Jugendsession': 0.175, 'Die': 0.06, 'Leitung': 0.19, 'Gruppe': 0.35, 'Digitalisierung': 0, 'war': 0, 'spannend': 0.06, 'noch': 0, 'spannender': 0.04, 'aber': 0.12, 'waren': 0.09, 'Diskussionen': 0.08, 'und': 0.04, 'Vorstösse': 0, 'erarbeitet': 0.07, 'wurden': 0, 'Danke': 0, 'an': 0, 'alle': 0, 'TeilnehmerInnen': 0.1}",positive,"[0.0041225855, 0.0020205672, 0.99385685]",,,,,,,,,,,,,,,,,,,positive
50.0,75.0,57.0,0.0,neutral,RT @KonstantinNotz: #Klimawandel + #Digitalisierung keine relevanten Themen. #Groko führt Selbstgespräche und versucht eigene Laufzeit zu v…,klimawandel digitalisierung relevant themen groko führen selbstgespräche versuchen eigene laufzeit v,,,,,,,,,,,,,,,,,,,,,,,,,,,,,,,,,,,,,,,,"{'Klimawandel': 0.09, 'Digitalisierung': 0, 'keine': 0, 'relevanten': 0.7, 'Themen': 0, 'Groko': 0.08, 'führt': 0, 'Selbstgespräche': 0, 'und': 0.07, 'versucht': 0.1, 'eigene': 0.04, 'Laufzeit': 0.04, 'zu': 0.05, 'v': 0, '…': 0}",neutral,"[0.8269277, 0.112666406, 0.06040587]",,,,,,,,,,,,,,,,,,,neutral
0.0,0.0,14.0,-0.7,neutral,"https://t.co/vstLVMStqB Kurze Erinnerung daran, dass wir auch inmitten einer Pandemie nicht einen Moment den Umweltschutz vergessen dürfen, ganz im Gegenteil.",kurze erinnerung daran inmitten pandemie moment umweltschutz vergessen dürfen ganz gegenteil,,,,,,,,,,,,,,,,,,,,,,,,,,,,,,,,,,,,,,,,,,,"{'Kurze': 0, 'Erinnerung': 0.06, 'daran': 0, 'dass': 0.04, 'wir': 0, 'auch': 0, 'inmitten': 0.03, 'einer': 0, 'Pandemie': 0.19, 'nicht': 0.08, 'einen': 0.04, 'Moment': 0.12, 'den': 0.03, 'Umweltschutz': 1.0, 'vergessen': 0.28, 'dürfen': 0, 'ganz': 0, 'im': 0, 'Gegenteil': 0}",positive,"[0.06409633, 0.008811691, 0.92709196]",,,,,,,,,,,,,,,,negative
100.0,100.0,86.0,0.7,neutral,"Es brauchte also ""nur"" monatelang anhaltenden Protest, unter anderem in Form zivilen Ungehorsams um sogar dem Mitte-Rechts dominierten Nationalrat auf die Sprünge zu helfen. Das macht Hoffnung für #NRW19. Vielleicht gibt es tatsächlich mal regelmässig Mehrheiten für Umweltschutz. https://t.co/CINp4avnbJ",brauchen monatelang anhaltend protest form zivil ungehorsams sogar mitte rechts dominieren nationalrat sprünge helfen hoffnung nrw19 vielleicht geben tatsächlich mal regelmässig mehrheiten umweltschutz,,,,,,,,,,,,,,,,,,,,,,,,,,,,,,,,,,,,,,,,,,,"{'Es': 0, 'brauchte': 0.03, 'also': 0, 'nur': 0.01, 'monatelang': 0.51, 'anhaltenden': 0, 'Protest': 0, 'unter': 0, 'anderem': 0, 'in': 0, 'Form': 0, 'zivilen': 0.02, 'Ungehorsams': 0.03, 'um': 0.02, 'sogar': 0.02, 'dem': 0.025, 'Mitte-Rechts': 0.01, 'dominierten': 0.02, 'Nationalrat': 0.03, 'auf': 0, 'die': 0.02, 'Sprünge': 0, 'zu': 0.03, 'helfen': 0, 'Das': 0.02, 'macht': 0, 'Hoffnung': 0.09, 'für': 1.0, 'NRW19.': 0, 'Vielleicht': 0.17, 'gibt': 0.16, 'es': 0, 'tatsächlich': 0, 'mal': 0, 'regelmässig': 0, 'Mehrheiten': 0.68, 'Umweltschutz': 0.615}",neutral,"[0.49833485, 0.068096906, 0.43356824]",,,,,,,,,,,,,,,,positive
50.0,75.0,57.0,0.0,neutral,"Gelesen: In der Schweiz wächst nun weisser Trüffel aufgrund der Klimaerwärmung.
Gedacht: Ach deshalb also bekämpft die #FDP so konsequent mehr Umweltschutz.",lesen schweiz wachsen weisser trüffel aufgrund klimaerwärmung gedenken ach deshalb bekämpfen fdp konsequent mehr umweltschutz,,,,,,,,,,,,,,,,,,,,,,,,,,,,,,,,,,,,,,,,,,,"{'Gelesen': 0.03, 'In': 0.02, 'der': 0.1, 'Schweiz': 0.03, 'wächst': 0, 'nun': 0, 'weisser': 0, 'Trüffel': 0, 'aufgrund': 0, 'Klimaerwärmung': 0.035, 'Gedacht': 0.06, 'Ach': 0, 'deshalb': 0, 'also': 0, 'bekämpft': 0.26, 'die': 0.1, 'FDP': 0.1, 'so': 0.36, 'konsequent': 0, 'mehr': 1.0, 'Umweltschutz': 0.69}",positive,"[0.012562911, 0.010123949, 0.97731316]",,,,,,,,,,,,,,,,neutral
100.0,100.0,100.0,1.0,neutral,"Keller-Suter im #EJPD und Parmelin im #WBF. Dürfte interessant werden, hat sich Parmelin im VBS doch ziemlich die Finger vebrannt und Keller-Suter ist Law&amp;Order-Hardlinerin par excellence. Hoffentlich erreicht Sommaruga im #UVEK klare Fortschritte im Umweltschutz.",keller suter ejpd parmelin wbf dürfen interessant parmelin vbs ziemlich finger vebrannt keller suter law amprder hardlinerin par excellence hoffentlich erreichen sommaruga uvek klaren fortschritte umweltschutz,,,,,,,,,,,,,,,,,,,,,,,,,,,,,,,,,,,,,,,,,,,"{'Keller-Suter': 0, 'im': 0, 'EJPD': 0.49, 'und': 0.12, 'Parmelin': 0.1, 'WBF': 0.08, 'Dürfte': 0, 'interessant': 0.33, 'werden': 0.06, 'hat': 0, 'sich': 0, 'VBS': 0.03, 'doch': 0, 'ziemlich': 0.025, 'die': 0.03, 'Finger': 0, 'vebrannt': 0, 'ist': 0.12, 'Law&amprder-Hardlinerin': 0, 'par': 0, 'excellence': 0.08, 'Hoffentlich': 0.28, 'erreicht': 0, 'Sommaruga': 0.07, 'UVEK': 0, 'klare': 0, 'Fortschritte': 0.06, 'Umweltschutz': 0.2}",positive,"[0.010469403, 0.009576077, 0.97995454]",,,,,,,,,,,,,,,,positive
0.0,0.0,14.0,-0.7,neutral,8 Milliarden (zur Veranschaulichung: 8'000'000'000 Fr.-) für ein paar neue Flugis? Für den gesamten (!) Umweltschutzbereich gibt die Schweiz ca. 11 Milliarden aus. Erst dem #co2gesetz alle Zähne ziehen und dann auch noch so nen Spass? Sind wir denn in den USA hier?,milliarden veranschaulichung fr paar neue flugis gesamt umweltschutzbereich geben schweiz ca milliarden erst co2gesetz all zähne ziehen nen spass usa,,,,,,,,,,,,,,,,,,,,,,,,,,,,,,,,,,,,,,,,,,,"{'8': 0, 'Milliarden': 0, 'zur': 0.1, 'Veranschaulichung': 0.05, ""8'000'000'000"": 0, 'Fr.-': 0, 'für': 0.04, 'ein': 0, 'paar': 0, 'neue': 0.03, 'Flugis': 0, 'Für': 0.04, 'den': 0.1, 'gesamten': 0.04, 'Umweltschutzbereich': 0.08, 'gibt': 1.0, 'die': 0.1, 'Schweiz': 0.14, 'ca.': 0, '11': 0, 'aus': 0.02, 'Erst': 0.14, 'dem': 0.1, 'co2gesetz': 0, 'alle': 0, 'Zähne': 0.06, 'ziehen': 0, 'und': 0.08, 'dann': 0.11, 'auch': 0, 'noch': 0, 'so': 0, 'nen': 0, 'Spass': 0.11, 'Sind': 1.0, 'wir': 0, 'denn': 0.11, 'in': 0.18, 'USA': 0.37, 'hier': 0.23}",neutral,"[0.7044265, 0.03178183, 0.26379174]",,,,,,,,,,,,,,,,negative
