answer_five,answer_four,answer_seven,polarity,sentiment_gs,tweet,tweet_tokens,absa_token_weights_3412,absa_sentiment_3412,absa_scores_3412,absa_token_weights_3436,absa_sentiment_3436,absa_scores_3436,sentiment_tb
25.0,25.0,28.0,-0.3333333333333333,negative,"FDP-CVP Fraktion im Kantonsrat SH verhindert mit ihrer Verweigerungshaltung eine i.S. #diversity fortschrittliche e-id Lösung.
Was meint dazu die @FDP_Liberalen CH?
Sekundiert von der SVP mit schlechten Scherzen zu Wehrpflicht und Rentenalter. Peinlich.
https://t.co/XXfvnCT3hr
mf",fdp cvp fraktion kantonsrat sh verhindern verweigerungshaltung i s diversity fortschrittliche e id lösung ch sekundiert svp schlecht scherzen wehrpflicht rentenalter peinlich mf,"{'FDP-CVP': 0, 'Fraktion': 0, 'im': 0, 'Kantonsrat': 0.03, 'SH': 0.02, 'verhindert': 0, 'mit': 0.1, 'ihrer': 0, 'Verweigerungshaltung': 0, 'eine': 0, 'i.': 0, 'S.': 0, 'diversity': 0.07, 'fortschrittliche': 0, 'e-id': 0, 'Lösung': 0.08, 'Was': 0, 'meint': 0, 'dazu': 0, 'die': 0.06, 'CH': 0.03, 'Sekundiert': 0.12, 'von': 0, 'der': 0.06, 'SVP': 0, 'schlechten': 0.48, 'Scherzen': 0, 'zu': 0, 'Wehrpflicht': 0, 'und': 0.16, 'Rentenalter': 0.47, 'Peinlich': 1.0, 'mf': 0.29}",negative,"[0.01350088, 0.88289, 0.10360909]",,,,negative
0.0,0.0,0.0,-1.0,neutral,"Undemokratisches Pack! Der Kantonsrat von Schaffhausen lehnt es ab, das Stimmvolk separat über die Vermögenssteuersenkung und die Erhöhung der Steuerabzüge für Versicherungsprämien befinden zu lassen. SVP und FDP stimmen mit Unterstützung der GLP gegen die Variantenabstimmung.
mf https://t.co/xtBaNGEOQJ",undemokratisches pack kantonsrat schaffhausen lehnen ab stimmvolk separat vermögenssteuersenkung erhöhung steuerabzüge versicherungsprämien befinden lassen svp fdp stimmen unterstützung glp variantenabstimmung mf,,,,"{'Undemokratisches': 0, 'Pack': 0.03, 'Der': 0.05, 'Kantonsrat': 0.055, 'von': 0, 'Schaffhausen': 0.05, 'lehnt': 0, 'es': 0, 'ab': 0, 'das': 0, 'Stimmvolk': 0.29, 'separat': 0.5, 'über': 0, 'die': 0.05, 'Vermögenssteuersenkung': 0.4025, 'und': 0.03, 'Erhöhung': 0.32, 'der': 0.05, 'Steuerabzüge': 0.11, 'für': 0.16, 'Versicherungsprämien': 0.07, 'befinden': 0, 'zu': 0.08, 'lassen': 0, 'SVP': 0, 'FDP': 0.04, 'stimmen': 0, 'mit': 0.1, 'Unterstützung': 0.08, 'GLP': 0.12, 'gegen': 0.14, 'Variantenabstimmung': 0.06, 'mf': 0.02}",neutral,"[0.58895767, 0.34721404, 0.0638283]",negative
50.0,75.0,57.0,0.0,neutral,"Rechnung Kt. SH 2020: Überschüsse in der Grössenordnung 70 Mio SFr.
Davon werden 35 Mio für Steuersenkungen und Strassenbau vorgesehen. @grunliberale_sh
hat die Wahl zwischen Strassenbau und Erhaltung sowie Förderung der Biodiversität: Stimmt geschlossen für Strassenbau.
mf",rechnung kt sh überschüsse grössenordnung mio sfr davon mio steuersenkungen strassenbau vorsehen wahl strassenbau erhaltung sowie förderung biodiversität stimmen schließen strassenbau mf,,,,"{'Rechnung': 0, 'Kt': 0.02, 'SH': 0.01, '2020': 0, 'Überschüsse': 0.05, 'in': 0.02, 'der': 0.05, 'Grössenordnung': 0.02, '70': 0, 'Mio': 0, 'SFr': 0.02, 'Davon': 0.04, 'werden': 0.19, '35': 0, 'für': 0.03, 'Steuersenkungen': 0.665, 'und': 0.12, 'Strassenbau': 0.16, 'vorgesehen': 0, 'hat': 0, 'die': 0.05, 'Wahl': 0.13, 'zwischen': 0.17, 'Erhaltung': 0, 'sowie': 0.03, 'Förderung': 0, 'Biodiversität': 0.04, 'Stimmt': 0, 'geschlossen': 0.06, 'mf': 0.02}",neutral,"[0.8607915, 0.008496254, 0.13071224]",neutral
50.0,75.0,57.0,0.0,neutral,"Gestern haben wir zusammen mit der @SchaffhausenSp, Juso, Grünen und Jungen Grünen die 1. Initiative im Kampf gegen die rechtsbürgerlichen Vermögenssteuersenkungspläne eingereicht: Temporärer Vermögenssteuerzuschlag für Vermögen ab 2 Mio. während 5 Jahren!
Quelle: SN vom 2.6.
mf https://t.co/DjjcQRjctx",gestern zusammen juso grün jung grün initiative kampf rechtsbürgerlichen vermögenssteuersenkungspläne einreichen temporär vermögenssteuerzuschlag vermögen ab mio jahren quelle sn mf,,,,"{'Gestern': 0.03, 'haben': 0, 'wir': 0, 'zusammen': 0.03, 'mit': 0.04, 'der': 0.04, 'Juso': 0.04, 'Grünen': 0, 'und': 0.03, 'Jungen': 0, 'die': 0.04, '1.': 0, 'Initiative': 0.11, 'im': 0, 'Kampf': 0, 'gegen': 0.11, 'rechtsbürgerlichen': 0, 'Vermögenssteuersenkungspläne': 0.295, 'eingereicht': 0.09, 'Temporärer': 1.0, 'Vermögenssteuerzuschlag': 0.7949999999999999, 'für': 0.22, 'Vermögen': 0.28, 'ab': 0, '2': 0, 'Mio.': 0, 'während': 0, '5': 0, 'Jahren': 0.19, 'Quelle': 0, 'SN': 0.05, 'vom': 0.06, '2.6.': 0, 'mf': 0.07}",neutral,"[0.49674234, 0.29243785, 0.21081984]",neutral
0.0,0.0,14.0,-0.7,neutral,"Die Rechtsbürgerlichen im Kantonsrat SH wollen unbedingt die Erhöhung der Versicherungsabzüge auf dem steuerbaren Einkommen mit einer Vermögenssteuersenkung verknüpfen. Wer die längst fällige Erhöhung der VA will, muss dann den 45% Einwohnern mit Vermögen die Steuern senken.
mf",rechtsbürgerlichen kantonsrat sh unbedingt erhöhung versicherungsabzüge steuerbaren einkommen vermögenssteuersenkung verknüpfen wer längst fällige erhöhung va einwohnern vermögen steuern senken mf,,,,"{'Die': 0.03, 'Rechtsbürgerlichen': 0, 'im': 0, 'Kantonsrat': 0.025, 'SH': 0.01, 'wollen': 0.05, 'unbedingt': 0, 'die': 0.03, 'Erhöhung': 0.06, 'der': 0.03, 'Versicherungsabzüge': 0.055, 'auf': 0.05, 'dem': 0.04, 'steuerbaren': 0, 'Einkommen': 0.06, 'mit': 0.02, 'einer': 0, 'Vermögenssteuersenkung': 0.65, 'verknüpfen': 0, 'Wer': 0, 'längst': 0.51, 'fällige': 0, 'VA': 0, 'will': 0, 'muss': 0.05, 'dann': 0.09, 'den': 0.03, '45': 0, 'Einwohnern': 0.03, 'Vermögen': 0, 'Steuern': 0, 'senken': 0, 'mf': 0.04}",negative,"[0.08239775, 0.6919121, 0.22569022]",negative
50.0,75.0,71.0,0.15,neutral,"@geizen @SHN_News Uiui. In einer 180°verdrehten Lesart und völlig aus dem Kontext gerissen präsentiert... so könntest du in den SN nicht zitieren, lieber Zeno. Das ALinfo-Textli vom Januar (vgl.: https://t.co/oyOuHAv5n4) erklärt doch gerade, dass eine Steuersenkung nicht zur Debatte steht.
mf",uiui verdrehen lesart völlig kontext reißen präsentieren sn zitieren lieb zeno alinfo textli januar vgl erklären gerade steuersenkung debatte stehen mf,,,,"{'Uiui': 0, 'In': 0.02, 'einer': 0, '180': 0, '°': 0, 'verdrehten': 0, 'Lesart': 0, 'und': 0, 'völlig': 0, 'aus': 0, 'dem': 0, 'Kontext': 0, 'gerissen': 0, 'präsentiert': 0, '...': 0, 'so': 0, 'könntest': 0, 'du': 0, 'in': 0, 'den': 0, 'SN': 0, 'nicht': 0, 'zitieren': 0, 'lieber': 0, 'Zeno': 0, 'Das': 0, 'ALinfo-Textli': 0, 'vom': 0, 'Januar': 0, 'vgl.': 0, 'erklärt': 0, 'doch': 0, 'gerade': 0, 'dass': 0, 'eine': 0, 'Steuersenkung': 0, 'zur': 0, 'Debatte': 0, 'steht': 0, 'mf': 0}",negative,"[0.14496459, 0.8486488, 0.006386612]",neutral
75.0,100.0,86.0,0.5,neutral,"Die Schurnalisten von @SHN_News
leben anscheinend in ihrem eigenen Schaffhausen mit seinen eigenen Regeln (inspiriert von den Rechtsbürgerlichen).
Eine Steuersenkung stand beim städt. Budget 21 nämlich gar nie zur Debatte. Es war kein Steuerfussreferendum.
Quelle: SN vom 8.2.
mf https://t.co/MAR5B3tvhi",schurnalisten leben anscheinen eigen schaffhausen eigen regeln inspirieren rechtsbürgerlichen steuersenkung stehen beim städt budget nämlich gar nie debatte steuerfussreferendum quelle sn mf,,,,"{'Die': 0.02, 'Schurnalisten': 0.05, 'von': 0.12, 'leben': 0, 'anscheinend': 0.04, 'in': 0.01, 'ihrem': 0, 'eigenen': 0.02, 'Schaffhausen': 0.04, 'mit': 0.02, 'seinen': 0, 'Regeln': 0.05, 'inspiriert': 0.04, 'den': 0.02, 'Rechtsbürgerlichen': 0, 'Eine': 0, 'Steuersenkung': 0.515, 'stand': 0, 'beim': 0.02, 'städt': 0, 'Budget': 0.04, '21': 0, 'nämlich': 0, 'gar': 0, 'nie': 0, 'zur': 0.02, 'Debatte': 0, 'Es': 0, 'war': 0, 'kein': 0, 'Steuerfussreferendum': 0.0775, 'Quelle': 0, 'SN': 0.05, 'vom': 0.06999999999999999, '8.2.': 0, 'mf': 0.12}",negative,"[0.42813307, 0.5457766, 0.026090339]",positive
50.0,75.0,71.0,0.1333333333333333,neutral,"2 Mitglieder fehlen in der städtischen GPK, mit Stichentscheid des Präsidiums hat so die Minderheit eine Mehrheit und drückt eine Steuersenkung durch. Das nennen SVP und FDP Kompromiss. Das Parlament in normaler Zusammensetzung korrigiert das. Was ist das jetzt für ein Budget?
mf",mitglieder fehlen städtisch gpk stichentscheid präsidiums minderheit mehrheit drücken steuersenkung nennen svp fdp kompromiss parlament normal zusammensetzung korrigieren budget mf,,,,"{'2': 0, 'Mitglieder': 0.03, 'fehlen': 0, 'in': 0.02, 'der': 0.02, 'städtischen': 0, 'GPK': 0.04, 'mit': 0.02, 'Stichentscheid': 0.045, 'des': 0, 'Präsidiums': 0.06, 'hat': 0, 'so': 0, 'die': 0.02, 'Minderheit': 0.08, 'eine': 0, 'Mehrheit': 0.14, 'und': 0.03, 'drückt': 0, 'Steuersenkung': 0.71, 'durch': 1.0, 'Das': 0.02, 'nennen': 0, 'SVP': 0, 'FDP': 0.03, 'Kompromiss': 0.07, 'Parlament': 0.05, 'normaler': 0.01, 'Zusammensetzung': 0.04, 'korrigiert': 0, 'das': 0.02, 'Was': 0, 'ist': 0.01, 'jetzt': 0.02, 'für': 0, 'ein': 0, 'Budget': 0.05, 'mf': 0.01}",neutral,"[0.9852706, 0.00589815, 0.00883123]",neutral
50.0,75.0,57.0,0.0,neutral,"SVP und FDP wollen an Kantonsschule weder 60jähriges (!) Mobiliar von 2 (!) Zimmern (von 60) ersetzen, noch runtergewirtschaftete Buffetwagen der Mensa. So erzielte Einsparungen von 43'000 Fr. sollen die rund 9 Mio schwere Steuersenkung um 3% finanzieren.
mf",svp fdp kantonsschule weder 60jähriges mobiliar zimmern ersetzen runtergewirtschaftete buffetwagen mensa erzielen einsparungen fr sollen rund mio schwer steuersenkung finanzieren mf,,,,"{'SVP': 0, 'und': 0.02, 'FDP': 0.04, 'wollen': 0.02, 'an': 0, 'Kantonsschule': 0.03, 'weder': 0, '60jähriges': 0.01, 'Mobiliar': 0.07, 'von': 0, '2': 0, 'Zimmern': 0.03, '60': 0, 'ersetzen': 0, 'noch': 0, 'runtergewirtschaftete': 0.035, 'Buffetwagen': 0.06, 'der': 0.36, 'Mensa': 0.07, 'So': 0, 'erzielte': 0, 'Einsparungen': 0.35, ""43'000"": 0, 'Fr.': 0, 'sollen': 0, 'die': 0.36, 'rund': 0.06, '9': 0, 'Mio': 0, 'schwere': 0, 'Steuersenkung': 0.685, 'um': 0, '3': 0, 'finanzieren': 1.0, 'mf': 0.06}",neutral,"[0.88441825, 0.03101543, 0.08456628]",neutral
