answer_five,answer_four,answer_seven,polarity,sentiment_gs,tweet,tweet_tokens,absa_token_weights_3389,absa_sentiment_3389,absa_scores_3389,absa_token_weights_3414,absa_sentiment_3414,absa_scores_3414,absa_token_weights_3466,absa_sentiment_3466,absa_scores_3466,absa_token_weights_3475,absa_sentiment_3475,absa_scores_3475,sentiment_tb
100.0,100.0,86.0,0.7,neutral,RT @plattform_ch: Die @plattform_ch unterstützt den 2-wöch. #Vaterschaftsurlaub damit Kinderbetreuung von Anfang an nicht nur als Aufgabe d…,unterstützen wöch vaterschaftsurlaub kinderbetreuung anfang aufgabe d,"{'Die': 0.05, 'unterstützt': 0.04, 'den': 0.05, '2-wöch': 0, 'Vaterschaftsurlaub': 0.09, 'damit': 0, 'Kinderbetreuung': 0.44, 'von': 0.11, 'Anfang': 0, 'an': 0, 'nicht': 1.0, 'nur': 0, 'als': 0, 'Aufgabe': 0.51, 'd': 0, '…': 0}",neutral,"[0.80213404, 0.025012447, 0.17285348]","{'Die': 0.06, 'unterstützt': 0.21, 'den': 0.06, '2-wöch': 0, 'Vaterschaftsurlaub': 0.61, 'damit': 0, 'Kinderbetreuung': 0.17, 'von': 0.09, 'Anfang': 0, 'an': 0, 'nicht': 0.17, 'nur': 0, 'als': 0, 'Aufgabe': 0.11, 'd': 0, '…': 0}",positive,"[0.3596212, 0.028142374, 0.61223644]",,,,,,,positive
100.0,100.0,86.0,0.7,neutral,RT @plattform_ch: Die @plattform_ch unterstützt den 2-wöch. #Vaterschaftsurlaub damit Kinderbetreuung von Anfang an nicht nur als Aufgabe d…,unterstützen wöch vaterschaftsurlaub kinderbetreuung anfang aufgabe d,"{'Die': 0.05, 'unterstützt': 0.04, 'den': 0.05, '2-wöch': 0, 'Vaterschaftsurlaub': 0.09, 'damit': 0, 'Kinderbetreuung': 0.44, 'von': 0.11, 'Anfang': 0, 'an': 0, 'nicht': 1.0, 'nur': 0, 'als': 0, 'Aufgabe': 0.51, 'd': 0, '…': 0}",neutral,"[0.80213404, 0.025012447, 0.17285348]","{'Die': 0.06, 'unterstützt': 0.21, 'den': 0.06, '2-wöch': 0, 'Vaterschaftsurlaub': 0.61, 'damit': 0, 'Kinderbetreuung': 0.17, 'von': 0.09, 'Anfang': 0, 'an': 0, 'nicht': 0.17, 'nur': 0, 'als': 0, 'Aufgabe': 0.11, 'd': 0, '…': 0}",positive,"[0.3596212, 0.028142374, 0.61223644]",,,,,,,positive
50.0,75.0,57.0,0.0,neutral,"RT @NZZaS: «Für das letzte Stück zur Gleichstellung wird es wohl mehr als die Digitalisierung brauchen. Es wird nur zu schaffen sein, wenn…",letzte stück gleichstellung wohl mehr digitalisierung brauchen schaffen,,,,,,,"{'«': 0, 'Für': 0, 'das': 0, 'letzte': 0, 'Stück': 0, 'zur': 0, 'Gleichstellung': 0, 'wird': 0, 'es': 0, 'wohl': 0, 'mehr': 0, 'als': 0, 'die': 0, 'Digitalisierung': 0, 'brauchen': 0, 'Es': 0, 'nur': 0, 'zu': 0, 'schaffen': 0, 'sein': 0, 'wenn': 0, '…': 0}",neutral,"[0.65695715, 0.3067556, 0.03628721]",,,,neutral
50.0,75.0,57.0,0.0,neutral,"RT @cyponair: Wollten Sie schon immer wissen, wie #Digitalisierung und Arbeit 4.0 funktioniert? Neu im #Zertifikatslehrgang https://t.co/9A…",schon immer wissen digitalisierung arbeit funktionieren neu zertifikatslehrgang,,,,,,,"{'Wollten': 0.08499999999999999, 'Sie': 0, 'schon': 0, 'immer': 0.1, 'wissen': 0.195, 'wie': 0.48, 'Digitalisierung': 0, 'und': 1.0, 'Arbeit': 0.92, '4.0': 0, 'funktioniert': 0, 'Neu': 0.06, 'im': 0, 'Zertifikatslehrgang': 0.04}",positive,"[0.26704866, 0.007941176, 0.7250102]",,,,neutral
100.0,100.0,86.0,0.7,neutral,RT @kfmv_ch: Wie wichtig die #PFZ für die Bildungsmobilität und Forschungszusammenarbeit zwischen der Schweiz und der EU ist und wie die BF…,wichtig pfz bildungsmobilität forschungszusammenarbeit schweiz eu bf,,,,,,,,,,"{'Wie': 0, 'wichtig': 0.97, 'die': 0.06, 'PFZ': 0.48, 'für': 1.0, 'Bildungsmobilität': 0.73, 'und': 0.09, 'Forschungszusammenarbeit': 0.38, 'zwischen': 0.4, 'der': 0.06, 'Schweiz': 0.13, 'EU': 0, 'ist': 0.87, 'wie': 0.22, 'BF': 0.07, '…': 0}",positive,"[0.0030389463, 0.0021059383, 0.99485505]",positive
