100.0,100.0,86.0,0.7,neutral,RT @EliasMaier: Rentenalter 66/66 würde das wichtige Sozialwerk #AHV wieder einigermassen ins Lot bringen - es fehlen 60 Mrd. CHF. Mit lauf…,rentenalter wichtig sozialwerk ahv einigermassen lot bringen fehlen mrd chf lauf,,,,"{'Rentenalter': 1.0, '66': 0, 'würde': 0.27, 'das': 0, 'wichtige': 0.04, 'Sozialwerk': 0.03, 'AHV': 0.04, 'wieder': 0, 'einigermassen': 0, 'ins': 0, 'Lot': 0, 'bringen': 0.13, 'es': 0.02, 'fehlen': 0, '60': 0, 'Mrd.': 0.05, 'CHF': 0.03, 'Mit': 0.02, 'lauf': 0.05, '…': 0}",positive,"[0.40550247, 0.06933005, 0.5251675]",,,,,,,,,,,,,,,,,,,,,,,,,,,,,,,,,,,,,,,,,,,positive
100.0,100.0,100.0,1.0,neutral,"RT @NicolasJutzet: «Der Vorschlag des Jungfreisinns ist richtig», sagt Alt-Bundesrat Pascal Couchepin 🤝

Wir fordern dass das Rentenalter s…",vorschlag jungfreisinns richtig sagen alt bundesrat pascal couchepin fordern rentenalter s,,,,"{'«': 0, 'Der': 0, 'Vorschlag': 0, 'des': 0, 'Jungfreisinns': 0, 'ist': 0, 'richtig': 0, '»': 0, 'sagt': 0, 'Alt-Bundesrat': 0, 'Pascal': 0, 'Couchepin': 0, '🤝': 0, 'Wir': 0, 'fordern': 0, 'dass': 0, 'das': 0, 'Rentenalter': 0, 's': 0, '…': 0}",neutral,"[0.9676188, 0.020778896, 0.0116023095]",,,,,,,,,,,,,,,,,,,,,,,,,,,,,,,,,,,,,,,,,,,positive
50.0,75.0,57.0,0.0,neutral,"RT @Moneycab: Andri Silberschmidt, Präsident der Jungfreisinnigen, zur AHV-Sanierung &amp; Rentenalter 66. ""Wir waren stets der Ansicht, dass m…",andri silberschmidt präsident jungfreisinnigen ahv sanierung amp rentenalter stets ansicht m,,,,"{'Andri': 0.05, 'Silberschmidt': 0.08, 'Präsident': 0.05, 'der': 0.02, 'Jungfreisinnigen': 0.025, 'zur': 0.02, 'AHV-Sanierung': 0.03, 'amp': 0.02, 'Rentenalter': 0.225, '66.': 0, 'Wir': 0.13, 'waren': 0, 'stets': 0.29, 'Ansicht': 0, 'dass': 1.0, 'm': 0.42, '…': 0}",neutral,"[0.5572673, 0.017964918, 0.42476782]",,,,,,,,,,,,,,,,,,,,,,,,,,,,,,,,,,,,,,,,,,,neutral
25.0,25.0,28.0,-0.35,neutral,"Die Gesprächsverweigerung über das Tabuthema #Rentenalter, ja sogar die fehlende Bereitschaft an einer gemeinsamen Lösungsfindung, wird zum Boomerang, nicht nur für die linken Akteure, sondern auch für die AHV. Immer mehr Menschen werden &gt;100, Rentenalter für immer 65?",gesprächsverweigerung tabuthema rentenalter ja sogar fehlend bereitschaft gemeinsam lösungsfindung boomerang link akteure ahv immer mehr menschen gt rentenalter immer,,,,"{'Die': 0.05, 'Gesprächsverweigerung': 0.05499999999999999, 'über': 0, 'das': 0, 'Tabuthema': 0.05, 'Rentenalter': 0.245, 'ja': 0.12, 'sogar': 0.11, 'die': 0.05, 'fehlende': 0, 'Bereitschaft': 0, 'an': 0, 'einer': 0, 'gemeinsamen': 0.02, 'Lösungsfindung': 0.04, 'wird': 0, 'zum': 0.035, 'Boomerang': 0.07, 'nicht': 0.05, 'nur': 0.09, 'für': 0.04, 'linken': 0.02, 'Akteure': 0.03, 'sondern': 0.07, 'auch': 0.08, 'AHV': 0.08, 'Immer': 0, 'mehr': 0.1, 'Menschen': 0.11, 'werden': 0, 'gt;100': 0, 'immer': 0, '65': 0}",neutral,"[0.63363093, 0.12842844, 0.2379406]",,,,,,,,,,,,,,,,,,,,,,,,,,,,,,,,,,,,,,,,,,,negative
50.0,25.0,57.0,-0.12,negative,"Die Pläne des Bundesrats bewirken ausser mehr Einnahmen nichts, die #AHV bleibt ein Fass ohne Boden. Und die Linken verweigern schon nur das Gespräch über ein höheres #Rentenalter, das regt mich auf und ist völlig unverantwortlich.#Renteninitiative jetzt!  https://t.co/MOEfWixE03",pläne bundesrats bewirken ausser mehr einnahmen ahv bleiben fass boden link verweigern schon gespräch hoch rentenalter regen völlig unverantwortlich renteninitiative,,,,"{'Die': 0.05, 'Pläne': 0.04, 'des': 0, 'Bundesrats': 0.08, 'bewirken': 0, 'ausser': 0, 'mehr': 0.05, 'Einnahmen': 0, 'nichts': 0.05, 'die': 0.05, 'AHV': 0.07, 'bleibt': 0.06, 'ein': 0, 'Fass': 0, 'ohne': 0, 'Boden': 0, 'Und': 0.05, 'Linken': 0.11, 'verweigern': 0.31, 'schon': 0, 'nur': 0, 'das': 0.18, 'Gespräch': 0, 'über': 0, 'höheres': 1.0, 'Rentenalter': 0.73, 'regt': 0, 'mich': 0.05, 'auf': 0, 'und': 0.05, 'ist': 0.06, 'völlig': 0, 'unverantwortlich.#Renteninitiative': 0.1, 'jetzt': 0.06}",neutral,"[0.6048186, 0.14365369, 0.25152773]",,,,,,,,,,,,,,,,,,,,,,,,,,,,,,,,,,,,,,,,,,,neutral
100.0,100.0,100.0,1.0,negative,"RT @gaeggsnaase: @andrisilbi_ @sonntagszeitung @NZZaS Richtig, ohne Anpassung von Umwandlungssatz und Rentenalter werden die Renten gegen d…",richtig anpassung umwandlungssatz rentenalter renten d,,,,"{'Richtig': 0, 'ohne': 1.0, 'Anpassung': 0, 'von': 0, 'Umwandlungssatz': 0.46, 'und': 0.35, 'Rentenalter': 0.8200000000000001, 'werden': 0, 'die': 0.11, 'Renten': 0.26, 'gegen': 0.36, 'd': 0, '…': 0}",neutral,"[0.7804109, 0.054482058, 0.16510701]",,,,,,,,,,,,,,,,,,,,,,,,,,,,,,,,,,,,,,,,,,,positive
75.0,75.0,71.0,0.35,neutral,"„Die Schweizer Politik darf die Debatte über ein höheres Rentenalter nicht länger aufschieben. Sie sollte der Sicherung der AHV mehr Aufmerksamkeit schenken.“ - ⁦@tgafafer⁩ 

Unsere VI zur strukturellen Reform ist in Vorbereitung 👍🏼

https://t.co/xzOecUeEhP",schweizer politik dürfen debatte hoch rentenalter lang aufschieben sollen sicherung ahv mehr aufmerksamkeit schenken vi strukturell reform vorbereitung,,,,"{'„': 0, 'Die': 0, 'Schweizer': 0, 'Politik': 0, 'darf': 0, 'die': 0, 'Debatte': 0, 'über': 0, 'ein': 0, 'höheres': 0, 'Rentenalter': 0, 'nicht': 0, 'länger': 0, 'aufschieben': 0, 'Sie': 0, 'sollte': 0, 'der': 0, 'Sicherung': 0, 'AHV': 0, 'mehr': 0, 'Aufmerksamkeit': 0, 'schenken': 0, '“': 0, '\u2066\u2069': 0, 'Unsere': 0, 'VI': 0, 'zur': 0, 'strukturellen': 0, 'Reform': 0, 'ist': 0, 'in': 0, 'Vorbereitung': 0}",neutral,"[0.6780808, 0.031200714, 0.29071847]",,,,,,,,,,,,,,,,,,,,,,,,,,,,,,,,,,,,,,,,,,,positive
50.0,75.0,57.0,0.0,neutral,"Ein Vaterschaftsurlaub ist nicht zeitgemäss und zementiert ein veraltetes Rollenbild. Zielführender wäre eine Elternzeit, die beide Elternteile in die Verantwortung nimmt. Ein solches Modell würde den Ansprüchen der Gleichstellung gerecht werden &amp; ermöglicht neue Familienmodelle. https://t.co/xLTanFXytF",vaterschaftsurlaub zeitgemäss zementieren veraltet rollenbild zielführender elternzeit beid elternteile verantwortung nehmen solch modell ansprüchen gleichstellung gerecht amp ermöglichen neue familienmodelle,,,,,,,"{'Ein': 0.04, 'Vaterschaftsurlaub': 0.26, 'ist': 0.23, 'nicht': 0.35, 'zeitgemäss': 0, 'und': 0.38, 'zementiert': 0, 'ein': 0, 'veraltetes': 0, 'Rollenbild': 0.31, 'Zielführender': 0.04, 'wäre': 0.03, 'eine': 0, 'Elternzeit': 0.145, 'die': 0.05, 'beide': 0.03, 'Elternteile': 0.09, 'in': 0, 'Verantwortung': 0, 'nimmt': 0, 'solches': 0.05, 'Modell': 0.08, 'würde': 0.03, 'den': 0.05, 'Ansprüchen': 0, 'der': 0.05, 'Gleichstellung': 0.08, 'gerecht': 0, 'werden': 0, 'amp': 0.07, 'ermöglicht': 0.09, 'neue': 0.07, 'Familienmodelle': 0.07}",negative,"[0.0019440645, 0.9690067, 0.029049145]",,,,,,,,,,,,,,,,,,,,,,,,,,,,,,,,,,,,,,,,neutral
100.0,100.0,100.0,1.0,neutral,"Freue mich auf die morgige Diskussion im #SonnTalk @JayBadran 

Grossveranstaltungen: Nötige Lockerung oder Startschuss für die zweite Welle?-Personenfreizügigkeit: Gefahr od Gewinn für den Wohlstand?-Vaterschaftsurlaub: Zeitgemässe Entwicklung oder Wegbereiter zum Sozialstaat? https://t.co/gkrwTUadUZ",freuen morgige diskussion sonntalk grossveranstaltungen nötig lockerung startschuss zweite wellen personenfreizügigkeit gefahr od gewinn wohlstand vaterschaftsurlaub zeitgemässe entwicklung wegbereiter sozialstaat,,,,,,,"{'Freue': 0, 'mich': 0, 'auf': 0, 'die': 0.12, 'morgige': 0.02, 'Diskussion': 0.04, 'im': 0, 'SonnTalk': 0.07, 'Grossveranstaltungen': 0.04, 'Nötige': 0.04, 'Lockerung': 0, 'oder': 0.42, 'Startschuss': 0.02, 'für': 0.22, 'zweite': 0.03, 'Welle?-Personenfreizügigkeit': 0.035, 'Gefahr': 0.04, 'od': 0, 'Gewinn': 0, 'den': 0.12, 'Wohlstand?-Vaterschaftsurlaub': 0.4075, 'Zeitgemässe': 0.18, 'Entwicklung': 0.18, 'Wegbereiter': 0, 'zum': 0.075, 'Sozialstaat': 0.24000000000000002}",neutral,"[0.87508196, 0.07944143, 0.045476627]",,,,,,,,,,,,,,,,,,,,,,,,,,,,,,,,,,,,,,,,positive
50.0,25.0,57.0,-0.075,neutral,"Muss auch gesagt sein: Die Pensionskassen machen ihre Hausaufgaben und trotzen den schwierigen politischen und wirtschaftlichen Rahmenbedingungen. Sie werden stets von der Linke schlecht geredet, stellen aber für die meisten ein wichtiger Bestandteil der eigenen Rente sicher. https://t.co/oH5TjO8qnV",sagen pensionskassen hausaufgaben trotzen schwierig politisch wirtschaftlich rahmenbedingungen stets link schlecht reden stellen meist wichtig bestandteil eigen rente sichern,,,,,,,,,,"{'Muss': 0, 'auch': 0.07, 'gesagt': 0.07, 'sein': 0, 'Die': 0.17, 'Pensionskassen': 0.655, 'machen': 0, 'ihre': 0.6, 'Hausaufgaben': 0.16, 'und': 0.11, 'trotzen': 0, 'den': 0.17, 'schwierigen': 0.14, 'politischen': 0.32, 'wirtschaftlichen': 0.24, 'Rahmenbedingungen': 0.19, 'Sie': 0, 'werden': 0, 'stets': 0.06, 'von': 0, 'der': 0.17, 'Linke': 0.23, 'schlecht': 0.1, 'geredet': 0, 'stellen': 0, 'aber': 0.22, 'für': 0.21, 'die': 0.17, 'meisten': 0.15, 'ein': 0, 'wichtiger': 0.48, 'Bestandteil': 0, 'eigenen': 0.55, 'Rente': 0, 'sicher': 0}",negative,"[0.121323474, 0.83241475, 0.046261713]",,,,,,,,,,,,,,,,,,,,,,,,,,,,,,,,,,,,,neutral
0.0,0.0,0.0,-1.0,negative,"Unsere Pensionskassen verwalten 1'000 Mrd. Franken Volksvermögen. Veraltete, bürokratische Einheitslimiten führen zu schlechten Renditen und tiefen Renten. Jetzt den Renten-Appell an den Nationalrat unterzeichnen und moderne Anlagevorschriften fordern. 👇🏻
https://t.co/3SIMvtqcbF",pensionskassen verwalten mrd franken volksvermögen veralten bürokratische einheitslimiten fahren schlecht renditen tief renten renten appell nationalrat unterzeichnen modern anlagevorschriften fordern,,,,,,,,,,"{'Unsere': 0.06, 'Pensionskassen': 0.115, 'verwalten': 0, ""1'000"": 0, 'Mrd.': 0.15, 'Franken': 0, 'Volksvermögen': 0.06, 'Veraltete': 0, 'bürokratische': 0.24, 'Einheitslimiten': 0.39, 'führen': 0.315, 'zu': 0.08, 'schlechten': 0, 'Renditen': 0.97, 'und': 0.06, 'tiefen': 0, 'Renten': 1.0, 'Jetzt': 0.14, 'den': 0.06, 'Renten-Appell': 0.09, 'an': 0, 'Nationalrat': 0.065, 'unterzeichnen': 0.13, 'moderne': 0.1, 'Anlagevorschriften': 0.12, 'fordern': 0.14}",negative,"[0.19467816, 0.7504158, 0.05490604]",,,,,,,,,,,,,,,,,,,,,,,,,,,,,,,,,,,,,negative
100.0,100.0,100.0,0.85,neutral,"Der Nationalrat berät in zwei Wochen die Motion der Sozialkommission Nationalrat mit dem Titel ""Sichere Renten dank umfassend kompetenter Verwaltung der Pensionskassengelder"" - das Potenzial der 1'000 Mrd. CHF PK-Gelder ist zum Teil noch ungenutzt.
https://t.co/HE779AY1yI https://t.co/YIK2XGsVrW",nationalrat beraten zwei wochen motion sozialkommission nationalrat titel sicher renten danken umfassen kompetent verwaltung pensionskassengelder potenzial mrd chf pk gelder teil ungenutzt,,,,,,,,,,"{'Der': 0.18, 'Nationalrat': 0.015, 'berät': 0, 'in': 0.03, 'zwei': 0.01, 'Wochen': 0.03, 'die': 0.18, 'Motion': 0.04, 'der': 0.18, 'Sozialkommission': 0.02, 'mit': 0, 'dem': 0.11499999999999999, 'Titel': 0, 'Sichere': 0, 'Renten': 0.09, 'dank': 0.11000000000000001, 'umfassend': 0, 'kompetenter': 0.1, 'Verwaltung': 0, 'Pensionskassengelder': 0.30000000000000004, 'das': 0, 'Potenzial': 0.72, ""1'000"": 0, 'Mrd.': 0.21, 'CHF': 0.06, 'PK-Gelder': 0, 'ist': 1.0, 'zum': 0.11499999999999999, 'Teil': 0, 'noch': 1.0, 'ungenutzt': 0.75}",negative,"[0.11643698, 0.78437793, 0.09918512]",,,,,,,,,,,,,,,,,,,,,,,,,,,,,,,,,,,,,positive
100.0,100.0,86.0,0.7,neutral,Die jährliche Budgetdebatte im #grzh beginnt. Wir @mehblau wollen die Stimmbevölkerung mit einer Steuersenkung entlasten und die Finanzen nachhaltig sichern. https://t.co/V3mFuYAVPS,jährlich budgetdebatte grzh beginnen stimmbevölkerung steuersenkung entlasten finanzen nachhaltig sichern,,,,,,,,,,,,,"{'Die': 0.1, 'jährliche': 0.07, 'Budgetdebatte': 0, 'im': 0, 'grzh': 0.04, 'beginnt': 0.07, 'Wir': 0.12, 'wollen': 0.38, 'die': 0.1, 'Stimmbevölkerung': 0, 'mit': 0.82, 'einer': 0, 'Steuersenkung': 0.7, 'entlasten': 0.35, 'und': 0.24, 'Finanzen': 0.24, 'nachhaltig': 0, 'sichern': 0.22}",positive,"[0.01966223, 0.002372102, 0.97796565]",,,,,,,,,,,,,,,,,,,,,,,,,,,,,,,,,,positive
100.0,100.0,86.0,0.7,neutral,"Die Motion der @FDP_Liberalen ""Mobilfunknetz. Rahmenbedingungen für einen raschen Aufbau jetzt schaffen"" wurde durch den Nationalrat angenommen. #5G @CHANCE_5G https://t.co/WsdIqBvYG8 Wichtiger Schritt und Zeichen, dass endlich vorwärts gemacht werden muss!",motion mobilfunknetz rahmenbedingungen rasch aufbau schaffen nationalrat annehmen g wichtig schritt zeichen endlich vorwärts,,,,,,,,,,,,,,,,"{'Die': 0.06, 'Motion': 0.23, 'der': 0.06, 'Mobilfunknetz': 1.0, 'Rahmenbedingungen': 0.09, 'für': 0.06, 'einen': 0, 'raschen': 0, 'Aufbau': 0, 'jetzt': 0.05, 'schaffen': 0.07, 'wurde': 0, 'durch': 0, 'den': 0.06, 'Nationalrat': 0.07500000000000001, 'angenommen': 0.07, '5': 0, 'G': 0, 'Wichtiger': 0.04, 'Schritt': 0.03, 'und': 0.04, 'Zeichen': 0.05, 'dass': 0.03, 'endlich': 0, 'vorwärts': 0.06, 'gemacht': 0, 'werden': 0, 'muss': 0}",positive,"[0.17002386, 0.030066192, 0.79991]",,,,,,,,,,,,,,,,,,,,,,,,,,,,,,,positive
75.0,75.0,71.0,0.3333333333333333,neutral,"Bin froh ist die @FDP_Liberalen-Basis in Sachen Pestizideinsatz in der Landwirtschaft nun auf derselben Linie wie die @Jungfreisinnige. Der Umweltschutz muss bei Direktzahlungen besser berücksichtigt werden, wobei wir Verbote klar ablehnen.

https://t.co/dLM5y6zFU7",froh basis sachen pestizideinsatz landwirtschaft linie umweltschutz direktzahlungen gut berücksichtigen wobei verbote klaren ablehnen,,,,,,,,,,,,,,,,,,,"{'Bin': 0, 'froh': 0, 'ist': 0.01, 'die': 0.03, '-Basis': 0, 'in': 1.0, 'Sachen': 0, 'Pestizideinsatz': 0.04, 'der': 0.03, 'Landwirtschaft': 0.03, 'nun': 0, 'auf': 0.04, 'derselben': 0.03, 'Linie': 0.04, 'wie': 0, 'Der': 0.03, 'Umweltschutz': 0.16, 'muss': 0.05, 'bei': 0, 'Direktzahlungen': 0.8049999999999999, 'besser': 0.31, 'berücksichtigt': 0.6525, 'werden': 0, 'wobei': 0, 'wir': 0, 'Verbote': 0, 'klar': 0, 'ablehnen': 0}",neutral,"[0.54722995, 0.014819176, 0.43795097]",,,,,,,"{'Bin': 0, 'froh': 0, 'ist': 0.03, 'die': 0.01, '-Basis': 0, 'in': 0.14, 'Sachen': 0, 'Pestizideinsatz': 0.03, 'der': 0.01, 'Landwirtschaft': 0.04, 'nun': 0, 'auf': 0.01, 'derselben': 0.02, 'Linie': 0.03, 'wie': 0, 'Der': 0.01, 'Umweltschutz': 0.5750000000000001, 'muss': 0.03, 'bei': 0, 'Direktzahlungen': 0.115, 'besser': 0.72, 'berücksichtigt': 0.21000000000000002, 'werden': 0, 'wobei': 0, 'wir': 0, 'Verbote': 0, 'klar': 0, 'ablehnen': 0}",positive,"[0.18808556, 0.14763676, 0.6642777]",,,,,,,,,,,,,,,,"{'Bin': 0, 'froh': 0, 'ist': 0.01, 'die': 0.01, '-Basis': 0, 'in': 0.05, 'Sachen': 0, 'Pestizideinsatz': 0.51, 'der': 0.01, 'Landwirtschaft': 1.0, 'nun': 0, 'auf': 0.01, 'derselben': 0.015, 'Linie': 0.02, 'wie': 0, 'Der': 0.01, 'Umweltschutz': 0.05, 'muss': 0.15, 'bei': 0, 'Direktzahlungen': 0.02, 'besser': 0.01, 'berücksichtigt': 0.0175, 'werden': 0, 'wobei': 0, 'wir': 0, 'Verbote': 0, 'klar': 0, 'ablehnen': 0}",neutral,"[0.9549146, 0.015476264, 0.02960913]",positive
50.0,75.0,57.0,0.0,negative,"Wieso kann nur die Marktwirtschaft die Welt retten 🌍 und was ist ein AXAnaut? 👩🏻‍🚀 Finde es in meinem Podcast mit Fabrizio Petrillo, CEO @AXA_Schweiz, heraus: https://t.co/Fzaq7reCD7",wieso marktwirtschaft welt retten axanaut finden podcast fabrizio petrillo ceo heraus,,,,,,,,,,,,,,,,,,,,,,"{'Wieso': 0, 'kann': 0.1, 'nur': 0.1, 'die': 0.03, 'Marktwirtschaft': 0.1, 'Welt': 0.07, 'retten': 0.03, 'und': 0.07, 'was': 0, 'ist': 0.04, 'ein': 0, 'AXAnaut': 0.15, '\u200d': 0, 'Finde': 0, 'es': 0, 'in': 0, 'meinem': 0, 'Podcast': 0, 'mit': 0, 'Fabrizio': 0, 'Petrillo': 0, 'CEO': 0, 'heraus': 0}",neutral,"[0.5379093, 0.22813918, 0.23395151]",,,,,,,,,,,,,,,,,,,,,,,,,neutral
0.0,0.0,0.0,-1.0,neutral,"Klimaschutz ist Vernunft und darf nicht einer totalitären Ideologie weichen. Eine Marktwirtschaft mit Kostenwahrheit und Innovation muss Teil der Lösung sein. Wir sind in der Verantwortung, exportieren wir unser Wissen in die ganze Welt! #srfarena",klimaschutz vernunft dürfen totalitär ideologie weich marktwirtschaft kostenwahrheit innovation teil lösung verantwortung exportieren wissen ganze welt srfarena,,,,,,,,,,,,,,,,,,,,,,"{'Klimaschutz': 0.03, 'ist': 0.07, 'Vernunft': 0, 'und': 0.06, 'darf': 0, 'nicht': 0.09, 'einer': 0, 'totalitären': 0.11, 'Ideologie': 0.13, 'weichen': 0.03, 'Eine': 0, 'Marktwirtschaft': 0.75, 'mit': 0.67, 'Kostenwahrheit': 0.44, 'Innovation': 0.16, 'muss': 0.04, 'Teil': 0.09, 'der': 0.01, 'Lösung': 0.21, 'sein': 0, 'Wir': 0, 'sind': 0, 'in': 0, 'Verantwortung': 0.21, 'exportieren': 0.05, 'wir': 0, 'unser': 0.06, 'Wissen': 0.03, 'die': 0.01, 'ganze': 0, 'Welt': 0.02, 'srfarena': 0.08}",positive,"[0.004907872, 0.0026105042, 0.9924817]",,,,,,,,,,,,,,,,,,,,,,,,,negative
50.0,75.0,57.0,0.0,neutral,"@BBrandli @Jungfreisinnige Freddie Mac und Fannie Mae sind ein Begriff nehme ich an, oder? Wenn es die Weltwirtschaft aufgrund der Negativzinsen getrieben von Nationalbanken ""lupft"", wird auch die Marktwirtschaft schuld sein?",freddie mac fannie mae begriff nehmen weltwirtschaft aufgrund negativzinsen getrieben nationalbanken lupfen marktwirtschaft schuld,,,,,,,,,,,,,,,,,,,,,,"{'Freddie': 0.03, 'Mac': 0.02, 'und': 0.03, 'Fannie': 0.03, 'Mae': 0, 'sind': 0.06, 'ein': 0, 'Begriff': 0, 'nehme': 0, 'ich': 0.05, 'an': 0, 'oder': 0, 'Wenn': 0, 'es': 0, 'die': 0.07, 'Weltwirtschaft': 0.05, 'aufgrund': 0, 'der': 0.07, 'Negativzinsen': 0, 'getrieben': 0.04, 'von': 0, 'Nationalbanken': 0, 'lupft': 0.05, 'wird': 1.0, 'auch': 0.22, 'Marktwirtschaft': 0.07, 'schuld': 0.47, 'sein': 0}",neutral,"[0.733545, 0.24595752, 0.02049744]",,,,,,,,,,,,,,,,,,,,,,,,,neutral
25.0,25.0,28.0,-0.35,neutral,"Bei den @Jungfreisinnige Schweiz steht die Freiheit jedes Menschen im Zentrum der Politik. Der Schutz der Umwelt und Unterstützung von Menschen mit weniger Möglichkeiten sind selbstverständlich, ohne aber dabei die unglaubliche Schaffungskraft einer Marktwirtschaft zu verkennen. https://t.co/YlecCqkUP0",schweiz stehen freiheit jed menschen zentrum politik schutz umwelt unterstützung menschen wenig möglichkeiten selbstverständlich dabei unglaublich schaffungskraft marktwirtschaft verkennen,,,,,,,,,,,,,,,,,,,,,,"{'Bei': 0.02, 'den': 0.16, 'Schweiz': 0.02, 'steht': 0, 'die': 0.16, 'Freiheit': 0.06, 'jedes': 0, 'Menschen': 0.04, 'im': 0, 'Zentrum': 0.03, 'der': 0.16, 'Politik': 0, 'Der': 0.16, 'Schutz': 0.12, 'Umwelt': 0.06, 'und': 0.03, 'Unterstützung': 0.04, 'von': 0, 'mit': 0.02, 'weniger': 0.07, 'Möglichkeiten': 0.05, 'sind': 0.02, 'selbstverständlich': 0.095, 'ohne': 0.05, 'aber': 0.03, 'dabei': 0, 'unglaubliche': 0.43, 'Schaffungskraft': 0, 'einer': 0, 'Marktwirtschaft': 0.755, 'zu': 0.05, 'verkennen': 0}",positive,"[0.0008344292, 0.0013132553, 0.9978523]",,,,,,,,,,,,,,,,,,,,,,,,,negative
50.0,75.0,57.0,0.0,neutral,@FlorianSchwab @andreaskirstein Haben wir denn heute Kapitalismus und Marktwirtschaft wie es du dir verstellst?🤔🤪,heute kapitalismus marktwirtschaft verstellen,,,,,,,,,,,,,,,,,,,,,,"{'Haben': 0.29, 'wir': 0, 'denn': 0, 'heute': 0.35, 'Kapitalismus': 0.23, 'und': 0.24, 'Marktwirtschaft': 0.25, 'wie': 0, 'es': 0, 'du': 0, 'dir': 0.41, 'verstellst': 0, '🤔': 0, '🤪': 0}",neutral,"[0.6709098, 0.06634874, 0.2627415]",,,,,,,,,,,,,,,,,,,,,,,,,neutral
100.0,100.0,86.0,0.675,neutral,"Nutzen wir die Chancen der Digitalisierung &amp; denken wir neu! Damit uns dies gelingt, muss die Politik den Individuen vertrauen, ihnen ihre Freiheiten garantieren &amp; sich auf das Schaffen optimaler Rahmenbedingungen konzentrieren. Mehr dazu: https://t.co/ap7fnBvsjV https://t.co/dAqIz7alVf",nutzen chancen digitalisierung amp denken neu gelingen politik individuen vertrauen freiheiten garantieren amp schaffen optimal rahmenbedingungen konzentrieren mehr,,,,,,,,,,,,,,,,,,,,,,,,,"{'Nutzen': 0.075, 'wir': 0, 'die': 0.04, 'Chancen': 0.05, 'der': 0.04, 'Digitalisierung': 0, 'amp': 0.03, 'denken': 0.02, 'neu': 0, 'Damit': 0.03, 'uns': 0.04, 'dies': 0, 'gelingt': 0.05, 'muss': 0.02, 'Politik': 0, 'den': 0.04, 'Individuen': 0.04, 'vertrauen': 0.05, 'ihnen': 0, 'ihre': 0.01, 'Freiheiten': 0, 'garantieren': 0.035, 'sich': 0, 'auf': 0.42, 'das': 0, 'Schaffen': 0, 'optimaler': 0.525, 'Rahmenbedingungen': 0.06, 'konzentrieren': 0, 'Mehr': 1.0, 'dazu': 0.02}",positive,"[0.11619175, 0.015285575, 0.86852264]",,,,,,,,,,,,,,,,,,,,,,positive
100.0,100.0,86.0,0.7,neutral,RT @FDP_Liberalen: #ParlCH | E-Collecting🗳️ Chancen der Digitalisierung nutzen und die direkte Demokratie stärken: Auf Initiative der FDP ü…,parlch e collecting chancen digitalisierung nutzen direkt demokratie stärken initiative fdp ü,,,,,,,,,,,,,,,,,,,,,,,,,"{'ParlCH': 0.09, 'E-Collecting️': 0, 'Chancen': 0.92, 'der': 0.03, 'Digitalisierung': 0, 'nutzen': 1.0, 'und': 0.34, 'die': 0.03, 'direkte': 0.06, 'Demokratie': 0.17, 'stärken': 0.34, 'Auf': 0.12, 'Initiative': 0.09, 'FDP': 0.05, 'ü': 0, '…': 0}",positive,"[0.12812893, 0.020341048, 0.85153]",,,,,,,,,,,,,,,,,,,,,,positive
0.0,0.0,0.0,-0.85,negative,"Wir sind einen (sehr kleinen) Schritt weiter in Sachen #eCollecting. Leider geht das alles sehr langsam vorwärts. Wenn man dachte, dass die Covid-Krise ein Digitalisierungsturbo in der Politik auslöse, dann bezweifle ich das sehr... https://t.co/6LJOBAZPsf https://t.co/p8adM6joXs",klein schritt weit sachen ecollecting leider gehen langsam vorwärts denken covid krise digitalisierungsturbo politik auslösen bezweifeln,,,,,,,,,,,,,,,,,,,,,,,,,"{'Wir': 0.02, 'sind': 0.03, 'einen': 0.5, 'sehr': 0.03, 'kleinen': 0.05, 'Schritt': 0.03, 'weiter': 0.03, 'in': 0.16, 'Sachen': 0, 'eCollecting': 0.15, 'Leider': 0.04, 'geht': 0, 'das': 0.19, 'alles': 0.08, 'langsam': 0, 'vorwärts': 0, 'Wenn': 0, 'man': 0, 'dachte': 0.26, 'dass': 0.19, 'die': 0.22, 'Covid-Krise': 0.36, 'ein': 0, 'Digitalisierungsturbo': 0, 'der': 0.22, 'Politik': 0, 'auslöse': 1.0, 'dann': 0.09, 'bezweifle': 0.36, 'ich': 0.04, '...': 0}",negative,"[0.304656, 0.61024046, 0.085103616]",,,,,,,,,,,,,,,,,,,,,,negative
50.0,75.0,57.0,0.0,neutral,"Das @EJPD_DFJP_DFGP macht vorwärts für eine Schweizer #eID Lösung, die für verschiedene Digitalisierungsvorhaben nach wie vor sehr wichtig ist. Gute Nachrichten - auch wenn eine gesetzliche Lösung wohl erst in 3 Jahren+ verabschiedet sein wird. https://t.co/enihWcomQH https://t.co/a9GODOaIpc",vorwärts schweizer eid lösung verschieden digitalisierungsvorhaben wichtig gut nachrichten gesetzliche lösung wohl erst jahren verabschieden,,,,,,,,,,,,,,,,,,,,,,,,,"{'Das': 0, 'macht': 0, 'vorwärts': 0, 'für': 0.01, 'eine': 0, 'Schweizer': 0.03, 'eID': 0.04, 'Lösung': 0.06, 'die': 0, 'verschiedene': 0, 'Digitalisierungsvorhaben': 1.0, 'nach': 0, 'wie': 0, 'vor': 0, 'sehr': 0.03, 'wichtig': 0.05, 'ist': 0.03, 'Gute': 0, 'Nachrichten': 0, 'auch': 0, 'wenn': 0.01, 'gesetzliche': 0, 'wohl': 0, 'erst': 0, 'in': 0, '3': 0, 'Jahren+': 0.02, 'verabschiedet': 0.11, 'sein': 0, 'wird': 0.01}",positive,"[0.18002664, 0.04293009, 0.7770433]",,,,,,,,,,,,,,,,,,,,,,neutral
100.0,100.0,100.0,1.0,neutral,Good News: Vollständig digitale Unternehmensgründungen werden schon bald Realität sein 🚀Der Bundesrat empfiehlt meinen entsprechenden Vorstoss zur Annahme! Unterzeichne jetzt den Digitalisierungs-Appell und verleihe dem Anliegen das nötige Gewicht: https://t.co/dcl82XS9GB,good news vollständig digitale unternehmensgründungen schon bald realität bundesrat empfehlen entsprechend vorstoss annahme unterzeichnen digitalisierungs appell verleihe anliegen nötig gewicht,,,,,,,,,,,,,,,,,,,,,,,,,"{'Good': 0.02, 'News': 0.03, 'Vollständig': 0, 'digitale': 0.05, 'Unternehmensgründungen': 0.05, 'werden': 0.02, 'schon': 0, 'bald': 0, 'Realität': 0.05, 'sein': 0, 'Der': 0.03, 'Bundesrat': 0.04, 'empfiehlt': 0.07, 'meinen': 0, 'entsprechenden': 0, 'Vorstoss': 0, 'zur': 0.03, 'Annahme': 0, 'Unterzeichne': 1.0, 'jetzt': 0.32, 'den': 0.03, 'Digitalisierungs-Appell': 0.64, 'und': 0.29, 'verleihe': 0, 'dem': 0.03, 'Anliegen': 0, 'das': 0.03, 'nötige': 0.05, 'Gewicht': 0.07}",neutral,"[0.91311795, 0.017215388, 0.069666706]",,,,,,,,,,,,,,,,,,,,,,positive
50.0,75.0,57.0,0.0,neutral,@adfichter @chplusplus Die Aussage von @Marcel_Dobler zum Datenschutz war nicht im Zusammenhang mit der Digitalisierung sondern der Impfstoffbeschaffung.,aussagen datenschutz zusammenhang digitalisierung impfstoffbeschaffung,,,,,,,,,,,,,,,,,,,,,,,,,"{'Die': 0.15, 'Aussage': 0.41, 'von': 0, 'zum': 0.175, 'Datenschutz': 0, 'war': 0, 'nicht': 1.0, 'im': 0, 'Zusammenhang': 0, 'mit': 0, 'der': 0.15, 'Digitalisierung': 0, 'sondern': 1.0, 'Impfstoffbeschaffung': 0.075}",neutral,"[0.96308964, 0.03260458, 0.0043057697]",,,,,,,,,,,,,,,,,,,,,,neutral
50.0,75.0,57.0,0.0,neutral,"Das #eID-Gesetz ist die Basis dafür, dass in der Schweiz neue Anwendungen entstehen können und dass die Digitalisierung hier und nicht im Ausland stattfindet. Das E-ID-Gesetz ist eine Investition in die Schweiz. Deshalb sage ich und die @FDP_Liberalen #eIDja

#abst21 @E_ID_Info https://t.co/PBLOmM5P3f",eid gesetz basis dafür schweiz neue anwendungen entstehen digitalisierung ausland stattfinden e id gesetz investition schweiz deshalb sage eidja abst21,,,,,,,,,,,,,,,,,,,,,,,,,"{'Das': 0.01, 'eID-Gesetz': 0.075, 'ist': 0.03, 'die': 0.01, 'Basis': 0.15, 'dafür': 0, 'dass': 0.02, 'in': 0.01, 'der': 0.01, 'Schweiz': 0.01, 'neue': 0.05, 'Anwendungen': 0.11, 'entstehen': 0, 'können': 0, 'und': 0.02, 'Digitalisierung': 0, 'hier': 0.08, 'nicht': 0.17, 'im': 0, 'Ausland': 0.04, 'stattfindet': 0.09, 'E-ID-Gesetz': 0.12, 'eine': 0, 'Investition': 0.03, 'Deshalb': 0, 'sage': 0, 'ich': 0.02, 'eIDja': 0.03, 'abst21': 0.04}",neutral,"[0.7157099, 0.033519626, 0.25077042]",,,,,,,,,,,,,,,,,,,,,,neutral
