answer_five,answer_four,answer_seven,polarity,sentiment_gs,tweet,tweet_tokens,absa_token_weights_3392,absa_sentiment_3392,absa_scores_3392,absa_token_weights_3412,absa_sentiment_3412,absa_scores_3412,absa_token_weights_3414,absa_sentiment_3414,absa_scores_3414,absa_token_weights_3415,absa_sentiment_3415,absa_scores_3415,absa_token_weights_3436,absa_sentiment_3436,absa_scores_3436,absa_token_weights_3446,absa_sentiment_3446,absa_scores_3446,absa_token_weights_3455,absa_sentiment_3455,absa_scores_3455,absa_token_weights_3465,absa_sentiment_3465,absa_scores_3465,absa_token_weights_3466,absa_sentiment_3466,absa_scores_3466,absa_token_weights_3467,absa_sentiment_3467,absa_scores_3467,absa_token_weights_3469,absa_sentiment_3469,absa_scores_3469,absa_token_weights_3472,absa_sentiment_3472,absa_scores_3472,absa_token_weights_3474,absa_sentiment_3474,absa_scores_3474,absa_token_weights_3475,absa_sentiment_3475,absa_scores_3475,absa_token_weights_3478,absa_sentiment_3478,absa_scores_3478,absa_token_weights_3479,absa_sentiment_3479,absa_scores_3479,sentiment_tb
50.0,75.0,57.0,0.0,neutral,Unser Entscheid in der #SGK-N; Ja zur Cannabislegalisierung 👍 https://t.co/uTJkIkbkHu,entscheid sgk n ja cannabislegalisierung,"{'Unser': 0.09, 'Entscheid': 0.15, 'in': 0.06, 'der': 0.12, 'SGK-N': 0, 'Ja': 0, 'zur': 0.2, 'Cannabislegalisierung': 0.725}",positive,"[0.04140664, 0.0030833636, 0.95551]",,,,,,,,,,,,,,,,,,,,,,,,,,,,,,,,,,,,,,,,,,,,,,neutral
100.0,100.0,86.0,0.7,neutral,Ein kleiner aber wichtiger Schritt in die richtige Richtung: Der Nationalrat stimmt für die Abgabe von Cannabis zu medizinischen Zwecken. Enttabuisierung von Cannabis auch im #parlCH. Nächster Schritt nach Bewilligung Pilotversuch - hoffentlich bald kontrollierte Legalisierung!,klein wichtig schritt richtige richtung nationalrat stimmen abgabe cannabis medizinisch zwecken enttabuisierung cannabis parlch nächst schritt bewilligung pilotversuch hoffentlich bald kontrollieren legalisierung,"{'Ein': 0.04, 'kleiner': 0, 'aber': 0.04, 'wichtiger': 0.06, 'Schritt': 0.05, 'in': 0.04, 'die': 0.14, 'richtige': 0.04, 'Richtung': 0.06, 'Der': 0.14, 'Nationalrat': 0.11, 'stimmt': 0.04, 'für': 0.76, 'Abgabe': 0, 'von': 0, 'Cannabis': 0.42, 'zu': 0, 'medizinischen': 0.32, 'Zwecken': 0.21, 'Enttabuisierung': 0.04, 'auch': 0.04, 'im': 0, 'parlCH': 0.11, 'Nächster': 0, 'nach': 0.01, 'Bewilligung': 0, 'Pilotversuch': 0.125, 'hoffentlich': 0.04, 'bald': 0, 'kontrollierte': 0.07, 'Legalisierung': 0.29}",positive,"[0.44747767, 0.016349548, 0.5361728]",,,,,,,,,,,,,,,,,,,,,,,,,,,,,,,,,,,,,,,,,,,,,,positive
50.0,75.0,57.0,0.0,neutral,"Der Nationalrat gibt grünes Licht für Pilotversuche legaler Cannabisabgaben in Städten (113:81). Auch wenn nur eine kontrollierte, komplette Liberalisierung das Problem mit dem Schwarzmarkt und fehlender Prävention lösen kann, ist es ein Schritt in die richtige Richtung. #parlCH",nationalrat geben grün licht pilotversuche legal cannabisabgaben städten kontrollieren komplette liberalisierung problem schwarzmarkt fehlend prävention lösen schritt richtige richtung parlch,"{'Der': 0.02, 'Nationalrat': 0.05, 'gibt': 0, 'grünes': 0.06, 'Licht': 0.04, 'für': 0.04, 'Pilotversuche': 0.08, 'legaler': 1.0, 'Cannabisabgaben': 1.0, 'in': 0.01, 'Städten': 0.04, '113:81': 0, 'Auch': 0, 'wenn': 0.01, 'nur': 0.01, 'eine': 0, 'kontrollierte': 0.02, 'komplette': 0.01, 'Liberalisierung': 0.05, 'das': 0, 'Problem': 0.02, 'mit': 0.01, 'dem': 0.02, 'Schwarzmarkt': 0.05, 'und': 0.01, 'fehlender': 0, 'Prävention': 0.02, 'lösen': 0.01, 'kann': 0.01, 'ist': 0.01, 'es': 0.01, 'ein': 0, 'Schritt': 0.01, 'die': 0.02, 'richtige': 0.01, 'Richtung': 0.01, 'parlCH': 0.04}",positive,"[0.085705414, 0.015594743, 0.8986998]",,,,,,,,,,,,,,,,,,,,,,,,,,,,,,,,,,,,,,,,,,,,,,neutral
100.0,100.0,86.0,0.7,neutral,"#Cannabis-Pilotversuch: Eine hohe Qualität kann sichergestellt werden und der Schwarzmarkt wird eliminiert. Die Prävention wird vereinfacht, indem der Konsum nicht versteckt erfolgt. Für die Landwirtschaft schafft es zudem einen neuen Markt.

https://t.co/55IvFvdbTQ",cannabis pilotversuch hoch qualität sicherstellen schwarzmarkt eliminieren prävention vereinfachen konsum verstecken erfolgen landwirtschaft schaffen zudem neu markt,"{'Cannabis-Pilotversuch': 0.76, 'Eine': 0, 'hohe': 0, 'Qualität': 0.4, 'kann': 0.08, 'sichergestellt': 0.14, 'werden': 0, 'und': 0.18, 'der': 0.2, 'Schwarzmarkt': 0.22, 'wird': 0, 'eliminiert': 0.19, 'Die': 0.2, 'Prävention': 0.11, 'vereinfacht': 0.07, 'indem': 0, 'Konsum': 0.19, 'nicht': 0.02, 'versteckt': 0.08, 'erfolgt': 0, 'Für': 0.06, 'die': 0.2, 'Landwirtschaft': 0.34, 'schafft': 0.06, 'es': 0.03, 'zudem': 0, 'einen': 0.05, 'neuen': 0.08, 'Markt': 0.22}",positive,"[0.33799785, 0.11040653, 0.5515956]",,,,,,,,,,,,,,,,,,,,,,,,,,,,,,,,,,,,,,,,,,,"{'Cannabis-Pilotversuch': 0.135, 'Eine': 0, 'hohe': 0, 'Qualität': 0.14, 'kann': 0.09, 'sichergestellt': 0.12, 'werden': 0, 'und': 0.06, 'der': 0.08, 'Schwarzmarkt': 0.385, 'wird': 0, 'eliminiert': 0.22, 'Die': 0.08, 'Prävention': 0.18, 'vereinfacht': 0.29, 'indem': 0, 'Konsum': 0.79, 'nicht': 0.28, 'versteckt': 0.37, 'erfolgt': 0, 'Für': 0.58, 'die': 0.08, 'Landwirtschaft': 0.58, 'schafft': 1.0, 'es': 0.19, 'zudem': 0, 'einen': 0.4, 'neuen': 1.0, 'Markt': 0.68}",positive,"[0.081989355, 0.00936233, 0.90864825]",positive
100.0,100.0,100.0,0.85,neutral,Ein wichtiger Entscheid für eine vernünftige Drogenpolitik. Eine Mehrheit des Nationalrates will auf wissenschaftlich begleitete Pilotversuche für kontrollierte Cannabis-Abgaben in Städten eintreten. 👍,wichtig entscheid vernünftig drogenpolitik mehrheit nationalrates wissenschaftlich begleiten pilotversuche kontrollieren cannabis abgaben städten eintreten,"{'Ein': 0.03, 'wichtiger': 0.02, 'Entscheid': 0.02, 'für': 0.39, 'eine': 0, 'vernünftige': 0.06, 'Drogenpolitik': 0.1, 'Eine': 0, 'Mehrheit': 0.01, 'des': 0, 'Nationalrates': 0.04, 'will': 0, 'auf': 0, 'wissenschaftlich': 0, 'begleitete': 0, 'Pilotversuche': 0.17, 'kontrollierte': 1.0, 'Cannabis-Abgaben': 1.0, 'in': 0.11, 'Städten': 0.12, 'eintreten': 0}",positive,"[0.46972716, 0.02651267, 0.50376016]",,,,,,,,,,,,,,,,,,,,,,,,,,,,,,,,,,,,,,,,,,,,,,positive
100.0,100.0,86.0,0.7,neutral,"RT @ChristianLuedi: Schon gewählt?
Ich wähle am 20. Oktober Andri Silberschmidt in den Nationalrat.
#zämemitDir legalisieren wir Cannabis.…",schon wählen wählen oktober andri silberschmidt nationalrat zämemitdir legalisieren cannabis,"{'Schon': 0, 'gewählt': 0, 'Ich': 0.02, 'wähle': 0, 'am': 0, '20.': 0, 'Oktober': 0.03, 'Andri': 0.03, 'Silberschmidt': 0.1, 'in': 0, 'den': 0.03, 'Nationalrat': 0.05500000000000001, 'zämemitDir': 0, 'legalisieren': 1.0, 'wir': 0, 'Cannabis': 0.53, '…': 0}",neutral,"[0.6704055, 0.0069775954, 0.32261688]",,,,,,,,,,,,,,,,,,,,,,,,,,,,,,,,,,,,,,,,,,,,,,positive
100.0,100.0,86.0,0.7,neutral,"RT @strategiedialog: #Rentenalter erhöhen oder #AHV ausbauen? 

Die Debatte um die Zukunft der #Altersvorsorge ist in vollem Gange, der #Di…",rentenalter erhöhen ahv ausbauen debatte zukunft altersvorsorge voll gange di,,,,"{'Rentenalter': 0.445, 'erhöhen': 0, 'oder': 0.8, 'AHV': 0.2, 'ausbauen': 0, 'Die': 0.08, 'Debatte': 0.22, 'um': 0, 'die': 0.08, 'Zukunft': 0.13, 'der': 0.08, 'Altersvorsorge': 0.42000000000000004, 'ist': 0.08, 'in': 0.06, 'vollem': 0.05, 'Gange': 0, 'Di': 0.07, '…': 0}",positive,"[0.15112983, 0.05154118, 0.79732907]",,,,,,,,,,,,,,,,,,,,,,,,,,,,,,,,,,,,,,,,,,,positive
50.0,75.0,57.0,0.0,neutral,@mediabeobachter @RentenVI Es gibt sehr viele ökonomischen Argumente für die Erhöhung des Rentenalters https://t.co/3S2MoJ9RJK,geben ökonomisch argumente erhöhung rentenalters,,,,"{'Es': 0, 'gibt': 0.13, 'sehr': 0, 'viele': 0, 'ökonomischen': 0.25, 'Argumente': 0.88, 'für': 0, 'die': 0.48, 'Erhöhung': 0, 'des': 0, 'Rentenalters': 0.765}",positive,"[0.19307621, 0.09121298, 0.7157109]",,,,,,,,,,,,,,,,,,,,,,,,,,,,,,,,,,,,,,,,,,,neutral
0.0,0.0,0.0,-1.0,neutral,"In den kommenden 25 Jahren fehlen 190 Milliarden CHF in der #AHV - gemäss #BSV. Und da bekämpfen Grüne und Gewerkschaften die Angleichung des Rentenalters. Völlig unglaubwürdig, in anderen Bereichen noch von nachhaltiger Politik zu sprechen. Es braucht die @RentenVI.",kommend jahren fehlen milliarden chf ahv gemäss bsv bekämpfen grüne gewerkschaften angleichung rentenalters völlig unglaubwürdig bereichen nachhaltig politik sprechen brauchen,,,,"{'In': 0.06, 'den': 0.13, 'kommenden': 0, '25': 0, 'Jahren': 0.05, 'fehlen': 0, '190': 0, 'Milliarden': 0, 'CHF': 0.05, 'in': 0.06, 'der': 0.13, 'AHV': 0.05, 'gemäss': 0.06, 'BSV': 0.09, 'Und': 0.17, 'da': 0, 'bekämpfen': 0, 'Grüne': 0, 'und': 0.17, 'Gewerkschaften': 0.47, 'die': 0.13, 'Angleichung': 0, 'des': 0.05, 'Rentenalters': 0.6599999999999999, 'Völlig': 0, 'unglaubwürdig': 0, 'anderen': 0, 'Bereichen': 0.1, 'noch': 0, 'von': 0.05, 'nachhaltiger': 0.13, 'Politik': 0, 'zu': 0.06, 'sprechen': 0.065, 'Es': 0.04, 'braucht': 0}",positive,"[0.37648943, 0.07871276, 0.5447978]",,,,,,,,,,,,,,,,,,,,,,,,,,,,,,,,,,,,,,,,,,,negative
0.0,0.0,0.0,-1.0,neutral,"Die Angleichung des Rentenalters ergibt Sinn #AHV21. Die langfristigen Herausforderungen in der Finanzierung der AHV bleiben aber ungelöst, weshalb es zwingend die @RentenVI braucht. @FuW_News https://t.co/aQbUUgeL3M",angleichung rentenalters ergeben sinn ahv21 langfristig herausforderungen finanzierung ahv bleiben ungelöst weshalb zwingen brauchen,,,,"{'Die': 0.08, 'Angleichung': 0, 'des': 0, 'Rentenalters': 0.765, 'ergibt': 0, 'Sinn': 0, 'AHV21.': 0, 'langfristigen': 0, 'Herausforderungen': 0.35, 'in': 0.06, 'der': 0.08, 'Finanzierung': 0.55, 'AHV': 0.11, 'bleiben': 0.07, 'aber': 0, 'ungelöst': 0.17, 'weshalb': 0, 'es': 0.05, 'zwingend': 0, 'die': 0.08, 'braucht': 0}",positive,"[0.15035309, 0.031050865, 0.81859607]",,,,,,,,,,,,,,,,,,,,,,,,,,,,,,,,,,,,,,,,,,,negative
0.0,0.0,14.0,-0.7,neutral,"@retolipp Ein Kompromiss wäre, ausgehend vom kumulierten Defizit vor #STAF (190 Mrd. CHF bis 2045) Sanierungsmassnahmen je zur Hälfte einnahmen- und ausgabenseitig zu beschliessen. Also ein Mix aus Rentenalter (inkl. Anreize, länger zu arbeiten) und Steuern.",kompromiss ausgehen kumulieren defizit staf mrd chf sanierungsmassnahmen je hälfte einnahmen ausgabenseitig beschliessen mix rentenalter inkl anreize lang arbeiten steuern,,,,"{'Ein': 0.42, 'Kompromiss': 0.19, 'wäre': 0.05, 'ausgehend': 0, 'vom': 0.04, 'kumulierten': 0, 'Defizit': 0.06, 'vor': 0.04, 'STAF': 0, '190': 0, 'Mrd.': 0.06, 'CHF': 0.08, 'bis': 0, '2045': 0, 'Sanierungsmassnahmen': 0.1, 'je': 0, 'zur': 0.08, 'Hälfte': 0.09, 'einnahmen-': 0, 'und': 0.64, 'ausgabenseitig': 0.05, 'zu': 0.12, 'beschliessen': 0.04, 'Also': 0, 'ein': 0, 'Mix': 1.0, 'aus': 0, 'Rentenalter': 0.875, 'inkl.': 0, 'Anreize': 0.21, 'länger': 0.07, 'arbeiten': 0.07, 'Steuern': 0}",neutral,"[0.97733307, 0.0068627438, 0.015804222]",,,,,,,,,,,,,,,,,,,,,,,,,,,,,,,,,,,,,,,,,,,negative
50.0,75.0,57.0,0.0,neutral,"RT @RentenVI: Wissenschaftler stellen fest: Schweiz ist bereit für ein höheres Rentenalter: https://t.co/dyiTl5EgBy

#Renteninitiative unte…",wissenschaftler stellen fest schweiz bereiten hoch rentenalter renteninitiative unte,,,,"{'Wissenschaftler': 0, 'stellen': 0, 'fest': 0, 'Schweiz': 0.15, 'ist': 0.09, 'bereit': 0.35, 'für': 0.49, 'ein': 0, 'höheres': 1.0, 'Rentenalter': 1.0, 'Renteninitiative': 0.135, 'unte': 0, '…': 0}",positive,"[0.18086688, 0.019494535, 0.7996385]",,,,,,,,,,,,,,,,,,,,,,,,,,,,,,,,,,,,,,,,,,,neutral
100.0,100.0,86.0,0.7,neutral,"Die Rezession trifft die Altersvorsorge besonders hart: Ihr entgehen Lohnbeiträge und Steuereinnahmen in Milliardenhöhe. Damit könnte auch das Tabu eines höheren Rentenalters fallen.

https://t.co/iw2Z7lB3e9 https://t.co/fHoaNbkWcQ",rezession treffen altersvorsorge besonders hart entgehen lohnbeiträge steuereinnahmen milliardenhöhe tabu hoch rentenalters fallen,,,,"{'Die': 0.25, 'Rezession': 0.14, 'trifft': 0, 'die': 0.25, 'Altersvorsorge': 0.48000000000000004, 'besonders': 0, 'hart': 0, 'Ihr': 0, 'entgehen': 0, 'Lohnbeiträge': 0.05, 'und': 0.04, 'Steuereinnahmen': 0.16, 'in': 0.04, 'Milliardenhöhe': 0.1, 'Damit': 0.04, 'könnte': 0.81, 'auch': 0.37, 'das': 0, 'Tabu': 0, 'eines': 0, 'höheren': 0.21, 'Rentenalters': 0.605, 'fallen': 0}",positive,"[0.10114403, 0.27297154, 0.6258844]",,,,,,,,,,,,,,,,,,,,,,,,,,,,,,,,,,,,,,,,,,,positive
0.0,0.0,0.0,-1.0,neutral,"Ein Grund unter vielen ist die Rentenalterdiskriminierung; weil die Dauer der Arbeitstätigkeit bis zur Pensionierung immer kürzer wird, was mit einer leichten Anhebung des Rentenalters entschärft würde (+weil Arbeit &gt;65 in manchen Berufsgruppen massiv erschwert wird). https://t.co/8ZJugr2jUH",grund rentenalterdiskriminierung dauer arbeitstätigkeit pensionierung immer kurz leicht anhebung rentenalters entschärfen arbeit gt manch berufsgruppen massiv erschweren,,,,"{'Ein': 0.02, 'Grund': 0, 'unter': 0, 'vielen': 0.09, 'ist': 0.02, 'die': 0.03, 'Rentenalterdiskriminierung': 0.52, 'weil': 0.02, 'Dauer': 0.06, 'der': 0.03, 'Arbeitstätigkeit': 0.05, 'bis': 0, 'zur': 0.035, 'Pensionierung': 0.04, 'immer': 0, 'kürzer': 0.05, 'wird': 0, 'was': 0, 'mit': 0.03, 'einer': 0.08, 'leichten': 0, 'Anhebung': 0, 'des': 0, 'Rentenalters': 0.04, 'entschärft': 0, 'würde': 0.04, 'Arbeit': 0.05, 'gt;65': 0, 'in': 0.02, 'manchen': 0.02, 'Berufsgruppen': 0.04, 'massiv': 0, 'erschwert': 0.04}",negative,"[0.012098325, 0.9668775, 0.021024138]",,,,,,,,,,,,,,,,,,,,,,,,,,,,,,,,,,,,,,,,,,,negative
100.0,100.0,86.0,0.7,neutral,"«Beim Thema Rentenalter und AHV bin ich sicher, dass jede Art von Vereinfachung – und dazu gehören nun einmal Demonstrationen – nichts zur Problemlösung beiträgt und nur die bestehenden Gräben vertieft»

https://t.co/0eFWE3L9sW",beim thema rentenalter ahv sichern jed art vereinfachung gehören demonstrationen problemlösung beitragen bestehend gräben vertiefen,,,,"{'«': 0, 'Beim': 0, 'Thema': 0, 'Rentenalter': 0, 'und': 0, 'AHV': 0, 'bin': 0, 'ich': 0, 'sicher': 0, 'dass': 0, 'jede': 0, 'Art': 0, 'von': 0, 'Vereinfachung': 0, '–': 0, 'dazu': 0, 'gehören': 0, 'nun': 0, 'einmal': 0, 'Demonstrationen': 0, 'nichts': 0, 'zur': 0, 'Problemlösung': 0, 'beiträgt': 0, 'nur': 0, 'die': 0, 'bestehenden': 0, 'Gräben': 0, 'vertieft': 0, '»': 0}",positive,"[0.42677587, 0.01617639, 0.5570478]",,,,,,,,,,,,,,,,,,,,,,,,,,,,,,,,,,,,,,,,,,,positive
100.0,100.0,86.0,0.7,neutral,RT @Jungfreisinnige: Im Jahr 2030 werden die meisten Länder ihr Rentenalter auf 66 oder noch höher erhöht haben. Die Schweiz bliebe die Aus…,jahr meist länder rentenalter hoch erhöhen schweiz bleiben,,,,"{'Im': 0, 'Jahr': 0, '2030': 0, 'werden': 0.33, 'die': 0.08, 'meisten': 0.3, 'Länder': 0.48, 'ihr': 0, 'Rentenalter': 1.0, 'auf': 0, '66': 0, 'oder': 0.59, 'noch': 0, 'höher': 0.16, 'erhöht': 0, 'haben': 0.595, 'Die': 0.08, 'Schweiz': 0.2, 'bliebe': 0.14, 'Aus': 0, '…': 0}",neutral,"[0.64310473, 0.06641679, 0.29047847]",,,,,,,,,,,,,,,,,,,,,,,,,,,,,,,,,,,,,,,,,,,positive
100.0,100.0,100.0,1.0,neutral,"RT @tagesanzeiger: Ein guter Teil der über 50-Jährigen ist definitiv bereit, über das ordentliche Rentenalter hinaus zu arbeiten. https://t…",gut teil jährig definitiv bereiten ordentliche rentenalter hinaus arbeiten,,,,"{'Ein': 0.04, 'guter': 0, 'Teil': 0, 'der': 0.54, 'über': 0.08, '50-Jährigen': 0.16, 'ist': 0, 'definitiv': 0, 'bereit': 0.13, 'das': 0, 'ordentliche': 0, 'Rentenalter': 0.94, 'hinaus': 0, 'zu': 0.11, 'arbeiten': 0.16}",positive,"[0.1872459, 0.011849601, 0.8009045]",,,,,,,,,,,,,,,,,,,,,,,,,,,,,,,,,,,,,,,,,,,positive
50.0,75.0,57.0,0.0999999999999999,neutral,"Je länger wir leben, desto länger sollen wir arbeiten. Rentenalter 66+, aber natürlich nicht für den Bauarbeiter, wo bereits heute eine Branchenlösung gefunden wurde. Wenn wir einfach nichts tun, hat die AHV im 2035 kein Geld mehr, Renten zu bezahlen. https://t.co/2BFfyuStqf",je lang leben desto lang sollen arbeiten rentenalter natürlich bauarbeiter bereits heute branchenlösung finden einfach tun ahv geld mehr renten bezahlen,,,,"{'Je': 0, 'länger': 0.1, 'wir': 0, 'leben': 0, 'desto': 0.02, 'sollen': 0.05, 'arbeiten': 0.14, 'Rentenalter': 1.0, '66': 0, 'aber': 0.14, 'natürlich': 0, 'nicht': 0.1, 'für': 0.06, 'den': 0.03, 'Bauarbeiter': 0.07, 'wo': 0.01, 'bereits': 0.02, 'heute': 0.02, 'eine': 0, 'Branchenlösung': 0.04, 'gefunden': 0.02, 'wurde': 0, 'Wenn': 0, 'einfach': 0, 'nichts': 0.02, 'tun': 0.015, 'hat': 0, 'die': 0.03, 'AHV': 0.04, 'im': 0, '2035': 0, 'kein': 0.01, 'Geld': 0.02, 'mehr': 0.01, 'Renten': 0.04, 'zu': 0.02, 'bezahlen': 0.02}",positive,"[0.44145858, 0.04304374, 0.51549774]",,,,,,,,,,,,,,,,,,,,,,,,,,,,,,,,,,,,,,,,,,,neutral
50.0,75.0,57.0,0.0,neutral,"RT @jfsolothurn: Unsere nationale #Renteninitiative ist lanciert.
Rentenalter 66 für beide Geschlechter und Bindung desselben an die Lebens…",national renteninitiative lanciert rentenalter beid geschlechter bindung lebens,,,,"{'Unsere': 0.04, 'nationale': 0.03, 'Renteninitiative': 0.055, 'ist': 0, 'lanciert': 0.09, 'Rentenalter': 0.215, '66': 0, 'für': 0.68, 'beide': 0.3, 'Geschlechter': 0, 'und': 1.0, 'Bindung': 0, 'desselben': 0, 'an': 0, 'die': 0, 'Lebens': 0.27, '…': 0}",positive,"[0.020231243, 0.002597546, 0.9771712]",,,,,,,,,,,,,,,,,,,,,,,,,,,,,,,,,,,,,,,,,,,neutral
50.0,75.0,57.0,0.0,neutral,RT @FDP_Liberalen: Die Diskussion übers #Rentenalter darf kein Tabu sein - die @spschweiz ist realitätsfern. Die Volksinitiative der @Jungf…,diskussion übers rentenalter dürfen tabu realitätsfern volksinitiative,,,,"{'Die': 0.12, 'Diskussion': 0.49, 'übers': 0, 'Rentenalter': 0.905, 'darf': 0, 'kein': 0, 'Tabu': 0, 'sein': 0, 'die': 0.12, 'ist': 0, 'realitätsfern': 0.44, 'Volksinitiative': 0.195, 'der': 0.12, '…': 0}",positive,"[0.16071719, 0.015510595, 0.8237722]",,,,,,,,,,,,,,,,,,,,,,,,,,,,,,,,,,,,,,,,,,,neutral
50.0,75.0,57.0,0.0,neutral,RT @NilsMatter: Rentenalter 66 für Alle #AHV #zämemitDir @andrisilbi_ https://t.co/tutdk5DS2j,rentenalter all ahv zämemitdir,,,,"{'Rentenalter': 0.835, '66': 0, 'für': 0.59, 'Alle': 0, 'AHV': 0.23, 'zämemitDir': 0}",positive,"[0.17259482, 0.009350278, 0.81805485]",,,,,,,,,,,,,,,,,,,,,,,,,,,,,,,,,,,,,,,,,,,neutral
100.0,100.0,100.0,1.0,neutral,RT @rudolf_mohler: „Die VI der @Jungfreisinnige|n für eine schrittweise Erhöhung des Rentenalters ist ein echter Lösungsansatz. Unvermeidli…,vi n schrittweise erhöhung rentenalters echt lösungsansatz unvermeidli,,,,"{'„': 0, 'Die': 0, 'VI': 0, 'der': 0, '|n': 0, 'für': 0, 'eine': 0, 'schrittweise': 0, 'Erhöhung': 0, 'des': 0, 'Rentenalters': 0, 'ist': 0, 'ein': 0, 'echter': 0, 'Lösungsansatz': 0, 'Unvermeidli': 0, '…': 0}",positive,"[0.031039068, 0.014238754, 0.95472217]",,,,,,,,,,,,,,,,,,,,,,,,,,,,,,,,,,,,,,,,,,,positive
50.0,25.0,28.0,-0.15,neutral,"@salegen @SandroBrotz @Jungfreisinnige Spannend, mir wird ab und zu auch das Gegenteil vorgeworfen. Zur AHV: Eine Erhöhung des Rentenalters stärkt die AHV, da die Beitragsjahre zunehmen und die Finanzierung gesichert wird.",spannen ab gegenteil vorwerfen ahv erhöhung rentenalters stärken ahv beitragsjahre zunehmen finanzierung sichern,,,,"{'Spannend': 0.11, 'mir': 0, 'wird': 0, 'ab': 0, 'und': 0.09, 'zu': 0.02, 'auch': 0, 'das': 0, 'Gegenteil': 0.07, 'vorgeworfen': 0.12, 'Zur': 0.04, 'AHV': 0.3, 'Eine': 0, 'Erhöhung': 0.1, 'des': 0.03, 'Rentenalters': 0.33, 'stärkt': 1.0, 'die': 0.06, 'da': 0, 'Beitragsjahre': 0.09, 'zunehmen': 0, 'Finanzierung': 0.19, 'gesichert': 0.12}",positive,"[0.064365044, 0.117712535, 0.8179224]",,,,,,,,,,,,,,,,,,,,,,,,,,,,,,,,,,,,,,,,,,,neutral
50.0,75.0,71.0,0.15,neutral,"@Anuril @LuciaDoebeli Unser VI will im Jahr 2032 das Rentenalter 66/66. Ich bin zuversichtlich, dass wir bis dahin das Problem der Beitragssätze politisch gelöst und zusätzliche Massnahme z.B. im Bereich der Weiterbildung ergriffen haben. Das eine tun, das andere nicht lassen.",vi jahr rentenalter zuversichtlich dahin problem beitragssätze politisch lösen zusätzliche massnahme z b bereich weiterbildung ergreifen tun lassen,,,,"{'Unser': 0.14, 'VI': 0.03, 'will': 0.04, 'im': 0, 'Jahr': 0, '2032': 0, 'das': 0.04, 'Rentenalter': 0.52, '66': 0, '66.': 0, 'Ich': 0.04, 'bin': 0, 'zuversichtlich': 0, 'dass': 0.04, 'wir': 0, 'bis': 0, 'dahin': 0, 'Problem': 0.1, 'der': 0.02, 'Beitragssätze': 0.035, 'politisch': 0.02, 'gelöst': 0, 'und': 0.02, 'zusätzliche': 0.04, 'Massnahme': 0, 'z.B.': 0, 'Bereich': 0.02, 'Weiterbildung': 0, 'ergriffen': 0, 'haben': 0.03, 'Das': 0.02, 'eine': 0.02, 'tun': 0.03, 'andere': 0, 'nicht': 0, 'lassen': 0}",positive,"[0.045224667, 0.007814532, 0.9469608]",,,,,,,,,,,,,,,,,,,,,,,,,,,,,,,,,,,,,,,,,,,neutral
100.0,100.0,86.0,0.7,neutral,"RT @LuciaDoebeli: «Man tut so, als ob die Leute nicht wüssten, dass es ein höheres #Rentenalter braucht. Wir glauben, dass die meisten Stim…",tun leute wüssten hoch rentenalter brauchen glauben meist stim,,,,"{'«': 0, 'Man': 0, 'tut': 0, 'so': 0, 'als': 0, 'ob': 0, 'die': 0, 'Leute': 0, 'nicht': 0, 'wüssten': 0, 'dass': 0, 'es': 0, 'ein': 0, 'höheres': 0, 'Rentenalter': 0, 'braucht': 0, 'Wir': 0, 'glauben': 0, 'meisten': 0, 'Stim': 0, '…': 0}",neutral,"[0.72220236, 0.2030491, 0.074748546]",,,,,,,,,,,,,,,,,,,,,,,,,,,,,,,,,,,,,,,,,,,positive
100.0,100.0,86.0,0.7,neutral,"RT @jobstwagner: Dank der Initiative der @Jungfreisinnige: Endlich Klarheit schaffen zum unumgänglich höheren Rentenalter. Auch hier, wie b…",danken initiative endlich klarheit schaffen unumgänglich hoch rentenalter b,,,,"{'Dank': 0.125, 'der': 0.28, 'Initiative': 0.13, 'Endlich': 0.24, 'Klarheit': 0.25, 'schaffen': 0, 'zum': 0.17500000000000002, 'unumgänglich': 1.0, 'höheren': 1.0, 'Rentenalter': 0.9199999999999999, 'Auch': 0, 'hier': 0.08, 'wie': 0.1, 'b': 0.06, '…': 0}",positive,"[0.018259834, 0.017835703, 0.96390444]",,,,,,,,,,,,,,,,,,,,,,,,,,,,,,,,,,,,,,,,,,,positive
100.0,100.0,100.0,1.0,neutral,"Danke, liebe @Jungfreisinnige, für euer Rentenalter 66 https://t.co/5OygXjO72o 

Wir sind auf dem richtigen Weg... Mit unserer #Renteninitiative lösen wir das strukturelle Defizit in der #AHV und stärken das 3-Säule-System 👍🏼

(NB: ist RA 66 bis 2032 wirklich radikal?😳)",danke lieb rentenalter richtig renteninitiative lösen strukturell defizit ahv stärken säule system nb ra wirklich radikal,,,,"{'Danke': 0.635, 'liebe': 0, 'für': 1.0, 'euer': 0.99, 'Rentenalter': 0.515, '66': 0, 'Wir': 0.03, 'sind': 0.07, 'auf': 0.11, 'dem': 0.02, 'richtigen': 0.26, 'Weg': 0, '...': 0, 'Mit': 0.07, 'unserer': 0.03, 'Renteninitiative': 0, 'lösen': 0, 'wir': 0, 'das': 0, 'strukturelle': 0.02, 'Defizit': 0.03, 'in': 0.02, 'der': 0.02, 'AHV': 0.02, 'und': 0.04, 'stärken': 0, '3-Säule-System': 0.04, 'NB': 0.02, 'ist': 0.06, 'RA': 0, 'bis': 0, '2032': 0, 'wirklich': 0.03, 'radikal': 0.04}",positive,"[0.0021633902, 0.003921915, 0.99391466]",,,,,,,,,,,,,,,,,,,,,,,,,,,,,,,,,,,,,,,,,,,positive
100.0,100.0,86.0,0.7,neutral,RT @SandroBrotz: Ich hab da noch eine Frage zum Rentenalter: Erhöhen oder nicht? #srfarena,fragen rentenalter erhöhen srfarena,,,,"{'Ich': 0.29, 'hab': 0.76, 'da': 0, 'noch': 0, 'eine': 0.52, 'Frage': 0, 'zum': 0.37, 'Rentenalter': 0.22499999999999998, 'Erhöhen': 0, 'oder': 0.18, 'nicht': 0.15, 'srfarena': 0.3}",neutral,"[0.8343099, 0.14263111, 0.023058986]",,,,,,,,,,,,,,,,,,,,,,,,,,,,,,,,,,,,,,,,,,,positive
50.0,75.0,57.0,0.0,neutral,Wieso Rentenalter 66/66 und Anbindung an die Lebenserwartungen? Antworten in der #srfarena:  https://t.co/7bu6oPQ44V #AHV21 #Renteninitiative #AHV @Jungfreisinnige @FDP_Liberalen https://t.co/7jSQc9IZCz,wieso rentenalter anbindung lebenserwartungen antworten srfarena ahv21 renteninitiative ahv,,,,"{'Wieso': 0, 'Rentenalter': 0.385, '66': 0, 'und': 0.26, 'Anbindung': 0.25, 'an': 0, 'die': 0.05, 'Lebenserwartungen': 0.03, 'Antworten': 0, 'in': 0.05, 'der': 0.05, 'srfarena': 0.07, 'AHV21': 0.06, 'Renteninitiative': 0, 'AHV': 0.06}",negative,"[0.42826495, 0.4710993, 0.10063572]",,,,,,,,,,,,,,,,,,,,,,,,,,,,,,,,,,,,,,,,,,,neutral
50.0,75.0,57.0,0.0,neutral,"Wenn Lampart ""dem Saal"" die Variante gibt 1) mehr Lohnprozente oder 2) Rentenalter 66/66 dann ist das keine ehrliche Auswahl. Denn mit mehr Lohnprozenten ist das Problem nicht nachhaltig gelöst - unverantwortlich. #srfarena",lampart saal variante geben mehr lohnprozente rentenalter ehrlich auswahl mehr lohnprozenten problem nachhaltig lösen unverantwortlich srfarena,,,,"{'Wenn': 0, 'Lampart': 0.05, 'dem': 0.02, 'Saal': 0, 'die': 0.02, 'Variante': 0, 'gibt': 0, '1': 0, 'mehr': 0.02, 'Lohnprozente': 0.07500000000000001, 'oder': 0.16, '2': 0, 'Rentenalter': 1.0, '66': 0, 'dann': 0.1, 'ist': 0.01, 'das': 0, 'keine': 0, 'ehrliche': 0.04, 'Auswahl': 0, 'Denn': 0.1, 'mit': 0.02, 'Lohnprozenten': 0.07500000000000001, 'Problem': 0.04, 'nicht': 0.01, 'nachhaltig': 0, 'gelöst': 0.02, 'unverantwortlich': 0.08, 'srfarena': 0.06}",neutral,"[0.8589166, 0.03251732, 0.10856611]",,,,,,,,,,,,,,,,,,,,,,,,,,,,,,,,,,,,,,,,,,,neutral
50.0,75.0,57.0,0.0,neutral,"Mit einer neuen (Kapitalgewinn-)Steuer wird das strukturelle (!) Problem in der #AHV nicht gelöst - man führt damit neue Probleme ein, z.B. werden Investitionen in Start-Ups gehemmt. Deshalb: Rentenalter anpacken! #srfarena",neu kapitalgewinn steuer strukturell problem ahv lösen führen neue probleme z b investitionen start ups hemmen deshalb rentenalter anpacken srfarena,,,,"{'Mit': 0, 'einer': 0, 'neuen': 0.09, 'Kapitalgewinn-)Steuer': 0.0625, 'wird': 0, 'das': 0, 'strukturelle': 0.03, 'Problem': 0.29, 'in': 0.06, 'der': 0.47, 'AHV': 0.05, 'nicht': 0.05, 'gelöst': 0, 'man': 0, 'führt': 0, 'damit': 0.06, 'neue': 0.09, 'Probleme': 0.16, 'ein': 0, 'z.B.': 0, 'werden': 0, 'Investitionen': 0.09, 'Start-Ups': 0, 'gehemmt': 0.23, 'Deshalb': 0.32, 'Rentenalter': 0.675, 'anpacken': 1.0, 'srfarena': 0.26}",positive,"[0.010390442, 0.0023147173, 0.98729485]",,,,,,,,,,,,,,,,,,,,,,,,,,,,,,,,,,,,,,,,,,,neutral
