answer_five,answer_four,answer_seven,polarity,sentiment_gs,tweet,tweet_tokens,absa_token_weights_3434,absa_sentiment_3434,absa_scores_3434,absa_token_weights_3450,absa_sentiment_3450,absa_scores_3450,absa_token_weights_3459,absa_sentiment_3459,absa_scores_3459,absa_token_weights_3466,absa_sentiment_3466,absa_scores_3466,absa_token_weights_3472,absa_sentiment_3472,absa_scores_3472,absa_token_weights_3479,absa_sentiment_3479,absa_scores_3479,sentiment_tb
50.0,75.0,57.0,0.0,neutral,"@MiniSchwiz @CamilleLotheSVP Nur weil ich einen Teil der Bilaterale, namentlich die #Personenfreizügigkeit bekämpfe heisst das nicht das ich alle Verträge künden will. Will ich auch nicht. #Lohngleichheit ist für mich ein persönliches Anliegen. Wahrscheinlich mit anderem Weg als sie um zum Ergebnis zu kommen",teil bilateral namentlich personenfreizügigkeit bekämpfen heisst all verträge künden lohngleichheit persönlich anliegen wahrscheinlich ergebnis kommen,"{'Nur': 0.03, 'weil': 0.03, 'ich': 0.06, 'einen': 0.04, 'Teil': 0.03, 'der': 0.04, 'Bilaterale': 0.08, 'namentlich': 0, 'die': 0.04, 'Personenfreizügigkeit': 0.07250000000000001, 'bekämpfe': 0, 'heisst': 0.45, 'das': 0.03, 'nicht': 0.1, 'alle': 0, 'Verträge': 0.19, 'künden': 0, 'will': 0, 'Will': 0, 'auch': 0, 'Lohngleichheit': 0.89, 'ist': 0.45, 'für': 0.07, 'mich': 0.1, 'ein': 0, 'persönliches': 0.12, 'Anliegen': 0, 'Wahrscheinlich': 0.08, 'mit': 0.04, 'anderem': 0, 'Weg': 0, 'als': 0, 'sie': 0, 'um': 0.04, 'zum': 0.035, 'Ergebnis': 0.08, 'zu': 0.03, 'kommen': 0}",neutral,"[0.46403393, 0.08405209, 0.45191392]",,,,,,,,,,,,,,,,neutral
50.0,25.0,28.0,-0.15,neutral,"""Kei Spähn ade Schuhe"" Die Männer die diese Aussage gegenüber unserer Präsidentin @CamilleLotheSVP in der #srfarena geäussert haben, sind sicher dieselben die ihren Angestellten die #Lohngleichheit verwehren.",kei spähn ade schuhe männer aussagen gegenüber präsidentin srfarena geäussert sichern angestellt lohngleichheit verwehren,"{'Kei': 0, 'Spähn': 0, 'ade': 0.06, 'Schuhe': 0.07, 'Die': 0.4, 'Männer': 0.07, 'die': 0.4, 'diese': 0.04, 'Aussage': 0.16, 'gegenüber': 0.07, 'unserer': 0.06, 'Präsidentin': 0.1, 'in': 0.12, 'der': 0.4, 'srfarena': 0.13, 'geäussert': 0, 'haben': 0.07, 'sind': 0.26, 'sicher': 0, 'dieselben': 0.43, 'ihren': 0, 'Angestellten': 0.46, 'Lohngleichheit': 0, 'verwehren': 0}",neutral,"[0.5382763, 0.3977323, 0.06399143]",,,,,,,,,,,,,,,,neutral
100.0,100.0,100.0,0.85,neutral,"RT @BernhardGuhl: Ich bedaure sehr, dass diese sinnvolle erneuerbare Energie - die Wasserkraft - in der ES2050 nicht stärker unterstützt wu…",bedaure sinnvoll erneuerbare energie wasserkraft es2050 stark unterstützen wu,,,,"{'Ich': 0.13, 'bedaure': 0, 'sehr': 0.1, 'dass': 0.23, 'diese': 0.43, 'sinnvolle': 0, 'erneuerbare': 1.0, 'Energie': 0.49, 'die': 0.11, 'Wasserkraft': 0.44, 'in': 0.1, 'der': 0.11, 'ES2050': 0.23, 'nicht': 0.18, 'stärker': 0, 'unterstützt': 0, 'wu': 0, '…': 0}",positive,"[0.0026033614, 0.022744438, 0.9746522]",,,,,,,,,,,,,positive
50.0,75.0,57.0,0.0,negative,"Nein zu E-Voting!
#NoEvoting

SRF News: Elektronische Abstimmungen - Hacker finden Schwachstelle im grössten Schweizer E-Voting-System
https://t.co/XvsSwYYFgv",nein e voting noevoting srf news elektronische abstimmungen hacker finden schwachstelle grössten schweizer e voting system,,,,,,,"{'Nein': 0.07, 'zu': 0.07, 'E-Voting': 0, 'NoEvoting': 0.28, 'SRF': 0.13, 'News': 0.27, 'Elektronische': 0.35, 'Abstimmungen': 1.0, 'Hacker': 0, 'finden': 0.42, 'Schwachstelle': 0.73, 'im': 0, 'grössten': 0, 'Schweizer': 0.56, 'E-Voting-System': 0}",negative,"[0.27201515, 0.46486542, 0.26311946]",,,,,,,,,,neutral
100.0,100.0,100.0,1.0,neutral,"RT @BeniFischer: @jacquelinefehr Dann machen Sie bitte Datenpolitik, treiben Sie Digitalisierung der Verwaltung voran, gibt auch ohne #Evot…",bitte datenpolitik treiben digitalisierung verwaltung voran geben evot,,,,,,,,,,"{'Dann': 0.19, 'machen': 0, 'Sie': 0, 'bitte': 0, 'Datenpolitik': 0.26, 'treiben': 0, 'Digitalisierung': 1.0, 'der': 0.44, 'Verwaltung': 0.41, 'voran': 0, 'gibt': 0, 'auch': 0, 'ohne': 0.18, 'Evot': 0.12, '…': 0}",positive,"[0.012108751, 0.00663789, 0.9812533]",,,,,,,positive
100.0,100.0,100.0,0.9,neutral,@DianaGutjahr1 @tagblatt_ch Das ist auch eine Art von Entwicklungshilfe. Tolles Resultat! Ich hoffe er kann sein Ziel erreichen und ist erfolgreich.,art entwicklungshilfe toll resultat hoffen ziel erreichen erfolgreich,,,,,,,,,,,,,"{'Das': 0, 'ist': 0.04, 'auch': 0.45, 'eine': 0, 'Art': 0, 'von': 0, 'Entwicklungshilfe': 0.43, 'Tolles': 0.26, 'Resultat': 0, 'Ich': 0.05, 'hoffe': 0.15, 'er': 0.04, 'kann': 0.09, 'sein': 0, 'Ziel': 0, 'erreichen': 0, 'und': 0.05, 'erfolgreich': 0.1}",positive,"[0.000503227, 0.000984447, 0.9985123]",,,,positive
100.0,100.0,86.0,0.7,neutral,RT @diegruene_agrar: Sechs heiss umstrittene #Volksinitiative|n zur 🇨🇭 #Landwirtschaft kommen bis 2020 vors Volk. «die grüne» verschafft ei…,sechs heiss umstritten volksinitiative n landwirtschaft kommen vors volk grüne verschaffen ei,,,,,,,,,,,,,,,,"{'Sechs': 0.03, 'heiss': 0, 'umstrittene': 0.06, 'Volksinitiative|n': 0.035, 'zur': 0.05, '🇨': 0, '🇭': 0, 'Landwirtschaft': 0, 'kommen': 0, 'bis': 0, '2020': 0, 'vors': 0, 'Volk': 0, '«': 0, 'die': 0, 'grüne': 0, '»': 0, 'verschafft': 0, 'ei': 0, '…': 0}",positive,"[0.06468967, 0.009855134, 0.92545515]",positive
50.0,75.0,57.0,0.0,neutral,Ich stehe ein für eine produzierende Landwirtschaft! Damit sie nicht zu Tode verbürokratisiert wird. #Regionalschau #Bezirkhinwil #Zukunftschaffen https://t.co/vJHMlVefHL,stehen produzierend landwirtschaft tode verbürokratisiert regionalschau bezirkhinwil zukunftschaffen,,,,,,,,,,,,,,,,"{'Ich': 0.09, 'stehe': 0.17, 'ein': 0, 'für': 0.23, 'eine': 0, 'produzierende': 0, 'Landwirtschaft': 1.0, 'Damit': 0.04, 'sie': 0, 'nicht': 0.05, 'zu': 0.04, 'Tode': 0, 'verbürokratisiert': 0.2, 'wird': 0, 'Regionalschau': 0, 'Bezirkhinwil': 0, 'Zukunftschaffen': 0.07250000000000001}",positive,"[0.0012609051, 0.0013024649, 0.9974367]",neutral
50.0,75.0,57.0,0.0,neutral,RT @SVPch: Landwirtschaft nicht auf dem Altar des Freihandels opfern https://t.co/njc6pOlQmA,landwirtschaft altar freihandels opfern,,,,,,,,,,,,,,,,"{'Landwirtschaft': 1.0, 'nicht': 0, 'auf': 0.34, 'dem': 0.15, 'Altar': 0.44, 'des': 0, 'Freihandels': 0.22999999999999998, 'opfern': 1.0}",neutral,"[0.5908816, 0.062281907, 0.34683642]",neutral
