answer_five,answer_four,answer_seven,polarity,sentiment_gs,tweet,tweet_tokens,absa_token_weights_3412,absa_sentiment_3412,absa_scores_3412,absa_token_weights_3414,absa_sentiment_3414,absa_scores_3414,absa_token_weights_3417,absa_sentiment_3417,absa_scores_3417,absa_token_weights_3431,absa_sentiment_3431,absa_scores_3431,absa_token_weights_3436,absa_sentiment_3436,absa_scores_3436,sentiment_tb
50.0,75.0,57.0,0.0,negative,RT @spschweiz: Vorsicht #Rentenklau: FDP und SVP wollen Rentenalter 67 - und erst noch tiefere Renten. Darum SP wählen! #wahlCH15 http://t.…,vorsicht rentenklau fdp svp rentenalter erst tief renten darum sp wählen wahlch15,"{'Vorsicht': 0.33, 'Rentenklau': 0, 'FDP': 0.17, 'und': 0.18, 'SVP': 0, 'wollen': 1.0, 'Rentenalter': 0.7849999999999999, '67': 0, 'erst': 0, 'noch': 0, 'tiefere': 0, 'Renten': 0.31, 'Darum': 0, 'SP': 0.04, 'wählen': 0, 'wahlCH15': 0}",positive,"[0.24726434, 0.09374626, 0.65898937]",,,,,,,,,,,,,neutral
50.0,75.0,57.0,0.0,neutral,RT @dani_graf: Heute startet #Initiative für 4 Wochen #Vaterschaftsurlaub! Jetzt online unterschreiben https://t.co/aDvTUVuj1D https://t.co…,heute starten initiative wochen vaterschaftsurlaub online unterschreiben,,,,"{'Heute': 0.11, 'startet': 0, 'Initiative': 0.18, 'für': 0.17, '4': 0, 'Wochen': 0.32, 'Vaterschaftsurlaub': 0.67, 'Jetzt': 0.12, 'online': 0.33, 'unterschreiben': 0.21}",neutral,"[0.6914676, 0.17439625, 0.13413617]",,,,,,,,,,neutral
100.0,100.0,100.0,1.0,negative,RT @LukaMarkic: FDP/SVP-Regierung #Schwyz propagiert seit Jahren gemeinnützigen Wohnungsbau; bis jetzt hat sie aber NICHTS gemacht. https:/…,fdp svp regierung schwyz propagieren seit jahren gemeinnützig wohnungsbau https,,,,,,,"{'FDP': 0.16, 'SVP-Regierung': 0.12000000000000001, 'Schwyz': 0.36, 'propagiert': 0, 'seit': 0, 'Jahren': 0.46, 'gemeinnützigen': 0, 'Wohnungsbau': 0.55, 'bis': 0.1, 'jetzt': 0.06, 'hat': 0, 'sie': 0.19, 'aber': 0.32, 'NICHTS': 0.3, 'gemacht': 0, 'https': 0.14, ':/': 0, '…': 0}",neutral,"[0.6900159, 0.05293455, 0.25704953]",,,,,,,positive
0.0,0.0,0.0,-1.0,negative,"RT @MikeMuellerLate: Die SVP fürchtet die Einbürgerung von Afrikanern in 20 Jahren? Solange wir nicht Rassisten ausbürgern, muss hier niema…",svp fürchten einbürgerung afrikanern jahren solange rassisten ausbürgern niema,,,,,,,,,,"{'Die': 0.42, 'SVP': 0, 'fürchtet': 1.0, 'die': 0.42, 'Einbürgerung': 1.0, 'von': 0, 'Afrikanern': 0.1, 'in': 0.22, '20': 0, 'Jahren': 0.14, 'Solange': 0, 'wir': 0, 'nicht': 0, 'Rassisten': 0.24, 'ausbürgern': 0.18, 'muss': 0.06, 'hier': 0, 'niema': 0, '…': 0}",neutral,"[0.7928347, 0.111488596, 0.0956767]",,,,negative
50.0,75.0,57.0,0.0,neutral,RT @AndreaArezina: #USR3 Prinzip: 1. Steuersenkungen für Grosskonzerne 2. Schauen was übrig bleibt 3. Steuererhöhungen für dich &amp; mich! htt…,usr3 prinzip steuersenkungen grosskonzerne schauen übrig bleiben steuererhöhungen amp htt,,,,,,,,,,,,,"{'USR3': 0.15, 'Prinzip': 0.71, '1.': 0, 'Steuersenkungen': 0.515, 'für': 0.04, 'Grosskonzerne': 0, '2.': 0, 'Schauen': 0.24, 'was': 0, 'übrig': 0.11, 'bleibt': 0, '3.': 0, 'Steuererhöhungen': 0.06, 'dich': 0.06, 'amp': 0.03, 'mich': 0.02, 'htt': 0.05, '…': 0}",positive,"[0.007551172, 0.0041038413, 0.988345]",neutral
50.0,75.0,57.0,0.0,neutral,"RT @enussbi: Mehr für die Armee, mehr Steuersenkungen für Firmen, Lanwirte - und dann bei der #Bildung sparen. Das ist die neue Mehrheit im…",mehr armee mehr steuersenkungen firmen lanwirte bildung sparen neue mehrheit,,,,,,,,,,,,,"{'Mehr': 1.0, 'für': 0.55, 'die': 0.07, 'Armee': 0.23, 'mehr': 1.0, 'Steuersenkungen': 0.8049999999999999, 'Firmen': 0.19, 'Lanwirte': 0, 'und': 0.21, 'dann': 0.99, 'bei': 0, 'der': 0.07, 'Bildung': 0.11, 'sparen': 0.31, 'Das': 0.07, 'ist': 0.09, 'neue': 0.11, 'Mehrheit': 0.13, 'im': 0, '…': 0}",positive,"[0.08164612, 0.014226644, 0.90412724]",neutral
