100.0,100.0,100.0,1.0,neutral,Der Super #Bildungsbericht ist wieder da! 🤓 Merci @SKBF_nat für die sagenhaften Zahlen zur Schweizer Bildungslandschaft! Neu mit #Digitalisierung! #Schweiz hat top Bildungssystem. @SBFI_CH https://t.co/vEwTQglwhY,super bildungsbericht merci sagenhaft zahlen schweizer bildungslandschaft neu digitalisierung schweiz top bildungssystem,,,,,,,,,,,,,,,,,,,,,,,,,,,,,,,,,,,,,,,,,,,"{'Der': 0.06, 'Super': 0.06, 'Bildungsbericht': 0.08, 'ist': 0.04, 'wieder': 0, 'da': 0, '🤓': 0, 'Merci': 0, 'für': 0, 'die': 0, 'sagenhaften': 0, 'Zahlen': 0, 'zur': 0, 'Schweizer': 0, 'Bildungslandschaft': 0, 'Neu': 0, 'mit': 0, 'Digitalisierung': 0, 'Schweiz': 0, 'hat': 0, 'top': 0, 'Bildungssystem': 0}",positive,"[0.0030690343, 0.0014387863, 0.9954921]",,,,,,,,,,,,,,,,,,,positive
100.0,100.0,100.0,1.0,neutral,"RT @phil_liberal: Herzlich willkommen @cwasi 💪🏼😊
Ich freue mich, zusammen mit Dir ein Co2-Gesetz zu ermöglichen, welches den Umweltschutz i…",herzlich willkommen freuen zusammen co2 gesetz ermöglichen welch umweltschutz i,,,,,,,,,,,,,,,,,,,,,,,,,,,,,,,,,,,,,,,,,,,,,,"{'Herzlich': 0, 'willkommen': 0.1, 'Ich': 0.88, 'freue': 0.065, 'mich': 0, 'zusammen': 0.04, 'mit': 0.03, 'Dir': 0.06, 'ein': 0, 'Co2-Gesetz': 0.065, 'zu': 0.03, 'ermöglichen': 0.09, 'welches': 0.22, 'den': 0.08, 'Umweltschutz': 0, 'i': 0.88, '…': 0}",positive,"[0.0013402604, 0.0011223013, 0.9975375]",,,,,,,,,,,,,,,,positive
50.0,75.0,57.0,0.0,neutral,RT @ChristaMarkwald: Erhellend in der @srfarena: 1. gibt es einen breiten Konsens zur Einhaltung von Menschenrechten und Umweltschutz von…,erhellen geben breit konsens einhaltung menschenrechten umweltschutz,,,,,,,,,,,,,,,,,,,,,,,,,,,,,,,,,,,,,,,,,,,,,,"{'Erhellend': 0, 'in': 0.05, 'der': 0.06, '1.': 0, 'gibt': 0, 'es': 0.11, 'einen': 0.11, 'breiten': 0.1, 'Konsens': 0.29, 'zur': 0.06, 'Einhaltung': 0, 'von': 0, 'Menschenrechten': 0.09, 'und': 0.23, 'Umweltschutz': 0.22999999999999998, '…': 0}",positive,"[0.09384516, 0.010752151, 0.8954027]",,,,,,,,,,,,,,,,neutral
100.0,100.0,100.0,1.0,neutral,"Nach dem gescheiterten #Rahmenabkommen will die SP den EU-Beitritt. Echt jetzt!? 🤦‍♂️

https://t.co/0ZWxmuRDVy 
@spschweiz",gescheitert rahmenabkommen sp eu beitreten echt,,,,,,,,,,,,,,,,,,,,,,,,,,,,,,,,,,,,,,,,,,,,,,,,,"{'Nach': 0.07, 'dem': 0.07500000000000001, 'gescheiterten': 0.11, 'Rahmenabkommen': 0.14, 'will': 0, 'die': 0.08, 'SP': 0.13, 'den': 0.08, 'EU-Beitritt': 0.34, 'Echt': 0, 'jetzt': 0.19, '🤦': 0, '\u200d️': 0}",neutral,"[0.6092417, 0.3563726, 0.034385655]",,,,,,,,,,,,,positive
50.0,75.0,57.0,0.0,negative,"Ich bin klar für die Bilateralen Verträge, sage ebenso klar NEIN zum #Rahmenabkommen. Dieses kann man nur noch die Tür des EU-Beitritts verlassen. Ein No-Go! Deine simple schwarz-weiss Denke wird nicht funktionieren. https://t.co/Ssa4aZMb7Y",klaren bilateral verträge sage ebenso klaren nein rahmenabkommen tür eu beitritts verlassen no go simpel schwarz weiss denken funktionieren,,,,,,,,,,,,,,,,,,,,,,,,,,,,,,,,,,,,,,,,,,,,,,,,,"{'Ich': 0.07, 'bin': 0, 'klar': 0, 'für': 0, 'die': 0.06, 'Bilateralen': 0.08, 'Verträge': 0, 'sage': 0, 'ebenso': 0.05, 'NEIN': 0.92, 'zum': 0.05, 'Rahmenabkommen': 0.07, 'Dieses': 0.13, 'kann': 0.16, 'man': 0, 'nur': 0.12, 'noch': 0, 'Tür': 0, 'des': 0, 'EU-Beitritts': 0.1, 'verlassen': 0, 'Ein': 0.44, 'No-Go': 0, 'Deine': 0.58, 'simple': 0.29, 'schwarz-weiss': 0, 'Denke': 0, 'wird': 0, 'nicht': 0, 'funktionieren': 0}",negative,"[0.15622112, 0.7207866, 0.1229923]",,,,,,,,,,,,,neutral
75.0,75.0,71.0,0.3333333333333333,neutral,"Die Nachverhandlungen zum #Rahmenabkommen stecken offenbar fest. 
Diese Übung ist abzubrechen - lieber früher als später. Es braucht eine ""respektvolle Beziehung auf Augenhöhe"" wie es @kompass_europa fordert und kein Abkommen Richtung EU-Beitritt.
https://t.co/1jHLLBSa4u https://t.co/yIG9A1UhWX",nachverhandlungen rahmenabkommen stecken offenbaren fest übung abbrechen lieb früh spät brauchen respektvolle beziehung augenhöhe fordern abkommen richtung eu beitreten,,,,,,,,,,,,,,,,,,,,,,,,,,,,,,,,,,,,,,,,,,,,,,,,,"{'Die': 0.01, 'Nachverhandlungen': 0.37, 'zum': 0.01, 'Rahmenabkommen': 0.02, 'stecken': 0, 'offenbar': 1.0, 'fest': 0, 'Diese': 0.18, 'Übung': 0.13, 'ist': 0.04, 'abzubrechen': 0, 'lieber': 0.03, 'früher': 0, 'als': 0.03, 'später': 0.02, 'Es': 0.04, 'braucht': 0, 'eine': 0, 'respektvolle': 0.05, 'Beziehung': 0.03, 'auf': 0.01, 'Augenhöhe': 0, 'wie': 0, 'es': 0.04, 'fordert': 0, 'und': 0.01, 'kein': 0, 'Abkommen': 0.02, 'Richtung': 0, 'EU-Beitritt': 0.03}",negative,"[0.32360408, 0.6287236, 0.047672294]",,,,,,,,,,,,,positive
25.0,25.0,14.0,-0.4666666666666666,neutral,"Morgen ist #Brexit.🤔
Klar ist: Das #Rahmenabkommen #InstA können wir nur noch durch die Tür des EU-Beitritts verlassen. Rote Linien sind einzuhalten:
⚠️Guillotine-Klausel aufheben
⚠️Unionsbürgerrichtlinie ausschliessen
⚠️weniger Macht des EU-Gerichtshofes bei Streitbeilegung https://t.co/opJYxNn42w",morgen brexit klaren rahmenabkommen insta tür eu beitritts verlassen rote linien einhalten guillotine klausel aufheben unionsbürgerrichtlinie ausschliessen wenig eu gerichtshofes streitbeilegung,,,,,,,,,,,,,,,,,,,,,,,,,,,,,,,,,,,,,,,,,,,,,,,,,"{'Morgen': 0.11, 'ist': 0, 'Brexit': 0.08, '🤔': 0, 'Klar': 0, 'Das': 0, 'Rahmenabkommen': 0, 'InstA': 0, 'können': 0, 'wir': 0, 'nur': 0, 'noch': 0, 'durch': 0, 'die': 0, 'Tür': 0, 'des': 0, 'EU-Beitritts': 0, 'verlassen': 0, 'Rote': 0, 'Linien': 0, 'sind': 0, 'einzuhalten': 0, '️Guillotine-Klausel': 0, 'aufheben': 0, '️Unionsbürgerrichtlinie': 0, 'ausschliessen': 0, '️weniger': 0, 'Macht': 0, 'EU-Gerichtshofes': 0, 'bei': 0, 'Streitbeilegung': 0}",negative,"[0.21039754, 0.7757157, 0.013886737]",,,,,,,,,,,,,negative
100.0,100.0,86.0,0.7,negative,@ManuelTornare EU-Beitritt oder doch Abschottung? Die SP ist schon untergetaucht. Gewerkschaften werden Ehrenmitglieder der #SVP.,eu beitreten abschottung sp schon untertauchen gewerkschaften ehrenmitglieder svp,,,,,,,,,,,,,,,,,,,,,,,,,,,,,,,,,,,,,,,,,,,,,,,,,"{'EU-Beitritt': 0.1, 'oder': 0.09, 'doch': 0, 'Abschottung': 0.07, 'Die': 0.12, 'SP': 0.06, 'ist': 0, 'schon': 0, 'untergetaucht': 0, 'Gewerkschaften': 0.7, 'werden': 0, 'Ehrenmitglieder': 0.885, 'der': 0.12, 'SVP': 0}",neutral,"[0.81558293, 0.11112213, 0.07329497]",,,,,,,,,,,,,positive
0.0,0.0,14.0,-0.7,negative,"Geschprächsverweigerung des @GewerkschaftSGB ist keine Lösung! 😡 
#Europapolitik der Linken ist totaler Widerspruch: @spschweiz will morgen den #EU-Beitritt, doch die Linke will nicht einmal über Reformen der #Bilateralen sprechen. Dafür dann laute Demos. #kopfschüttel https://t.co/sJShNM1Awa",geschprächsverweigerung lösung europapolitik link total widerspruch morgen eu beitreten link reformen bilateral sprechen dafür laut demos kopfschüttel,,,,,,,,,,,,,,,,,,,,,,,,,,,,,,,,,,,,,,,,,,,,,,,,,"{'Geschprächsverweigerung': 0.015, 'des': 0, 'ist': 0.22, 'keine': 0, 'Lösung': 0.38, 'Europapolitik': 0.16999999999999998, 'der': 0.02, 'Linken': 0.04, 'totaler': 0.18, 'Widerspruch': 0.4, 'will': 0, 'morgen': 0.04, 'den': 0.02, 'EU-Beitritt': 0.03, 'doch': 0, 'die': 0.02, 'Linke': 0.04, 'nicht': 0.67, 'einmal': 0, 'über': 0, 'Reformen': 0.03, 'Bilateralen': 0, 'sprechen': 0.01, 'Dafür': 0, 'dann': 0.05, 'laute': 0, 'Demos': 0.08, 'kopfschüttel': 0.08}",negative,"[0.08147066, 0.8987083, 0.019821055]",,,,,,,,,,,,,negative
50.0,75.0,57.0,0.0,neutral,"Der 46. Präsident der Vereinigten Staaten @JoeBiden  betont viel den Zusammenhalt und die Chancen. 
Eine Chance ist ein #Freihandelsabkommen zwischen der Schweiz und den USA. 💪
🇨🇭🇺🇸
#InaugurationDay  
#POTUS 
@POTUS https://t.co/U0MbLdrqT2",präsident vereinigen staaten betonen zusammenhalt chancen chance freihandelsabkommen schweiz usa inaugurationday potus,,,,,,,,,,,,,,,,,,,,,,,,,,,,,,,,,,,,,,,,,,,,,,,,,,,,"{'Der': 0.06, '46.': 0, 'Präsident': 0.06, 'der': 0.06, 'Vereinigten': 0.04, 'Staaten': 0.03, 'betont': 0, 'viel': 0.05500000000000001, 'den': 0.06, 'Zusammenhalt': 0.08, 'und': 0.07, 'die': 0.06, 'Chancen': 0, 'Eine': 0.07, 'Chance': 0, 'ist': 0.09, 'ein': 0.07, 'Freihandelsabkommen': 0, 'zwischen': 0.1, 'Schweiz': 0.1, 'USA': 0.07, '🇨': 0, '🇭': 0, '🇺': 0, '🇸': 0, 'InaugurationDay': 0, 'POTUS': 0}",neutral,"[0.5410032, 0.34083337, 0.1181634]",,,,,,,,,,neutral
25.0,25.0,28.0,-0.2333333333333333,neutral,@forum_futur @TaniaSchell Dazu hat die Schweiz genügend Mittel und es braucht keine neue wirkungslose Steuer. Allein im Bildungs- Forschungs- Innovationsbereich stehen pro Jahr rund 6‘300‘000‘000 Franken (6.3 Mrd.) bereit. @_Innosuisse @snf_ch helfen gerne weiter.,schweiz genügen mittel brauchen neue wirkungslose steuer allein bildungs forschungs innovationsbereich stehen pro jahr rund franken mrd bereiten helfen gerne weit,,,,,,,,,,,,,,,,,,,,,,,,,,,,,,,,,,,,,,,,,,,,,,,,,,,,,,,"{'Dazu': 0.08, 'hat': 0, 'die': 0.06, 'Schweiz': 0.12, 'genügend': 0.07, 'Mittel': 0, 'und': 0.07, 'es': 0.04, 'braucht': 0, 'keine': 0, 'neue': 0.03, 'wirkungslose': 0.06, 'Steuer': 0.03, 'Allein': 0.19, 'im': 0, 'Bildungs-': 0, 'Forschungs-': 0.14, 'Innovationsbereich': 0.125, 'stehen': 0, 'pro': 0, 'Jahr': 0.16, 'rund': 0.1, '6‘300‘000‘000': 0, 'Franken': 0, '6.3': 0, 'Mrd.': 0.19, 'bereit': 0, 'helfen': 0.89, 'gerne': 0, 'weiter': 0}",positive,"[0.002507012, 0.0016698415, 0.99582314]",,,,,,,neutral
50.0,75.0,57.0,0.0,neutral,"RT @fdp_stadtbern: Unser Neujahesapéro mit über 100 Gästen in vollem Gang. Bildung, Forschung, Innovation und optimale Rahmenbedingen für u…",neujahesapéro gästen voll gang bildung forschung innovation optimale rahmenbedingen u,,,,,,,,,,,,,,,,,,,,,,,,,,,,,,,,,,,,,,,,,,,,,,,,,,,,,,,"{'Unser': 0.05, 'Neujahesapéro': 0.045000000000000005, 'mit': 0.04, 'über': 0.02, '100': 0, 'Gästen': 0.03, 'in': 0.02, 'vollem': 0.03, 'Gang': 0, 'Bildung': 1.0, 'Forschung': 0.45, 'Innovation': 0.72, 'und': 0.7, 'optimale': 0.65, 'Rahmenbedingen': 0.125, 'für': 0.19, 'u': 0.05, '…': 0}",positive,"[0.00090064824, 0.0009024999, 0.9981969]",,,,,,,neutral
100.0,100.0,100.0,0.85,neutral,"Gute Investitionen in die Zukunft: #Nationalrat unterstützt #Bildung 👩‍🎓👨‍🔧 #Forschung 🔬 und @AlpinesMuseum 🥾!
Merci viemals für den Support! 😃 https://t.co/UH4blp6ESA",gut investitionen zukunft nationalrat unterstützen bildung forschung merci viemals support,,,,,,,,,,,,,,,,,,,,,,,,,,,,,,,,,,,,,,,,,,,,,,,,,,,,,,,"{'Gute': 0, 'Investitionen': 0.12, 'in': 0.07, 'die': 0.06, 'Zukunft': 0.09, 'Nationalrat': 0.29500000000000004, 'unterstützt': 1.0, 'Bildung': 1.0, '\u200d\u200d': 0, 'Forschung': 0, 'und': 0, '🥾': 0, 'Merci': 0, 'viemals': 0, 'für': 0, 'den': 0, 'Support': 0}",positive,"[0.0062552462, 0.002136617, 0.99160814]",,,,,,,positive
100.0,100.0,100.0,0.925,neutral,"Lieber Hannes @_BR_JSA, ich bedaure Deinen Rücktritt sehr. Merci für Deinen grossen Einsatz für Bildung, Forschung, Werkplatz, Freihandel, neue Perspektiven usw.! Ich habe das immer zu schätzen gewusst. Alles Gute und viel Erfolg! @FDP_Liberalen @fdp_bern #BRJSA https://t.co/A5cUIdW9J1",lieb hannes bedaure rücktritt merci grossen einsatz bildung forschung werkplatz freihandel neue perspektiven usw immer schätzen gewusst gut erfolg brjsa,,,,,,,,,,,,,,,,,,,,,,,,,,,,,,,,,,,,,,,,,,,,,,,,,,,,,,,"{'Lieber': 0.07, 'Hannes': 0.04, 'ich': 0.02, 'bedaure': 0, 'Deinen': 0, 'Rücktritt': 0.04, 'sehr': 0.03, 'Merci': 0.135, 'für': 0.26, 'grossen': 0, 'Einsatz': 0, 'Bildung': 1.0, 'Forschung': 0.13, 'Werkplatz': 0, 'Freihandel': 0.035, 'neue': 0.03, 'Perspektiven': 0.06, 'usw.': 0, 'Ich': 0.02, 'habe': 0, 'das': 0.05, 'immer': 0.04, 'zu': 0.17, 'schätzen': 0, 'gewusst': 0, 'Alles': 0, 'Gute': 0, 'und': 0.02, 'viel': 0, 'Erfolg': 0, 'BRJSA': 0.04}",positive,"[0.0017069969, 0.0020205015, 0.99627244]",,,,,,,positive
50.0,75.0,57.0,0.0,neutral,Es gibt keine Pflicht zum Tragen einer Maske. Weder im öffentlichen Verkehr noch sonst wo. Das sollte der Direktor der @zvv wissen. https://t.co/XXDHzZO19V via @NZZ,geben pflicht tragen maske weder öffentlich verkehr sollen direktor wissen via,,,,,,,,,,,,,,,,,,,,,,,,,,,,,,,,,,,,,,,,,,,,,,,,,,,,,,,,,,"{'Es': 0.16, 'gibt': 0, 'keine': 0, 'Pflicht': 0, 'zum': 0.15, 'Tragen': 0, 'einer': 0, 'Maske': 0.16, 'Weder': 0.1, 'im': 0, 'öffentlichen': 0.15, 'Verkehr': 0, 'noch': 0, 'sonst': 0, 'wo': 0, 'Das': 0.22, 'sollte': 0.32, 'der': 0.22, 'Direktor': 0.45, 'wissen': 0.36, 'via': 1.0}",neutral,"[0.7591007, 0.03177599, 0.20912333]",,,,neutral
50.0,75.0,57.0,0.0,neutral,"RT @liberale_twi: Neben ökonomischen Fehlanreizen gibt es in der Landwirtschaft enorme ökologische Probleme, gerade bei der Pestizidbelastu…",neben ökonomisch fehlanreizen geben landwirtschaft enorme ökologisch probleme gerade pestizidbelastu,,,,,,,,,,,,,,,,,,,,,,,,,,,,,,,,,,,,,,,,,,,,,,,,,,,,,,,,,,,,,"{'Neben': 0, 'ökonomischen': 0.12, 'Fehlanreizen': 0.305, 'gibt': 0.36, 'es': 0, 'in': 0.41, 'der': 0, 'Landwirtschaft': 1.0, 'enorme': 0.67, 'ökologische': 0.69, 'Probleme': 1.0, 'gerade': 0, 'bei': 0, 'Pestizidbelastu': 0.265, '…': 0}",negative,"[0.004674242, 0.76237077, 0.23295498]",neutral
50.0,75.0,57.0,0.0,neutral,RT @JFAargau: Bauernlobby blockiert Klimaschutzmassnahmen in der Landwirtschaft. Zeigt wiedereinmal wie wichtig eine Annahme der Trinkwasse…,bauernlobby blockieren klimaschutzmassnahmen landwirtschaft zeigen wiedereinmal wichtig annahme trinkwasse,,,,,,,,,,,,,,,,,,,,,,,,,,,,,,,,,,,,,,,,,,,,,,,,,,,,,,,,,,,,,"{'Bauernlobby': 0.7949999999999999, 'blockiert': 0, 'Klimaschutzmassnahmen': 0.6000000000000001, 'in': 0.39, 'der': 0, 'Landwirtschaft': 0.64, 'Zeigt': 0, 'wiedereinmal': 0.105, 'wie': 0.15, 'wichtig': 0.12, 'eine': 0, 'Annahme': 0, 'Trinkwasse': 0.14500000000000002, '…': 0}",positive,"[0.25244263, 0.050323617, 0.6972338]",neutral
50.0,75.0,57.0,0.0,neutral,"Werden die von direkten staatlichen Subventionen abhängigen Online-Medien die Hand noch beissen, die sie füttert? Sind Direktzahlungen wie in Landwirtschaft wirklich richtig für die dynamische Medienwelt? #Zweifel 🤔 

https://t.co/eAueO7zlPp via @SRF",direkt staatlich subventionen abhängig online medien hand beissen füttern direktzahlungen landwirtschaft wirklich richtig dynamisch medienwelt zweifel via,,,,,,,,,,,,,,,,,,,,,,,,,,,,,,,,,,"{'Werden': 0.28, 'die': 0.06, 'von': 0, 'direkten': 0.32, 'staatlichen': 0, 'Subventionen': 0.04, 'abhängigen': 0.04, 'Online-Medien': 0.045, 'Hand': 0.03, 'noch': 0.08, 'beissen': 0.03, 'sie': 0, 'füttert': 0.06, 'Sind': 1.0, 'Direktzahlungen': 0.545, 'wie': 0, 'in': 0.09, 'Landwirtschaft': 0.09, 'wirklich': 0.36, 'richtig': 0, 'für': 0.11, 'dynamische': 0.04, 'Medienwelt': 0.05, 'Zweifel': 0.41, '🤔': 0, 'via': 0}",neutral,"[0.7270593, 0.25239128, 0.020549495]",,,,,,,,,,,,,,,,,,,,,,,,,"{'Werden': 0.42, 'die': 0.13, 'von': 0, 'direkten': 0.11, 'staatlichen': 0, 'Subventionen': 0.09, 'abhängigen': 0.07, 'Online-Medien': 0.16, 'Hand': 0.04, 'noch': 0.06, 'beissen': 0.04, 'sie': 0, 'füttert': 0.06, 'Sind': 0.75, 'Direktzahlungen': 0.21, 'wie': 0, 'in': 0.17, 'Landwirtschaft': 0.62, 'wirklich': 0.42, 'richtig': 0, 'für': 0.15, 'dynamische': 0.16, 'Medienwelt': 0.225, 'Zweifel': 0.57, '🤔': 0, 'via': 0}",neutral,"[0.9352541, 0.035603978, 0.029141922]",neutral
50.0,75.0,57.0,0.0,neutral,RT @FDP_Liberalen: Die Chancen der technologischen Innovation für eine nachhaltige Landwirtschaft zugunsten der Umwelt nutzen. Die FDP gibt…,chancen technologisch innovation nachhaltig landwirtschaft zugunsten umwelt nutzen fdp geben,,,,,,,,,,,,,,,,,,,,,,,,,,,,,,,,,,,,,,,,,,,,,,,,,,,,,,,,,,,,,"{'Die': 0.06, 'Chancen': 0.08, 'der': 0.06, 'technologischen': 0.1, 'Innovation': 0.17, 'für': 0.17, 'eine': 0, 'nachhaltige': 1.0, 'Landwirtschaft': 1.0, 'zugunsten': 0.04, 'Umwelt': 0.19, 'nutzen': 0.18, 'FDP': 0.11, 'gibt': 0, '…': 0}",positive,"[0.0012846112, 0.0013029451, 0.9974125]",neutral
100.0,100.0,100.0,0.85,neutral,"@Trinkwasser_ch @JauslinMatthias @DorisFiala @FluriKurt @ChristaMarkwald @andrisilbi_ @RuediNoser @Damian_Mueller_ @CottierDamien @regine_sauter @nantermod @SchneeDani67 @HPPortmann @Marcel_Dobler @themattmueller_ @AlainS1991 Subventionen in der #Landwirtschaft  sind künftig gezielter einzusetzen. D.h. Reduktion von Pestiziden und damit saubereres #Trinkwasser.
Fortschritte in grüner #Gentechnik (CRISPR-Methode) helfen dabei.
Umsetzung der Initiative kann man im Gesetz flexibler gestalten. 
Darum JA",subventionen landwirtschaft künftig gezielt einsetzen d h reduktion pestiziden sauber trinkwasser fortschritte grün gentechnik crispr methode helfen dabei umsetzung initiative gesetz flexibel gestalten darum ja,,,,,,,,,,,,,,,,,,,,,,,,,,,,,,,,,,,,,,,,,,,,,,,,,,,,,,,,,,,,,"{'Subventionen': 0.08, 'in': 0.04, 'der': 0.06, 'Landwirtschaft': 0.1, 'sind': 0.13, 'künftig': 0.04, 'gezielter': 0.08, 'einzusetzen': 0.04, 'D.h': 0, 'Reduktion': 0.03, 'von': 0, 'Pestiziden': 0.06, 'und': 0.03, 'damit': 0.04, 'saubereres': 0.03, 'Trinkwasser': 0.02, 'Fortschritte': 0, 'grüner': 0, 'Gentechnik': 0, 'CRISPR-Methode': 0.05, 'helfen': 0.12, 'dabei': 0, 'Umsetzung': 0.08, 'Initiative': 0.09, 'kann': 0.22, 'man': 0, 'im': 0, 'Gesetz': 0.13, 'flexibler': 0.115, 'gestalten': 0, 'Darum': 0, 'JA': 0.03}",neutral,"[0.49473447, 0.053541653, 0.45172384]",positive
0.0,0.0,0.0,-1.0,neutral,"@ChristophSchaer @gewerbeverband Danke, dass der KMU-Wirtschaftsverband den Mut aufbringt, eine weitere Milliarden-Subventions-Giesskanne nach der Energiestrategie zu kritisieren. ENDLICH! 
Nur weil man Geld erhält, muss man nicht immer Ja sagen. Eine Landwirtschaft reicht. #CO2Gesetz",danke kmu wirtschaftsverband mut aufbringen weit milliarden subventions giesskanne energiestrategie kritisieren endlich geld erhalten immer ja sagen landwirtschaft reichen co2gesetz,,,,,,,,,,,,,,,,,,,,,,,,,,,,,,,,,,,,,,,,,,,,,,,,,,,,,,,,,,,,,"{'Danke': 0.065, 'dass': 0.05, 'der': 0.06, 'KMU-Wirtschaftsverband': 0.060000000000000005, 'den': 0.06, 'Mut': 0, 'aufbringt': 0, 'eine': 0, 'weitere': 0, 'Milliarden-Subventions-Giesskanne': 0.04625, 'nach': 0, 'Energiestrategie': 0.07, 'zu': 0.15, 'kritisieren': 0.13, 'ENDLICH': 0.05500000000000001, 'Nur': 0.04, 'weil': 0.09, 'man': 0, 'Geld': 0.17, 'erhält': 0, 'muss': 0.15, 'nicht': 0, 'immer': 0.13, 'Ja': 0, 'sagen': 0.15, 'Eine': 0, 'Landwirtschaft': 0.89, 'reicht': 0, 'CO2Gesetz': 0}",positive,"[0.0048035043, 0.0012275048, 0.99396896]",negative
50.0,75.0,57.0,0.0,negative,Will jetzt die ganze Medienbranche auch zu Bauern werden? Ich meine eine Landwirtschaft reicht. https://t.co/CFP1vjTplf,ganze medienbranche bauern landwirtschaft reichen,,,,,,,,,,,,,,,,,,,,,,,,,,,,,,,,,,,,,,,,,,,,,,,,,,,,,,,,,,,,,"{'Will': 0, 'jetzt': 0.05, 'die': 0.03, 'ganze': 0, 'Medienbranche': 0.035, 'auch': 0, 'zu': 0.03, 'Bauern': 0.05, 'werden': 0, 'Ich': 0.08, 'meine': 0, 'eine': 0, 'Landwirtschaft': 0.55, 'reicht': 0}",positive,"[0.13027789, 0.00573805, 0.86398405]",neutral
25.0,25.0,14.0,-0.425,neutral,"Jene, die immer nach dem #Staatstropf rufen, behindern jene, die diesen finanzieren. 😡
Die Exportindustrie leidet und die linken Protektionisten verhindern mit der Landwirtschaftslobby die Aufhebung der Industriezölle. Geht es uns immer noch zu gut? https://t.co/kVFPHMUH2e",jen immer staatstropf rufen behindern jen finanzieren exportindustrie leiden link protektionisten verhindern landwirtschaftslobby aufhebung industriezölle gehen immer gut,,,,,,,,,,,,,,,,,,,,,,,,,,,,,,,,,,,,,,,,,,,,,,,,,,,,,,,,,,,,,"{'Jene': 0.02, 'die': 0.07, 'immer': 0.03, 'nach': 0, 'dem': 0.07, 'Staatstropf': 0.015, 'rufen': 0.03, 'behindern': 0.04, 'jene': 0.02, 'diesen': 0, 'finanzieren': 0.01, 'Die': 0.07, 'Exportindustrie': 0.035, 'leidet': 0, 'und': 0.09, 'linken': 0.05, 'Protektionisten': 0, 'verhindern': 0, 'mit': 0.05, 'der': 0.07, 'Landwirtschaftslobby': 0.06, 'Aufhebung': 0, 'Industriezölle': 0, 'Geht': 0, 'es': 0.09, 'uns': 0, 'noch': 0.25, 'zu': 0, 'gut': 0}",neutral,"[0.8702838, 0.07910899, 0.050607216]",negative
100.0,100.0,86.0,0.7,neutral,Endlich! Schweiz kann bei #Gentechnologien liberaler vorgehen als die EU! #CrisprCas bietet Vorteile und Chancen für die Landwirtschaft. 👩‍🌾👨‍🌾 https://t.co/CEL3MKIcOQ,endlich schweiz gentechnologien liberal vorgehen eu crisprcas bieten vorteile chancen landwirtschaft,,,,,,,,,,,,,,,,,,,,,,,,,,,,,,,,,,,,,,,,,,,,,,,,,,,,,,,,,,,,,"{'Endlich': 0.11, 'Schweiz': 0.09, 'kann': 0.1, 'bei': 0, 'Gentechnologien': 0.08, 'liberaler': 0, 'vorgehen': 0, 'als': 0, 'die': 0.04, 'EU': 0, 'CrisprCas': 0.57, 'bietet': 1.0, 'Vorteile': 0, 'und': 0.2, 'Chancen': 0.63, 'für': 0.16, 'Landwirtschaft': 0.49, '\u200d\u200d': 0}",positive,"[0.0021777789, 0.0012978788, 0.9965243]",positive
50.0,75.0,57.0,0.0,neutral,Sommaruga im #UVEK und Parmelin im #WBF: Es gibt dann nicht nur Velo- und Landwirtschaftspolitik ! 👆,sommaruga uvek parmelin wbf geben velo landwirtschaftspolitik,,,,,,,,,,,,,,,,,,,,,,,,,,,,,,,,,,,,,,,,,,,,,,,,,,,,,,,,,,,,,"{'Sommaruga': 0.25, 'im': 0, 'UVEK': 0, 'und': 0.46, 'Parmelin': 0.19, 'WBF': 0.2, 'Es': 0.29, 'gibt': 0, 'dann': 0.21, 'nicht': 0.17, 'nur': 0.27, 'Velo-': 0, 'Landwirtschaftspolitik': 1.0}",positive,"[0.091612026, 0.026729573, 0.88165843]",neutral
50.0,75.0,71.0,0.2,neutral,Klare Ablehnung von #FairFood und #Ernährungssouveränität ist ein starkes Zeichen für mehr Markt in der Landwirtschaft und mehr Auswahl für die Konsumenten. Bioprodukte kann man auch ohne Gesetz kaufen. Morgen schon wieder. 😋 #abst18 #CHvote https://t.co/wtFlHzYfiM,klaren ablehnung fairfood ernährungssouveränität stark zeichen mehr markt landwirtschaft mehr auswahl konsumenten bioprodukte gesetz kaufen morgen schon abst18 chvote,,,,,,,,,,,,,,,,,,,,,,,,,,,,,,,,,,,,,,,,,,,,,,,,,,,,,,,,,,,,,"{'Klare': 0, 'Ablehnung': 0.11, 'von': 0, 'FairFood': 0.2, 'und': 0.68, 'Ernährungssouveränität': 0.18, 'ist': 0.07, 'ein': 0, 'starkes': 0.11, 'Zeichen': 0.23, 'für': 0.1, 'mehr': 0.27, 'Markt': 0.5, 'in': 0.96, 'der': 0, 'Landwirtschaft': 1.0, 'Auswahl': 0, 'die': 0, 'Konsumenten': 0.39, 'Bioprodukte': 0, 'kann': 0.05, 'man': 0, 'auch': 0.04, 'ohne': 0.04, 'Gesetz': 0.1, 'kaufen': 0, 'Morgen': 0.07, 'schon': 0, 'wieder': 0.04, 'abst18': 0.18, 'CHvote': 0.17}",positive,"[0.009381787, 0.0023558869, 0.98826236]",neutral
50.0,75.0,57.0,0.0,neutral,"RT @FDP_Liberalen: @cwasi: Der Staat sagt uns nicht, was auf den Teller kommt. Wir brauchen keine planwirtschaftliche Landwirtschaft. Darum…",staat sagen teller kommen brauchen planwirtschaftliche landwirtschaft darum,,,,,,,,,,,,,,,,,,,,,,,,,,,,,,,,,,,,,,,,,,,,,,,,,,,,,,,,,,,,,"{'Der': 0.08, 'Staat': 0.2, 'sagt': 0, 'uns': 0.06, 'nicht': 0, 'was': 0, 'auf': 0.03, 'den': 0.08, 'Teller': 0, 'kommt': 0, 'Wir': 0.11, 'brauchen': 0.08, 'keine': 0, 'planwirtschaftliche': 0.135, 'Landwirtschaft': 0, 'Darum': 1.0, '…': 0}",neutral,"[0.6653438, 0.29548356, 0.039172564]",neutral
50.0,75.0,57.0,0.0,neutral,"@feusl @AgrarDiktat Die neue Agrarpolitik ist eine Chance, die Landwirtschaft mehr auf Markt einzustellen. Der Mut dazu fehlt bis heute.",neue agrarpolitik chance landwirtschaft mehr markt einstellen mut fehlen heute,,,,,,,,,,,,,,,,,,,,,,,,,,,,,,,,,,,,,,,,,,,,,,,,,,,,,,,,,,,,,"{'Die': 0.07, 'neue': 0.17, 'Agrarpolitik': 0.245, 'ist': 0.05, 'eine': 0, 'Chance': 0, 'die': 0.07, 'Landwirtschaft': 1.0, 'mehr': 0.48, 'auf': 0, 'Markt': 0.3, 'einzustellen': 0.05, 'Der': 0.07, 'Mut': 0, 'dazu': 0.05, 'fehlt': 0.05, 'bis': 0, 'heute': 0.11}",positive,"[0.021594986, 0.0036474224, 0.9747576]",neutral
50.0,75.0,57.0,0.0,neutral,"Der Staat sagt uns nicht, was auf den Teller kommt❗️ Wir brauchen keine planwirtschaftliche Landwirtschaft❗️ Darum NEIN zu #FairFood und NEIN zur #Ernährungssouveränität. @AgrarDiktat #abst18 #FairFoodNein #chvote https://t.co/qu4AjjOfLQ",staat sagen teller kommen brauchen planwirtschaftliche landwirtschaft darum nein fairfood nein ernährungssouveränität abst18 fairfoodnein chvote,,,,,,,,,,,,,,,,,,,,,,,,,,,,,,,,,,,,,,,,,,,,,,,,,,,,,,,,,,,,,"{'Der': 0.02, 'Staat': 0.06, 'sagt': 0, 'uns': 0.02, 'nicht': 0.02, 'was': 0, 'auf': 0.02, 'den': 0.02, 'Teller': 0, 'kommt️': 0, 'Wir': 0.02, 'brauchen': 0.035, 'keine': 0, 'planwirtschaftliche': 0.075, 'Landwirtschaft️': 0, 'Darum': 0.05, 'NEIN': 0.05, 'zu': 0.04, 'FairFood': 1.0, 'und': 0.11, 'zur': 0.03, 'Ernährungssouveränität': 0.105, 'abst18': 0.07, 'FairFoodNein': 0, 'chvote': 0.09}",positive,"[0.3658823, 0.07244029, 0.5616774]",neutral
100.0,100.0,100.0,0.85,positive,"Danke, danke, danke für diesen hervorragenden Artikel! #Gentech-Pflanzen 🥬 sind wichtig für Zukunft. Von ihnen geht keine Gefahr aus! #CRISPR/CAS ist eine Chance für grünere Landwirtschaft. 👍 https://t.co/tEVt7RZupG",danke danke danke hervorragend artikel gentech pflanzen wichtig zukunft gehen gefahr crispr cas chance grün landwirtschaft,,,,,,,,,,,,,,,,,,,,,,,,,,,,,,,,,,,,,,,,,,,,,,,,,,,,,,,,,,,,,"{'Danke': 0.035, 'danke': 0.035, 'für': 0, 'diesen': 0.03, 'hervorragenden': 0.09, 'Artikel': 0.12, 'Gentech-Pflanzen': 0.14, '🥬': 0, 'sind': 0, 'wichtig': 0, 'Zukunft': 0, 'Von': 0, 'ihnen': 0, 'geht': 0, 'keine': 0, 'Gefahr': 0, 'aus': 0, 'CRISPR': 0, 'CAS': 0, 'ist': 0, 'eine': 0, 'Chance': 0, 'grünere': 0, 'Landwirtschaft': 0}",positive,"[0.0019762446, 0.00143311, 0.9965906]",positive
