answer_five,answer_four,answer_seven,polarity,sentiment_gs,tweet,tweet_tokens,absa_token_weights_3412,absa_sentiment_3412,absa_scores_3412,absa_token_weights_3415,absa_sentiment_3415,absa_scores_3415,absa_token_weights_3441,absa_sentiment_3441,absa_scores_3441,absa_token_weights_3465,absa_sentiment_3465,absa_scores_3465,absa_token_weights_3477,absa_sentiment_3477,absa_scores_3477,sentiment_tb
100.0,100.0,100.0,0.7999999999999999,neutral,"Widmer-Schlumpf will die Pensionskassenleistungen senken (und das Rentenalter erhöhen). Erstaunliche Aussagen der @prosenectute-Präsidentin, wenn wir wissen, dass heute 320'000 Rentnerinnen #Ergänzungsleistungen erhalten, weil ihre Renten nicht zum Leben reichen.",widmer schlumpf pensionskassenleistungen senken rentenalter erhöhen erstaunlich aussagen präsidentin wissen heute rentnerinnen ergänzungsleistungen erhalten renten leben reich,"{'Widmer-Schlumpf': 0.1, 'will': 0, 'die': 0.04, 'Pensionskassenleistungen': 0.08, 'senken': 0, 'und': 0.49, 'das': 0.03, 'Rentenalter': 0.665, 'erhöhen': 0, 'Erstaunliche': 0.18, 'Aussagen': 0, 'der': 0.04, '-Präsidentin': 0, 'wenn': 0, 'wir': 0, 'wissen': 0.03, 'dass': 0.03, 'heute': 0, ""320'000"": 0, 'Rentnerinnen': 0.07, 'Ergänzungsleistungen': 0.09, 'erhalten': 0, 'weil': 0.04, 'ihre': 0.03, 'Renten': 0.07, 'nicht': 0.04, 'zum': 0.035, 'Leben': 0, 'reichen': 0}",positive,"[0.18208352, 0.07279977, 0.7451168]","{'Widmer-Schlumpf': 0.11, 'will': 0, 'die': 0.02, 'Pensionskassenleistungen': 0.125, 'senken': 0, 'und': 0.2, 'das': 0.02, 'Rentenalter': 0.1, 'erhöhen': 0, 'Erstaunliche': 0.11, 'Aussagen': 0, 'der': 0.02, '-Präsidentin': 0, 'wenn': 0, 'wir': 0, 'wissen': 0.02, 'dass': 0.02, 'heute': 0, ""320'000"": 0, 'Rentnerinnen': 0.06, 'Ergänzungsleistungen': 0.07, 'erhalten': 0, 'weil': 0.05, 'ihre': 0.02, 'Renten': 0.05, 'nicht': 0.03, 'zum': 0.02, 'Leben': 0, 'reichen': 0}",negative,"[0.054996476, 0.8956643, 0.04933923]",,,,,,,,,,positive
100.0,100.0,100.0,0.7999999999999999,neutral,"Widmer-Schlumpf will die Pensionskassenleistungen senken (und das Rentenalter erhöhen). Erstaunliche Aussagen der @prosenectute-Präsidentin, wenn wir wissen, dass heute 320'000 Rentnerinnen #Ergänzungsleistungen erhalten, weil ihre Renten nicht zum Leben reichen.",widmer schlumpf pensionskassenleistungen senken rentenalter erhöhen erstaunlich aussagen präsidentin wissen heute rentnerinnen ergänzungsleistungen erhalten renten leben reich,"{'Widmer-Schlumpf': 0.1, 'will': 0, 'die': 0.04, 'Pensionskassenleistungen': 0.08, 'senken': 0, 'und': 0.49, 'das': 0.03, 'Rentenalter': 0.665, 'erhöhen': 0, 'Erstaunliche': 0.18, 'Aussagen': 0, 'der': 0.04, '-Präsidentin': 0, 'wenn': 0, 'wir': 0, 'wissen': 0.03, 'dass': 0.03, 'heute': 0, ""320'000"": 0, 'Rentnerinnen': 0.07, 'Ergänzungsleistungen': 0.09, 'erhalten': 0, 'weil': 0.04, 'ihre': 0.03, 'Renten': 0.07, 'nicht': 0.04, 'zum': 0.035, 'Leben': 0, 'reichen': 0}",positive,"[0.18208352, 0.07279977, 0.7451168]","{'Widmer-Schlumpf': 0.11, 'will': 0, 'die': 0.02, 'Pensionskassenleistungen': 0.125, 'senken': 0, 'und': 0.2, 'das': 0.02, 'Rentenalter': 0.1, 'erhöhen': 0, 'Erstaunliche': 0.11, 'Aussagen': 0, 'der': 0.02, '-Präsidentin': 0, 'wenn': 0, 'wir': 0, 'wissen': 0.02, 'dass': 0.02, 'heute': 0, ""320'000"": 0, 'Rentnerinnen': 0.06, 'Ergänzungsleistungen': 0.07, 'erhalten': 0, 'weil': 0.05, 'ihre': 0.02, 'Renten': 0.05, 'nicht': 0.03, 'zum': 0.02, 'Leben': 0, 'reichen': 0}",negative,"[0.054996476, 0.8956643, 0.04933923]",,,,,,,,,,positive
75.0,75.0,71.0,0.2333333333333333,neutral,"Ruth Humbel bezeichnet die Forderung des Pflegepersonals als „zynisch“, weil so miserabel dessen Verdienst auch nicht sei. Humbel hat gut reden. Muss man eigentlich den Mindestlohn verdienen, bis eine Verbesserung der Arbeitsbedingungen möglich ist? Sicher nicht! #mehralsApplaus",ruth humbel bezeichnen forderung pflegepersonals zynisch miserabel verdienen humbel gut reden eigentlich mindestlohn verdienen verbesserung arbeitsbedingungen möglich sichern mehralsapplaus,,,,,,,"{'Ruth': 0.04, 'Humbel': 0, 'bezeichnet': 0, 'die': 0.34, 'Forderung': 0, 'des': 0, 'Pflegepersonals': 0.025, 'als': 0.03, '„': 0, 'zynisch': 0, '“': 0, 'weil': 0, 'so': 0, 'miserabel': 0, 'dessen': 0, 'Verdienst': 0, 'auch': 0, 'nicht': 0, 'sei': 0, 'hat': 0, 'gut': 0, 'reden': 0, 'Muss': 0, 'man': 0, 'eigentlich': 0, 'den': 0, 'Mindestlohn': 0, 'verdienen': 0, 'bis': 0, 'eine': 0, 'Verbesserung': 0, 'der': 0, 'Arbeitsbedingungen': 0, 'möglich': 0, 'ist': 0, 'Sicher': 0, 'mehralsApplaus': 0}",neutral,"[0.5243387, 0.10905109, 0.36661017]",,,,,,,neutral
100.0,100.0,86.0,0.7,neutral,Freie Marktwirtschaft. Ultraschlanker Staat. Blackout. https://t.co/IVGFqYnkQC,freie marktwirtschaft ultraschlanker staat blackout,,,,,,,,,,"{'Freie': 1.0, 'Marktwirtschaft': 0.6950000000000001, 'Ultraschlanker': 0, 'Staat': 0.18, 'Blackout': 0.11}",positive,"[0.0014702558, 0.001136546, 0.99739313]",,,,positive
75.0,75.0,71.0,0.2333333333333333,negative,"Erschreckend eindrücklich: Die mit Abstand höchsten Umwelt- und Gesundheitskosten verursacht der Strassenverkehr: Alleine 9,5 der 11,8 Milliarden Franken gehen auf sein Konto! https://t.co/bKNOBqF4Om",erschrecken eindrücklich abstand hoch umwelt gesundheitskosten verursachen strassenverkehr alleine milliarden franken gehen konto,,,,,,,,,,,,,"{'Erschreckend': 0, 'eindrücklich': 0.06, 'Die': 0.03, 'mit': 0, 'Abstand': 0, 'höchsten': 0.28, 'Umwelt-': 0, 'und': 0.04, 'Gesundheitskosten': 0.10500000000000001, 'verursacht': 1.0, 'der': 0.03, 'Strassenverkehr': 0.32499999999999996, 'Alleine': 0.03, '9,5': 0, '11,8': 0, 'Milliarden': 0, 'Franken': 0, 'gehen': 0, 'auf': 0, 'sein': 0, 'Konto': 0.02}",negative,"[0.072077386, 0.65543973, 0.2724829]",neutral
