answer_five,answer_four,answer_seven,polarity,sentiment_gs,tweet,tweet_tokens,absa_token_weights_3392,absa_sentiment_3392,absa_scores_3392,absa_token_weights_3414,absa_sentiment_3414,absa_scores_3414,absa_token_weights_3419,absa_sentiment_3419,absa_scores_3419,absa_token_weights_3463,absa_sentiment_3463,absa_scores_3463,absa_token_weights_3467,absa_sentiment_3467,absa_scores_3467,absa_token_weights_3474,absa_sentiment_3474,absa_scores_3474,absa_token_weights_3477,absa_sentiment_3477,absa_scores_3477,absa_token_weights_3479,absa_sentiment_3479,absa_scores_3479,sentiment_tb
50.0,75.0,57.0,0.0,neutral,"'Pilotversuch mit #Cannabis' - Fraktionserklärung von #SVP und #EDU heute im Zürcher Kantonsrat. Vorgetragen von Hans Egli, EDU. #KRZH #Drogen. 
https://t.co/aV5sftIK6l",pilotversuch cannabis fraktionserklärung svp edu heute zürcher kantonsrat vortragen hans egli edu krzh drogen,"{'Pilotversuch': 0.13, 'mit': 0.46, 'Cannabis': 1.0, 'Fraktionserklärung': 0.095, 'von': 0, 'SVP': 0, 'und': 0.05, 'EDU': 0.04, 'heute': 0.07, 'im': 0, 'Zürcher': 0, 'Kantonsrat': 0.055, 'Vorgetragen': 0.04, 'Hans': 0.04, 'Egli': 0, 'KRZH': 0.08, 'Drogen': 0.06}",neutral,"[0.95801497, 0.004595087, 0.037389938]",,,,,,,,,,,,,,,,,,,,,,neutral
0.0,0.0,0.0,-1.0,neutral,Verdoppelung des Vaterschaftsurlaubs des kantonalen Personals (Kanton ZH) so + jetzt verantwortungslos! http://t.co/zEFTt5QkIF,verdoppelung vaterschaftsurlaubs kantonalen personals kanton zh verantwortungslos,,,,"{'Verdoppelung': 0.07, 'des': 0, 'Vaterschaftsurlaubs': 0.125, 'kantonalen': 0.06, 'Personals': 0, 'Kanton': 0.03, 'ZH': 0.06, 'so': 0.07, 'jetzt': 0.22, 'verantwortungslos': 1.0}",negative,"[0.011121429, 0.8879542, 0.10092437]",,,,,,,,,,,,,,,,,,,negative
50.0,75.0,57.0,0.0,neutral,Denkanstoss 🤔 im Ktipp vom 6. Oktober 2021. #Organspende #EDU #Ethik https://t.co/6EUPwEE1w7,denkanstoss ktipp oktober organspende edu ethik,,,,,,,"{'Denkanstoss': 0.145, '🤔': 0, 'im': 0, 'Ktipp': 0, 'vom': 0, '6.': 0, 'Oktober': 0, '2021.': 0, 'Organspende': 0, 'EDU': 0, 'Ethik': 0}",positive,"[0.043397192, 0.0031022183, 0.95350057]",,,,,,,,,,,,,,,,neutral
50.0,75.0,57.0,0.0,neutral,"Eine Schweiz ohne #Kampfflugzeuge ist wie ein Haus ohne Dach. Es wäre fahrlässig, den Luftraum nicht mehr verteidigen zu wollen. #edu https://t.co/uVaVSelDmZ",schweiz kampfflugzeuge haus dach fahrlässig luftraum mehr verteidigen edu,,,,,,,,,,"{'Eine': 0, 'Schweiz': 0.68, 'ohne': 0.16, 'Kampfflugzeuge': 0, 'ist': 0.74, 'wie': 0, 'ein': 0, 'Haus': 0, 'Dach': 0.12, 'Es': 0.74, 'wäre': 0.35, 'fahrlässig': 0, 'den': 0.05, 'Luftraum': 0.08, 'nicht': 0.08, 'mehr': 0, 'verteidigen': 0.09, 'zu': 0.04, 'wollen': 0.06, 'edu': 0.13}",negative,"[0.4021216, 0.49911964, 0.09875884]",,,,,,,,,,,,,neutral
50.0,75.0,57.0,0.0,neutral,"Bin gespannt. Lothar Gassmann: ""Warum ich Umweltschützer aber kein Grüner bin."" - #EDU #Gruene  #Umweltschutz https://t.co/uM2kr3tG9v",spannen lothar gassmann warum umweltschützer grün edu gruene umweltschutz,,,,,,,,,,,,,"{'Bin': 0, 'gespannt': 0, 'Lothar': 0.14, 'Gassmann': 0.19, 'Warum': 0.1, 'ich': 0.05, 'Umweltschützer': 0.54, 'aber': 0.07, 'kein': 0, 'Grüner': 0, 'bin': 0, 'EDU': 0.25, 'Gruene': 0.3, 'Umweltschutz': 0.9199999999999999}",positive,"[0.038562283, 0.004830194, 0.9566075]",,,,,,,,,,neutral
50.0,75.0,57.0,0.0,neutral,"Spontane Antworten in jeweils 20 Sekunden zu: #Oberlandautobahn / #Sicherheit im öffentlichen Raum / #Asylpolitik 
http://t.co/Rqvy6tOmNG",spontane antworten jeweils sekunden oberlandautobahn sicherheit öffentlich raum asylpolitik,,,,,,,,,,,,,,,,"{'Spontane': 0.07, 'Antworten': 0, 'in': 0.17, 'jeweils': 0, '20': 0, 'Sekunden': 0.05, 'zu': 0.05, 'Oberlandautobahn': 0, 'Sicherheit': 1.0, 'im': 0, 'öffentlichen': 0.11, 'Raum': 0.11, 'Asylpolitik': 0.07500000000000001}",positive,"[0.10233287, 0.013885354, 0.88378185]",,,,,,,neutral
50.0,75.0,57.0,0.0,neutral,Knatsch zwischen #Fahrlehrer und #Strassenverkehrsamt http://t.co/0wMtr81NyX Überheblichkeit und Machtspiele des Strassenverkehrsamtes!,knatsch fahrlehrer strassenverkehrsamt überheblichkeit machtspiele strassenverkehrsamtes,,,,,,,,,,,,,,,,,,,"{'Knatsch': 0, 'zwischen': 0.04, 'Fahrlehrer': 0.055, 'und': 0.05, 'Strassenverkehrsamt': 0.04, 'Überheblichkeit': 0.07, 'Machtspiele': 0.05500000000000001, 'des': 0, 'Strassenverkehrsamtes': 0.04}",positive,"[0.18384872, 0.010194958, 0.80595636]",,,,neutral
50.0,75.0,57.0,0.0,neutral,"#KRZH überweist #EDU Postulat 'Fischzucht in der Landwirtschaftszone' von Hans Egli klar. Dagegen: GLP, AL,BDP. http://t.co/oTSgef2dl0",krzh überweisen edu postulat fischzucht landwirtschaftszone hans egli klaren dagegen glp al bdp,,,,,,,,,,,,,,,,,,,,,,"{'KRZH': 0.12, 'überweist': 0.24, 'EDU': 0.18, 'Postulat': 0.65, 'Fischzucht': 0.625, 'in': 1.0, 'der': 0.46, 'Landwirtschaftszone': 0.71, 'von': 0, 'Hans': 0.06, 'Egli': 0, 'klar': 0, 'Dagegen': 0.46, 'GLP': 0.07, 'AL': 0.02, 'BDP': 0.06}",positive,"[0.3518143, 0.014609211, 0.6335766]",neutral
50.0,75.0,57.0,0.0,neutral,#krzh debattiert über #EDU Postulat KR-NR. 92/2014 'Fischzucht in der Landwirtschaftszone' von Hans Egli.,krzh debattieren edu postulat kr nr fischzucht landwirtschaftszone hans egli,,,,,,,,,,,,,,,,,,,,,,"{'krzh': 0.09, 'debattiert': 0, 'über': 0, 'EDU': 0.07, 'Postulat': 0.09, 'KR-NR': 0, '92': 0, '2014': 0, 'Fischzucht': 0.665, 'in': 1.0, 'der': 0.59, 'Landwirtschaftszone': 0.94, 'von': 0, 'Hans': 0.11, 'Egli': 0}",neutral,"[0.6131625, 0.010444489, 0.37639296]",neutral
