answer_five,answer_four,answer_seven,polarity,sentiment_gs,tweet,tweet_tokens,absa_token_weights_3414,absa_sentiment_3414,absa_scores_3414,absa_token_weights_3450,absa_sentiment_3450,absa_scores_3450,absa_token_weights_3462,absa_sentiment_3462,absa_scores_3462,absa_token_weights_3463,absa_sentiment_3463,absa_scores_3463,absa_token_weights_3467,absa_sentiment_3467,absa_scores_3467,absa_token_weights_3468,absa_sentiment_3468,absa_scores_3468,absa_token_weights_3479,absa_sentiment_3479,absa_scores_3479,sentiment_tb
0.0,0.0,0.0,-1.0,neutral,"@studioandydna @Nutzername_neu @DianaGutjahr1 @lohnabzuegeNein @NZZaS @SVPch @svptg @gewerbeverband Habe kein Problem damit, wenn die SVP konservative Familienpolitik betreibt. Dafür steht sie ja. Nicht i.O. ist aber, die Elternzeit im Parlament abzulehnen und im Abstimmungskampf um den Vaterschaftsurlaub wieder eben eine solche zu fordern. Aber auch das ist wohl typisch SVP😏.",problem svp konservative familienpolitik betreiben dafür stehen ja i o elternzeit parlament ablehnen abstimmungskampf vaterschaftsurlaub eben fordern wohl typisch svp,"{'Habe': 0.03, 'kein': 0.07, 'Problem': 0.07, 'damit': 0.105, 'wenn': 0.03, 'die': 0.07, 'SVP': 0, 'konservative': 0.07, 'Familienpolitik': 0.07500000000000001, 'betreibt': 0, 'Dafür': 0, 'steht': 0.05, 'sie': 0, 'ja': 0.27, 'Nicht': 0.15, 'i.O.': 0, 'ist': 0.05, 'aber': 0.06, 'Elternzeit': 0.3, 'im': 0, 'Parlament': 0.13, 'abzulehnen': 0.15, 'und': 0.27, 'Abstimmungskampf': 0.13, 'um': 0, 'den': 0.07, 'Vaterschaftsurlaub': 0.195, 'wieder': 0.09, 'eben': 0, 'eine': 0, 'solche': 0, 'zu': 0.15, 'fordern': 0.25, 'Aber': 0.06, 'auch': 0, 'das': 0.05, 'wohl': 0, 'typisch': 0}",neutral,"[0.62913585, 0.038609367, 0.33225474]",,,,,,,,,,,,,,,,,,,negative
50.0,75.0,57.0,0.0,negative,@rudolf_mohler @kuendigung_nein @JagdgesetzNein @_Mogelpackung @lohnabzuegeNein @sicherheit_ja Wieso bist du gegen den Vaterschaftsurlaub?,wieso vaterschaftsurlaub,"{'Wieso': 0, 'bist': 0.395, 'du': 0, 'gegen': 1.0, 'den': 0, 'Vaterschaftsurlaub': 0.69}",negative,"[0.34365562, 0.48957893, 0.16676542]",,,,,,,,,,,,,,,,,,,neutral
0.0,0.0,0.0,-1.0,neutral,"RT @beatflach: Die #FDP hat heut die Vorlage für einen #Vaterschaftsurlaub auch mit der Begründung abgelehnt, es brauche eine Elternzeit. A…",fdp heut vorlage vaterschaftsurlaub begründung ablehnen brauche elternzeit a,"{'Die': 0.05, 'FDP': 0.27, 'hat': 0, 'heut': 0.1, 'die': 0.05, 'Vorlage': 0, 'für': 0.32, 'einen': 0.06, 'Vaterschaftsurlaub': 0.09, 'auch': 0, 'mit': 0, 'der': 0.05, 'Begründung': 0, 'abgelehnt': 0, 'es': 0, 'brauche': 0, 'eine': 0, 'Elternzeit': 0.095, 'A': 0.06, '…': 0}",neutral,"[0.46110746, 0.45131367, 0.08757889]",,,,,,,,,,,,,,,,,,,negative
50.0,75.0,57.0,0.0,neutral,"Die @jglp_sg hat die Parolen für die Abstimmungen vom 27.09.2020 gefasst.

❌Nein zur #Kündigungsinitiative
❌Nein zum #Abschussgesetz
❌Nein zur #Mogelpackung
✅JA zum #Vaterschaftsurlaub
✅JA zur #Kampfflugzeugbeschaffung

Zur Medienmitteilung: https://t.co/lo3obqB6xz",parolen abstimmungen gefasst nein kündigungsinitiative nein abschussgesetz nein mogelpackung ja vaterschaftsurlaub ja kampfflugzeugbeschaffung medienmitteilung,"{'Die': 0.05, 'hat': 0, 'die': 0.05, 'Parolen': 0.12, 'für': 0.02, 'Abstimmungen': 0, 'vom': 0.05, '27.09.2020': 0, 'gefasst': 0, 'Nein': 0.06, 'zur': 0.05, 'Kündigungsinitiative': 0.045, 'zum': 0.05, 'Abschussgesetz': 0, 'Mogelpackung': 0, 'JA': 0, 'Vaterschaftsurlaub': 0.61, 'Kampfflugzeugbeschaffung': 0.08249999999999999, 'Zur': 0.05, 'Medienmitteilung': 0.065}",positive,"[0.045674916, 0.013496376, 0.94082874]",,,,,,,"{'Die': 0.26, 'hat': 0, 'die': 0.26, 'Parolen': 0.12, 'für': 0.03, 'Abstimmungen': 0, 'vom': 0.26, '27.09.2020': 0, 'gefasst': 0, 'Nein': 0.14, 'zur': 0.315, 'Kündigungsinitiative': 0.09000000000000001, 'zum': 0.315, 'Abschussgesetz': 0, 'Mogelpackung': 0, 'JA': 0, 'Vaterschaftsurlaub': 0.18, 'Kampfflugzeugbeschaffung': 0.2425, 'Zur': 0.315, 'Medienmitteilung': 0.5650000000000001}",neutral,"[0.4878639, 0.027644537, 0.48449153]",,,,,,,,,,neutral
100.0,100.0,100.0,1.0,positive,#Vaterschaftsurlaub: Die Pro-Argumente überwiegen für mich klar. Wir brauchen endlich eine progressive Familienpolitik losgelöst von alten Rollenbildern. Noch besser wäre also eine #Elternzeit. Zeit für ein Gegenvorschlag? #MVjglpCH https://t.co/V0jq8gj2zX,vaterschaftsurlaub pro argumente überwiegen klaren brauchen endlich progressive familienpolitik loslösen alt rollenbildern gut elternzeit zeit gegenvorschlag mvjglpch,"{'Vaterschaftsurlaub': 0.03, 'Die': 0.12, 'Pro-Argumente': 0.11, 'überwiegen': 0.17, 'für': 0.01, 'mich': 0.17, 'klar': 0, 'Wir': 0.05, 'brauchen': 0.04, 'endlich': 0, 'eine': 0, 'progressive': 0.03, 'Familienpolitik': 0.035, 'losgelöst': 0.02, 'von': 0.01, 'alten': 0.01, 'Rollenbildern': 0.02, 'Noch': 0, 'besser': 0.05, 'wäre': 0.02, 'also': 0, 'Elternzeit': 0.03, 'Zeit': 0.03, 'ein': 0, 'Gegenvorschlag': 0.025, 'MVjglpCH': 0.13}",neutral,"[0.76505065, 0.07450532, 0.16044407]",,,,,,,,,,,,,,,,,,,positive
0.0,0.0,0.0,-1.0,neutral,RT @GrassSelina: Innovativer Vorstoss aus der JGLP-Denkfabrik: Strom-Bojen im Rhein. Nur mit verschiedenen erneuerbaren Energiequellen kann…,innovativ vorstoss jglp denkfabrik strom bojen rhein verschieden erneuerbaren energiequellen,,,,"{'Innovativer': 0.1, 'Vorstoss': 0, 'aus': 0, 'der': 0.03, 'JGLP-Denkfabrik': 0.03, 'Strom-Bojen': 0.04, 'im': 0, 'Rhein': 0, 'Nur': 0, 'mit': 0.38, 'verschiedenen': 1.0, 'erneuerbaren': 1.0, 'Energiequellen': 0.335, 'kann': 0.23, '…': 0}",neutral,"[0.83975095, 0.025012061, 0.1352371]",,,,,,,,,,,,,,,,negative
50.0,75.0,57.0,0.0,neutral,"RT @jglp_sg: Die Welt entwickelt sich weiter, ob mit oder ohne uns. Innovation ist gefordert! 

Unser Vorstoss zu erneuerbaren Energiequell…",welt entwickeln weit innovation fordern vorstoss erneuerbaren energiequell,,,,"{'Die': 0.05, 'Welt': 0.06, 'entwickelt': 0, 'sich': 0, 'weiter': 0, 'ob': 0, 'mit': 0.05, 'oder': 0.07, 'ohne': 0.04, 'uns': 0.03, 'Innovation': 0.11, 'ist': 0.09, 'gefordert': 0.11, 'Unser': 1.0, 'Vorstoss': 0, 'zu': 0, 'erneuerbaren': 0.3, 'Energiequell': 0.11, '…': 0}",positive,"[0.025283875, 0.00560738, 0.9691087]",,,,,,,,,,,,,,,,neutral
0.0,0.0,0.0,-1.0,neutral,@beatflach Weshalb waren wir schon wieder besorgt? Kriegsmaterialexporte? Schleppender Fortschritt im Klimaschutz? Angriff auf unsere Vernetzung in Europa durch eine populistische Initiative? Ja dann schon 😉.,weshalb schon besorgen kriegsmaterialexporte schleppend fortschritt klimaschutz angreifen vernetzung europa populistische initiative ja schon,,,,,,,"{'Weshalb': 0, 'waren': 0, 'wir': 0, 'schon': 0, 'wieder': 0.13, 'besorgt': 0, 'Kriegsmaterialexporte': 0.8825000000000001, 'Schleppender': 0, 'Fortschritt': 0.17, 'im': 0, 'Klimaschutz': 0.13, 'Angriff': 0.15, 'auf': 0.04, 'unsere': 0.07, 'Vernetzung': 0.11, 'in': 0.05, 'Europa': 0.07, 'durch': 0, 'eine': 0, 'populistische': 0.14, 'Initiative': 0.11, 'Ja': 0, 'dann': 0.03}",negative,"[0.37874418, 0.5835798, 0.03767604]",,,,,,,,,,,,,negative
75.0,75.0,71.0,0.3333333333333333,neutral,"Ich persönlich stelle mich klar gegen Kriegsmaterial-Exporte ins Ausland.

Die #Korrekturinitiative  ist daher ein erster wichtiger Schritt in die richtige Richtung und setzt ein klares Zeichen gegen den äusserst fragwürdigen Entscheid des Bundesrates.",persönlich stelle klaren kriegsmaterial exporte ausland korrekturinitiative daher erst wichtig schritt richtige richtung setzen klar zeichen äusserst fragwürdig entscheid bundesrates,,,,,,,"{'Ich': 0.14, 'persönlich': 0.08, 'stelle': 0, 'mich': 0, 'klar': 0.02, 'gegen': 0.1, 'Kriegsmaterial-Exporte': 0.24, 'ins': 0, 'Ausland': 0.21, 'Die': 0.03, 'Korrekturinitiative': 0.08, 'ist': 0.04, 'daher': 0, 'ein': 0, 'erster': 0.02, 'wichtiger': 0.03, 'Schritt': 0.03, 'in': 0.02, 'die': 0.03, 'richtige': 0.03, 'Richtung': 0.03, 'und': 0.02, 'setzt': 0, 'klares': 0.02, 'Zeichen': 0, 'den': 0.03, 'äusserst': 0.02, 'fragwürdigen': 0, 'Entscheid': 0.13, 'des': 0, 'Bundesrates': 0.025}",positive,"[0.42413163, 0.05454687, 0.5213215]",,,,,,,,,,,,,positive
100.0,100.0,100.0,0.85,negative,Exporte von Kriegsmaterial ins Ausland: Für mich generell mit einer neutralen - und vor allem humanitären Schweiz - absolut unvereinbar. Ganz egal in welches Land. Das wär doch mal ein Thema für eine Initiative @jglpCH @grunliberale? https://t.co/okRFswblVO,exporte kriegsmaterial ausland generell neutral humanitär schweiz absolut unvereinbar ganz egal welch land wär mal thema initiative,,,,,,,"{'Exporte': 0.3, 'von': 0, 'Kriegsmaterial': 0.5599999999999999, 'ins': 0, 'Ausland': 0.33, 'Für': 0.13, 'mich': 0.25, 'generell': 0.315, 'mit': 0.65, 'einer': 0, 'neutralen': 0.43, 'und': 0.24, 'vor': 0, 'allem': 0, 'humanitären': 0.4, 'Schweiz': 0.36, 'absolut': 0.97, 'unvereinbar': 1.0, 'Ganz': 0.1, 'egal': 0.10500000000000001, 'in': 0.17, 'welches': 0.06, 'Land': 0, 'Das': 0, 'wär': 0.09, 'doch': 0, 'mal': 0, 'ein': 0, 'Thema': 0, 'für': 0.13, 'eine': 0, 'Initiative': 0.29}",negative,"[0.09945638, 0.5502757, 0.350268]",,,,,,,,,,,,,positive
50.0,75.0,57.0,0.0,neutral,"Die @jglp_sg hat die Parolen für die Abstimmungen vom 27.09.2020 gefasst.

❌Nein zur #Kündigungsinitiative
❌Nein zum #Abschussgesetz
❌Nein zur #Mogelpackung
✅JA zum #Vaterschaftsurlaub
✅JA zur #Kampfflugzeugbeschaffung

Zur Medienmitteilung: https://t.co/lo3obqB6xz",parolen abstimmungen gefasst nein kündigungsinitiative nein abschussgesetz nein mogelpackung ja vaterschaftsurlaub ja kampfflugzeugbeschaffung medienmitteilung,"{'Die': 0.05, 'hat': 0, 'die': 0.05, 'Parolen': 0.12, 'für': 0.02, 'Abstimmungen': 0, 'vom': 0.05, '27.09.2020': 0, 'gefasst': 0, 'Nein': 0.06, 'zur': 0.05, 'Kündigungsinitiative': 0.045, 'zum': 0.05, 'Abschussgesetz': 0, 'Mogelpackung': 0, 'JA': 0, 'Vaterschaftsurlaub': 0.61, 'Kampfflugzeugbeschaffung': 0.08249999999999999, 'Zur': 0.05, 'Medienmitteilung': 0.065}",positive,"[0.045674916, 0.013496376, 0.94082874]",,,,,,,"{'Die': 0.26, 'hat': 0, 'die': 0.26, 'Parolen': 0.12, 'für': 0.03, 'Abstimmungen': 0, 'vom': 0.26, '27.09.2020': 0, 'gefasst': 0, 'Nein': 0.14, 'zur': 0.315, 'Kündigungsinitiative': 0.09000000000000001, 'zum': 0.315, 'Abschussgesetz': 0, 'Mogelpackung': 0, 'JA': 0, 'Vaterschaftsurlaub': 0.18, 'Kampfflugzeugbeschaffung': 0.2425, 'Zur': 0.315, 'Medienmitteilung': 0.5650000000000001}",neutral,"[0.4878639, 0.027644537, 0.48449153]",,,,,,,,,,neutral
50.0,75.0,57.0,0.0,neutral,@FurbieMiller @jglpCH @Willkuer_NEIN Umweltschutzbestimmungen? Und Art. 239 StGB?,umweltschutzbestimmungen art stgb,,,,,,,,,,,,,"{'Umweltschutzbestimmungen': 0.40499999999999997, 'Und': 0.91, 'Art': 0, '239': 0, 'StGB': 0}",neutral,"[0.96624213, 0.023858603, 0.009899269]",,,,,,,neutral
50.0,75.0,71.0,0.15,neutral,"@morvjn Ich will, dass Unternehmen, deren Geschäftspraxis darin besteht, durch Umgehung von Umweltschutz- oder Arbeitsrechtsbestimmungen bessere Gewinnmarchen zu erzielen, zur Rechenschaft gezogen werden. Dass hat nichts mit Hass, sondern mit der Durchsetzung von Recht zu tun.",unternehmen geschäftspraxis darin bestehen umgehung umweltschutz arbeitsrechtsbestimmungen gut gewinnmarchen erzielen rechenschaft ziehen hass durchsetzung recht tun,,,,,,,,,,,,,"{'Ich': 0.64, 'will': 0, 'dass': 0.05, 'Unternehmen': 0, 'deren': 0.66, 'Geschäftspraxis': 0.075, 'darin': 0, 'besteht': 0, 'durch': 0, 'Umgehung': 0, 'von': 0, 'Umweltschutz-': 0.08, 'oder': 0.05, 'Arbeitsrechtsbestimmungen': 0.03, 'bessere': 0.11, 'Gewinnmarchen': 0.04, 'zu': 0.02, 'erzielen': 0, 'zur': 0.015, 'Rechenschaft': 0, 'gezogen': 0, 'werden': 0, 'Dass': 0.05, 'hat': 0, 'nichts': 0.04, 'mit': 0.02, 'Hass': 0, 'sondern': 0.03, 'der': 0.01, 'Durchsetzung': 0.02, 'Recht': 0.03, 'tun': 0.02}",negative,"[0.3143334, 0.47987136, 0.20579532]",,,,,,,neutral
50.0,75.0,71.0,0.15,neutral,"@morvjn @themattmueller_ @Jungfreisinnige @BuergKomitee @konzern_vi Ich will, dass Unternehmen, deren Geschäftspraxis darin besteht, durch Umgehung von Umweltschutz- oder Arbeitsrechtsbestimmungen bessere Gewinnmarchen zu erzielen, zur Rechenschaft gezogen werden. Dass hat nichts mit Hass, sondern mit der Durchsetzung von Recht zu tun.",unternehmen geschäftspraxis darin bestehen umgehung umweltschutz arbeitsrechtsbestimmungen gut gewinnmarchen erzielen rechenschaft ziehen hass durchsetzung recht tun,,,,,,,,,,,,,"{'Ich': 0.64, 'will': 0, 'dass': 0.05, 'Unternehmen': 0, 'deren': 0.66, 'Geschäftspraxis': 0.075, 'darin': 0, 'besteht': 0, 'durch': 0, 'Umgehung': 0, 'von': 0, 'Umweltschutz-': 0.08, 'oder': 0.05, 'Arbeitsrechtsbestimmungen': 0.03, 'bessere': 0.11, 'Gewinnmarchen': 0.04, 'zu': 0.02, 'erzielen': 0, 'zur': 0.015, 'Rechenschaft': 0, 'gezogen': 0, 'werden': 0, 'Dass': 0.05, 'hat': 0, 'nichts': 0.04, 'mit': 0.02, 'Hass': 0, 'sondern': 0.03, 'der': 0.01, 'Durchsetzung': 0.02, 'Recht': 0.03, 'tun': 0.02}",negative,"[0.3143334, 0.47987136, 0.20579532]",,,,,,,neutral
100.0,100.0,86.0,0.7,neutral,"@JoelDrittenbass Kann man so nicht sagen. Das Schweizer Umwelt- und Arbeitnehmerschutzrecht entspricht ""anerkannten Menschenrechten und Umweltschutzstandards"". Das Parlament würde mit einer solchen Gesetzgebung dem Wesen der Initiative nachkommen.",sagen schweizer umwelt arbeitnehmerschutzrecht entsprechen anerkannt menschenrechten umweltschutzstandards parlament solch gesetzgebung wesen initiative nachkommen,,,,,,,,,,,,,"{'Kann': 0.09, 'man': 0, 'so': 0, 'nicht': 0.09, 'sagen': 0.295, 'Das': 0.07, 'Schweizer': 0.12, 'Umwelt-': 0, 'und': 0.49, 'Arbeitnehmerschutzrecht': 0.30000000000000004, 'entspricht': 0.51, 'anerkannten': 1.0, 'Menschenrechten': 0.6950000000000001, 'Umweltschutzstandards': 0.405, 'Parlament': 0.19, 'würde': 0.16, 'mit': 0.06, 'einer': 0, 'solchen': 0.08, 'Gesetzgebung': 0.18, 'dem': 0.29000000000000004, 'Wesen': 0.09, 'der': 0.07, 'Initiative': 0.19, 'nachkommen': 0}",positive,"[0.080305606, 0.026938349, 0.89275604]",,,,,,,positive
100.0,100.0,100.0,1.0,neutral,@peterhettich Das meinte ich nicht: Wie bei allen Vertragsverhandlungen führt ein Ungleichgewicht zwischen den Partnern nicht immer zu ausgewogenen Lösungen.  Investitionsschutzabkommen bedienen ein Interesse des Heimatstaates und werden daher durchgesetzt. Umweltschutz - nicht.,vertragsverhandlungen führen ungleichgewicht partnern immer ausgewogen lösungen investitionsschutzabkommen bedienen interesse heimatstaates daher durchsetzen umweltschutz,,,,,,,,,,,,,"{'Das': 0.03, 'meinte': 0, 'ich': 0.02, 'nicht': 1.0, 'Wie': 0.03, 'bei': 0, 'allen': 0, 'Vertragsverhandlungen': 0.03, 'führt': 0, 'ein': 0, 'Ungleichgewicht': 0.09, 'zwischen': 0.03, 'den': 0.03, 'Partnern': 0.03, 'immer': 0.09, 'zu': 0.03, 'ausgewogenen': 0.07, 'Lösungen': 0.04, 'Investitionsschutzabkommen': 0.375, 'bedienen': 0.14, 'Interesse': 0, 'des': 0, 'Heimatstaates': 0.025, 'und': 0.05, 'werden': 0, 'daher': 0, 'durchgesetzt': 0.22, 'Umweltschutz': 0.57}",neutral,"[0.6234636, 0.29908767, 0.077448756]",,,,,,,positive
100.0,100.0,100.0,1.0,neutral,"@peterhettich Wir kennen (und schätzen) auch andere Formen der extraterritorialen Schutzpflichten, bspw. bei Investitionsschutzabkommen. Dass solche im Unterschied zu griffigen Umweltschutzabkommen zustandekommen, ist oftmals den politischen/rechtlichen Umständen im Gaststaat geschuldet.",kennen schätzen formen extraterritorialen schutzpflichten bspw investitionsschutzabkommen unterscheiden griffig umweltschutzabkommen zustandekommen oftmals politisch rechtlich umständen gaststaat schulden,,,,,,,,,,,,,"{'Wir': 0.04, 'kennen': 0.04, 'und': 0.04, 'schätzen': 0, 'auch': 0.06, 'andere': 0, 'Formen': 0.65, 'der': 0.07, 'extraterritorialen': 0.22, 'Schutzpflichten': 0.365, 'bspw.': 0, 'bei': 0, 'Investitionsschutzabkommen': 0.38, 'Dass': 0, 'solche': 0.12, 'im': 0, 'Unterschied': 0, 'zu': 0.65, 'griffigen': 0, 'Umweltschutzabkommen': 1.0, 'zustandekommen': 0.135, 'ist': 0, 'oftmals': 0.11, 'den': 0.07, 'politischen': 0.12, 'rechtlichen': 0.16, 'Umständen': 0.09, 'Gaststaat': 0.11, 'geschuldet': 0}",positive,"[0.09431016, 0.032173596, 0.87351626]",,,,,,,positive
100.0,100.0,86.0,0.7,neutral,"RT @glp_sg: #EsistZeit, dem #Umweltschutz #Artenschutz #Biodiversität #Klimaschutz endlich die nötige Priorität einzuräumen. Genug geredet,…",esistzeit umweltschutz artenschutz biodiversität klimaschutz endlich nötig priorität einräumen genug reden,,,,,,,,,,,,,"{'EsistZeit': 0, 'dem': 0.24, 'Umweltschutz': 0.32499999999999996, 'Artenschutz': 0.22999999999999998, 'Biodiversität': 0.18, 'Klimaschutz': 0.16999999999999998, 'endlich': 0, 'die': 0.36, 'nötige': 0.22, 'Priorität': 0.36, 'einzuräumen': 0.12, 'Genug': 0.08, 'geredet': 0.13, '…': 0}",positive,"[0.049099445, 0.014892685, 0.93600786]",,,,,,,positive
25.0,25.0,28.0,-0.35,negative,RT @uelifisch: Die FDP soll sich mehr für den Klima- und Umweltschutz engagieren: https://t.co/vt1DzK2oqh Und wem es bei der FDP zu langsam…,fdp mehr klima umweltschutz engagieren wer fdp langsam,,,,,,,,,,,,,"{'Die': 0.02, 'FDP': 0.02, 'soll': 0, 'sich': 0, 'mehr': 0.28, 'für': 0.04, 'den': 0.02, 'Klima-': 0.46, 'und': 0.17, 'Umweltschutz': 0.725, 'engagieren': 0, 'Und': 0.17, 'wem': 0, 'es': 0.02, 'bei': 0.02, 'der': 0.02, 'zu': 0.4, 'langsam': 0.06, '…': 0}",positive,"[0.112140864, 0.09489034, 0.79296875]",,,,,,,negative
100.0,100.0,86.0,0.7,negative,RT @PVuichard: Offenbar ist weder Umweltschutz noch Wissenschaft in der #DNA der FDP - Warum sonst müssten sie zuerst bei ihren Mitgliedern…,offenbaren weder umweltschutz wissenschaft dna fdp warum müssten zuerst mitgliedern,,,,,,,,,,,,,"{'Offenbar': 1.0, 'ist': 0.22, 'weder': 1.0, 'Umweltschutz': 0.27, 'noch': 0, 'Wissenschaft': 0.13, 'in': 0.15, 'der': 0.06, 'DNA': 0.06, 'FDP': 0.06, 'Warum': 0.13, 'sonst': 0, 'müssten': 0.0425, 'sie': 0, 'zuerst': 0.05, 'bei': 0, 'ihren': 0, 'Mitgliedern': 0.03, '…': 0}",negative,"[0.05522181, 0.93276596, 0.012012217]",,,,,,,positive
100.0,100.0,86.0,0.7,neutral,RT @grunliberale: Wir begrüssen den Gegenvorschlag zur Konzernverantwortungsinitiative. #Menschenrechte und #Umweltschutz müssen auch im Au…,begrüssen gegenvorschlag konzernverantwortungsinitiative menschenrechte umweltschutz müssen au,,,,,,,,,,,,,"{'Wir': 0.06, 'begrüssen': 0, 'den': 0.06, 'Gegenvorschlag': 0.06, 'zur': 0.06, 'Konzernverantwortungsinitiative': 0.0575, 'Menschenrechte': 0.32, 'und': 1.0, 'Umweltschutz': 0.51, 'müssen': 0.06, 'auch': 0.62, 'im': 0, 'Au': 0, '…': 0}",positive,"[0.005010024, 0.0020803902, 0.9929096]",,,,,,,positive
100.0,100.0,100.0,1.0,neutral,"@OpLiberoPlus @wahlforschung0 @grunliberale @jglpCH @operationlibero Ah jetzt wird‘s konkreter 😉. Es gibt durchaus Teilgebiete, in welchen die EU-Rechtsetzung kritisch/intransparent sein mag (z.B. TTIP). Aber deshalb ist die glp auch für ein Rahmenabkommen und nicht für einen Beitritt. Also hopp, Mitglied werden: https://t.co/xx7Ukp2Np5",ah s konkret geben durchaus teilgebiete welch eu rechtsetzung kritisch intransparent mögen z b ttip deshalb glp rahmenabkommen beitreten hopp mitglied,,,,,,,,,,,,,,,,"{'Ah': 0.07, 'jetzt': 0.07, 'wird': 0, '‘': 0, 's': 0, 'konkreter': 0, 'Es': 0, 'gibt': 0, 'durchaus': 0, 'Teilgebiete': 0, 'in': 0, 'welchen': 0, 'die': 0, 'EU-Rechtsetzung': 0, 'kritisch': 0, 'intransparent': 0, 'sein': 0, 'mag': 0, 'z.B.': 0, 'TTIP': 0, 'Aber': 0, 'deshalb': 0, 'ist': 0, 'glp': 0, 'auch': 0, 'für': 0, 'ein': 0, 'Rahmenabkommen': 0, 'und': 0, 'nicht': 0, 'einen': 0, 'Beitritt': 0, 'Also': 0, 'hopp': 0, 'Mitglied': 0, 'werden': 0}",neutral,"[0.4712845, 0.37750718, 0.15120833]",,,,positive
50.0,75.0,57.0,0.0,neutral,"RT @Elias_Giesinger: @JupaSG-Podium zur #TWI ist, wenn die konservative @DieJungeMitteSG beim ökologischen Wandel in der Landwirtschaft auf…",podium twi konservative beim ökologisch wandel landwirtschaft,,,,,,,,,,,,,,,,,,,"{'-Podium': 0, 'zur': 1.0, 'TWI': 0.09, 'ist': 0.38, 'wenn': 0, 'die': 1.0, 'konservative': 0.64, 'beim': 1.0, 'ökologischen': 0.24, 'Wandel': 0.39, 'in': 0.16, 'der': 1.0, 'Landwirtschaft': 0.28, 'auf': 0.45, '…': 0}",positive,"[0.2448014, 0.025613058, 0.7295855]",neutral
75.0,75.0,71.0,0.35,neutral,"@ThomasKuster12 Ein bisschen mehr staatliche Überwachung, dafür sicher keine Eigenverantwortung in der Landwirtschaft. Kann man machen...",bisschen mehr staatliche überwachung dafür sichern eigenverantwortung landwirtschaft,,,,,,,,,,,,,,,,,,,"{'Ein': 0.1, 'bisschen': 0.28, 'mehr': 0.14, 'staatliche': 0.1, 'Überwachung': 0, 'dafür': 0, 'sicher': 0, 'keine': 0, 'Eigenverantwortung': 0.31, 'in': 0.15, 'der': 0, 'Landwirtschaft': 0.32, 'Kann': 0.19, 'man': 0, 'machen': 0.19, '...': 0}",neutral,"[0.51529306, 0.07505093, 0.40965602]",positive
50.0,75.0,57.0,0.0,neutral,"RT @glp_sg: Podium – Zukunft Landwirtschaft | Landwirtschaft und Nachhaltigkeit – Geht das zusammen?
WANN: 27.08.2019
ZEIT: 19:00 Uhr
ORT:…",podium zukunft landwirtschaft landwirtschaft nachhaltigkeit gehen zusammen wann zeit uhr ort,,,,,,,,,,,,,,,,,,,"{'Podium': 0.51, '–': 0, 'Zukunft': 0, 'Landwirtschaft': 0, 'und': 0, 'Nachhaltigkeit': 0, 'Geht': 0, 'das': 0, 'zusammen': 0, 'WANN': 0, '27.08.2019': 0, 'ZEIT': 0, '19:00': 0, 'Uhr': 0, 'ORT': 0, '…': 0}",neutral,"[0.83676535, 0.014610351, 0.14862433]",neutral
100.0,100.0,100.0,0.9,neutral,"RT @GrassSelina: Hochkarätiger Anlass der Jungen Grünliberalen St.Gallen: Podium ""Nachhaltige Landwirtschaft"". Wir freuen uns auf zahlreich…",hochkarätig anlass jung grünliberalen st gallen podium nachhaltig landwirtschaft freuen zahlreich,,,,,,,,,,,,,,,,,,,"{'Hochkarätiger': 0, 'Anlass': 0, 'der': 0.07, 'Jungen': 0, 'Grünliberalen': 0.12, 'St.': 0, 'Gallen': 0.14, 'Podium': 0.3, 'Nachhaltige': 1.0, 'Landwirtschaft': 1.0, 'Wir': 0.05, 'freuen': 0, 'uns': 0, 'auf': 0, 'zahlreich': 0.04, '…': 0}",positive,"[0.0007164352, 0.0010342862, 0.9982493]",positive
0.0,0.0,0.0,-1.0,neutral,"Ich kandidiere für die @jglp_sg für einen Sitz im Nationalrat!

Ich setze mich ein für...
... eine Sicherheitspolitik mit Hand, Fuss und Herz💂‍♂️💚 
... eine gegenüber verschiedensten Lebensformen offenen Gesellschaft 👨‍👦‍👦👩‍💻
... eine innovative, nachhaltige Landwirtschaftspolitik🚜🌽 https://t.co/pVFzouMBD2",kandidieren sitzen nationalrat setzen sicherheitspolitik hand fuss herz gegenüber verschieden lebensformen offen gesellschaft innovative nachhaltig landwirtschaftspolitik,,,,,,,,,,,,,,,,,,,"{'Ich': 0.02, 'kandidiere': 0.02, 'für': 0.02, 'die': 0.04, 'einen': 0.03, 'Sitz': 0.03, 'im': 0, 'Nationalrat': 0.025, 'setze': 0, 'mich': 0, 'ein': 0, '...': 0, 'eine': 0, 'Sicherheitspolitik': 0.16999999999999998, 'mit': 0.02, 'Hand': 0.02, 'Fuss': 0, 'und': 0.03, 'Herz\u200d️': 0, 'gegenüber': 0.03, 'verschiedensten': 0, 'Lebensformen': 0.04, 'offenen': 0.02, 'Gesellschaft': 0.08, '\u200d\u200d\u200d': 0, 'innovative': 0, 'nachhaltige': 0, 'Landwirtschaftspolitik': 0}",positive,"[0.00050076074, 0.0010332108, 0.998466]",negative
50.0,75.0,57.0,0.0,neutral,RT @grunliberale: Die unendliche Geschichte über #Pestizide und #Überdüngung in der Landwirtschaft (1/6). 2012 stimmt der Nationalrat auf I…,unendliche geschichte pestizide überdüngung landwirtschaft stimmen nationalrat i,,,,,,,,,,,,,,,,,,,"{'Die': 0.16, 'unendliche': 0, 'Geschichte': 0.03, 'über': 0, 'Pestizide': 0.06, 'und': 0.03, 'Überdüngung': 0.06, 'in': 0.17, 'der': 0.16, 'Landwirtschaft': 0.04, '1': 0, '6': 0, '2012': 0, 'stimmt': 0, 'Nationalrat': 0.155, 'auf': 1.0, 'I': 0.5, '…': 0}",neutral,"[0.9379421, 0.009890689, 0.052167147]",neutral
50.0,75.0,57.0,0.0,neutral,RT @NikolaiOrgland: Das #Insektensterben in unserer Landwirtschaft bringt das ganze Ökosystem aus dem Gleichgewicht. 🐝🦋 In nur 20 Jahren si…,insektensterben landwirtschaft bringen ganze ökosystem gleichgewicht jahren si,,,,,,,,,,,,,,,,,,,"{'Das': 0.07, 'Insektensterben': 0.15, 'in': 0.05, 'unserer': 1.0, 'Landwirtschaft': 1.0, 'bringt': 0, 'das': 0, 'ganze': 0.11, 'Ökosystem': 0.17, 'aus': 0.04, 'dem': 0.07, 'Gleichgewicht': 0.08, '🦋': 0, 'In': 0, 'nur': 0, '20': 0, 'Jahren': 0, 'si': 0, '…': 0}",positive,"[0.19956829, 0.107545845, 0.6928859]",neutral
