answer_five,answer_four,answer_seven,polarity,sentiment_gs,tweet,tweet_tokens,absa_token_weights_3436,absa_sentiment_3436,absa_scores_3436,absa_token_weights_3459,absa_sentiment_3459,absa_scores_3459,absa_token_weights_3465,absa_sentiment_3465,absa_scores_3465,sentiment_tb
50.0,75.0,57.0,0.0,neutral,"@andriniovic @doppel_m @fdp_bern #wahlbern16 Wer hat die Voraussetzung geschaffen, dass wir überhaupt über Steuersenkung reden können?",wahlbern16 wer voraussetzung schaffen überhaupt steuersenkung reden,"{'wahlbern16': 0.4, 'Wer': 0.65, 'hat': 0, 'die': 0.12, 'Voraussetzung': 0, 'geschaffen': 0.18, 'dass': 0, 'wir': 0, 'überhaupt': 0.23500000000000001, 'über': 0, 'Steuersenkung': 0.19, 'reden': 0, 'können': 0.125}",neutral,"[0.9941989, 0.0019245974, 0.0038765366]",,,,,,,neutral
100.0,100.0,100.0,0.9,neutral,#e-Voting bringt keinen grossen Fortschritt. Das Denken greift um sich. Top Aufarbeitung mit schmeichelndem Fazit im @Zeitfragen Bundesrat verschiebt die gesetzliche Regelung von E-Voting als ordentliches Abstimmungsverfahren https://t.co/fJ31QGGMz8,e voting bringen grossen fortschritt denken greifen top aufarbeitung schmeichelnd fazit bundesrat verschieben gesetzliche regelung e voting ordentlich abstimmungsverfahren,,,,"{'e-Voting': 0, 'bringt': 0, 'keinen': 0, 'grossen': 0, 'Fortschritt': 0.03, 'Das': 0.22, 'Denken': 0, 'greift': 0, 'um': 0.06, 'sich': 0, 'Top': 0.05, 'Aufarbeitung': 0, 'mit': 0.06, 'schmeichelndem': 0.08, 'Fazit': 0.17, 'im': 0, 'Bundesrat': 0.16, 'verschiebt': 0, 'die': 0.22, 'gesetzliche': 0.12, 'Regelung': 0.18, 'von': 0, 'E-Voting': 0, 'als': 0.12, 'ordentliches': 0, 'Abstimmungsverfahren': 0.07}",negative,"[0.25760394, 0.5963358, 0.14606024]",,,,positive
50.0,25.0,57.0,-0.1,negative,"Warum mir #FakeNews für unser Land keine Sorgen machen, warum e-Voting strikt abzulehnen ist - das alles und noch viel mehr nächsten Montag am #Wahlen #Debatte für den #Nationalrat in #Bern Schmiedstube https://t.co/xT0pUqjYGZ",warum fakenews land sorgen warum e voting strikt ablehnen mehr nächst montag wahlen debatte nationalrat bern schmiedstube,,,,"{'Warum': 0.03, 'mir': 0, 'FakeNews': 0.1, 'für': 0.03, 'unser': 0.01, 'Land': 0, 'keine': 0, 'Sorgen': 0.02, 'machen': 0, 'warum': 0.03, 'e-Voting': 0, 'strikt': 0, 'abzulehnen': 0.02, 'ist': 0, 'das': 0.02, 'alles': 0, 'und': 0.02, 'noch': 0, 'viel': 0, 'mehr': 0.01, 'nächsten': 0.01, 'Montag': 0.02, 'am': 0, 'Wahlen': 0, 'Debatte': 0.06, 'den': 0.05, 'Nationalrat': 0, 'in': 0.07, 'Bern': 0.16, 'Schmiedstube': 0}",negative,"[0.32753608, 0.4663423, 0.2061216]",,,,neutral
100.0,100.0,86.0,0.7,neutral,"Die soziale zur öko-sozialen Marktwirtschaft weiterentwickeln: Eine Vision mit 4 Elementen  https://t.co/yjnpfsFdbU
#WahlenCH19 @fdp_bern @FDP_Liberalen  #wahlen2019 #wahlch19 #wiewähleich #fdp #teamfdp @fdp_stadtbern
 #Bern @BernerZeitung @derbund",soziale öko sozial marktwirtschaft weiterentwickel vision elementen wahlench19 wahlen2019 wahlch19 wiewähleich fdp teamfdp bern,,,,,,,"{'Die': 0.14, 'soziale': 1.0, 'zur': 0.15000000000000002, 'öko-sozialen': 0, 'Marktwirtschaft': 0.7849999999999999, 'weiterentwickeln': 0, 'Eine': 0, 'Vision': 0.11, 'mit': 0.06, '4': 0, 'Elementen': 0.07, 'WahlenCH19': 0, 'wahlen2019': 0, 'wahlch19': 0.09, 'wiewähleich': 0, 'fdp': 0, 'teamfdp': 0.13, 'Bern': 0.06}",positive,"[0.0039016367, 0.0032108699, 0.99288756]",positive
