answer_five,answer_four,answer_seven,polarity,sentiment_gs,tweet,tweet_tokens,absa_token_weights_3389,absa_sentiment_3389,absa_scores_3389,absa_token_weights_3414,absa_sentiment_3414,absa_scores_3414,absa_token_weights_3434,absa_sentiment_3434,absa_scores_3434,absa_token_weights_3450,absa_sentiment_3450,absa_scores_3450,absa_token_weights_3466,absa_sentiment_3466,absa_scores_3466,absa_token_weights_3467,absa_sentiment_3467,absa_scores_3467,sentiment_tb
50.0,75.0,57.0,0.0,neutral,"RT @glplab: Mit Corona sind viele ins Home Office gewechselt. Was bedeutet das für unsere Arbeit, die Kinderbetreuung oder Mobilität? Am Mi…",corona home office wechseln bedeuten arbeit kinderbetreuung mobilität mi,"{'Mit': 0.07, 'Corona': 0.03, 'sind': 0, 'viele': 0, 'ins': 0, 'Home': 0.04, 'Office': 0.04, 'gewechselt': 0, 'Was': 0, 'bedeutet': 0, 'das': 0, 'für': 0.08, 'unsere': 0.1, 'Arbeit': 0.12, 'die': 0.05, 'Kinderbetreuung': 0.12, 'oder': 0.15, 'Mobilität': 0.15, 'Am': 0, 'Mi': 0, '…': 0}",neutral,"[0.98303545, 0.014894106, 0.0020704356]",,,,,,,,,,,,,,,,neutral
50.0,75.0,57.0,0.0,neutral,RT @KatrinCometta: Wie bringen wir die #Gleichstellung und die #Vereinbarkeit von Familie &amp; Beruf voran? Ist mit dem #Vaterschaftsurlaub al…,bringen gleichstellung vereinbarkeit familie amp beruf voran vaterschaftsurlaub al,,,,"{'Wie': 0, 'bringen': 0.04, 'wir': 0, 'die': 0.55, 'Gleichstellung': 0.08, 'und': 0.07, 'Vereinbarkeit': 0.1, 'von': 0, 'Familie': 0.09, 'amp': 0.1, 'Beruf': 0, 'voran': 0, 'Ist': 0.25, 'mit': 0.39, 'dem': 0.55, 'Vaterschaftsurlaub': 0.6, 'al': 0.26, '…': 0}",positive,"[0.004825428, 0.0047885384, 0.990386]",,,,,,,,,,,,,neutral
50.0,75.0,57.0,0.0,neutral,"Sollen #Frauen mehr oder #Männer weniger verdienen?

#Gleichberechtigung #Lohngleichheit https://t.co/vP89I2tjMA",sollen frauen mehr männer wenig verdienen gleichberechtigung lohngleichheit,,,,,,,"{'Sollen': 1.0, 'Frauen': 0.13, 'mehr': 0.09, 'oder': 0.2, 'Männer': 0.19, 'weniger': 0, 'verdienen': 0.24, 'Gleichberechtigung': 0.31, 'Lohngleichheit': 0.43000000000000005}",neutral,"[0.7209145, 0.02636003, 0.25272545]",,,,,,,,,,neutral
100.0,100.0,100.0,1.0,neutral,"Danke für die Wahlempfehlung @ZueriErneuerbar! 
Für erneuerbare #Energie und mutige #Klimapolitik in #Züri und der ganzen #Schweiz. 
Die gesamte Liste gibt es hier: https://t.co/ggsSpGkfmT
#Klimawahl #WahlCH19 #wahlen19 https://t.co/NfjRhN5YWY",danke wahlempfehlung erneuerbare energie mutig klimapolitik züri ganz schweiz gesamt liste geben klimawahl wahlch19 wahlen19,,,,,,,,,,"{'Danke': 0, 'für': 0.47, 'die': 0.02, 'Wahlempfehlung': 0.1, 'Für': 0.47, 'erneuerbare': 1.0, 'Energie': 0.33, 'und': 0.08, 'mutige': 0, 'Klimapolitik': 0.02, 'in': 0.14, 'Züri': 0, 'der': 0.02, 'ganzen': 0, 'Schweiz': 0.02, 'Die': 0.02, 'gesamte': 0, 'Liste': 0, 'gibt': 0, 'es': 0.02, 'hier': 0.03, 'Klimawahl': 0.02, 'WahlCH19': 0, 'wahlen19': 0}",positive,"[0.00060605834, 0.0017878211, 0.99760604]",,,,,,,positive
50.0,75.0,57.0,0.0,neutral,RT @foraus: Unsere Sister Think Tanks @polis180 und @PontoThinkTank haben via #PolicyKitchen die zukünftige europäische Digitalisierungspol…,sister think tanks via policykitchen zukünftig europäische digitalisierungspol,,,,,,,,,,,,,"{'Unsere': 0.05, 'Sister': 0.07, 'Think': 0.07, 'Tanks': 0.13, 'und': 0.08, 'haben': 0.13, 'via': 0.15, 'PolicyKitchen': 0.31, 'die': 0.14, 'zukünftige': 0.16, 'europäische': 0.31, 'Digitalisierungspol': 0.685, '…': 0}",positive,"[0.25741348, 0.01797071, 0.7246158]",,,,neutral
50.0,75.0,57.0,0.0,neutral,"RT @glpzh: Die @grunliberale sind die wirtschaftsfreundlichste Partei. 
Das Ranking der @Handelszeitung zeigt, dass Klima- und Umweltschutz…",wirtschaftsfreundlichste partei ranking zeigen klima umweltschutz,,,,,,,,,,,,,,,,"{'Die': 0.09, 'sind': 0.1, 'die': 0.09, 'wirtschaftsfreundlichste': 0.09, 'Partei': 0.08, 'Das': 0.09, 'Ranking': 0.17, 'der': 0.09, 'zeigt': 0, 'dass': 0.65, 'Klima-': 0.17, 'und': 0.31, 'Umweltschutz': 0.3, '…': 0}",positive,"[0.0011099677, 0.0009241129, 0.99796593]",neutral
100.0,100.0,100.0,1.0,negative,"RT @klinglergeorg: 54 Abstimmungen für Umweltschutz analysiert. #SVP und #Lega lehnten alles ab, die #FDP über 40. Interessant ist auch, da…",abstimmungen umweltschutz analysieren svp lega lehnen ab fdp interessant,,,,,,,,,,,,,,,,"{'Abstimmungen': 0, 'für': 0.44, 'Umweltschutz': 0.675, 'analysiert': 1.0, 'SVP': 0, 'und': 0.17, 'Lega': 0, 'lehnten': 0, 'alles': 0.08, 'ab': 0, 'die': 0.09, 'FDP': 0.14, 'über': 0.06, '40.': 0, 'Interessant': 0.1, 'ist': 0.04, 'auch': 0.04, 'da': 0, '…': 0}",positive,"[0.14426465, 0.012997569, 0.8427378]",positive
