answer_five,answer_four,answer_seven,polarity,sentiment_gs,tweet,tweet_tokens,absa_token_weights_3450,absa_sentiment_3450,absa_scores_3450,absa_token_weights_3466,absa_sentiment_3466,absa_scores_3466,absa_token_weights_3467,absa_sentiment_3467,absa_scores_3467,sentiment_tb
50.0,75.0,57.0,0.0,neutral,"Gestrige Sendung ""die politische Woche - der Talk"" zu den Themen #Energiewende #Axpo #Heiratsstrafe #Jagdgesetz 👉https://t.co/QZcwSWbsTg
#kernkraftwerk #atomkraft #erneuerbare #energie #individualbesteuerung #wolf #jagd #fdp #svp #evp #WahlCH19",gestrig sendung politische woche talk themen energiewende axpo heiratsstrafe jagdgesetz kernkraftwerk atomkraft erneuerbare energie individualbesteuerung wolf jagd fdp svp evp wahlch19,"{'Gestrige': 0.03, 'Sendung': 0, 'die': 0.04, 'politische': 0.11, 'Woche': 0.02, 'der': 0.04, 'Talk': 0.02, 'zu': 0, 'den': 0.04, 'Themen': 0, 'Energiewende': 0.2, 'Axpo': 0.1, 'Heiratsstrafe': 0, 'Jagdgesetz': 0.12, 'kernkraftwerk': 0.5275000000000001, 'atomkraft': 0.665, 'erneuerbare': 0.86, 'energie': 0.2, 'individualbesteuerung': 0.05500000000000001, 'wolf': 0.06, 'jagd': 0, 'fdp': 0, 'svp': 0, 'evp': 0.05, 'WahlCH19': 0}",neutral,"[0.570287, 0.026376002, 0.40333706]",,,,,,,neutral
100.0,100.0,100.0,1.0,neutral,"Liebe @sunniejaye, super Interview -&gt; sehr lesenswert: https://t.co/VMWDJUOGly
Über #Digitalisierung, #Politik, #Wirtschaft, #Zukunft der #Schweiz, #Bildung, #Schulsystem, #Klimawandel und #WahlCH19.",lieb super interview gt lesenswert digitalisierung politik wirtschaft zukunft schweiz bildung schulsystem klimawandel wahlch19,,,,"{'Liebe': 0.09, 'super': 0, 'Interview': 0.07, '-&gt': 0, 'sehr': 0.12, 'lesenswert': 0.155, 'Über': 0, 'Digitalisierung': 0, 'Politik': 0, 'Wirtschaft': 0, 'Zukunft': 0.04, 'der': 0, 'Schweiz': 0.05, 'Bildung': 0.03, 'Schulsystem': 0, 'Klimawandel': 0.025, 'und': 0.06, 'WahlCH19.': 0}",positive,"[0.009176079, 0.0033145312, 0.9875094]",,,,positive
100.0,100.0,86.0,0.7,neutral,Spannende Thesen von @wissensfabrik Joël Luc Cachelin zum Thema #Digitalisierung und #Sport am #hufo in Arosa. https://t.co/swlHrJdlDe,spannend thesen joël luc cachelin thema digitalisierung sport hufo arosa,,,,"{'Spannende': 0.79, 'Thesen': 0.36, 'von': 0, 'Joël': 0, 'Luc': 0.1, 'Cachelin': 0.38, 'zum': 0.21, 'Thema': 0, 'Digitalisierung': 0, 'und': 0.43, 'Sport': 0.22, 'am': 0, 'hufo': 0.16, 'in': 0.12, 'Arosa': 0.13}",positive,"[0.042233583, 0.0047174664, 0.95304894]",,,,positive
100.0,100.0,100.0,1.0,neutral,"Liechtenstein macht's vor. Schulterschluss von Wirtschaft, Wissenschaft und Politik um den Digitalen Wandel möglichst erfolgreich zu meistern. Ein Vorbild für die Schweiz! #roadmap #liechtenstein #digitalerwandel #digitalisierung https://t.co/qZ3PWudzNy",liechtenstein s schulterschluss wirtschaft wissenschaft politik digital wandel möglichst erfolgreich meistern vorbild schweiz roadmap liechtenstein digitalerwandel digitalisierung,,,,"{'Liechtenstein': 0.11, ""macht's"": 0, 'vor': 0, 'Schulterschluss': 0, 'von': 0, 'Wirtschaft': 0.02, 'Wissenschaft': 0.02, 'und': 0.02, 'Politik': 0, 'um': 0.05, 'den': 0.01, 'Digitalen': 0.04, 'Wandel': 0.03, 'möglichst': 0.02, 'erfolgreich': 0, 'zu': 0.03, 'meistern': 0.05, 'Ein': 0.05, 'Vorbild': 0, 'für': 0.03, 'die': 0.01, 'Schweiz': 0.06, 'roadmap': 0.1, 'liechtenstein': 0.11, 'digitalerwandel': 0.5, 'digitalisierung': 1.0}",positive,"[0.35429686, 0.011947586, 0.6337555]",,,,positive
50.0,75.0,57.0,0.0,neutral,Digitalisierung des Gesundheitswesen. Bin auf die Umsetzung gespannt. https://t.co/Nwn7xFtQkF via @digitalgenesen,digitalisierung gesundheitswesen umsetzung spannen via,,,,"{'Digitalisierung': 0, 'des': 0, 'Gesundheitswesen': 0.16, 'Bin': 0, 'auf': 0, 'die': 0.06, 'Umsetzung': 0.11, 'gespannt': 0, 'via': 0.11}",positive,"[0.002457945, 0.0012261821, 0.9963159]",,,,neutral
100.0,100.0,100.0,1.0,neutral,RT @vrmandat: In den #Aufsichtsgremien herrscht Bedarf nach jüngeren Mitgliedern und #Digitalisierungsspezialisten. Gut jeder Zweite hielt…,aufsichtsgremien herrschen bedarf jung mitgliedern digitalisierungsspezialisten gut jed zweite halten,,,,"{'In': 0.06, 'den': 0.04, 'Aufsichtsgremien': 0.07500000000000001, 'herrscht': 0, 'Bedarf': 0, 'nach': 0, 'jüngeren': 0.06, 'Mitgliedern': 0.07, 'und': 0.08, 'Digitalisierungsspezialisten': 0.155, 'Gut': 0, 'jeder': 0, 'Zweite': 0.5, 'hielt': 1.0, '…': 0}",neutral,"[0.9119888, 0.04272161, 0.0452895]",,,,positive
50.0,75.0,57.0,0.0,neutral,"„Viele Unternehmen reden über die neuen Möglichkeiten, kennen den Weg zur Umsetzung aber noch nicht. „ #technologiewandel #digitalisierung https://t.co/lnXwvnk3No",unternehmen reden neu möglichkeiten kennen umsetzung technologiewandel digitalisierung,,,,"{'„': 0, 'Viele': 0, 'Unternehmen': 0, 'reden': 0, 'über': 0, 'die': 0, 'neuen': 0, 'Möglichkeiten': 0, 'kennen': 0, 'den': 0, 'Weg': 0, 'zur': 0, 'Umsetzung': 0, 'aber': 0, 'noch': 0, 'nicht': 0, 'technologiewandel': 0, 'digitalisierung': 0}",neutral,"[0.98164064, 0.008504056, 0.00985531]",,,,neutral
50.0,75.0,57.0,0.0,neutral,"Mein heutiger Gastbeitrag zum Thema #Nachhaltigkeit. 
Wer heute Nachhaltigkeit fordert, darf nicht nur von #Umweltschutz und #Klimawandel sprechen, denn Nachhaltigkeit ist eine Haltung, die weit über Umweltfragen hinaus geht. #dieOstschweiz https://t.co/uwA6A8nymV",heutig gastbeitrag thema nachhaltigkeit wer heute nachhaltigkeit fordern dürfen umweltschutz klimawandel sprechen nachhaltigkeit haltung weit umweltfragen hinaus gehen dieostschweiz,,,,,,,"{'Mein': 0.04, 'heutiger': 0.12, 'Gastbeitrag': 0.045, 'zum': 0.03, 'Thema': 0, 'Nachhaltigkeit': 0.07, 'Wer': 0.02, 'heute': 0.12, 'fordert': 0.07, 'darf': 0, 'nicht': 0.1, 'nur': 0.17, 'von': 0, 'Umweltschutz': 0.515, 'und': 0.31, 'Klimawandel': 0.13, 'sprechen': 0.32, 'denn': 0, 'ist': 0.05, 'eine': 0, 'Haltung': 0.09, 'die': 0.03, 'weit': 0.08, 'über': 0, 'Umweltfragen': 0.03, 'hinaus': 0, 'geht': 0.03, 'dieOstschweiz': 0.04}",positive,"[0.18122207, 0.040847912, 0.7779301]",neutral
