answer_five,answer_four,answer_seven,polarity,sentiment_gs,tweet,tweet_tokens,absa_token_weights_3412,absa_sentiment_3412,absa_scores_3412,absa_token_weights_3419,absa_sentiment_3419,absa_scores_3419,absa_token_weights_3466,absa_sentiment_3466,absa_scores_3466,absa_token_weights_3472,absa_sentiment_3472,absa_scores_3472,absa_token_weights_3479,absa_sentiment_3479,absa_scores_3479,sentiment_tb
50.0,75.0,57.0,0.0,neutral,"RT @casimirvonarx: 1/ Das Rentenalter den demografischen Realitäten anzupassen, wird früher oder später auch in der Stadt Bern unumgänglich…",rentenalter demografischen realitäten anpassen früh spät stadt bern unumgänglich,"{'Das': 0.06, 'Rentenalter': 0.515, 'den': 0.06, 'demografischen': 0.28, 'Realitäten': 0.15, 'anzupassen': 0, 'wird': 0.35, 'früher': 0, 'oder': 0.05, 'später': 0.04, 'auch': 0, 'in': 0.09, 'der': 0.06, 'Stadt': 0.09, 'Bern': 0.11, 'unumgänglich': 0.22, '…': 0}",neutral,"[0.5943202, 0.058690615, 0.34698924]",,,,,,,,,,,,,neutral
50.0,75.0,57.0,0.0,neutral,"Die Sanierung der #AHV hat noch viele Baustellen. Eine Erhöhung des Rentenalters und eine #Individualbesteuerung sind Schritte in die richtige Richtung.

https://t.co/TdKhL4Md8E",sanierung ahv baustellen erhöhung rentenalters individualbesteuerung schritte richtige richtung,"{'Die': 0.1, 'Sanierung': 0, 'der': 0.1, 'AHV': 0.15, 'hat': 0, 'noch': 0.13, 'viele': 0, 'Baustellen': 0.21500000000000002, 'Eine': 0, 'Erhöhung': 1.0, 'des': 0, 'Rentenalters': 0.9450000000000001, 'und': 0.32, 'eine': 0, 'Individualbesteuerung': 0.255, 'sind': 0.43, 'Schritte': 0.2, 'in': 0.07, 'die': 0.1, 'richtige': 0.2, 'Richtung': 0.16}",positive,"[0.043726828, 0.04006063, 0.9162126]",,,,,,,,,,,,,neutral
75.0,75.0,71.0,0.3333333333333333,positive,"Ein hitziges, aber auch unterhaltsames Podium an der @unibern zur #Organspende.
Für mich ist weiterhin klar, dass die Widerspruchslösung durchaus #liberal ist. 
Was aber nötig bleibt, ist der Diskurs über das Thema mit den Liebsten.

Danke an die Moderation durch @newmark_c https://t.co/DpuXlkeCgf",hitzig unterhaltsam podium organspende weiterhin klaren widerspruchslösung durchaus liberal nötigen bleiben diskurs thema lieb danke moderation,,,,"{'Ein': 0.03, 'hitziges': 0.1, 'aber': 0.11, 'auch': 0.1, 'unterhaltsames': 0.45, 'Podium': 0.21, 'an': 0, 'der': 0.04, 'zur': 0.035, 'Organspende': 0.665, 'Für': 0, 'mich': 0.03, 'ist': 0.02, 'weiterhin': 0, 'klar': 0.06, 'dass': 0.04, 'die': 0.04, 'Widerspruchslösung': 0.07, 'durchaus': 0, 'liberal': 0.1, 'Was': 0, 'nötig': 0.03, 'bleibt': 0.03, 'Diskurs': 0.06, 'über': 0, 'das': 0.04, 'Thema': 0, 'mit': 0.03, 'den': 0.04, 'Liebsten': 0.035, 'Danke': 0, 'Moderation': 0.09, 'durch': 0}",positive,"[0.005739478, 0.0019229216, 0.99233764]",,,,,,,,,,positive
100.0,100.0,86.0,0.7,neutral,"In Zeiten der #Digitalisierung muss sich auch die Geschwindigkeit des Internets anpassen. Daher unterstütze ich den Ausbau des #5G-Netzes. 

https://t.co/PVpQ4iCSWt",zeiten digitalisierung geschwindigkeit internets anpassen daher unterstützen ausbau g netzes,,,,,,,"{'In': 0.12, 'Zeiten': 0.24, 'der': 0.04, 'Digitalisierung': 0, 'muss': 0, 'sich': 0, 'auch': 0.04, 'die': 0.04, 'Geschwindigkeit': 0.08, 'des': 0, 'Internets': 0, 'anpassen': 0, 'Daher': 0, 'unterstütze': 0.05, 'ich': 0.03, 'den': 0.04, 'Ausbau': 0.05, '5G-Netzes': 0.07}",neutral,"[0.7655477, 0.10611774, 0.12833458]",,,,,,,positive
0.0,0.0,0.0,-1.0,neutral,"""Die klassische spendenfinanzierte Entwicklungshilfe sei nicht nachhaltig, [...]. Und er rüttelt an einem Tabu: Darf man mit den ärmsten Menschen dieser Welt Geschäfte machen?""
Ja, darf man und sollte man auch.

https://t.co/0BuWdBVT4b",klassische spendenfinanzierte entwicklungshilfe nachhaltig rütteln tabu dürfen arm menschen welt geschäfte ja dürfen sollen,,,,,,,,,,"{'Die': 0.02, 'klassische': 0.22, 'spendenfinanzierte': 0, 'Entwicklungshilfe': 0.85, 'sei': 0, 'nicht': 1.0, 'nachhaltig': 0, '...': 0, 'Und': 0.03, 'er': 0.44, 'rüttelt': 0.03, 'an': 0, 'einem': 0, 'Tabu': 0, 'Darf': 0, 'man': 0, 'mit': 0.03, 'den': 0.02, 'ärmsten': 0.08, 'Menschen': 0.03, 'dieser': 0, 'Welt': 0.02, 'Geschäfte': 0, 'machen': 0.03, 'Ja': 0.03, 'darf': 0, 'und': 0.03, 'sollte': 0.05, 'auch': 0}",negative,"[0.10654638, 0.69923484, 0.19421874]",,,,negative
50.0,75.0,57.0,0.0,neutral,RT @Michael_Koepfli: Das dogmatische Festhalten am Gentech-Moratorium in der Landwirtschaft ist wissenschaftlich nicht begründbar - insbeso…,dogmatische festhalten gentech moratorium landwirtschaft wissenschaftlich begründbar insbeso,,,,,,,,,,,,,"{'Das': 0.13, 'dogmatische': 0.17, 'Festhalten': 0, 'am': 0, 'Gentech-Moratorium': 0, 'in': 0.16, 'der': 0.13, 'Landwirtschaft': 0.29, 'ist': 0, 'wissenschaftlich': 0, 'nicht': 0, 'begründbar': 0, 'insbeso': 0.58, '…': 0}",positive,"[0.08021182, 0.009800398, 0.9099878]",neutral
