answer_five,answer_four,answer_seven,polarity,sentiment_gs,tweet,tweet_tokens,absa_token_weights_3392,absa_sentiment_3392,absa_scores_3392,absa_token_weights_3412,absa_sentiment_3412,absa_scores_3412,absa_token_weights_3417,absa_sentiment_3417,absa_scores_3417,absa_token_weights_3436,absa_sentiment_3436,absa_scores_3436,absa_token_weights_3444,absa_sentiment_3444,absa_scores_3444,absa_token_weights_3466,absa_sentiment_3466,absa_scores_3466,absa_token_weights_3467,absa_sentiment_3467,absa_scores_3467,absa_token_weights_3468,absa_sentiment_3468,absa_scores_3468,absa_token_weights_3478,absa_sentiment_3478,absa_scores_3478,absa_token_weights_3479,absa_sentiment_3479,absa_scores_3479,sentiment_tb
25.0,25.0,28.0,-0.2333333333333333,positive,"Weniger Steuern ist immer gut. Für noch weniger Steuern und mehr Legalisierung -&gt; @JfStadtZH #legalizeit #CannabisCommunity @VereinLegalize #cannabis #hanf 

https://t.co/T9V8voQhcd",wenig steuern immer gut wenig steuern mehr legalisierung gt legalizeit cannabiscommunity cannabis hanf,"{'Weniger': 0, 'Steuern': 0, 'ist': 0.05, 'immer': 0.04, 'gut': 0, 'Für': 0.07, 'noch': 0, 'weniger': 0, 'und': 0.06, 'mehr': 0.05, 'Legalisierung': 0.08, '-&gt': 0, 'legalizeit': 0, 'CannabisCommunity': 0, 'cannabis': 0.7, 'hanf': 0.3}",neutral,"[0.64083695, 0.027438186, 0.33172485]",,,,,,,,,,,,,,,,,,,,,,,,,,,,neutral
100.0,100.0,100.0,0.85,neutral,"Im neuen Videoformat von HighDefinition erkläre ich weshalb ich Drogen legalisieren will und ob man als Kiffer ein guter Schwiegersohn ist. #LegalizeIt #cannabis #CannabisCommunity @VereinLegalize 

https://t.co/BMaxAEg35z",neu videoformat highdefinition erklären weshalb drogen legalisieren kiffer gut schwiegersohn legalizeit cannabis cannabiscommunity,"{'Im': 0, 'neuen': 0.03, 'Videoformat': 0.04, 'von': 0, 'HighDefinition': 0.11, 'erkläre': 0.04, 'ich': 0.01, 'weshalb': 0, 'Drogen': 0.06, 'legalisieren': 0.11, 'will': 0, 'und': 0.04, 'ob': 0, 'man': 0, 'als': 0.02, 'Kiffer': 0.03, 'ein': 0, 'guter': 0, 'Schwiegersohn': 0.04, 'ist': 0, 'LegalizeIt': 0.25, 'cannabis': 0.22, 'CannabisCommunity': 1.0}",neutral,"[0.93820643, 0.028845016, 0.032948546]",,,,,,,,,,,,,,,,,,,,,,,,,,,,positive
50.0,75.0,57.0,0.0,neutral,"JF provozieren mit Drogen-Video. Liberalisierung gegen Schwarzmarkt, Drogentote und giftige Streckmittel. via @nau_live #legalizeit #cannabis @JfStadtZH @JFZH  https://t.co/th8PP3Ac0R",jf provozieren drogen video liberalisierung schwarzmarkt drogentote giftig streckmittel via legalizeit cannabis,"{'JF': 0.12, 'provozieren': 0.13, 'mit': 0.11, 'Drogen-Video': 0.18000000000000002, 'Liberalisierung': 0.29, 'gegen': 0.18, 'Schwarzmarkt': 0.065, 'Drogentote': 0.10500000000000001, 'und': 0.11, 'giftige': 0.12, 'Streckmittel': 0, 'via': 1.0, 'legalizeit': 0, 'cannabis': 0.43}",neutral,"[0.8023784, 0.007666328, 0.18995523]",,,,,,,,,,,,,,,,,,,,,,,,,,,,neutral
100.0,100.0,100.0,1.0,neutral,RT @narimoldi: Wenn man keine eigene Ideen hat: Zwei Wochen nach der höchst erfolgreichen #Cannabis-Aktion der @JFZH wird diese von den @jg…,eigene ideen zwei wochen höchst erfolgreich cannabis aktion,"{'Wenn': 0, 'man': 0, 'keine': 0, 'eigene': 0.04, 'Ideen': 0.07, 'hat': 0, 'Zwei': 0.14, 'Wochen': 1.0, 'nach': 0.38, 'der': 1.0, 'höchst': 0, 'erfolgreichen': 0.25, 'Cannabis-Aktion': 0.25, 'wird': 0, 'diese': 0, 'von': 0, 'den': 1.0, '…': 0}",neutral,"[0.8194046, 0.028918225, 0.15167716]",,,,,,,,,,,,,,,,,,,,,,,,,,,,positive
100.0,100.0,86.0,0.7,neutral,"@KarlKuenzle @LXEvans @Jungfreisinnige @FDP_Liberalen Ich denke mit der Angleichung des Rentenalters machen wir bereits einen grossen Schritt in Richtung Gleichberechtigung. Die Lebenserwartung verändert sich bei beiden Geschlechter ähnlich, deshalb schien uns dort eine Unterscheidung als unnötig.",denken angleichung rentenalters bereits grossen schritt richtung gleichberechtigung lebenserwartung verändern beid geschlechter ähnlich deshalb scheinen unterscheidung unnötig,,,,"{'Ich': 0.08, 'denke': 0.11, 'mit': 0.25, 'der': 0.16, 'Angleichung': 0, 'des': 0, 'Rentenalters': 0.31, 'machen': 0, 'wir': 0, 'bereits': 0.11, 'einen': 0.03, 'grossen': 0, 'Schritt': 0.12, 'in': 0.03, 'Richtung': 0, 'Gleichberechtigung': 0, 'Die': 0.16, 'Lebenserwartung': 0.08, 'verändert': 0.07, 'sich': 0, 'bei': 0, 'beiden': 0.02, 'Geschlechter': 0, 'ähnlich': 0, 'deshalb': 0, 'schien': 0.05, 'uns': 0.03, 'dort': 0.02, 'eine': 0, 'Unterscheidung': 0.05, 'als': 0, 'unnötig': 0.06}",positive,"[0.03167341, 0.012138237, 0.9561884]",,,,,,,,,,,,,,,,,,,,,,,,,positive
50.0,75.0,57.0,0.0,neutral,"@BeriniFelix @Jungfreisinnige @FDP_Liberalen Bauarbeiter haben oftmals eigene Rentenalter, wie z.B. Maurer mit 60 Jahren. Dies in ihrem GAV geregelt. Wir setzen uns dafür ein, dass dies auch so bleibt und im GAV geregelt wird.",bauarbeiter oftmals eigene rentenalter z b maurer jahren gav regeln setzen dafür bleiben gav regeln,,,,"{'Bauarbeiter': 0.12, 'haben': 0.28, 'oftmals': 0.32, 'eigene': 1.0, 'Rentenalter': 0.645, 'wie': 0, 'z.B.': 0, 'Maurer': 0, 'mit': 0, 'Jahren': 0, 'Dies': 0, 'in': 0.05, 'ihrem': 0, 'GAV': 0.08, 'geregelt': 0.13, 'Wir': 0.03, 'setzen': 0, 'uns': 0, 'dafür': 0, 'ein': 0, 'dass': 0.04, 'dies': 0, 'auch': 0, 'so': 0, 'bleibt': 0, 'und': 0.03, 'im': 0, 'wird': 0}",neutral,"[0.63790756, 0.016325278, 0.3457671]",,,,,,,,,,,,,,,,,,,,,,,,,neutral
100.0,100.0,86.0,0.6999999999999998,neutral,"Eine Erhöhung des Rentenalters sichert uns unseren Wohlstand im Alter. Gerne bin ich bereit länger zu arbeiten, anstatt jährlich massiv höhere Abzüge ertragen zu müssen. @Jungfreisinnige @FDP_Liberalen #rentensichern #ahvretten https://t.co/ogOxPyk6FD",erhöhung rentenalters sichern wohlstand altern gerne bereiten lang arbeiten anstatt jährlich massiv hoch abzüge ertragen müssen rentensichern ahvretten,,,,"{'Eine': 0, 'Erhöhung': 0, 'des': 0, 'Rentenalters': 0.26, 'sichert': 0, 'uns': 0, 'unseren': 0.11, 'Wohlstand': 0.31, 'im': 0, 'Alter': 0, 'Gerne': 0, 'bin': 0, 'ich': 0.05, 'bereit': 0, 'länger': 0.04, 'zu': 0.03, 'arbeiten': 0.07, 'anstatt': 0.035, 'jährlich': 0, 'massiv': 0, 'höhere': 0.04, 'Abzüge': 0, 'ertragen': 0.07, 'müssen': 0.03, 'rentensichern': 0.09, 'ahvretten': 0.14}",positive,"[0.02315128, 0.010324288, 0.9665245]",,,,,,,,,,,,,,,,,,,,,,,,,positive
50.0,75.0,57.0,0.0,negative,"@redder66 @nau_live Nö, gegen eine anständige Rente habe ich gar Nichts einzuwenden. Mir geht es um die Finanzierung derer. 

Bereits Pensionierte welche das Land aufgebaut haben sind nebenbei auch nicht von einer Erhöhung des Rentenalters betroffen ;)",nö anständig rente gar einwenden gehen finanzierung bereits pensionieren welch land aufbauen nebenbei erhöhung rentenalters betreffen,,,,"{'Nö': 0, 'gegen': 0.08, 'eine': 0, 'anständige': 0.08, 'Rente': 0, 'habe': 0.05, 'ich': 0.03, 'gar': 0, 'Nichts': 0.06, 'einzuwenden': 0, 'Mir': 0, 'geht': 0, 'es': 0.05, 'um': 0.05, 'die': 0.26, 'Finanzierung': 0, 'derer': 0, 'Bereits': 0.12, 'Pensionierte': 0.19, 'welche': 0, 'das': 0, 'Land': 0, 'aufgebaut': 0.095, 'haben': 0.045, 'sind': 0.11, 'nebenbei': 0, 'auch': 0.15, 'nicht': 0.55, 'von': 0, 'einer': 0, 'Erhöhung': 1.0, 'des': 0, 'Rentenalters': 0.73, 'betroffen': 0.21}",positive,"[0.34396827, 0.02701096, 0.6290208]",,,,,,,,,,,,,,,,,,,,,,,,,neutral
50.0,75.0,57.0,0.0,neutral,"@redder66 @nau_live Altersvorsorge.
Generationenvertrag im Hintergrund der alternden Bevölkerung. Alles zulasten der jungen und arbeitenden Bevölkerung oder an die Lebenserwartung angepasstes Rentenalter?",altersvorsorge generationenvertrag hintergrund alternd bevölkerung zulasten jung arbeitend bevölkerung lebenserwartung angepasstes rentenalter,,,,"{'Altersvorsorge': 0.14, 'Generationenvertrag': 0, 'im': 0, 'Hintergrund': 0.06, 'der': 0.05, 'alternden': 0.07, 'Bevölkerung': 0.06, 'Alles': 0.18, 'zulasten': 0.0975, 'jungen': 0, 'und': 0.04, 'arbeitenden': 0.03, 'oder': 0.39, 'an': 0, 'die': 0.05, 'Lebenserwartung': 0.23500000000000001, 'angepasstes': 0, 'Rentenalter': 0.20500000000000002}",neutral,"[0.8721097, 0.030705858, 0.097184405]",,,,,,,,,,,,,,,,,,,,,,,,,neutral
50.0,75.0,57.0,0.0,neutral,RT @renten_sichern: Die #OECD erachtet eine nachhaltige Reform der #Altersvorsorge als «überfällig». Sie fordern #Rentenalter 67 + Bindung…,oecd erachten nachhaltig reform altersvorsorge überfällig fordern rentenalter bindung,,,,"{'Die': 0.09, 'OECD': 0.07, 'erachtet': 0, 'eine': 0, 'nachhaltige': 0.11, 'Reform': 0.16, 'der': 0.09, 'Altersvorsorge': 0.56, 'als': 0, '«': 0, 'überfällig': 0, '»': 0, 'Sie': 0, 'fordern': 0, 'Rentenalter': 0, 'Bindung': 0, '…': 0}",neutral,"[0.9378628, 0.022634374, 0.039502803]",,,,,,,,,,,,,,,,,,,,,,,,,neutral
100.0,100.0,100.0,0.7999999999999999,neutral,"@gianbrun @AlainS1991 @andrisilbi_ Da die SP nicht wirklich stark mit Zahlen ist muss man zwischen effektivem Zeitgewinn und von der SP wahrgenommenen Zeitgewinn unterscheiden. @NZZaS vom letzten Sonntag: ""Für SP-Chef Levrat ist der Steuerdeal der erste Schritt, um die AHV ohne höheres Rentenalter zu sanieren.""",sp wirklich stark zahlen effektiv zeitgewinn sp wahrgenommen zeitgewinn unterscheiden letzt sonntag sp chef levrat steuerdeal erste schritt ahv hoch rentenalter sanieren,,,,"{'Da': 0, 'die': 0.14, 'SP': 0.02, 'nicht': 0.02, 'wirklich': 0.02, 'stark': 0, 'mit': 0.03, 'Zahlen': 0.03, 'ist': 0.1, 'muss': 0.02, 'man': 0, 'zwischen': 0.05, 'effektivem': 0.04, 'Zeitgewinn': 0.02, 'und': 0.04, 'von': 0.04, 'der': 0.14, 'wahrgenommenen': 0.05, 'unterscheiden': 0, 'vom': 0.09000000000000001, 'letzten': 0.02, 'Sonntag': 0.02, 'Für': 0.04, 'SP-Chef': 0, 'Levrat': 0.04, 'Steuerdeal': 0.05, 'erste': 0.08, 'Schritt': 0.13, 'um': 0.6, 'AHV': 0.26, 'ohne': 1.0, 'höheres': 1.0, 'Rentenalter': 0.65, 'zu': 0.02, 'sanieren': 0}",neutral,"[0.61362505, 0.038071007, 0.3483039]",,,,,,,,,,,,,,,,,,,,,,,,,positive
50.0,75.0,57.0,0.0,neutral,"Die Erhöhung des Rentenalters wird nicht mehrheitsfähiger, durch schnüren von noch grösserer Packete. Dies hat lediglich eine Erhöhung der Gegnerschaft zur Folge. Vor allem in der heutigen Zeit, in der Parlaments fremde Komitees schnell gebildet werden können. https://t.co/QMVl9mEbSp",erhöhung rentenalters mehrheitsfähiger schnüren grösserer packete lediglich erhöhung gegnerschaft folgen heutig zeit parlaments fremd komitees schnellen bilden,,,,"{'Die': 0.18, 'Erhöhung': 0.51, 'des': 0, 'Rentenalters': 0.76, 'wird': 0.72, 'nicht': 0.31, 'mehrheitsfähiger': 0.15, 'durch': 0, 'schnüren': 0, 'von': 0, 'noch': 0, 'grösserer': 0, 'Packete': 0, 'Dies': 0, 'hat': 0, 'lediglich': 0.04, 'eine': 0, 'der': 0.18, 'Gegnerschaft': 0.17, 'zur': 0.12, 'Folge': 0, 'Vor': 0.04, 'allem': 0, 'in': 0.04, 'heutigen': 0, 'Zeit': 0, 'Parlaments': 0, 'fremde': 0, 'Komitees': 0.05, 'schnell': 0, 'gebildet': 0, 'werden': 0.72, 'können': 0.06}",negative,"[0.011549294, 0.9216941, 0.066756554]",,,,,,,,,,,,,,,,,,,,,,,,,neutral
0.0,0.0,0.0,-1.0,negative,"Völlig absurde Diskussion in Frankreich. Wie man gutes Gewissen gegen eine Abschaffung des Rentenalters 50 und lebenslangen Kündigungsschutz streiken kann entzieht sich meiner Logik. 
Lösung wäre auch hier Privatisierung und schaffen von Konkurrenz in der Personenbeförderung. https://t.co/C956o34MXK",völlig absurd diskussion frankreich gutes gewiß abschaffung rentenalters lebenslang kündigungsschutz streiken entziehen logik lösung privatisierung schaffen konkurrenz personenbeförderung,,,,"{'Völlig': 0, 'absurde': 0.14, 'Diskussion': 0.19, 'in': 0.05, 'Frankreich': 0.17, 'Wie': 0, 'man': 0, 'gutes': 0.09, 'Gewissen': 0.27, 'gegen': 0.13, 'eine': 0.09, 'Abschaffung': 1.0, 'des': 0, 'Rentenalters': 0.85, 'und': 0.08, 'lebenslangen': 0.24, 'Kündigungsschutz': 0.2025, 'streiken': 0, 'kann': 0.09, 'entzieht': 0, 'sich': 0, 'meiner': 0, 'Logik': 0.12, 'Lösung': 0.16, 'wäre': 0.07, 'auch': 0, 'hier': 0.04, 'Privatisierung': 0.11, 'schaffen': 0, 'von': 0, 'Konkurrenz': 0, 'der': 0.05, 'Personenbeförderung': 0.13}",positive,"[0.29381385, 0.11442947, 0.5917567]",,,,,,,"{'Völlig': 0, 'absurde': 0.09, 'Diskussion': 0.03, 'in': 0.01, 'Frankreich': 0.02, 'Wie': 0, 'man': 0, 'gutes': 0.02, 'Gewissen': 0.04, 'gegen': 0.14, 'eine': 0.02, 'Abschaffung': 0.19, 'des': 0, 'Rentenalters': 0.13, 'und': 0.02, 'lebenslangen': 1.0, 'Kündigungsschutz': 0.335, 'streiken': 0, 'kann': 0.02, 'entzieht': 0, 'sich': 0, 'meiner': 0, 'Logik': 0.07, 'Lösung': 0.05, 'wäre': 0.02, 'auch': 0, 'hier': 0.02, 'Privatisierung': 0.06, 'schaffen': 0, 'von': 0, 'Konkurrenz': 0, 'der': 0.02, 'Personenbeförderung': 0.045}",positive,"[0.011167699, 0.01310859, 0.9757237]",,,,,,,,,,,,,,,,negative
50.0,75.0,57.0,0.0,neutral,"RT @mehblau: Wenn Sie das Bild so lesen, sind Sie da überrascht? Wir waren es. Rotgrün war zwar an der Macht, im Wohnungsbau waren sie aber…",bild lesen überraschen rotgrün wohnungsbau,,,,,,,"{'Wenn': 0, 'Sie': 0, 'das': 0, 'Bild': 0, 'so': 0, 'lesen': 0.05, 'sind': 0.01, 'da': 0, 'überrascht': 0.04, 'Wir': 0, 'waren': 0.15, 'es': 0, 'Rotgrün': 0, 'war': 0, 'zwar': 0, 'an': 0, 'der': 0.03, 'Macht': 0.31, 'im': 0, 'Wohnungsbau': 1.0, 'sie': 0, 'aber': 0.7, '…': 0}",neutral,"[0.8322319, 0.15114473, 0.016623365]",,,,,,,,,,,,,,,,,,,,,,neutral
50.0,25.0,28.0,-0.15,neutral,Um der Stadtzürcher Wirtschaft wieder auf die Beine zu helfen fordern wir Steuersenkungen zur Anregung der Privatkonsum und eine Abschaffung von Regulierungen wie dem Nachtfahrverbot oder dem Verbot der Sonntagsarbeit. https://t.co/ukwynFdjK5,stadtzürcher wirtschaft beine helfen fordern steuersenkungen anregung privatkonsum abschaffung regulierungen nachtfahrverbot verbieten sonntagsarbeit,,,,,,,,,,"{'Um': 0, 'der': 0.05, 'Stadtzürcher': 0.0675, 'Wirtschaft': 0, 'wieder': 0, 'auf': 0.03, 'die': 0.05, 'Beine': 0, 'zu': 0.46, 'helfen': 0.11, 'fordern': 0, 'wir': 0, 'Steuersenkungen': 0.575, 'zur': 0.255, 'Anregung': 0, 'Privatkonsum': 0.14500000000000002, 'und': 0.09, 'eine': 0, 'Abschaffung': 0.1, 'von': 0, 'Regulierungen': 0.14, 'wie': 0, 'dem': 0.255, 'Nachtfahrverbot': 0.060000000000000005, 'oder': 0.04, 'Verbot': 0.06, 'Sonntagsarbeit': 0.045}",neutral,"[0.8501831, 0.02590241, 0.12391447]",,,,,,,,,,,,,,,,,,,neutral
50.0,25.0,57.0,-0.1,negative,RT @LuisDeplazes: ‚Für alle statt für wenige‘ und dann eine Steuersenkung nur für ausgewählte Gruppen gutheissen? Wie untreu kann man seine…,all statt wenig steuersenkung ausgewählt gruppen gutheissen untreu,,,,,,,,,,"{'‚': 0, 'Für': 0, 'alle': 0, 'statt': 0, 'für': 0, 'wenige': 0, '‘': 0, 'und': 0, 'dann': 0, 'eine': 0, 'Steuersenkung': 0, 'nur': 0, 'ausgewählte': 0, 'Gruppen': 0, 'gutheissen': 0, 'Wie': 0, 'untreu': 0, 'kann': 0, 'man': 0, 'seine': 0, '…': 0}",neutral,"[0.69556093, 0.2559585, 0.048480563]",,,,,,,,,,,,,,,,,,,neutral
100.0,100.0,86.0,0.7,neutral,RT @JfStadtZH: Wow! Die @JUSOzh setzt sich für #Steuersenkungen ein!? Dass es das mal noch gibt. Ausnahmsweise unterstützen wir euer Anlieg…,wow setzen steuersenkungen mal geben ausnahmsweise unterstützen anlieg,,,,,,,,,,"{'Wow': 0.43, 'Die': 0, 'setzt': 0, 'sich': 0, 'für': 0, 'Steuersenkungen': 0.45, 'ein': 0, 'Dass': 0.34, 'es': 0, 'das': 0.34, 'mal': 0, 'noch': 0.2, 'gibt': 0, 'Ausnahmsweise': 0.14, 'unterstützen': 0.52, 'wir': 0, 'euer': 0.17, 'Anlieg': 0, '…': 0}",positive,"[0.06300582, 0.018750228, 0.9182439]",,,,,,,,,,,,,,,,,,,positive
0.0,0.0,0.0,-1.0,negative,"Völlig absurde Diskussion in Frankreich. Wie man gutes Gewissen gegen eine Abschaffung des Rentenalters 50 und lebenslangen Kündigungsschutz streiken kann entzieht sich meiner Logik. 
Lösung wäre auch hier Privatisierung und schaffen von Konkurrenz in der Personenbeförderung. https://t.co/C956o34MXK",völlig absurd diskussion frankreich gutes gewiß abschaffung rentenalters lebenslang kündigungsschutz streiken entziehen logik lösung privatisierung schaffen konkurrenz personenbeförderung,,,,"{'Völlig': 0, 'absurde': 0.14, 'Diskussion': 0.19, 'in': 0.05, 'Frankreich': 0.17, 'Wie': 0, 'man': 0, 'gutes': 0.09, 'Gewissen': 0.27, 'gegen': 0.13, 'eine': 0.09, 'Abschaffung': 1.0, 'des': 0, 'Rentenalters': 0.85, 'und': 0.08, 'lebenslangen': 0.24, 'Kündigungsschutz': 0.2025, 'streiken': 0, 'kann': 0.09, 'entzieht': 0, 'sich': 0, 'meiner': 0, 'Logik': 0.12, 'Lösung': 0.16, 'wäre': 0.07, 'auch': 0, 'hier': 0.04, 'Privatisierung': 0.11, 'schaffen': 0, 'von': 0, 'Konkurrenz': 0, 'der': 0.05, 'Personenbeförderung': 0.13}",positive,"[0.29381385, 0.11442947, 0.5917567]",,,,,,,"{'Völlig': 0, 'absurde': 0.09, 'Diskussion': 0.03, 'in': 0.01, 'Frankreich': 0.02, 'Wie': 0, 'man': 0, 'gutes': 0.02, 'Gewissen': 0.04, 'gegen': 0.14, 'eine': 0.02, 'Abschaffung': 0.19, 'des': 0, 'Rentenalters': 0.13, 'und': 0.02, 'lebenslangen': 1.0, 'Kündigungsschutz': 0.335, 'streiken': 0, 'kann': 0.02, 'entzieht': 0, 'sich': 0, 'meiner': 0, 'Logik': 0.07, 'Lösung': 0.05, 'wäre': 0.02, 'auch': 0, 'hier': 0.02, 'Privatisierung': 0.06, 'schaffen': 0, 'von': 0, 'Konkurrenz': 0, 'der': 0.02, 'Personenbeförderung': 0.045}",positive,"[0.011167699, 0.01310859, 0.9757237]",,,,,,,,,,,,,,,,negative
50.0,75.0,57.0,0.0,neutral,"@zac1967 @economiesuisse @FDP_Liberalen Dass tiefere Lohnklassen unter Druck kommen ist schlecht, aber dafür gibts die FLAM und diese Lohnklassen würden wohl auf lange sicht auch ohne PFZ durch die Digitalisierung/Automatisierung unter Druck kommen. Gegen die PFZ kann man aus diversen guten Gründen sein,.. 2/n",tief lohnklassen druck kommen schlecht dafür gibts flam lohnklassen wohl lang sicht pfz digitalisierung automatisierung druck kommen pfz divers gut gründen n,,,,,,,,,,,,,,,,"{'Dass': 0.02, 'tiefere': 0, 'Lohnklassen': 0.07, 'unter': 0.05, 'Druck': 0.1, 'kommen': 0.03, 'ist': 0.01, 'schlecht': 0.03, 'aber': 0.02, 'dafür': 0, 'gibts': 0.01, 'die': 0.04, 'FLAM': 0.05, 'und': 0.02, 'diese': 0, 'würden': 0.02, 'wohl': 0, 'auf': 0, 'lange': 0.03, 'sicht': 0, 'auch': 0, 'ohne': 0.06, 'PFZ': 0.09, 'durch': 0, 'Digitalisierung': 0, 'Automatisierung': 0.24, 'Gegen': 0.07, 'kann': 0.02, 'man': 0, 'aus': 0, 'diversen': 0, 'guten': 0.01, 'Gründen': 0, 'sein': 0, '..': 0, 'n': 0.02}",negative,"[0.3418741, 0.42146298, 0.2366629]",,,,,,,,,,,,,neutral
100.0,100.0,86.0,0.7,neutral,Auch @Jungfreisinnige setzen im Wahlkampf auf Digitalisierung. Mithilfe der sozialen Netzwerken werden Mitglieder zum wählen aufgefordert und mit der @FDP_Liberalen werden potenzielle Wähler an der Tür besucht. https://t.co/zYCi9v0m51 @tagesanzeiger #jfs19 #WahlZH19 #WahlCH19,setzen wahlkampf digitalisierung mithilfe sozial netzwerken mitglieder wählen auffordern potenzielle wähler tür besuchen jfs19 wahlzh19 wahlch19,,,,,,,,,,,,,,,,"{'Auch': 0.91, 'setzen': 0, 'im': 0, 'Wahlkampf': 0.175, 'auf': 1.0, 'Digitalisierung': 0, 'Mithilfe': 0.17, 'der': 0.04, 'sozialen': 0.07, 'Netzwerken': 0.14, 'werden': 0, 'Mitglieder': 0.13, 'zum': 0.04, 'wählen': 0, 'aufgefordert': 0.12, 'und': 0.07, 'mit': 0.11, 'potenzielle': 0.06, 'Wähler': 0.06, 'an': 0, 'Tür': 0, 'besucht': 0, 'jfs19': 0.07, 'WahlZH19': 0.13, 'WahlCH19': 0}",neutral,"[0.44732362, 0.24396469, 0.30871165]",,,,,,,,,,,,,positive
50.0,25.0,57.0,-0.1,negative,"Schweiz schneidet schlecht ab aufgrund der komplexen Zolltarife und der Unternehmensgründung. Zweiteres kann ich selbst bestätigen und erinnere mich nur ungern was für ein Ärgernis das war. Da muss unbedingt mehr Digitalisierung Einzug erhalten.

https://t.co/dR2u8dsiyc",schweiz schneiden schlecht ab aufgrund komplex zolltarife unternehmensgründung zweiteres bestätigen erinnern ungern ärgernis unbedingt mehr digitalisierung einzug erhalten,,,,,,,,,,,,,,,,"{'Schweiz': 0.12, 'schneidet': 0, 'schlecht': 0, 'ab': 0, 'aufgrund': 0.03, 'der': 0.06, 'komplexen': 0.05, 'Zolltarife': 0.065, 'und': 0.04, 'Unternehmensgründung': 0.07, 'Zweiteres': 0.06, 'kann': 0.15, 'ich': 0.07, 'selbst': 0, 'bestätigen': 0.1, 'erinnere': 0.08, 'mich': 0, 'nur': 0, 'ungern': 0, 'was': 0.09, 'für': 0, 'ein': 0, 'Ärgernis': 0, 'das': 0.43, 'war': 0, 'Da': 0, 'muss': 0.05, 'unbedingt': 0, 'mehr': 0.52, 'Digitalisierung': 0, 'Einzug': 0, 'erhalten': 0}",negative,"[0.2199204, 0.63287044, 0.14720914]",,,,,,,,,,,,,neutral
100.0,100.0,86.0,0.7,neutral,"@fri_velo @FDP_Liberalen @SVPch @GOP Sie stellen ihre Interpretation von «Freiheit» über die Freiheit kommender Generationen auf einem bewohnbaren Planeten zu leben.

Stimmt nicht. Umweltschutz geht auch ohne Aufhebung meiner Interpretation von Freiheit.",stellen interpretation freiheit freiheit kommend generationen bewohnbar planeten leben stimmen umweltschutz gehen aufhebung interpretation freiheit,,,,,,,,,,,,,,,,,,,"{'Sie': 0, 'stellen': 0.05, 'ihre': 0.02, 'Interpretation': 0, 'von': 0, '«': 0, 'Freiheit': 0, '»': 0, 'über': 0, 'die': 0, 'kommender': 0, 'Generationen': 0, 'auf': 0, 'einem': 0, 'bewohnbaren': 0, 'Planeten': 0, 'zu': 0, 'leben': 0, 'Stimmt': 0, 'nicht': 0, 'Umweltschutz': 0, 'geht': 0, 'auch': 0, 'ohne': 0, 'Aufhebung': 0, 'meiner': 0}",positive,"[0.034613375, 0.01667171, 0.948715]",,,,,,,,,,positive
50.0,75.0,71.0,0.15,neutral,"NR lehnt heute Motion von @RuediNoser zur Förderung von umweltfreundlichen Investitionen ab. Zeigt unglaubliche Doppelmoral der Linken. Umweltschutz aber nur mit Sozialismus!

Genau aus diesem Grund haben sich die Bürgerlichen Jungparteien zusammengeschlossen @ZukunftKlima #klima",nr lehnen heute motion förderung umweltfreundlich investitionen ab zeigen unglaublich doppelmoral link umweltschutz sozialismus genau grund bürgerlich jungparteien zusammenschließen klima,,,,,,,,,,,,,,,,,,,"{'NR': 0, 'lehnt': 0.09, 'heute': 0.04, 'Motion': 0.05, 'von': 0.03, 'zur': 0.03, 'Förderung': 0, 'umweltfreundlichen': 0, 'Investitionen': 0.08, 'ab': 0, 'Zeigt': 0, 'unglaubliche': 0, 'Doppelmoral': 0.09, 'der': 0.03, 'Linken': 0.15, 'Umweltschutz': 1.0, 'aber': 0.47, 'nur': 0.3, 'mit': 0.18, 'Sozialismus': 0.19, 'Genau': 0, 'aus': 0, 'diesem': 0.02, 'Grund': 0, 'haben': 0.03, 'sich': 0, 'die': 0.03, 'Bürgerlichen': 0, 'Jungparteien': 0.095, 'zusammengeschlossen': 0, 'klima': 0}",positive,"[0.010889752, 0.014471189, 0.97463906]",,,,,,,,,,neutral
75.0,75.0,71.0,0.2333333333333333,negative,"@schlegel_stefan [1] Wer wie die GLP mehr Europa wagen will und die EU auf solch einen Sockel stellt hat Beitritts-Allüren, anders kann man das nicht mehr betiteln.

Laut eurer Website ist man offen für Alternativen zum bilat. Weg. Mitglieder erzählen im Gespräch sie würden gerne beitreten.",wer glp mehr europa wagen eu solch sockel stellen beitritts allüren mehr betiteln laut website offen alternativ bilat mitglieder erzählen gespräch gerne beitreten,,,,,,,,,,,,,,,,,,,,,,"{'Wer': 0.03, 'wie': 0, 'die': 0.03, 'GLP': 0.05, 'mehr': 0.02, 'Europa': 0.03, 'wagen': 0, 'will': 0, 'und': 0.02, 'EU': 0, 'auf': 0.03, 'solch': 0.05, 'einen': 0.02, 'Sockel': 0, 'stellt': 0, 'hat': 0, 'Beitritts-Allüren': 0.060000000000000005, 'anders': 0, 'kann': 0, 'man': 0, 'das': 0, 'nicht': 0, 'betiteln': 0, 'Laut': 0.14, 'eurer': 0, 'Website': 0.07, 'ist': 0.06, 'offen': 0.27, 'für': 0, 'Alternativen': 0.24, 'zum': 0.115, 'bilat': 0.11, 'Weg': 0.17, 'Mitglieder': 0.88, 'erzählen': 1.0, 'im': 0, 'Gespräch': 1.0, 'sie': 0, 'würden': 0, 'gerne': 0, 'beitreten': 0.37}",neutral,"[0.85488904, 0.13127892, 0.013832042]",,,,,,,neutral
50.0,75.0,57.0,0.0,neutral,"@schlegel_stefan Dann teilst du meine Aussage und könntest dich gleich selbst als Untergangsapostel betiteln ;)

Kämpfe gerne mit die EU föderalistischer umzubauen, zeigen auch meine Engagements bei ALDE, Lymec. Solange dies nicht der Fall ist verstehe ich Beitritts-Alüren aber nicht.",teilen aussagen gleichen untergangsapostel betiteln kämpfe gerne eu föderalistisch umbauen zeigen engagements alde lymec solange fall verstehen beitritts alüren,,,,,,,,,,,,,,,,,,,,,,"{'Dann': 0.04, 'teilst': 0.08, 'du': 0, 'meine': 0.06, 'Aussage': 0.23, 'und': 0.04, 'könntest': 0.04, 'dich': 0.03, 'gleich': 0, 'selbst': 0, 'als': 0.08, 'Untergangsapostel': 0.060000000000000005, 'betiteln': 0, 'Kämpfe': 0, 'gerne': 0, 'mit': 0, 'die': 0.1, 'EU': 0.57, 'föderalistischer': 0.06, 'umzubauen': 0.04, 'zeigen': 0.07, 'auch': 0.07, 'Engagements': 0.07, 'bei': 0.05, 'ALDE': 0.04, 'Lymec': 0.1, 'Solange': 0, 'dies': 0, 'nicht': 1.0, 'der': 0.1, 'Fall': 0, 'ist': 0.09, 'verstehe': 1.0, 'ich': 0.57, 'Beitritts-Alüren': 0, 'aber': 0}",neutral,"[0.57604235, 0.27534097, 0.14861669]",,,,,,,neutral
50.0,75.0,57.0,0.0,neutral,"RT @TeamFreiheitCH: Tempo 30 in den Städten. Ein solches Vorhaben bremst den öffentlichen Verkehr aus, verlagert Verkehr in die Quartiere u…",tempo städten solch vorhaben bremsen öffentlich verkehr verlagern verkehr quartiere u,,,,,,,,,,,,,,,,,,,,,,,,,"{'Tempo': 0, 'in': 0.04, 'den': 0.14, 'Städten': 0.07, 'Ein': 0.1, 'solches': 0.2, 'Vorhaben': 0.36, 'bremst': 0, 'öffentlichen': 0.1, 'Verkehr': 1.0, 'aus': 0, 'verlagert': 0, 'die': 0.14, 'Quartiere': 0, 'u': 0, '…': 0}",negative,"[0.017406186, 0.95038, 0.032213774]",,,,neutral
100.0,100.0,100.0,0.85,neutral,"Immens wichtig, dass der Bund anfängt seine Ziele seriös zu überprüfen mit sinnvollen Indikatoren. Man muss sich auch Gedanken machen, ob man die gesteckten Ziele nicht besser erreichen kann als mit Flächensubvention der Landwirtschaft. https://t.co/154DNB0Imh @nzz @agriecologist",immens wichtig bund anfangen ziele seriös überprüfen sinnvoll indikatoren gedanken gesteckt ziele gut erreichen flächensubvention landwirtschaft,,,,,,,,,,,,,,,,,,,,,,,,,,,,"{'Immens': 0, 'wichtig': 0.02, 'dass': 0.02, 'der': 0.02, 'Bund': 0, 'anfängt': 0.02, 'seine': 0, 'Ziele': 0.16, 'seriös': 0, 'zu': 0.03, 'überprüfen': 0, 'mit': 0.03, 'sinnvollen': 0.04, 'Indikatoren': 0.05, 'Man': 0, 'muss': 0.03, 'sich': 0, 'auch': 0.03, 'Gedanken': 0, 'machen': 0, 'ob': 0, 'man': 0, 'die': 0.02, 'gesteckten': 0, 'nicht': 0, 'besser': 0.07, 'erreichen': 0, 'kann': 0.07, 'als': 0, 'Flächensubvention': 0.84, 'Landwirtschaft': 1.0}",neutral,"[0.8663161, 0.018294984, 0.115388855]",positive
