answer_five,answer_four,answer_seven,polarity,sentiment_gs,tweet,tweet_tokens,absa_token_weights_3434,absa_sentiment_3434,absa_scores_3434,absa_token_weights_3472,absa_sentiment_3472,absa_scores_3472,absa_token_weights_3478,absa_sentiment_3478,absa_scores_3478,sentiment_tb
50.0,75.0,57.0,0.0,neutral,"RT @jungegruenebern: Enough is enough!
#Lohngleichheit muss jetzt durchgesetzt werden! Danke an alle die heute in Bern waren und mit uns un…",enough is enough lohngleichheit durchsetzen danke all heute bern un,"{'Enough': 0.21, 'is': 0.15, 'enough': 0.21, 'Lohngleichheit': 0.815, 'muss': 0.08, 'jetzt': 0.43, 'durchgesetzt': 0.76, 'werden': 0, 'Danke': 0, 'an': 0, 'alle': 0.08, 'die': 0, 'heute': 0.06, 'in': 0.04, 'Bern': 0.08, 'waren': 0.04, 'und': 0.08, 'mit': 0.04, 'uns': 0.08, 'un': 0, '…': 0}",positive,"[0.08595722, 0.033217583, 0.88082516]",,,,,,,neutral
50.0,75.0,57.0,0.0,neutral,"RT @Alida_Hilarious: Thread: Afrika und Kapitalismus

 „Afrika muss entwickelt werden“, sagt der Westen. Dafür gibt es „Entwicklungshilfe“.…",thread afrika kapitalismus afrika entwickeln sagen westen dafür geben entwicklungshilfe,,,,"{'Thread': 0.1, 'Afrika': 0, 'und': 0.03, 'Kapitalismus': 0.06, '„': 0, 'muss': 0, 'entwickelt': 0, 'werden': 0, '“': 0, 'sagt': 0, 'der': 0, 'Westen': 0, 'Dafür': 0, 'gibt': 0, 'es': 0, 'Entwicklungshilfe': 0, '…': 0}",positive,"[0.082632996, 0.016686935, 0.90068007]",,,,neutral
100.0,100.0,86.0,0.7,neutral,"@leanindersprite Als erfahrene Möbel-mit-öffentlichen-Verkehrsmitteln-Transporteurin bin ich sicher, dass das in der Bahn klappt!",erfahren möbel öffentlich verkehrsmitteln transporteurin sichern bahn klappen,,,,,,,"{'Als': 0, 'erfahrene': 0.18, 'Möbel-mit-öffentlichen-Verkehrsmitteln-Transporteurin': 0, 'bin': 0, 'ich': 0.17, 'sicher': 0, 'dass': 0.3, 'das': 0.3, 'in': 0, 'der': 0.25, 'Bahn': 0, 'klappt': 0}",positive,"[0.32443956, 0.14309761, 0.5324629]",positive
