100.0,100.0,100.0,1.0,neutral,RT @JA_Zug: Für uns ist klar. Die Zuger Bevölkerung muss bei den geplanten #Corona-#Steuersenkungen das letzte Wort haben! #referendum http…,klaren zuger bevölkerung geplant corona steuersenkungen letzte wort referendum http,,,,,,,,,,,,,,,,,,,,,,"{'Für': 0.04, 'uns': 0.03, 'ist': 0.03, 'klar': 0.07, 'Die': 0.11, 'Zuger': 0, 'Bevölkerung': 0.08, 'muss': 0, 'bei': 0, 'den': 0.11, 'geplanten': 0.31, 'Corona-#Steuersenkungen': 0.685, 'das': 0, 'letzte': 0.04, 'Wort': 0, 'haben': 0.05, 'referendum': 0.53, 'http': 0.61, '…': 0}",positive,"[0.37166503, 0.013921576, 0.6144135]",,,,,,,,,,,,,,,,,,,,,,,,,,,,,,,positive
25.0,0.0,14.0,-0.5,neutral,"@SVPZuberbuhler @anlustenberger @AlternativeZG Meinst du ""Höseler"" im Sinne von ""Waschlappen"" oder ""unzuverlässiger Mensch""? 🤣 Auf jeden Fall bringen Konsumgutscheine mehr für die Konjunktur als Steuersenkungen für Reiche. Das schleckt keine Geiss weg.😉",höseler sinne waschlappen unzuverlässig mensch jed fall bringen konsumgutscheine mehr konjunktur steuersenkungen reichen schleckt geiss,,,,,,,,,,,,,,,,,,,,,,"{'Meinst': 0.025, 'du': 0, 'Höseler': 0, 'im': 0, 'Sinne': 0, 'von': 0, 'Waschlappen': 0.02, 'oder': 0.04, 'unzuverlässiger': 0.525, 'Mensch': 0, '🤣': 0, 'Auf': 0, 'jeden': 0, 'Fall': 0, 'bringen': 0, 'Konsumgutscheine': 0, 'mehr': 0, 'für': 0, 'die': 0, 'Konjunktur': 0, 'als': 0, 'Steuersenkungen': 0, 'Reiche': 0, 'Das': 0, 'schleckt': 0, 'keine': 0, 'Geiss': 0, 'weg': 0}",neutral,"[0.8752, 0.06703901, 0.057760954]",,,,,,,,,,,,,,,,,,,,,,,,,,,,,,,negative
100.0,100.0,100.0,1.0,neutral,Auch wenn es ökonomisch sinnvoller als Steuersenkungen wäre. #KRzg lehnt Postulat von @anlustenberger und mir für ein Gutschein von 120 Franken für alle Einwohner*innen ab. @AlternativeZG https://t.co/oYMOOfIcFo,ökonomisch sinnvoll steuersenkungen krzg lehnen postulat gutschein franken all einwohner innen ab,,,,,,,,,,,,,,,,,,,,,,"{'Auch': 0, 'wenn': 0.45, 'es': 0, 'ökonomisch': 0, 'sinnvoller': 0.665, 'als': 0, 'Steuersenkungen': 0.6950000000000001, 'wäre': 0.29, 'KRzg': 0.08, 'lehnt': 0.12, 'Postulat': 0.06, 'von': 0, 'und': 0.04, 'mir': 0.02, 'für': 0.05, 'ein': 0, 'Gutschein': 0, 'Franken': 0, 'alle': 0, 'Einwohner*innen': 0.04, 'ab': 0}",neutral,"[0.63234407, 0.31150988, 0.056146104]",,,,,,,,,,,,,,,,,,,,,,,,,,,,,,,positive
100.0,100.0,86.0,0.7,neutral,"Von einer Steuersenkung profitieren nur die Reichen und Grossunternehmen. Von einem Gewerbegutschein jedoch ALLE! #coronavirus @JA_Zug 
https://t.co/T0t9yx8M3s",steuersenkung profitieren reich grossunternehmen gewerbegutschein jedoch all coronavirus,,,,,,,,,,,,,,,,,,,,,,"{'Von': 0.05, 'einer': 0, 'Steuersenkung': 0.265, 'profitieren': 1.0, 'nur': 1.0, 'die': 0.42, 'Reichen': 0, 'und': 0.16, 'Grossunternehmen': 0, 'einem': 0, 'Gewerbegutschein': 0.055, 'jedoch': 0, 'ALLE': 0.09, 'coronavirus': 0.11}",positive,"[0.36224693, 0.03477922, 0.6029739]",,,,,,,,,,,,,,,,,,,,,,,,,,,,,,,positive
0.0,0.0,0.0,-1.0,neutral,"RT @AlternativeZG: Der Zuger Finanzdirektor Heinz Tännler vergleicht auf @zentralplus Personen, die sich gegen Steuersenkungen wehren, mit…",zuger finanzdirektor heinz tännler vergleichen personen steuersenkungen wehren,,,,,,,,,,,,,,,,,,,,,,"{'Der': 0.43, 'Zuger': 0, 'Finanzdirektor': 0.33999999999999997, 'Heinz': 0.3, 'Tännler': 0, 'vergleicht': 1.0, 'auf': 0, 'Personen': 0, 'die': 0.43, 'sich': 0, 'gegen': 0, 'Steuersenkungen': 0.36, 'wehren': 0, 'mit': 0.75, '…': 0}",neutral,"[0.93548757, 0.02310555, 0.041406784]",,,,,,,,,,,,,,,,,,,,,,,,,,,,,,,negative
50.0,75.0,57.0,0.1,neutral,"@gianbrun @WernerFuchs_CH Prof. Schaltegger (der def. kein Linker ist): «Die Steuersenkung könnte ein Kriterium sein für sehr gewinnintensive Unternehmen» [..] während Kleinunternehmen, die wegen der Corona-Krise in Zahlungsschwierigkeiten geraten, davon wenig profitieren würden. https://t.co/DWV0E1YsOc",prof schaltegger def link steuersenkung kriterium gewinnintensive unternehmen kleinunternehmen wegen corona krise zahlungsschwierigkeiten geraten davon wenig profitieren,,,,,,,,,,,,,,,,,,,,,,"{'Prof.': 0, 'Schaltegger': 0.05, 'der': 0, 'def': 0, 'kein': 0, 'Linker': 0, 'ist': 0.01, '):': 0, '«': 0, 'Die': 0, 'Steuersenkung': 0, 'könnte': 0, 'ein': 0, 'Kriterium': 0, 'sein': 0, 'für': 0, 'sehr': 0, 'gewinnintensive': 0, 'Unternehmen': 0, '»': 0, '..': 0, 'während': 0, 'Kleinunternehmen': 0, 'die': 0, 'wegen': 0, 'Corona-Krise': 0, 'in': 0, 'Zahlungsschwierigkeiten': 0, 'geraten': 0, 'davon': 0, 'wenig': 0, 'profitieren': 0, 'würden': 0}",negative,"[0.07046186, 0.7935496, 0.13598849]",,,,,,,,,,,,,,,,,,,,,,,,,,,,,,,neutral
75.0,75.0,71.0,0.35,neutral,@gianbrun @WernerFuchs_CH Ja die anderen Massnahmen sind richtig und wichtig. Doch die Steuersenkung bringt im Kampf gegen #COVID19 und die Minimierung der wirt. Schäden gar nichts sondern ist eine #Verpolitisierung der Krise.,ja massnahmen richtig wichtig steuersenkung bringen kampf covid19 minimierung wirt schäden gar verpolitisierung krise,,,,,,,,,,,,,,,,,,,,,,"{'Ja': 0.05, 'die': 0.05, 'anderen': 0, 'Massnahmen': 0.11, 'sind': 0.1, 'richtig': 0.09, 'und': 0.05, 'wichtig': 0.17, 'Doch': 0.05, 'Steuersenkung': 0.73, 'bringt': 0.49, 'im': 0, 'Kampf': 0, 'gegen': 0.18, 'COVID19': 0.08, 'Minimierung': 0.07, 'der': 0.05, 'wirt': 0, 'Schäden': 0.14, 'gar': 0, 'nichts': 0.04, 'sondern': 0.05, 'ist': 0.13, 'eine': 0, 'Verpolitisierung': 0.09, 'Krise': 0.19}",negative,"[0.0096613625, 0.9207893, 0.06954933]",,,,,,,,,,,,,,,,,,,,,,,,,,,,,,,positive
0.0,0.0,14.0,-0.7,neutral,Der #STAF-Steuerdeal ist für die Länder des globalen Südens eine Katastrophe. Die Schweiz entzieht weiterhin Milliarden an Steuersubstrat! Nun braucht es von der ganzen Linken inkl. @spschweiz vollstes Engagement gegen Steuersenkungen auf Kantonsebene.@stafnein #abst19,staf steuerdeal länder global südens katastrophe schweiz entziehen weiterhin milliarden steuersubstrat brauchen ganz link inkl voll engagement steuersenkungen kantonsebene abst19,,,,,,,,,,,,,,,,,,,,,,"{'Der': 0.04, 'STAF-Steuerdeal': 0.0975, 'ist': 0.02, 'für': 0.02, 'die': 0.04, 'Länder': 0.03, 'des': 0, 'globalen': 0.03, 'Südens': 0.01, 'eine': 0, 'Katastrophe': 0, 'Die': 0.04, 'Schweiz': 0.04, 'entzieht': 0, 'weiterhin': 0, 'Milliarden': 0.06, 'an': 0, 'Steuersubstrat': 0.03, 'Nun': 0, 'braucht': 0.16, 'es': 0.02, 'von': 0, 'der': 0.04, 'ganzen': 0, 'Linken': 0.08, 'inkl.': 0, 'vollstes': 0, 'Engagement': 0.61, 'gegen': 1.0, 'Steuersenkungen': 0.63, 'auf': 0, 'Kantonsebene': 0.07, 'abst19': 0.06}",negative,"[0.10439987, 0.8318206, 0.06377951]",,,,,,,,,,,,,,,,,,,,,,,,,,,,,,,negative
25.0,25.0,28.0,-0.35,neutral,"#maillard im #EchoderZeit: ""Es ist Aufgabe der Linken in CH bei Steuersenkungen gute Kompensationen herauszuholen"". Nein, Aufgabe der Linken ist es Steuersenkungen &amp; Staatsabbau zu VERHINDERN! #SGBUSS18 #staf #sv17",maillard echoderzeit aufgabe link ch steuersenkungen gut kompensationen herauszuholen nein aufgabe link steuersenkungen amp staatsabbau verhindern sgbuss18 staf sv17,,,,,,,,,,,,,,,,,,,,,,"{'maillard': 0.05, 'im': 0, 'EchoderZeit': 0.08, 'Es': 0.26, 'ist': 0.26, 'Aufgabe': 0.04, 'der': 0.07, 'Linken': 0.11, 'in': 0.03, 'CH': 0.04, 'bei': 0, 'Steuersenkungen': 0.63, 'gute': 0, 'Kompensationen': 0.07, 'herauszuholen': 0.052500000000000005, 'Nein': 0.18, 'es': 0.26, 'amp': 0.54, 'Staatsabbau': 0.14500000000000002, 'zu': 0.06, 'VERHINDERN': 0, 'SGBUSS18': 0.1, 'staf': 0, 'sv17': 0.06}",positive,"[0.31114572, 0.04709416, 0.6417601]",,,,,,,,,,,,,,,,,,,,,,,,,,,,,,,negative
100.0,100.0,100.0,1.0,neutral,Jahrelang im #Gesundheitswesen sparen und jetzt das. Als nächstes fordert die SVP noch gute Arbeitsbedingungen für das #Pflegepersonal und einen Mindestlohn 🤯 #Doppelmoral https://t.co/Mp4BbBMfIg,jahrelang gesundheitswesen sparen nächst fordern svp gut arbeitsbedingungen pflegepersonal mindestlohn doppelmoral,,,,,,,,,,,,,,,,,,,,,,,,,"{'Jahrelang': 0.16999999999999998, 'im': 0, 'Gesundheitswesen': 0, 'sparen': 0.03, 'und': 0.55, 'jetzt': 0.04, 'das': 0.03, 'Als': 0, 'nächstes': 0.1, 'fordert': 0, 'die': 0.15, 'SVP': 0, 'noch': 0, 'gute': 0, 'Arbeitsbedingungen': 0.14500000000000002, 'für': 0.29, 'Pflegepersonal': 0.25, 'einen': 1.0, 'Mindestlohn': 0.675, '🤯': 0, 'Doppelmoral': 0}",positive,"[0.011382127, 0.0063535403, 0.98226434]",,,,,,,,,,,,,,,,,,,,,,,,,,,,positive
50.0,75.0,57.0,0.0,neutral,"Im Zuger Kantonsspital wird nun endlich das Arbeitsgesetz bei der Umkleidezeit eingehalten. Zudem gilt ein Mindestlohn von 4000 Franken ✊ #Gewerkschaften @VPOD_Schweiz 
https://t.co/q9FtKO1Kap",zuger kantonsspital endlich arbeitsgesetz umkleidezeit einhalten zudem gelten mindestlohn franken gewerkschaften,,,,,,,,,,,,,,,,,,,,,,,,,"{'Im': 0, 'Zuger': 0, 'Kantonsspital': 0.04, 'wird': 0, 'nun': 0, 'endlich': 0, 'das': 0, 'Arbeitsgesetz': 0.11, 'bei': 0, 'der': 0.05, 'Umkleidezeit': 0.05, 'eingehalten': 0.03, 'Zudem': 0.325, 'gilt': 0, 'ein': 0, 'Mindestlohn': 0.665, 'von': 0, 'Franken': 0, 'Gewerkschaften': 0.17}",negative,"[0.02304374, 0.966294, 0.010662245]",,,,,,,,,,,,,,,,,,,,,,,,,,,,neutral
100.0,100.0,100.0,1.0,negative,RT @GrueneCH: Eure Politik ist steinalt - steckt die Kohle lieber in Erneuerbare! Wir wollen die Energiewende - deswegen jetzt Ja zur #ES20…,politik steinalt stecken kohle lieb erneuerbare energiewende deswegen ja es20,,,,,,,,,,,,,,,,,,,,,,,,,,,,"{'Eure': 0.02, 'Politik': 0, 'ist': 0.02, 'steinalt': 0, 'steckt': 0, 'die': 0.03, 'Kohle': 0, 'lieber': 0, 'in': 0, 'Erneuerbare': 0, 'Wir': 0.01, 'wollen': 0.02, 'Energiewende': 0.045000000000000005, 'deswegen': 0, 'jetzt': 0.01, 'Ja': 0, 'zur': 0.02, 'ES20': 0.02, '…': 0}",neutral,"[0.6904826, 0.08928924, 0.22022814]",,,,,,,,,,,,,,,,,,,,,,,,,positive
50.0,75.0,57.0,0.0,neutral,@narimoldi @Radio3FACH Und argumentiere jetzt bitte nicht mit dem Gaskraftwerk-Märchen. Fakt ist: Ausbau erneuerbarer Energien ist nötig um #AKW zu ersetzen.,argumentiere bitte gaskraftwerk märchen fakt ausbau erneuerbarer energien nötigen akw ersetzen,,,,,,,,,,,,,,,,,,,,,,,,,,,,"{'Und': 0.06, 'argumentiere': 0.09, 'jetzt': 0, 'bitte': 0, 'nicht': 0, 'mit': 0.05, 'dem': 0.51, 'Gaskraftwerk-Märchen': 0.09, 'Fakt': 0.32, 'ist': 0.76, 'Ausbau': 1.0, 'erneuerbarer': 0.77, 'Energien': 0.46, 'nötig': 1.0, 'um': 0, 'AKW': 0.045, 'zu': 0.51, 'ersetzen': 0}",positive,"[0.31781426, 0.17371392, 0.5084718]",,,,,,,,,,,,,,,,,,,,,,,,,neutral
0.0,0.0,0.0,-1.0,neutral,"RT @ManuelaWeichelt: Mein Votum für die Initiative ""Für ein Verbot der Finanzierung von Kriegsmaterialproduzenten"": https://t.co/sUS3ivpowt…",votum initiative verbieten finanzierung kriegsmaterialproduzenten,,,,,,,,,,,,,,,,,,,,,,,,,,,,,,,"{'Mein': 0.17, 'Votum': 1.0, 'für': 0.13, 'die': 0.03, 'Initiative': 0.14, 'Für': 0.13, 'ein': 0, 'Verbot': 0.16, 'der': 0.03, 'Finanzierung': 0.09, 'von': 0, 'Kriegsmaterialproduzenten': 0.13}",neutral,"[0.5888496, 0.26454285, 0.1466075]",,,,,,,,,,,,,,,,,,,,,,negative
0.0,0.0,0.0,-1.0,neutral,Nach dem unverantwortlichen Entscheid des #Ständerates ist es definitiv: Wir lancieren die #Korrekturinitiative! Stoppen wir die Kriegsmaterialexporte in Bürgerkriegsländer. @jGruene_jVertEs @GrueneCH @GSoASchweiz https://t.co/efRgxioHlb,unverantwortlich entscheid ständerates definitiv lancieren korrekturinitiative stoppen kriegsmaterialexporte bürgerkriegsländer,,,,,,,,,,,,,,,,,,,,,,,,,,,,,,,"{'Nach': 0.24, 'dem': 0.35, 'unverantwortlichen': 0.15, 'Entscheid': 0.07, 'des': 0, 'Ständerates': 0.0775, 'ist': 0.02, 'es': 0.02, 'definitiv': 0, 'Wir': 0.06, 'lancieren': 0, 'die': 0.46, 'Korrekturinitiative': 0.145, 'Stoppen': 1.0, 'wir': 0, 'Kriegsmaterialexporte': 0.27, 'in': 0, 'Bürgerkriegsländer': 0.1}",neutral,"[0.75448966, 0.034209955, 0.21130037]",,,,,,,,,,,,,,,,,,,,,,negative
50.0,25.0,28.0,-0.15,neutral,"Gemeinsam verhindern wir Kriegsmaterialexporte in Bürgerkriegsländer, hilfst du mit? @jGruene_jVertEs @AlternativeZG @GrueneCH https://t.co/plMnqJO2fx https://t.co/soKf5Q17SN",gemeinsam verhindern kriegsmaterialexporte bürgerkriegsländer helfen,,,,,,,,,,,,,,,,,,,,,,,,,,,,,,,"{'Gemeinsam': 0.16, 'verhindern': 0, 'wir': 0, 'Kriegsmaterialexporte': 0.08, 'in': 0, 'Bürgerkriegsländer': 0.0575, 'hilfst': 0.71, 'du': 0.07, 'mit': 0}",neutral,"[0.8713174, 0.071152195, 0.057530407]",,,,,,,,,,,,,,,,,,,,,,neutral
50.0,75.0,57.0,0.0,neutral,"Schweizer Waffen morden: stoppen wir die Kriegsmaterialexporte! 
https://t.co/dv7ddFOIQ1",schweizer waffen morden stoppen kriegsmaterialexporte,,,,,,,,,,,,,,,,,,,,,,,,,,,,,,,"{'Schweizer': 0.1, 'Waffen': 0.15, 'morden': 0, 'stoppen': 1.0, 'wir': 0, 'die': 0.84, 'Kriegsmaterialexporte': 0.485}",positive,"[0.42939082, 0.03967822, 0.530931]",,,,,,,,,,,,,,,,,,,,,,neutral
50.0,75.0,57.0,0.0,neutral,"#CH exportiert wieder mehr #Kriegsmaterial! Aber für Bürgerliche zählt weiterhin: #Profit vor #Mensch.

https://t.co/sAh3FL92Ul https://t.co/xPhFyADdVG",ch exportieren mehr kriegsmaterial bürgerliche zählen weiterhin profit mensch,,,,,,,,,,,,,,,,,,,,,,,,,,,,,,,"{'CH': 0.11, 'exportiert': 0, 'wieder': 0.13, 'mehr': 0.11, 'Kriegsmaterial': 0.19, 'Aber': 0.22, 'für': 0.12, 'Bürgerliche': 0.19, 'zählt': 0.17, 'weiterhin': 0, 'Profit': 0.34, 'vor': 0.42, 'Mensch': 0.53}",positive,"[0.21301845, 0.02798125, 0.7590003]",,,,,,,,,,,,,,,,,,,,,,neutral
50.0,75.0,57.0,0.0,neutral,RT @GSoASchweiz: Neuste #Kriegsmaterial-Exportzahlen publiziert: Wir verlangen Exportstopp in destabilisierte Länder! Unsere MM --&gt; https:/…,neuste kriegsmaterial exportzahlen publizieren verlangen exportstopp destabilisierte länder mm gt https,,,,,,,,,,,,,,,,,,,,,,,,,,,,,,,"{'Neuste': 0, 'Kriegsmaterial-Exportzahlen': 0.10250000000000001, 'publiziert': 0.12, 'Wir': 0.13, 'verlangen': 0.6950000000000001, 'Exportstopp': 0, 'in': 0, 'destabilisierte': 0, 'Länder': 0.42, 'Unsere': 0.05, 'MM': 0.06, '--&gt': 0, 'https': 0.17, ':/': 0, '…': 0}",neutral,"[0.7856338, 0.18330437, 0.031061877]",,,,,,,,,,,,,,,,,,,,,,neutral
100.0,100.0,86.0,0.7,negative,@GrueneCH unterstützen Kriegsmaterialinitiative ohne Gegenstimme. Danke ! #DVgruene https://t.co/zGJ61ZcjtN,unterstützen kriegsmaterialinitiative gegenstimme danke dvgruene,,,,,,,,,,,,,,,,,,,,,,,,,,,,,,,"{'unterstützen': 0.08, 'Kriegsmaterialinitiative': 0.0675, 'ohne': 0.03, 'Gegenstimme': 0.05, 'Danke': 0.065, 'DVgruene': 1.0}",positive,"[0.006903997, 0.0028048828, 0.9902912]",,,,,,,,,,,,,,,,,,,,,,positive
25.0,25.0,28.0,-0.35,negative,"RT @RegulaRytz: Der Pseudowettbewerb auf einem überlasteten Bahnnetz bringt den Kund/innen gar nichts. Anstatt ""Marktwirtschaft"" zu spielen…",pseudowettbewerb überlastet bahnnetz bringen kund innen gar anstatt marktwirtschaft spielen,,,,,,,,,,,,,,,,,,,,,,,,,,,,,,,,,,"{'Der': 0.05, 'Pseudowettbewerb': 0, 'auf': 0.05, 'einem': 0, 'überlasteten': 0.12, 'Bahnnetz': 0.14, 'bringt': 0, 'den': 0.05, 'Kund': 0, 'innen': 0, 'gar': 0, 'nichts': 0, 'Anstatt': 0.41500000000000004, 'Marktwirtschaft': 0.5449999999999999, 'zu': 0, 'spielen': 0, '…': 0}",neutral,"[0.69610214, 0.008439967, 0.29545787]",,,,,,,,,,,,,,,,,,,negative
50.0,75.0,57.0,0.0,neutral,"#Digitalisierung darf nicht auf dem Buckel der Arbeiter*innen geschehen! @syndicom_de 
https://t.co/Lizi2LSoaC",digitalisierung dürfen buckel arbeiter innen geschehen,,,,,,,,,,,,,,,,,,,,,,,,,,,,,,,,,,,,,"{'Digitalisierung': 0, 'darf': 0, 'nicht': 0.27, 'auf': 0.08, 'dem': 0.07, 'Buckel': 0, 'der': 0.07, 'Arbeiter*innen': 0.09, 'geschehen': 0.27}",negative,"[0.34316573, 0.6208682, 0.035966102]",,,,,,,,,,,,,,,,neutral
100.0,100.0,100.0,1.0,negative,"RT @jGruene_jVertEs: «Wer auf den Umweltschutz achtet, hätte diesen Flug nicht gemacht.» @luzian_franzini 🔥✊🏼 #FuckDePlanet https://t.co/9D…",wer umweltschutz achten flug fuckdeplanet,,,,,,,,,,,,,,,,,,,,,,,,,,,,,,,,,,,,,,,,"{'«': 0, 'Wer': 0, 'auf': 0, 'den': 0, 'Umweltschutz': 0, 'achtet': 0, 'hätte': 0, 'diesen': 0, 'Flug': 0, 'nicht': 0, 'gemacht': 0, '»': 0, 'FuckDePlanet': 0}",neutral,"[0.44859287, 0.32593334, 0.22547375]",,,,,,,,,,,,,positive
100.0,100.0,100.0,1.0,neutral,"Braucht es neue #ParadisePapers Enthüllungen, damit das Parlament auch wirklich etwas für Menschenrechte und Umweltschutz tun will? #KOVI https://t.co/SZOecZKgoA",brauchen neue paradisepapers enthüllungen parlament wirklich menschenrechte umweltschutz tun kovi,,,,,,,,,,,,,,,,,,,,,,,,,,,,,,,,,,,,,,,,"{'Braucht': 0, 'es': 0, 'neue': 0.12, 'ParadisePapers': 0.2, 'Enthüllungen': 0.22, 'damit': 0.08, 'das': 0.24, 'Parlament': 0.42, 'auch': 0, 'wirklich': 0.18, 'etwas': 0.14, 'für': 0.15, 'Menschenrechte': 0.11, 'und': 0.19, 'Umweltschutz': 0.325, 'tun': 0.09, 'will': 0, 'KOVI': 0.43}",neutral,"[0.5499365, 0.022093054, 0.4279705]",,,,,,,,,,,,,positive
100.0,100.0,100.0,0.85,neutral,"RT @GrueneCH: Umweltschutz bei der FDP? 🤔 Sicher, Frau Gössi? 🤥 7 anschauliche Beispiele, die das Gegenteil beweisen. https://t.co/vbWe33Cw…",umweltschutz fdp sichern frau gössi anschaulich beispiele gegenteil beweisen,,,,,,,,,,,,,,,,,,,,,,,,,,,,,,,,,,,,,,,,"{'Umweltschutz': 0.585, 'bei': 0.19, 'der': 0.04, 'FDP': 0.35, '🤔': 0, 'Sicher': 0, 'Frau': 0, 'Gössi': 0, '🤥': 0, 'anschauliche': 0, 'Beispiele': 0, 'die': 0, 'das': 0, 'Gegenteil': 0, 'beweisen': 0}",neutral,"[0.7217322, 0.036064073, 0.24220374]",,,,,,,,,,,,,positive
50.0,75.0,57.0,0.0,neutral,Umweltschutz vs. Baulobby: Es wird spannend! @ParlCH https://t.co/fYBv0LH07L,umweltschutz vs baulobby spannen,,,,,,,,,,,,,,,,,,,,,,,,,,,,,,,,,,,,,,,,"{'Umweltschutz': 0.69, 'vs.': 0, 'Baulobby': 0, 'Es': 0, 'wird': 0.13, 'spannend': 0.37}",positive,"[0.006817738, 0.0017594609, 0.99142283]",,,,,,,,,,,,,neutral
50.0,75.0,57.0,0.0,neutral,"RT @jGruene_jVertEs: https://t.co/fpexcT0PBK
@grunliberale stimmen immer häufiger gegen Umweltschutzanliegen!",stimmen immer häufig umweltschutzanliegen,,,,,,,,,,,,,,,,,,,,,,,,,,,,,,,,,,,,,,,,"{'stimmen': 0, 'immer': 0, 'häufiger': 0.295, 'gegen': 1.0, 'Umweltschutzanliegen': 0.395}",positive,"[0.013458682, 0.002496065, 0.98404527]",,,,,,,,,,,,,neutral
100.0,100.0,100.0,1.0,neutral,"https://t.co/Yy9jcOpTki
Umweltrating von #NR und #SR zeigt: @GrueneCH sind umweltfreundlichste Partei, doch die @grunliberale stimmt immer häufiger gegen Umweltschutzanliegen! @verkehrsclub @WWF_Schweiz @greenpeace_ch @energiestiftung @BirdLife_News",umweltrating nr sr zeigen umweltfreundlich partei stimmen immer häufig umweltschutzanliegen,,,,,,,,,,,,,,,,,,,,,,,,,,,,,,,,,,,,,,,,"{'Umweltrating': 0.275, 'von': 0, 'NR': 0, 'und': 0.03, 'SR': 0.04, 'zeigt': 0, 'sind': 0.35, 'umweltfreundlichste': 0.08499999999999999, 'Partei': 0.09, 'doch': 0, 'die': 0.06, 'stimmt': 0, 'immer': 0, 'häufiger': 0, 'gegen': 1.0, 'Umweltschutzanliegen': 0.605}",positive,"[0.1154709, 0.27877197, 0.6057572]",,,,,,,,,,,,,positive
50.0,75.0,57.0,0.0,neutral,@narimoldi @Radio3FACH @SVPch @zersiedelung #Erdöl-Rösti und Akw-Lobby betreibt Umweltschutz?  #Realitätsverlust oder Satire ?,erdöl rösti akw lobby betreiben umweltschutz realitätsverlust satire,,,,,,,,,,,,,,,,,,,,,,,,,,,,,,,,,,,,,,,,"{'Erdöl-Rösti': 0, 'und': 0.1, 'Akw-Lobby': 0.1, 'betreibt': 0, 'Umweltschutz': 0.14500000000000002, 'Realitätsverlust': 0.2175, 'oder': 0.32, 'Satire': 0.53}",neutral,"[0.946491, 0.03955918, 0.013949796]",,,,,,,,,,,,,neutral
100.0,100.0,100.0,1.0,neutral,@narimoldi @Radio3FACH (2/2) Die @SVPch &amp; Co interessierten sich die letzten Jahre jedoch 0 für Umweltschutz. Nun plötzlich Vogelschützer und gegen @zersiedelung ?,amp co interessieren letzt jahre jedoch umweltschutz plötzlich vogelschützer,,,,,,,,,,,,,,,,,,,,,,,,,,,,,,,,,,,,,,,,"{'Die': 0.06, 'amp': 0.1, 'Co': 0.36, 'interessierten': 1.0, 'sich': 0, 'die': 0.06, 'letzten': 0, 'Jahre': 0.16, 'jedoch': 0.31, 'für': 0, 'Umweltschutz': 0.7, 'Nun': 0, 'plötzlich': 0.14, 'Vogelschützer': 0.18, 'und': 0.08, 'gegen': 0.11}",positive,"[0.22743718, 0.03509275, 0.73747003]",,,,,,,,,,,,,positive
50.0,75.0,57.0,0.0,neutral,@narimoldi @Radio3FACH Alle g. Umweltschutzorganisationen (@pronaturach @greenpeace_ch @WWF_Schweiz sind dafür. Experten f.Umweltschutz sind für #ES2050. (1/2),all g umweltschutzorganisationen dafür experten f umweltschutz es2050,,,,,,,,,,,,,,,,,,,,,,,,,,,,,,,,,,,,,,,,"{'Alle': 0.18, 'g.': 0, 'Umweltschutzorganisationen': 0.0775, 'sind': 0.1, 'dafür': 0, 'Experten': 0.1, 'f.': 0, 'Umweltschutz': 0.065, 'für': 0.16, 'ES2050.': 0}",positive,"[0.03717595, 0.018462442, 0.94436157]",,,,,,,,,,,,,neutral
50.0,75.0,57.0,0.0,neutral,"@narimoldi @Radio3FACH Inwiefern trägt die Reduktion des Energievebrauchs, energetische Sanierungen und mehr Effizienz nicht zum Umweltschutz bei? #Es2050",inwiefern tragen reduktion energievebrauchs energetische sanierungen mehr effizienz umweltschutz es2050,,,,,,,,,,,,,,,,,,,,,,,,,,,,,,,,,,,,,,,,"{'Inwiefern': 0.29000000000000004, 'trägt': 0, 'die': 0.16, 'Reduktion': 0.24, 'des': 0, 'Energievebrauchs': 0.065, 'energetische': 0.17, 'Sanierungen': 0.14, 'und': 0.44, 'mehr': 0, 'Effizienz': 0.63, 'nicht': 1.0, 'zum': 0.275, 'Umweltschutz': 0.66, 'bei': 0, 'Es2050': 0.19}",positive,"[0.43792763, 0.10084044, 0.46123183]",,,,,,,,,,,,,neutral
50.0,75.0,57.0,0.0,neutral,@veryconfusedcat @LauraCurau (1/2) Antwort auf die verkehrte Logik der SVP. Sicherheit schafft man durch Atomausstieg und Umweltschutz,antwort verkehren logik svp sicherheit schaffen atomausstieg umweltschutz,,,,,,,,,,,,,,,,,,,,,,,,,,,,,,,,,,,,,,,,"{'Antwort': 0, 'auf': 0, 'die': 0.06, 'verkehrte': 0.71, 'Logik': 0.09, 'der': 0.06, 'SVP': 0, 'Sicherheit': 0, 'schafft': 0, 'man': 0, 'durch': 0, 'Atomausstieg': 0.12, 'und': 0.28, 'Umweltschutz': 0}",positive,"[0.13600668, 0.08041363, 0.7835797]",,,,,,,,,,,,,neutral
50.0,75.0,57.0,0.0,neutral,"Für @ignaziocassis sind die #Menschenrechte ""ein  wesentlicher Bestandteil der Aussenpolitik"". Meint er damit das @konzern_vi -Nein, #Glencore-Minenbesuche und die Ökonomisierung der #Entwicklungshilfe ? #ironieoff https://t.co/oTz5ds83WL",menschenrechte wesentlich bestandteil aussenpolitik nein glencore minenbesuche ökonomisierung entwicklungshilfe ironieoff,,,,,,,,,,,,,,,,,,,,,,,,,,,,,,,,,,,,,,,,,,,"{'Für': 0.09, 'sind': 0.09, 'die': 0.21, 'Menschenrechte': 0.04, 'ein': 0, 'wesentlicher': 0.05, 'Bestandteil': 0, 'der': 0.21, 'Aussenpolitik': 0.04, 'Meint': 0, 'er': 0, 'damit': 0, 'das': 0, '-Nein': 0, 'Glencore-Minenbesuche': 0, 'und': 0.28, 'Ökonomisierung': 0.33, 'Entwicklungshilfe': 0.16, 'ironieoff': 0}",neutral,"[0.8422823, 0.1126898, 0.045027874]",,,,,,,,,,neutral
100.0,100.0,86.0,0.7,neutral,"RT @ChBadertscher: 2011 wurde beschlossen, die Entwicklungshilfe auf 0.5% des Bruttonationaleinkommens zu erhöhen. Mit der neuen IZA-Botsch…",beschließen entwicklungshilfe bruttonationaleinkommens erhöhen neu iza botsch,,,,,,,,,,,,,,,,,,,,,,,,,,,,,,,,,,,,,,,,,,,"{'wurde': 0, 'beschlossen': 0.22, 'die': 0.64, 'Entwicklungshilfe': 0.26, 'auf': 0, '0.5': 0, 'des': 0, 'Bruttonationaleinkommens': 0.2325, 'zu': 0.07, 'erhöhen': 0, 'Mit': 0.6, 'der': 0.64, 'neuen': 1.0, 'IZA-Botsch': 0, '…': 0}",neutral,"[0.6224372, 0.17976344, 0.19779943]",,,,,,,,,,positive
100.0,100.0,100.0,1.0,neutral,"https://t.co/YmfnEFEqAr

Loch in die Staatskasse reissen, Energiewende abblasen und Entwicklungshilfe kürzen: perfektes Feindbild zum #1.Mai",loch staatskasse reissen energiewende abblasen entwicklungshilfe kürzen perfekt feindbild mai,,,,,,,,,,,,,,,,,,,,,,,,,,,,,,,,,,,,,,,,,,,"{'Loch': 0, 'in': 0.04, 'die': 0.08, 'Staatskasse': 0, 'reissen': 0, 'Energiewende': 0.08499999999999999, 'abblasen': 0, 'und': 0.13, 'Entwicklungshilfe': 0.45, 'kürzen': 0, 'perfektes': 0.93, 'Feindbild': 0.29000000000000004, 'zum': 0.08, '1.Mai': 0.32}",positive,"[0.006970355, 0.0067786747, 0.986251]",,,,,,,,,,positive
50.0,25.0,28.0,-0.15,negative,"RT @jGruene_jVertEs: ""Klimaschutz zu propagieren und gleichzeitig den Strassenverkehr zu fördern ist ein Widerspruch» kritisiert @luzian_fr…",klimaschutz propagieren gleichzeitig strassenverkehr fördern widerspruch kritisieren,,,,,,,,,,,,,,,,,,,,,,,,,,,,,,,,,,,,,,,,,,,,,,"{'Klimaschutz': 0.28500000000000003, 'zu': 0, 'propagieren': 0, 'und': 0.26, 'gleichzeitig': 0, 'den': 0.13, 'Strassenverkehr': 0.745, 'fördern': 0, 'ist': 0.4, 'ein': 0, 'Widerspruch': 0.49, '»': 0, 'kritisiert': 0, '…': 0}",positive,"[0.102168515, 0.30221027, 0.5956212]",,,,,,,neutral
0.0,0.0,0.0,-1.0,neutral,"@andrisilbi_ @MilchkuhJa Verursachergerechtigkeit? Der Strassenverkehr verursachte 2015 6.8 Milliarden Umweltkosten, da bezahlen alle",verursachergerechtigkeit strassenverkehr verursachen milliarden umweltkosten bezahlen all,,,,,,,,,,,,,,,,,,,,,,,,,,,,,,,,,,,,,,,,,,,,,,"{'Verursachergerechtigkeit': 0.45, 'Der': 0, 'Strassenverkehr': 0.3, 'verursachte': 0.33, '6.8': 0, 'Milliarden': 0, 'Umweltkosten': 0.08, 'da': 0, 'bezahlen': 0, 'alle': 0.09}",neutral,"[0.45794588, 0.4423562, 0.099697836]",,,,,,,negative
0.0,0.0,0.0,-1.0,neutral,"Täglich pendeln 60 000 Menschen im Kanton Zug. Mit Teilzeit-#Homeoffice und öffentlichen #CoWorking-Spaces liesse sich auch ausserhalb von #Covid19 das Verkehrsaufkommen massiv reduzieren! 
https://t.co/X1Gui511tg",täglich pendeln menschen kanton zug teilzeit homeoffice öffentlich coworking spaces liesse ausserhalb covid19 verkehrsaufkommen massiv reduzieren,,,,,,,,,,,,,,,,,,,,,,,,,,,,,,,,,,,,,,,,,,,,,,,,,"{'Täglich': 0, 'pendeln': 0.12, 'Menschen': 0.04, 'im': 0, 'Kanton': 0.02, 'Zug': 0.03, 'Mit': 0.03, 'Teilzeit-#Homeoffice': 0.035, 'und': 0.04, 'öffentlichen': 0.04, 'CoWorking-Spaces': 0, 'liesse': 0, 'sich': 0, 'auch': 0.28, 'ausserhalb': 0.375, 'von': 0, 'Covid19': 0.15, 'das': 0, 'Verkehrsaufkommen': 0.825, 'massiv': 0, 'reduzieren': 0}",negative,"[0.0016106134, 0.9898115, 0.008577843]",,,,negative
