100.0,100.0,86.0,0.7,neutral,"@SandroBrotz Fast 10 000 Menschen unterstützen bereits unsere Petition gegen die GA-Preiserhöhungen. Der öffentliche Verkehr muss bezahlbar bleiben! #SBBLeak
https://t.co/S0GDXKGoHl",fast menschen unterstützen bereits petition ga preiserhöhungen öffentlich verkehr bezahlbar bleiben sbbleak,,,,,,,,,,,,,,,,,,,,,,,,,,,,,,,,,,,,,,,,,,,,,,,,,"{'Fast': 0, 'Menschen': 0.03, 'unterstützen': 0.04, 'bereits': 0.02, 'unsere': 0.03, 'Petition': 0.07, 'gegen': 0.05, 'die': 0.03, 'GA-Preiserhöhungen': 0.052500000000000005, 'Der': 0.03, 'öffentliche': 0.07, 'Verkehr': 0, 'muss': 0, 'bezahlbar': 0, 'bleiben': 0.06, 'SBBLeak': 1.0}",positive,"[0.055324033, 0.11026542, 0.83441055]",,,,positive
0.0,0.0,0.0,-1.0,neutral,@Sandra_Christen @nau_live @SVPch @zersiedelung Hat NR Pieren den Initiativtext überhaupt gelesen ? Baustopp oder ein Verbot von bodenunabhängiger Landwirtschaft - das sind krasse #FakeNews! Hier kann man die Faktenlage nachlesen: https://t.co/K37tLrNRtB #Zersiedelungsinitative,nr pieren initiativtext überhaupt lesen baustopp verbieten bodenunabhängiger landwirtschaft krasse fakenews faktenlage nachlesen zersiedelungsinitative,,,,,,,,,,,,,,,,,,,,,,,,,,,,,,,,,,,,,,,,,,,,,,,,,,,,"{'Hat': 0, 'NR': 0, 'Pieren': 0, 'den': 0.04, 'Initiativtext': 0, 'überhaupt': 0, 'gelesen': 0.07, 'Baustopp': 0.235, 'oder': 0.37, 'ein': 0, 'Verbot': 1.0, 'von': 0, 'bodenunabhängiger': 0.35, 'Landwirtschaft': 1.0, 'das': 0, 'sind': 0.07, 'krasse': 0.14, 'FakeNews': 0.2, 'Hier': 0.02, 'kann': 0.02, 'man': 0, 'die': 0.04, 'Faktenlage': 0, 'nachlesen': 0.07, 'Zersiedelungsinitative': 0.29}",neutral,"[0.49272028, 0.13294472, 0.374335]",negative
100.0,100.0,100.0,1.0,neutral,Ein intensives Politwochenende: @FairFoodJa Kampagne und #DVGruene in Zug. Gemeinsam für eine nachhaltige Landwirtschaftspolitik! Herzlichen Dank allen Helfer*innen @AlternativeZG @GrueneCH @jGruene_jVertEs https://t.co/3AHRL2PCw5,intensiv politwochenende kampagne dvgruene zug gemeinsam nachhaltig landwirtschaftspolitik herzlich danken helfer innen,,,,,,,,,,,,,,,,,,,,,,,,,,,,,,,,,,,,,,,,,,,,,,,,,,,,"{'Ein': 0.23, 'intensives': 0.07, 'Politwochenende': 0, 'Kampagne': 0.09, 'und': 0.03, 'DVGruene': 0.17, 'in': 0.03, 'Zug': 0.07, 'Gemeinsam': 0.14, 'für': 0.2, 'eine': 0, 'nachhaltige': 1.0, 'Landwirtschaftspolitik': 0.74, 'Herzlichen': 0, 'Dank': 0.05, 'allen': 0, 'Helfer*innen': 0.11}",positive,"[0.00073860434, 0.0009864907, 0.9982749]",positive
50.0,75.0,57.0,0.0,neutral,"RT @jGruene_jVertEs: Wie sieht die #Landwirtschaft von morgen aus? Wir diskutieren an unserem Bildungstag mit zwei Bauern und ""Vision Landw…",sehen landwirtschaft morgen diskutieren bildungstag zwei bauern vision landw,,,,,,,,,,,,,,,,,,,,,,,,,,,,,,,,,,,,,,,,,,,,,,,,,,,,"{'Wie': 0, 'sieht': 0, 'die': 0.07, 'Landwirtschaft': 0.08, 'von': 0, 'morgen': 0.09, 'aus': 0, 'Wir': 0.46, 'diskutieren': 0, 'an': 0, 'unserem': 0.1, 'Bildungstag': 0.175, 'mit': 0.78, 'zwei': 0.23, 'Bauern': 0.12, 'und': 0.26, 'Vision': 0.17, 'Landw': 0, '…': 0}",neutral,"[0.9920535, 0.0032710377, 0.004675482]",neutral
100.0,100.0,100.0,1.0,neutral,RT @Kilian_Baumann: Mit der #FairFoodInitiative der @GrueneCH zeigt sich welche Parteien sich im @ParlCH wirklich für die 🇨🇭Landwirtschaft…,fairfoodinitiative zeigen welch parteien wirklich landwirtschaft,,,,,,,,,,,,,,,,,,,,,,,,,,,,,,,,,,,,,,,,,,,,,,,,,,,,"{'Mit': 0, 'der': 0.16, 'FairFoodInitiative': 0.54, 'zeigt': 0, 'sich': 0, 'welche': 1.0, 'Parteien': 1.0, 'im': 0, 'wirklich': 0.5, 'für': 0, 'die': 0.16, '🇨': 0, '🇭': 0, 'Landwirtschaft': 0, '…': 0}",neutral,"[0.52135247, 0.35232386, 0.12632367]",positive
