answer_five,answer_four,answer_seven,polarity,sentiment_gs,tweet,tweet_tokens,absa_token_weights_3389,absa_sentiment_3389,absa_scores_3389,absa_token_weights_3414,absa_sentiment_3414,absa_scores_3414,absa_token_weights_3431,absa_sentiment_3431,absa_scores_3431,absa_token_weights_3436,absa_sentiment_3436,absa_scores_3436,absa_token_weights_3441,absa_sentiment_3441,absa_scores_3441,absa_token_weights_3450,absa_sentiment_3450,absa_scores_3450,absa_token_weights_3458,absa_sentiment_3458,absa_scores_3458,absa_token_weights_3465,absa_sentiment_3465,absa_scores_3465,absa_token_weights_3466,absa_sentiment_3466,absa_scores_3466,absa_token_weights_3467,absa_sentiment_3467,absa_scores_3467,absa_token_weights_3474,absa_sentiment_3474,absa_scores_3474,absa_token_weights_3477,absa_sentiment_3477,absa_scores_3477,absa_token_weights_3479,absa_sentiment_3479,absa_scores_3479,sentiment_tb
50.0,75.0,57.0,0.0,neutral,"RT @metamythos: Dringend: Lehrbetrieb gesucht!

Unser Sohn (17) sucht als FABE Kinderbetreuung fürs 3. Lehrjahr eine Kinderkrippe im Grossr…",dringen lehrbetrieb suchen sohn suchen fabe kinderbetreuung fürs lehrjahr kinderkrippe grossr,"{'Dringend': 0, 'Lehrbetrieb': 0.31, 'gesucht': 0, 'Unser': 0.47, 'Sohn': 0.44, 'sucht': 0, 'als': 0, 'FABE': 0.88, 'Kinderbetreuung': 0.82, 'fürs': 0.23, '3.': 0, 'Lehrjahr': 0.1, 'eine': 0, 'Kinderkrippe': 0.06, 'im': 0, 'Grossr': 0, '…': 0}",positive,"[0.31021392, 0.050386995, 0.6393991]",,,,,,,,,,,,,,,,,,,,,,,,,,,,,,,,,,,,,neutral
0.0,0.0,14.0,-0.7,neutral,@MFrauchigerSVP @SamBu95 Bei der jetztigen Zinssituation ist das Abbezahlen der Schulden wohl unsere geringste Sorge. Wieviel kostet denn der Vaterschaftsurlaub? 420 Millionen laut SRF. Das heisst mit 40 Milliarden könnten wir 95 Jahre lang 4 Wochen Vaterschaftsurlaub finanzieren.,jetztigen zinssituation abbezahlen schulden wohl gering sorge wieviel kosten vaterschaftsurlaub millionen laut srf heisst milliarden jahre langen wochen vaterschaftsurlaub finanzieren,,,,"{'Bei': 0, 'der': 0.02, 'jetztigen': 0, 'Zinssituation': 0.03, 'ist': 0.1, 'das': 0.07, 'Abbezahlen': 0.02, 'Schulden': 0, 'wohl': 0, 'unsere': 0.06, 'geringste': 0.05, 'Sorge': 0.25, 'Wieviel': 0.6950000000000001, 'kostet': 0, 'denn': 0, 'Vaterschaftsurlaub': 0.08499999999999999, 'Millionen': 0, 'laut': 0.065, 'SRF': 0.05, 'Das': 0.02, 'heisst': 0.1, 'mit': 0.05, 'Milliarden': 0, 'könnten': 0.16, 'wir': 0, 'Jahre': 0.05, 'lang': 0, 'Wochen': 0.03, 'finanzieren': 0.07}",neutral,"[0.6220217, 0.28854603, 0.08943235]",,,,,,,,,,,,,,,,,,,,,,,,,,,,,,,,,,negative
50.0,75.0,57.0,0.0,negative,"RT @ZStadtfux: Das Resultat unmenschlicher Einwanderungspolitik. Die #SVP fordert: #Einbürgerung nur, wenn nie #Sozialhilfe beansprucht wur…",resultat unmenschlicher einwanderungspolitik svp fordern einbürgerung nie sozialhilfe beanspruchen wur,,,,,,,"{'Das': 0.13, 'Resultat': 0, 'unmenschlicher': 0, 'Einwanderungspolitik': 0.08, 'Die': 0.13, 'SVP': 0, 'fordert': 0, 'Einbürgerung': 1.0, 'nur': 0.71, 'wenn': 0.14, 'nie': 0, 'Sozialhilfe': 0.06, 'beansprucht': 0.08, 'wur': 0, '…': 0}",neutral,"[0.7151021, 0.06265295, 0.22224487]",,,,,,,,,,,,,,,,,,,,,,,,,,,,,,,neutral
50.0,75.0,57.0,0.0,neutral,"@MarcoZueri Das Volk soll die Anforderungen festlegen, ausführen muss wer Anderes. Das Volk legt die Gesetze fest durchsetzen tut sie wer Anderes. In deinem System wie geht man mit Einbürgerungen um die willkürlich sind?",volk anforderungen festlegen ausfahren wer volk legen gesetze fest durchsetzen tun wer system gehen einbürgerungen willkürlich,,,,,,,"{'Das': 0.08, 'Volk': 0.12, 'soll': 0, 'die': 0.08, 'Anforderungen': 0, 'festlegen': 0.13, 'ausführen': 0.06, 'muss': 0.06, 'wer': 0, 'Anderes': 0, 'legt': 0, 'Gesetze': 0.28, 'fest': 0, 'durchsetzen': 0, 'tut': 0, 'sie': 0, 'In': 0.08, 'deinem': 0.09, 'System': 0.13, 'wie': 0.18, 'geht': 0, 'man': 0, 'mit': 0.21, 'Einbürgerungen': 1.0, 'um': 0, 'willkürlich': 0, 'sind': 0.91}",negative,"[0.14312638, 0.8499314, 0.0069421795]",,,,,,,,,,,,,,,,,,,,,,,,,,,,,,,neutral
0.0,0.0,0.0,-0.85,neutral,@MarcoZueri Ess geht doch nicht darum wie oft Unrecht passiert sondern ob und ob man das begünstigt. Einbürgerungen durch Volksentscheide sind brandgefährlich für einen Rechtsstaat. Der Willkür wird die Tür geöffnet. Deshalb müssen diese Entscheide auch anfechtbar sein.,ess gehen darum oft unrecht passieren begünstigen einbürgerungen volksentscheide brandgefährlich rechtsstaat willkür tür öffnen deshalb müssen entscheide anfechtbar,,,,,,,"{'Ess': 0, 'geht': 0, 'doch': 0, 'nicht': 0.02, 'darum': 0.04, 'wie': 0.01, 'oft': 0, 'Unrecht': 0, 'passiert': 0.02, 'sondern': 0.02, 'ob': 0, 'und': 0.01, 'man': 0, 'das': 0, 'begünstigt': 0, 'Einbürgerungen': 0, 'durch': 0.15, 'Volksentscheide': 0.33, 'sind': 0, 'brandgefährlich': 0.565, 'für': 0.14, 'einen': 0.05, 'Rechtsstaat': 0.075, 'Der': 0.03, 'Willkür': 0.05, 'wird': 0, 'die': 0.03, 'Tür': 0, 'geöffnet': 0, 'Deshalb': 0.04, 'müssen': 0.02, 'diese': 0, 'Entscheide': 0, 'auch': 0.05, 'anfechtbar': 0.03, 'sein': 0}",negative,"[0.006767072, 0.9827533, 0.010479617]",,,,,,,,,,,,,,,,,,,,,,,,,,,,,,,negative
100.0,100.0,100.0,1.0,neutral,"@MarcoZueri ... Konservative ein ding von einem anderen Planeten zu sein. Man kann eine Einbürgerung nicht der Willkür überlassen, hinter solchen Gesuchen stehen Menschen mit Rechten und Schicksalen, sie verdienen eine faire und nachvollziehbare Entscheidung.",konservative ding planeten einbürgerung willkür überlassen solch gesuchen stehen menschen recht schicksalen verdienen faire nachvollziehbar entscheidung,,,,,,,"{'...': 0, 'Konservative': 0, 'ein': 0, 'ding': 0.07, 'von': 0.05, 'einem': 0, 'anderen': 0, 'Planeten': 0, 'zu': 0.42, 'sein': 0.07, 'Man': 0, 'kann': 0, 'eine': 0, 'Einbürgerung': 0.83, 'nicht': 0, 'der': 0, 'Willkür': 0.32, 'überlassen': 1.0, 'hinter': 0.03, 'solchen': 0.07, 'Gesuchen': 0.09, 'stehen': 0.08, 'Menschen': 0.08, 'mit': 0.04, 'Rechten': 0.08, 'und': 0.04, 'Schicksalen': 0, 'sie': 0, 'verdienen': 0, 'faire': 0.42, 'nachvollziehbare': 0, 'Entscheidung': 0.07}",positive,"[0.16453229, 0.06489444, 0.7705733]",,,,,,,,,,,,,,,,,,,,,,,,,,,,,,,positive
25.0,25.0,14.0,-0.4333333333333333,neutral,"@MarcoZueri Genau damit Einbürgerungen zum absoluten Zufallsakt werden. Damit deine Einbürgerung auch einfach mal abgelehnt werden kann, weil den Dorfbewohnern deine Visage nicht passt oder weil du dich politisch auf der falschen Seite engagierst. Rechtsstaatlichkeit scheint für manch ...",genau einbürgerungen absolut zufallsakt einbürgerung einfach mal ablehnen dorfbewohnern visage passt politisch falsch seite engagieren rechtsstaatlichkeit scheinen manch,,,,,,,"{'Genau': 0, 'damit': 0.13, 'Einbürgerungen': 0.07, 'zum': 0.175, 'absoluten': 0.18, 'Zufallsakt': 0, 'werden': 0, 'Damit': 0.13, 'deine': 0.02, 'Einbürgerung': 0.05, 'auch': 0, 'einfach': 0, 'mal': 0, 'abgelehnt': 0, 'kann': 0.05, 'weil': 0.06, 'den': 0.22, 'Dorfbewohnern': 0.03, 'Visage': 0.02, 'nicht': 0, 'passt': 0, 'oder': 0.05, 'du': 0, 'dich': 0.03, 'politisch': 0.03, 'auf': 0.02, 'der': 0.22, 'falschen': 0.04, 'Seite': 0, 'engagierst': 0, 'Rechtsstaatlichkeit': 0.355, 'scheint': 0.36, 'für': 0, 'manch': 0.43, '...': 0}",neutral,"[0.42302814, 0.32198852, 0.2549834]",,,,,,,,,,,,,,,,,,,,,,,,,,,,,,,negative
100.0,100.0,100.0,1.0,neutral,"@MarcoZueri Es ist ein Verwaltungsakt kein politischer Akt. Eine Ablehnung muss gut begründet werden. Der Antragssteller hat alle Anforderungen erfüllt, ihn jetzt nicht einzubürgern ist pure Willkür. Deshalb keine Einbürgerungen via Gemeinde- oder Bürgerversammlungen.",verwaltungsakt politisch akt ablehnung gut begründen antragssteller all anforderungen erfüllen einbürgern pur willkür deshalb einbürgerungen via gemeinden bürgerversammlungen,,,,,,,"{'Es': 0.28, 'ist': 0.28, 'ein': 0, 'Verwaltungsakt': 0.015, 'kein': 0.08, 'politischer': 0.02, 'Akt': 0, 'Eine': 0, 'Ablehnung': 0, 'muss': 0, 'gut': 0, 'begründet': 0.03, 'werden': 0, 'Der': 0.05, 'Antragssteller': 0.12, 'hat': 0, 'alle': 0, 'Anforderungen': 0, 'erfüllt': 0, 'ihn': 0.15, 'jetzt': 0.26, 'nicht': 1.0, 'einzubürgern': 0, 'pure': 0.1, 'Willkür': 0.09, 'Deshalb': 0.09, 'keine': 0, 'Einbürgerungen': 0.06, 'via': 0.03, 'Gemeinde-': 0, 'oder': 0.04, 'Bürgerversammlungen': 0}",negative,"[0.32972702, 0.64888376, 0.021389283]",,,,,,,,,,,,,,,,,,,,,,,,,,,,,,,positive
75.0,75.0,71.0,0.35,negative,"1. Keine Einbürgerungen mehr durch Gemeindeversammlungen, zu oft geht das schief und ist willkürlich.
2. Wieso lese ich die Kommentare wenn ich auch genau weiss, das dort die SVP-Anhängerschaft sich trifft und gegenseitig bestärkt?
https://t.co/Pib1msCZNm",einbürgerungen mehr gemeindeversammlungen oft gehen schief willkürlich wieso lesen kommentare genau weiss svp anhängerschaft treffen gegenseitig bestärken,,,,,,,"{'1.': 0, 'Keine': 0, 'Einbürgerungen': 1.0, 'mehr': 0.8, 'durch': 0.14, 'Gemeindeversammlungen': 0.04, 'zu': 0, 'oft': 0, 'geht': 0.04, 'das': 0.03, 'schief': 0, 'und': 0.02, 'ist': 0.11, 'willkürlich': 0, '2.': 0, 'Wieso': 0, 'lese': 0.02, 'ich': 0.01, 'die': 0.02, 'Kommentare': 0.02, 'wenn': 0, 'auch': 0, 'genau': 0.01, 'weiss': 0, 'dort': 0.01, 'SVP-Anhängerschaft': 0.02, 'sich': 0, 'trifft': 0, 'gegenseitig': 0, 'bestärkt': 0}",negative,"[0.14374493, 0.53706414, 0.31919098]",,,,,,,,,,,,,,,,,,,,,,,,,,,,,,,positive
100.0,100.0,100.0,0.85,neutral,"@MFrauchigerSVP Wie gesagt erfolgreich darin die Politik zu verkaufen. Doch wie Steuersenkungen für die Reichsten und Kampf gegen Überbrückungsrenten den Arbeitern dienen soll, bleibt euch vorbehalten. Oder der Kampf gegen Mindestlöhne, flankierende Massnahmen, Papizeit, etc....",sagen erfolgreich darin politik verkaufen steuersenkungen reich kampf überbrückungsrenten arbeitern dienen bleiben vorbehalten kampf mindestlöhne flankierend massnahmen papizeit etc,,,,,,,,,,"{'Wie': 0.13, 'gesagt': 0.14, 'erfolgreich': 0.34, 'darin': 0.08, 'die': 0.03, 'Politik': 0, 'zu': 0.04, 'verkaufen': 0.04, 'Doch': 1.0, 'wie': 1.0, 'Steuersenkungen': 0.44, 'für': 0.33, 'Reichsten': 0.09, 'und': 0.26, 'Kampf': 0, 'gegen': 0.03, 'Überbrückungsrenten': 0.09, 'den': 0.03, 'Arbeitern': 0.02, 'dienen': 0.05, 'soll': 0, 'bleibt': 0, 'euch': 0.07, 'vorbehalten': 0, 'Oder': 0.11, 'der': 0.03, 'Mindestlöhne': 0.025, 'flankierende': 0, 'Massnahmen': 0.04, 'Papizeit': 0.02, 'etc': 0.04, '....': 0}",positive,"[0.09899573, 0.15712637, 0.7438779]",,,,,,,,,,,,,,,,,,,,,,,,,,,,positive
50.0,75.0,57.0,0.0,negative,"@MFrauchigerSVP @fuulu_ @SilvanStoeckli Nur für diejenigen für die es sich lohnt. Steuersenkungen und ziehen immer Ausgabensenkungen nach sich. Nachher sinken andere Beiträge wieder die die Menschen benötigen. Steuersenkungen helfen oft nur den Besserverdienenden, selten der ganzen Bevölkerung",derjenige lohnen steuersenkungen ziehen immer ausgabensenkungen nachher sinken beiträge menschen benötigen steuersenkungen helfen oft besserverdienenden selten ganz bevölkerung,,,,,,,,,,"{'Nur': 0, 'für': 0.09, 'diejenigen': 0.07, 'die': 0.02, 'es': 0, 'sich': 0, 'lohnt': 0.055, 'Steuersenkungen': 0.035, 'und': 1.0, 'ziehen': 0, 'immer': 0.87, 'Ausgabensenkungen': 0.085, 'nach': 0, 'Nachher': 0, 'sinken': 0, 'andere': 0, 'Beiträge': 0.04, 'wieder': 0.06, 'Menschen': 0.03, 'benötigen': 0, 'helfen': 0.03, 'oft': 0, 'nur': 0.08, 'den': 0.02, 'Besserverdienenden': 0, 'selten': 0, 'der': 0.02, 'ganzen': 0, 'Bevölkerung': 0.04}",negative,"[0.04698178, 0.88643044, 0.06658776]",,,,,,,,,,,,,,,,,,,,,,,,,,,,neutral
25.0,25.0,28.0,-0.3333333333333333,negative,@super_sach @SilvanStoeckli Dann muss die Frage schon dumm sein. Steuersenkungen um einfach mal die Steuern zu senken macht keinen Sinn und (siehe Luzern) geht gerne mal nach hinten los.,fragen schon dumm steuersenkungen einfach mal steuern senken sinn siehe luzern gehen gerne mal hinten los,,,,,,,,,,"{'Dann': 0.05, 'muss': 0.18, 'die': 0.03, 'Frage': 0, 'schon': 0, 'dumm': 0.19, 'sein': 0, 'Steuersenkungen': 0.495, 'um': 0, 'einfach': 0, 'mal': 0, 'Steuern': 0, 'zu': 0.18, 'senken': 0, 'macht': 0, 'keinen': 0, 'Sinn': 0, 'und': 0.32, 'siehe': 0, 'Luzern': 0, 'geht': 0, 'gerne': 0, 'nach': 0, 'hinten': 0, 'los': 0.03}",negative,"[0.0054827086, 0.98771477, 0.006802566]",,,,,,,,,,,,,,,,,,,,,,,,,,,,negative
25.0,25.0,28.0,-0.3333333333333333,negative,@SilvanStoeckli Genau weil Steuererhöhungen ja auch so common in der Schweiz sind. Die letzten die die Steuern erhöht haben waren wohl die Luzerner weil die bürgerliche Finanzpolitik katastrophal nach hinten losgegangen sind. Die FDP macht keine Politik sie sucht Vorwände für Steuersenkungen.,genau steuererhöhungen ja common schweiz letzt steuern erhöhen wohl luzerner bürgerliche finanzpolitik katastrophal hinten losgehen fdp politik suchen vorwände steuersenkungen,,,,,,,,,,"{'Genau': 0, 'weil': 0.03, 'Steuererhöhungen': 0.085, 'ja': 0, 'auch': 0, 'so': 0.01, 'common': 0.03, 'in': 0.01, 'der': 0.08, 'Schweiz': 0.01, 'sind': 0.01, 'Die': 0.08, 'letzten': 0.01, 'die': 0.08, 'Steuern': 0, 'erhöht': 0, 'haben': 0.01, 'waren': 0, 'wohl': 0, 'Luzerner': 0.04, 'bürgerliche': 0.02, 'Finanzpolitik': 0.02, 'katastrophal': 0, 'nach': 0, 'hinten': 0, 'losgegangen': 0, 'FDP': 0.07, 'macht': 0, 'keine': 0, 'Politik': 0, 'sie': 0, 'sucht': 0, 'Vorwände': 0, 'für': 1.0, 'Steuersenkungen': 0.5700000000000001}",positive,"[0.46111226, 0.07744209, 0.46144557]",,,,,,,,,,,,,,,,,,,,,,,,,,,,negative
50.0,75.0,57.0,0.0,neutral,@SilvanStoeckli @Jungfreisinnige @jungesvp «Steuerliche Anreize» kommt 2mal vor in den 10 Forderungen. Das ist kein Programm sodern ein Vorwand für Steuersenkungen. https://t.co/XwOgcwyp5z,steuerlich anreize kommen 2mal forderungen programm sodern vorwand steuersenkungen,,,,,,,,,,"{'«': 0, 'Steuerliche': 0, 'Anreize': 0, '»': 0, 'kommt': 0, '2mal': 0, 'vor': 0, 'in': 0, 'den': 0, 'Forderungen': 0, 'Das': 0, 'ist': 0, 'kein': 0, 'Programm': 0, 'sodern': 0, 'ein': 0, 'Vorwand': 0, 'für': 0, 'Steuersenkungen': 0}",neutral,"[0.8142157, 0.020088807, 0.16569544]",,,,,,,,,,,,,,,,,,,,,,,,,,,,neutral
50.0,75.0,57.0,0.0,neutral,"RT @dergazetteur: Wenn du zum Geburtstag schon wieder nicht die Steuersenkung für Reiche bekommen hast, die du so gerne wolltest. https://t…",geburtstag schon steuersenkung reichen bekommen gerne,,,,,,,,,,"{'Wenn': 0, 'du': 0, 'zum': 0.1, 'Geburtstag': 0.12, 'schon': 0, 'wieder': 0, 'nicht': 0, 'die': 0.1, 'Steuersenkung': 0.25, 'für': 0.17, 'Reiche': 0.23, 'bekommen': 0.14, 'hast': 0, 'so': 0.49, 'gerne': 0, 'wolltest': 1.0}",negative,"[0.017221216, 0.967927, 0.014851726]",,,,,,,,,,,,,,,,,,,,,,,,,,,,neutral
25.0,0.0,14.0,-0.5,neutral,@SamBu95 @MFrauchigerSVP Grundeinkommen bin ich selber gespalten. Für Mindestlohn muss glaub nicht der Staatshaushalt bezahlen. Bzw. ich denke der Staat zahlt niemandem weniger als 4000.-,grundeinkommen selber spalten mindestlohn glaub staatshaushalt bezahlen bzw denken staat zahlen niemand wenig,,,,,,,,,,,,,"{'Grundeinkommen': 0.075, 'bin': 0, 'ich': 0.03, 'selber': 0.03, 'gespalten': 0.05, 'Für': 0.6, 'Mindestlohn': 0.9650000000000001, 'muss': 0.2, 'glaub': 0, 'nicht': 0, 'der': 0.22, 'Staatshaushalt': 0.245, 'bezahlen': 0.31, 'Bzw': 0.29, 'denke': 0.13, 'Staat': 0.21, 'zahlt': 0.13, 'niemandem': 0, 'weniger': 0, 'als': 0, '4000.-': 0}",neutral,"[0.9382163, 0.024414666, 0.03736901]",,,,,,,,,,,,,,,,,,,,,,,,,negative
50.0,75.0,57.0,0.0,neutral,@hjboesch @NZZ @tagesanzeiger @20min @nau_live @watson_news @Blickch Auf den eAuto-Parkplätzen an den ÖV-Drehscheiben wo ihr Auto aufgeladen wird mit erneuerbaren Energien während die Menschen mit dem ÖV am einkaufen sind. Zum Beispiel?,eauto parkplätzen öv drehscheiben auto aufladen erneuerbaren energien menschen öv einkaufen beispiel,,,,,,,,,,,,,,,,"{'Auf': 0.1, 'den': 0.07, 'eAuto-Parkplätzen': 0.04, 'an': 0, 'ÖV-Drehscheiben': 0.08, 'wo': 0.12, 'ihr': 0, 'Auto': 0, 'aufgeladen': 0.19, 'wird': 0, 'mit': 0.06, 'erneuerbaren': 0.27, 'Energien': 0.16, 'während': 0.11, 'die': 0.07, 'Menschen': 0.08, 'dem': 0.07, 'ÖV': 0, 'am': 0, 'einkaufen': 0.06, 'sind': 0.1, 'Zum': 0.07, 'Beispiel': 1.0}",positive,"[0.33086973, 0.23093891, 0.43819135]",,,,,,,,,,,,,,,,,,,,,,neutral
50.0,75.0,57.0,0.0,neutral,"Die gleiche Partei die partout nichts von Offenlegung der Parteien- und Kampagnenfinanzierung hält? Ja, genau die fordert ""Transparenz"". https://t.co/CUWVZEvIAW",gleich partei partout offenlegung parteien kampagnenfinanzierung halten ja genau fordern transparenz,,,,,,,,,,,,,,,,,,,"{'Die': 0.04, 'gleiche': 0.13, 'Partei': 0.49, 'die': 0.04, 'partout': 0, 'nichts': 0, 'von': 0, 'Offenlegung': 0, 'der': 0.04, 'Parteien-': 0.49, 'und': 1.0, 'Kampagnenfinanzierung': 0.645, 'hält': 0, 'Ja': 1.0, 'genau': 0, 'fordert': 0.02, 'Transparenz': 0.07}",neutral,"[0.8497083, 0.084416606, 0.06587509]",,,,,,,,,,,,,,,,,,,neutral
100.0,100.0,86.0,0.7,negative,"Wenn die FDP-Vertreter im #grzh, sagen sie wollen den Klimawandel mit freiheitlichen und marktwirtschaftlichen Konzepten bekämpfen, dann heisst das konkret: «Wir haben keine Idee, haben in den letzten Jahren auch keinen brauchbaren Vorschlag gebracht, aber tun gerne so.»",fdp vertreter grzh sagen klimawandel freiheitlich marktwirtschaftlichen konzepten bekämpfen heisst konkret idee letzt jahren brauchbar vorschlag bringen tun gerne,,,,,,,,,,,,,,,,,,,,,,"{'Wenn': 0.03, 'die': 0.04, 'FDP-Vertreter': 0.08, 'im': 0, 'grzh': 0.05, 'sagen': 0.02, 'sie': 0, 'wollen': 0.05, 'den': 0, 'Klimawandel': 0.245, 'mit': 0.3, 'freiheitlichen': 0, 'und': 0.5, 'marktwirtschaftlichen': 1.0, 'Konzepten': 0.46, 'bekämpfen': 0, 'dann': 0, 'heisst': 0, 'das': 0.02, 'konkret': 0.05, '«': 0, 'Wir': 0, 'haben': 0, 'keine': 0, 'Idee': 0, 'in': 0, 'letzten': 0, 'Jahren': 0, 'auch': 0, 'keinen': 0, 'brauchbaren': 0, 'Vorschlag': 0, 'gebracht': 0, 'aber': 0, 'tun': 0, 'gerne': 0, 'so': 0, '»': 0}",positive,"[0.14062619, 0.05523142, 0.80414236]",,,,,,,,,,,,,,,,positive
50.0,75.0,57.0,0.0,negative,"Wenn Politiker die keine Ahnung von IT oder Digitalisierung haben für die eID werben, dann muss man Nein stimmen. https://t.co/l8nNiQYiZQ",politiker ahnung it digitalisierung eid werben nein stimmen,,,,,,,,,,,,,,,,,,,,,,,,,"{'Wenn': 0, 'Politiker': 0, 'die': 0.15, 'keine': 0, 'Ahnung': 0.11, 'von': 0, 'IT': 0.14, 'oder': 0.38, 'Digitalisierung': 0, 'haben': 0.035, 'für': 0, 'eID': 0.32, 'werben': 0, 'dann': 0.04, 'muss': 0.04, 'man': 0, 'Nein': 0.07, 'stimmen': 0}",neutral,"[0.8429722, 0.11743583, 0.039591867]",,,,,,,,,,,,,neutral
50.0,75.0,57.0,0.0,neutral,"@YasiBourgeois @NZZzuerich Und fürs nächste Mal, wenn du mir vorwirfst ""gegen Digitalisierung zu sein"", würde ich vorher versuchen herauszufinden mit was der nette Herr von den Grünen denn sein Geld verdient. Ich verdiene noch meine Brötchen mit der Digitalisierung.",fürs nächst mal vorwerfen digitalisierung vorher versuchen herauszufinden nette herr grün geld verdienen verdienen brötchen digitalisierung,,,,,,,,,,,,,,,,,,,,,,,,,"{'Und': 0.02, 'fürs': 0.02, 'nächste': 0.02, 'Mal': 0, 'wenn': 0.2, 'du': 0.03, 'mir': 0.11, 'vorwirfst': 0.38, 'gegen': 1.0, 'Digitalisierung': 0, 'zu': 0.01, 'sein': 0.43, 'würde': 0.01, 'ich': 0.02, 'vorher': 0, 'versuchen': 0.01, 'herauszufinden': 0.015, 'mit': 0.02, 'was': 0, 'der': 0.02, 'nette': 0, 'Herr': 0, 'von': 0.03, 'den': 0.02, 'Grünen': 0.02, 'denn': 0, 'Geld': 0.04, 'verdient': 0, 'Ich': 0.02, 'verdiene': 0, 'noch': 0.02, 'meine': 0.02, 'Brötchen': 0}",negative,"[0.3961557, 0.5664263, 0.03741809]",,,,,,,,,,,,,neutral
100.0,100.0,86.0,0.7,neutral,"RT @bglaettli: Soll der Gewinn in der Schweiz wichtiger sein als Umweltschutz und Menschenrechte in #Indonesien?

NEIN zum Freihandelsabkom…",gewinn schweiz wichtig umweltschutz menschenrechte indonesien nein freihandelsabkom,,,,,,,,,,,,,,,,,,,,,,,,,,,,"{'Soll': 0.15, 'der': 0.06, 'Gewinn': 0.14, 'in': 0.18, 'Schweiz': 0.08, 'wichtiger': 0.14, 'sein': 0, 'als': 0, 'Umweltschutz': 0.625, 'und': 1.0, 'Menschenrechte': 0.355, 'Indonesien': 0.09, 'NEIN': 0.07, 'zum': 0.055, 'Freihandelsabkom': 0.052500000000000005, '…': 0}",positive,"[0.38515848, 0.03842571, 0.5764159]",,,,,,,,,,positive
50.0,75.0,71.0,0.15,neutral,"@SchoyMichael Also von einer Partei die den Umweltschutz jahrzehntelang verschlafen hat, muss man sich ja nicht sagen lassen, man solle auch mal an die nächste Generation denken. Lieber jetzt Schulden für die Wirtschaft machen, als Coronatote für die Wirtschaft in Kauf nehmen.",partei umweltschutz jahrzehntelang verschlafen ja sagen lassen sollen mal nächst generation denken lieb schulden wirtschaft coronatote wirtschaft kauf nehmen,,,,,,,,,,,,,,,,,,,,,,,,,,,,"{'Also': 0.01, 'von': 0, 'einer': 0, 'Partei': 0.07, 'die': 0.01, 'den': 0.01, 'Umweltschutz': 0.3, 'jahrzehntelang': 0.03, 'verschlafen': 0, 'hat': 0, 'muss': 0.01, 'man': 0, 'sich': 0, 'ja': 0, 'nicht': 0, 'sagen': 0.01, 'lassen': 0, 'solle': 0.01, 'auch': 0.01, 'mal': 0, 'an': 0, 'nächste': 0.01, 'Generation': 0.02, 'denken': 0.01, 'Lieber': 0, 'jetzt': 0.01, 'Schulden': 0.03, 'für': 0.02, 'Wirtschaft': 0, 'machen': 0, 'als': 0, 'Coronatote': 0, 'in': 0, 'Kauf': 0, 'nehmen': 0.01}",positive,"[0.23557194, 0.07673865, 0.6876894]",,,,,,,,,,neutral
100.0,100.0,100.0,1.0,negative,@talvi04 Ich sag ja nicht das unsere Regierung besser ist. Deswegen bin ich auch dagegen Dinge wie Artenvielfalt und Umweltschutz allzu sehr in die Hand der Kantone zu geben.,sag ja regierung gut deswegen dagegen dinge artenvielfalt umweltschutz allzu hand kantone geben,,,,,,,,,,,,,,,,,,,,,,,,,,,,"{'Ich': 0.3, 'sag': 0, 'ja': 0.17, 'nicht': 0.09, 'das': 0.1, 'unsere': 0.07, 'Regierung': 0.12, 'besser': 0.08, 'ist': 0.1, 'Deswegen': 0.04, 'bin': 0, 'ich': 0.3, 'auch': 0, 'dagegen': 0.05, 'Dinge': 0.3, 'wie': 0, 'Artenvielfalt': 0.28, 'und': 0.17, 'Umweltschutz': 0.32, 'allzu': 0.78, 'sehr': 0, 'in': 0.07, 'die': 0.05, 'Hand': 0, 'der': 0.05, 'Kantone': 0.11, 'zu': 0, 'geben': 0}",negative,"[0.10363691, 0.6977799, 0.1985832]",,,,,,,,,,positive
100.0,100.0,86.0,0.7,neutral,"@Vuchur Daher ist die Frage ""wer angefangen hat"", durchaus relevant wenn nicht sogar zentral. Wenn Gewalt z.B. aus einer Demo herausgeht, darf sie selber die ihr zugestandenen Mittel anwenden um die öffentliche Sicherheit herzustellen. Wenn jetzt also die Gewalt von der Polizei ausging..",daher fragen wer anfangen durchaus relevant sogar zentral gewalt z b demo herausgeht dürfen selber zugestanden mittel anwenden öffentlich sicherheit herstellen gewalt polizei ausgehen,,,,,,,,,,,,,,,,,,,,,,,,,,,,,,,"{'Daher': 0, 'ist': 0.03, 'die': 0.02, 'Frage': 0, 'wer': 0.02, 'angefangen': 0, 'hat': 0, 'durchaus': 0, 'relevant': 0.03, 'wenn': 0.02, 'nicht': 0.02, 'sogar': 0, 'zentral': 0.02, 'Wenn': 0, 'Gewalt': 0.11, 'z.B.': 0, 'aus': 0.02, 'einer': 0, 'Demo': 0.07, 'herausgeht': 0.02, 'darf': 0, 'sie': 0, 'selber': 0, 'ihr': 0, 'zugestandenen': 0, 'Mittel': 0, 'anwenden': 0.08, 'um': 0.03, 'öffentliche': 0.39, 'Sicherheit': 1.0, 'herzustellen': 0.23, 'jetzt': 0.02, 'also': 0, 'von': 0.03, 'der': 0.02, 'Polizei': 0.09, 'ausging': 0.025, '..': 0}",positive,"[0.44084838, 0.026107872, 0.5330437]",,,,,,,positive
0.0,0.0,0.0,-1.0,neutral,"@bartolomeuw7 @c_caviglia @huberfe Wir machen schlimmstenfalls auch Gesetze für die 2 Promille. Wenn ein Schild dort steht, wird es auch strafbar. Die Anwendung grundsätzlicher Logik ist im Strassenverkehr keine Voraussetzung und auch nicht sehr verbreitet.",schlimmstenfalls gesetze promille schild stehen strafbar anwendung grundsätzlich logik strassenverkehr voraussetzung verbreiten,,,,,,,,,,,,,,,,,,,,,,,,,,,,,,,,,,"{'Wir': 0.01, 'machen': 0, 'schlimmstenfalls': 0.015, 'auch': 0.09, 'Gesetze': 0.05, 'für': 0.03, 'die': 0.13, 'Promille': 0.02, 'Wenn': 0, 'ein': 0, 'Schild': 0, 'dort': 0.02, 'steht': 0, 'wird': 0, 'es': 0.06, 'strafbar': 0, 'Die': 0.13, 'Anwendung': 0.27, 'grundsätzlicher': 0, 'Logik': 0.12, 'ist': 0.06, 'im': 0, 'Strassenverkehr': 0.66, 'keine': 0, 'Voraussetzung': 0.63, 'und': 0.11, 'nicht': 0.06, 'sehr': 0.03, 'verbreitet': 0}",neutral,"[0.7516775, 0.19127494, 0.05704756]",,,,negative
100.0,100.0,86.0,0.7,neutral,"Ne, is klar. Der Präsident des Bauernverbands hat Recht, der vertritt ja auch keine Lobby-Interessen und die Menschen im Bundesamt für Landwirtschaft sind Ideologiesteuerte Politiker. Man könnte auch mal die eigene position reflektieren.  https://t.co/jTp5Kn9pBu",ne is klaren präsident bauernverbands recht vertreten ja lobby interessen menschen bundesamt landwirtschaft ideologiesteuerte politiker mal eigene position reflektieren,,,,,,,,,,,,,,,,,,,,,,,,,,,,,,,,,,,,,"{'Ne': 0, 'is': 0.14, 'klar': 0.07, 'Der': 0.03, 'Präsident': 0.15, 'des': 0, 'Bauernverbands': 0.04, 'hat': 0, 'Recht': 0, 'der': 0.03, 'vertritt': 0, 'ja': 0.47, 'auch': 0.27, 'keine': 0, 'Lobby-Interessen': 0.21000000000000002, 'und': 0.47, 'die': 0.03, 'Menschen': 0.09, 'im': 0, 'Bundesamt': 0.04, 'für': 0.04, 'Landwirtschaft': 0.1, 'sind': 0.44, 'Ideologiesteuerte': 0, 'Politiker': 0, 'Man': 0, 'könnte': 0.2, 'mal': 0, 'eigene': 0.05, 'position': 0.05, 'reflektieren': 0.15}",neutral,"[0.8160411, 0.052347578, 0.13161132]",positive
