50.0,75.0,57.0,0.0,neutral,"RT @info_mobilitaet: Nationalrat entscheidet über Hilfe für öffentlichen Verkehr. Die LITRA setzt sich dafür an, dass dem öV als Gesamtsyst…",nationalrat entscheiden hilfe öffentlich verkehr litra setzen dafür öv gesamtsyst,,,,,,,,,,,,,,,,,,,,,,,,,,,,,,,,,,,,,,,,,,,,,,,,,"{'Nationalrat': 0.06, 'entscheidet': 0.09, 'über': 0, 'Hilfe': 0, 'für': 0.04, 'öffentlichen': 0.03, 'Verkehr': 0, 'Die': 0, 'LITRA': 0, 'setzt': 0, 'sich': 0, 'dafür': 0, 'an': 0.08, 'dass': 0.17, 'dem': 0.13, 'öV': 0, 'als': 0.24, 'Gesamtsyst': 0, '…': 0}",positive,"[0.341586, 0.05003744, 0.60837656]",,,,neutral
50.0,75.0,57.0,0.0,neutral,RT @info_mobilitaet: Der Ständerat debattiert heute über die Unterstützung an die Transportunternehmen des öffentlichen Verkehrs. Dabei ent…,ständerat debattieren heute unterstützung transportunternehmen öffentlich verkehrs dabei ent,,,,,,,,,,,,,,,,,,,,,,,,,,,,,,,,,,,,,,,,,,,,,,,,,"{'Der': 0.17, 'Ständerat': 0.14, 'debattiert': 0, 'heute': 0.52, 'über': 0, 'die': 0.17, 'Unterstützung': 0.34, 'an': 0, 'Transportunternehmen': 0.22, 'des': 0, 'öffentlichen': 0.06, 'Verkehrs': 0, 'Dabei': 0, 'ent': 0.88, '…': 0}",neutral,"[0.9402177, 0.02722014, 0.032562096]",,,,neutral
50.0,25.0,28.0,-0.15,neutral,"RT @info_mobilitaet: Wie unterstützt der Bund den öffentlichen Verkehr, damit die Corona-Pandemie keinen nachhaltigen Schaden verursacht? U…",unterstützen bund öffentlich verkehr corona pandemie nachhaltig schaden verursachen u,,,,,,,,,,,,,,,,,,,,,,,,,,,,,,,,,,,,,,,,,,,,,,,,,"{'Wie': 0, 'unterstützt': 0, 'der': 0.1, 'Bund': 0, 'den': 0.1, 'öffentlichen': 0.07, 'Verkehr': 0, 'damit': 0, 'die': 0.1, 'Corona-Pandemie': 0, 'keinen': 0, 'nachhaltigen': 0, 'Schaden': 0.34, 'verursacht': 0, 'U': 0.89, '…': 0}",neutral,"[0.6078176, 0.32782933, 0.06435308]",,,,neutral
100.0,100.0,100.0,1.0,neutral,Die Generalversammlung des Verbandes öffentlicher Verkehr (VöV) wählt in #Neuenburg #Neuchatel Renato Fasciati zum neuen Präsidenten. Herzliche Gratulation Renato! Auf eine weiterhin erfolgreiche Zusammenarbeit zwischen #VöV und #LITRA! @info_mobilitaet https://t.co/RLIS85Q3GL,generalversammlung verbandes öffentlich verkehr vöv wählen neuenburg neuchatel renato fasciati neu präsidenten herzlich gratulation renato weiterhin erfolgreich zusammenarbeit vöv litra,,,,,,,,,,,,,,,,,,,,,,,,,,,,,,,,,,,,,,,,,,,,,,,,,"{'Die': 0.04, 'Generalversammlung': 0.08499999999999999, 'des': 0, 'Verbandes': 0.14, 'öffentlicher': 0.04, 'Verkehr': 0, 'VöV': 0, 'wählt': 0.11, 'in': 0.07, 'Neuenburg': 0.24, 'Neuchatel': 0.21, 'Renato': 0.12, 'Fasciati': 0.15, 'zum': 0.19999999999999998, 'neuen': 0.05, 'Präsidenten': 0, 'Herzliche': 0, 'Gratulation': 0.46, 'Auf': 0, 'eine': 0, 'weiterhin': 0, 'erfolgreiche': 0.34, 'Zusammenarbeit': 0.58, 'zwischen': 0.37, 'und': 0.41, 'LITRA': 0}",positive,"[0.28625664, 0.24959894, 0.46414444]",,,,positive
50.0,75.0,57.0,0.0,neutral,"RT @info_mobilitaet: Martin Candinas:  ""Es besteht Handlungsbedarf, um der Elektromobilität im öffentlichen Verkehr zum Durchbruch zu verhe…",martin candinas bestehen handlungsbedarf elektromobilität öffentlich verkehr durchbruch verhe,,,,,,,,,,,,,,,,,,,,,,,,,,,,,,,,,,,,,,,,,,,,,,,,,"{'Martin': 0.24, 'Candinas': 0.23, 'Es': 0.19, 'besteht': 0, 'Handlungsbedarf': 0.115, 'um': 0.06, 'der': 0, 'Elektromobilität': 0.2, 'im': 0, 'öffentlichen': 0.05, 'Verkehr': 0, 'zum': 0.05, 'Durchbruch': 0.19, 'zu': 0.05, 'verhe': 0, '…': 0}",neutral,"[0.4643535, 0.38217324, 0.15347336]",,,,neutral
50.0,75.0,57.0,0.0,neutral,RT @info_mobilitaet: Coronavirus: Massnahmenpaket für öffentlichen Verkehr und Schienengüterverkehr geht ans Parlament (Medienmitteilung de…,coronavirus massnahmenpaket öffentlich verkehr schienengüterverkehr gehen ans parlament medienmitteilung de,,,,,,,,,,,,,,,,,,,,,,,,,,,,,,,,,,,,,,,,,,,,,,,,,"{'Coronavirus': 0.26, 'Massnahmenpaket': 0.32, 'für': 0.31, 'öffentlichen': 0.09, 'Verkehr': 0, 'und': 0.36, 'Schienengüterverkehr': 0.38249999999999995, 'geht': 1.0, 'ans': 0, 'Parlament': 0.82, 'Medienmitteilung': 0.28500000000000003, 'de': 0, '…': 0}",neutral,"[0.8765707, 0.10541021, 0.018019043]",,,,neutral
50.0,75.0,57.0,0.0,neutral,"RT @info_mobilitaet: Medienkonferenz vom 17. August 2020 ""Elektrobusse im öffentlichen Verkehr: Wie schnell nehmen sie Fahrt auf?"" https://…",medienkonferenz august elektrobusse öffentlich verkehr schnellen nehmen fahrt,,,,,,,,,,,,,,,,,,,,,,,,,,,,,,,,,,,,,,,,,,,,,,,,,"{'Medienkonferenz': 0.18, 'vom': 0, '17.': 0, 'August': 0.05, 'Elektrobusse': 0.07, 'im': 0, 'öffentlichen': 0.03, 'Verkehr': 0, 'Wie': 0, 'schnell': 0, 'nehmen': 0, 'sie': 0, 'Fahrt': 0, 'auf': 0.08}",neutral,"[0.66441745, 0.24755572, 0.0880268]",,,,neutral
50.0,75.0,57.0,0.0,neutral,RT @info_mobilitaet: Stellungnahme zum dringlichen Bundesgesetz über die Unterstützung des öffentlichen Verkehrs in der Covid-19-Krise http…,stellungnahme dringlich bundesgesetz unterstützung öffentlich verkehrs covid krise http,,,,,,,,,,,,,,,,,,,,,,,,,,,,,,,,,,,,,,,,,,,,,,,,,"{'Stellungnahme': 0.33, 'zum': 0.18, 'dringlichen': 0.11, 'Bundesgesetz': 0.16, 'über': 0, 'die': 0.18, 'Unterstützung': 0.14, 'des': 0, 'öffentlichen': 0.06, 'Verkehrs': 0, 'in': 0.13, 'der': 0.18, 'Covid-19-Krise': 0.55, 'http': 1.0, '…': 0}",neutral,"[0.79002625, 0.14855468, 0.061419025]",,,,neutral
50.0,75.0,57.0,0.0,neutral,RT @info_mobilitaet: Der Bundesrat will die Ertragsausfälle im öffentlichen Verkehr während der Corona-Pandemie mit rund 800 Millionen Fran…,bundesrat ertragsausfälle öffentlich verkehr corona pandemie rund millionen fran,,,,,,,,,,,,,,,,,,,,,,,,,,,,,,,,,,,,,,,,,,,,,,,,,"{'Der': 0.05, 'Bundesrat': 0.355, 'will': 0, 'die': 0.05, 'Ertragsausfälle': 0.34, 'im': 0, 'öffentlichen': 0.06, 'Verkehr': 0, 'während': 0, 'der': 0.05, 'Corona-Pandemie': 0, 'mit': 0.05, 'rund': 0.06, 'Millionen': 0, 'Fran': 0.03, '…': 0}",negative,"[0.16349679, 0.7799915, 0.05651172]",,,,neutral
50.0,75.0,57.0,0.0,neutral,"RT @info_mobilitaet: ""5.3 Mia. Franken werden jährlich in den öffentlichen Verkehr investiert - das ist jeder 30. Franken, der in der Schwe…",mia franken jährlich öffentlich verkehr investieren jed franken schwe,,,,,,,,,,,,,,,,,,,,,,,,,,,,,,,,,,,,,,,,,,,,,,,,,"{'5.3': 0, 'Mia': 0, 'Franken': 0, 'werden': 0, 'jährlich': 0, 'in': 0.19, 'den': 0, 'öffentlichen': 0.05, 'Verkehr': 0, 'investiert': 0.19, 'das': 0.19, 'ist': 0.14, 'jeder': 0, '30.': 0, 'der': 0, 'Schwe': 0, '…': 0}",neutral,"[0.80309933, 0.1208731, 0.076027505]",,,,neutral
50.0,75.0,57.0,0.0,neutral,"RT @info_mobilitaet: Zur Studie ""Die volkswirtschaftliche Bedeutung des öffentlichen Verkehrs"" informieren:

Damaris Bertschmann, Projektle…",studie volkswirtschaftlich bedeutung öffentlich verkehrs informieren damaris bertschmann projektle,,,,,,,,,,,,,,,,,,,,,,,,,,,,,,,,,,,,,,,,,,,,,,,,,"{'Zur': 0.06, 'Studie': 0.15, 'Die': 0.06, 'volkswirtschaftliche': 0.17, 'Bedeutung': 0.31, 'des': 0, 'öffentlichen': 1.0, 'Verkehrs': 0, 'informieren': 0, 'Damaris': 0.12, 'Bertschmann': 0.08, 'Projektle': 0.08, '…': 0}",neutral,"[0.55486965, 0.04765309, 0.3974773]",,,,neutral
100.0,100.0,86.0,0.7,neutral,RT @info_mobilitaet: Der öffentliche Verkehr sichert 100'000 Arbeitsplätze - alleine im Transport sind es rund 42'000. Das zeigt die jüngst…,öffentlich verkehr sichern arbeitsplätze alleine transport rund zeigen jüngst,,,,,,,,,,,,,,,,,,,,,,,,,,,,,,,,,,,,,,,,,,,,,,,,,"{'Der': 0.75, 'öffentliche': 0.09, 'Verkehr': 0, 'sichert': 0.26, ""100'000"": 0, 'Arbeitsplätze': 0.13, 'alleine': 0.11, 'im': 0, 'Transport': 0.15, 'sind': 0.24, 'es': 0.36, 'rund': 0.1, ""42'000."": 0, 'Das': 0.75, 'zeigt': 0, 'die': 0.75, 'jüngst': 0, '…': 0}",neutral,"[0.51924527, 0.09129812, 0.3894566]",,,,positive
100.0,100.0,86.0,0.7,neutral,"RT @info_mobilitaet: ""Der öffentliche Verkehr leistet einen ähnlich grossen Beitrag an das inländische Bruttoinlandprodukt wie die Energiev…",öffentlich verkehr leisten ähnlich grossen beitrag inländische bruttoinlandprodukt energiev,,,,,,,,,,,,,,,,,,,,,,,,,,,,,,,,,,,,,,,,,,,,,,,,,"{'Der': 0.18, 'öffentliche': 0.1, 'Verkehr': 0, 'leistet': 0, 'einen': 0.25, 'ähnlich': 0, 'grossen': 0, 'Beitrag': 1.0, 'an': 0, 'das': 0, 'inländische': 0.11, 'Bruttoinlandprodukt': 0.1775, 'wie': 0, 'die': 0.18, 'Energiev': 0.16, '…': 0}",positive,"[0.11947566, 0.09196258, 0.78856176]",,,,positive
0.0,0.0,0.0,-0.85,neutral,"RT @MllerSRF: #Coronakrise: Investitionen in den Öffentlichen Verkehr seien gefährdet, warnt @martin_candinas , Präsident von @info_mobilit…",coronakrise investitionen öffentlich verkehr gefährden warnen präsident,,,,,,,,,,,,,,,,,,,,,,,,,,,,,,,,,,,,,,,,,,,,,,,,,"{'Coronakrise': 0, 'Investitionen': 0.12, 'in': 0.08, 'den': 0, 'Öffentlichen': 0.06, 'Verkehr': 0, 'seien': 0, 'gefährdet': 0, 'warnt': 0.27, 'Präsident': 0.44, 'von': 0, '…': 0}",negative,"[0.1583186, 0.726674, 0.11500743]",,,,negative
50.0,75.0,57.0,0.0,neutral,"RT @info_mobilitaet: Christian Plüss, CEO von PostAuto, zu den Fahrplanänderungen des öffentlichen Verkehrs während der Coronakrise: Flexib…",christian plüss ceo postauto fahrplanänderungen öffentlich verkehrs coronakrise flexib,,,,,,,,,,,,,,,,,,,,,,,,,,,,,,,,,,,,,,,,,,,,,,,,,"{'Christian': 0.11, 'Plüss': 0, 'CEO': 0.14, 'von': 0, 'PostAuto': 0, 'zu': 0, 'den': 0.1, 'Fahrplanänderungen': 0.12, 'des': 0, 'öffentlichen': 0.08, 'Verkehrs': 0, 'während': 0, 'der': 0.1, 'Coronakrise': 0, 'Flexib': 1.0, '…': 0}",neutral,"[0.42644858, 0.33074734, 0.2428041]",,,,neutral
100.0,100.0,86.0,0.7,neutral,"RT @info_mobilitaet: ""Der öffentliche Verkehr wurde in der Corona-Pandemie kräftig durchgeschüttelt. Dennoch: Wir können stolz sein, wie kr…",öffentlich verkehr corona pandemie kräftigen durchschütteln dennoch stolz kr,,,,,,,,,,,,,,,,,,,,,,,,,,,,,,,,,,,,,,,,,,,,,,,,,"{'Der': 0.05, 'öffentliche': 0.07, 'Verkehr': 0, 'wurde': 0, 'in': 0.04, 'der': 0.05, 'Corona-Pandemie': 0, 'kräftig': 0, 'durchgeschüttelt': 0.05, 'Dennoch': 0, 'Wir': 0.14, 'können': 0.08, 'stolz': 0, 'sein': 0, 'wie': 0.91, 'kr': 1.0, '…': 0}",positive,"[0.033624135, 0.025833521, 0.94054234]",,,,positive
50.0,75.0,57.0,0.0,neutral,RT @info_mobilitaet: Welchen Beitrag zur Schweizer Volkswirtschaft leistet der öffentliche Verkehr in der Schweiz? Wieviele Leute arbeiten…,welch beitrag schweizer volkswirtschaft leisten öffentlich verkehr schweiz wieviele leute arbeiten,,,,,,,,,,,,,,,,,,,,,,,,,,,,,,,,,,,,,,,,,,,,,,,,,"{'Welchen': 0, 'Beitrag': 0, 'zur': 0.18, 'Schweizer': 0.19, 'Volkswirtschaft': 0.35, 'leistet': 0, 'der': 0.16, 'öffentliche': 0.82, 'Verkehr': 0, 'in': 0, 'Schweiz': 0, 'Wieviele': 0.08499999999999999, 'Leute': 0.1, 'arbeiten': 0.23, '…': 0}",neutral,"[0.79699016, 0.13101193, 0.0719979]",,,,neutral
50.0,75.0,57.0,0.0,neutral,"RT @info_mobilitaet: Die neuen LITRA-Verkehrszahlen entstehen! 
#litra #öv #öffentlicherverkehr #publictransport #workinprogress https://t.…",neu litra verkehrszahlen entstehen litra öv öffentlicherverkehr publictransport workinprogress,,,,,,,,,,,,,,,,,,,,,,,,,,,,,,,,,,,,,,,,,,,,,,,,,"{'Die': 0.34, 'neuen': 0.57, 'LITRA-Verkehrszahlen': 0.6625, 'entstehen': 0, 'litra': 0, 'öv': 0, 'öffentlicherverkehr': 0.09, 'publictransport': 0.24, 'workinprogress': 0.3}",positive,"[0.06121274, 0.051190417, 0.8875969]",,,,neutral
0.0,0.0,0.0,-1.0,negative,"RT @CVP_PDC: Auch der öffentliche Verkehr leidet unter der #Corona-Krise. Obwohl über 80% der Kunden ausbleiben, muss fast das gleiche Ange…",öffentlich verkehr leiden corona krise obwohl kunden ausbleiben fast gleich ange,,,,,,,,,,,,,,,,,,,,,,,,,,,,,,,,,,,,,,,,,,,,,,,,,"{'Auch': 0.25, 'der': 0.09, 'öffentliche': 0.05, 'Verkehr': 0, 'leidet': 0, 'unter': 0, 'Corona-Krise': 0, 'Obwohl': 0, 'über': 0.05, 'Kunden': 0.07, 'ausbleiben': 0, 'muss': 0, 'fast': 0, 'das': 0, 'gleiche': 0.45, 'Ange': 0, '…': 0}",negative,"[0.09320836, 0.8599781, 0.046813507]",,,,negative
100.0,100.0,86.0,0.7,neutral,"Die LITRA sucht per 01.06.2020 oder nach Vereinbarung eine/n engagierte/n Geschäftsführer/-in (80-100%). Wir wenden uns an dienstleistungsorientierte, flexible und selbstständige Persönlichkeiten, welche sich für einen starken öffentlichen Verkehr engagieren wollen. https://t.co/tkJUNXW4ag",litra suchen per vereinbarung n engagieren n geschäftsführer wenden dienstleistungsorientierte flexible selbstständige persönlichkeiten welch stark öffentlich verkehr engagieren,,,,,,,,,,,,,,,,,,,,,,,,,,,,,,,,,,,,,,,,,,,,,,,,,"{'Die': 0, 'LITRA': 0, 'sucht': 0, 'per': 0, '01.06.2020': 0, 'oder': 0.12, 'nach': 0, 'Vereinbarung': 0.36, 'eine': 0, 'n': 0, 'engagierte': 0.08, 'Geschäftsführer/-in': 0, 'Wir': 1.0, 'wenden': 0, 'uns': 0, 'an': 0, 'dienstleistungsorientierte': 0, 'flexible': 0.75, 'und': 0.21, 'selbstständige': 0, 'Persönlichkeiten': 0.51, 'welche': 0, 'sich': 0, 'für': 0.12, 'einen': 0.07, 'starken': 0, 'öffentlichen': 0.14, 'Verkehr': 0, 'engagieren': 0, 'wollen': 0.15}",neutral,"[0.42355746, 0.3954663, 0.18097623]",,,,positive
50.0,75.0,57.0,0.0,neutral,RT @info_mobilitaet: Reminder Prix LITRA 2019: Der Förderpreis für neue Impulse im öffentlichen Verkehr - https://t.co/JAGprxOn2M https://t…,reminder prix litra förderpreis neue impulse öffentlich verkehr,,,,,,,,,,,,,,,,,,,,,,,,,,,,,,,,,,,,,,,,,,,,,,,,,"{'Reminder': 0.29, 'Prix': 0, 'LITRA': 0, 'Der': 0.31, 'Förderpreis': 0.41000000000000003, 'für': 0.22, 'neue': 0.11, 'Impulse': 0, 'im': 0, 'öffentlichen': 0.2, 'Verkehr': 0}",positive,"[0.3832598, 0.17752063, 0.43921953]",,,,neutral
50.0,75.0,57.0,0.0,neutral,RT @info_mobilitaet: Reminder Prix LITRA 2019: Der Förderpreis für neue Impulse im öffentlichen Verkehr - https://t.co/8Zdy3o4eNt https://t…,reminder prix litra förderpreis neue impulse öffentlich verkehr,,,,,,,,,,,,,,,,,,,,,,,,,,,,,,,,,,,,,,,,,,,,,,,,,"{'Reminder': 0.29, 'Prix': 0, 'LITRA': 0, 'Der': 0.31, 'Förderpreis': 0.41000000000000003, 'für': 0.22, 'neue': 0.11, 'Impulse': 0, 'im': 0, 'öffentlichen': 0.2, 'Verkehr': 0}",positive,"[0.3832598, 0.17752063, 0.43921953]",,,,neutral
100.0,100.0,86.0,0.7,neutral,RT @info_mobilitaet: Einladung zur Medienkonferenz «Wie können wir den Modalsplit im öffentlichen Verkehr erhöhen?» durchgeführt von @AREsc…,einladung medienkonferenz modalsplit öffentlich verkehr erhöhen durchführen,,,,,,,,,,,,,,,,,,,,,,,,,,,,,,,,,,,,,,,,,,,,,,,,,"{'Einladung': 0.17, 'zur': 0.07, 'Medienkonferenz': 0.08499999999999999, '«': 0, 'Wie': 0, 'können': 0, 'wir': 0, 'den': 0, 'Modalsplit': 0, 'im': 0, 'öffentlichen': 0, 'Verkehr': 0, 'erhöhen': 0, '»': 0, 'durchgeführt': 0, 'von': 0, '…': 0}",neutral,"[0.8258129, 0.12881495, 0.04537219]",,,,positive
50.0,75.0,57.0,0.0,neutral,"RT @KathyRiklin: Interessante Karte zur Nutzung des öffentlichen Verkehrs #ÖV. Es gibt offensichtlich ÖV-Wüsten, z.B. Ticino! Referat bei L…",interessante karte nutzung öffentlich verkehrs öv geben offensichtlich öv wüst z b ticino referat l,,,,,,,,,,,,,,,,,,,,,,,,,,,,,,,,,,,,,,,,,,,,,,,,,"{'Interessante': 0.9, 'Karte': 0.37, 'zur': 0, 'Nutzung': 0, 'des': 0, 'öffentlichen': 0.47, 'Verkehrs': 0, 'ÖV': 0, 'Es': 0, 'gibt': 0.84, 'offensichtlich': 1.0, 'ÖV-Wüsten': 0.6174999999999999, 'z.B.': 0, 'Ticino': 0.27, 'Referat': 0, 'bei': 0.07, 'L': 0.08, '…': 0}",positive,"[0.035494294, 0.027420439, 0.9370852]",,,,neutral
100.0,100.0,100.0,1.0,neutral,"Dank der @CVP_PDC werden Massnahmen für die finanzielle Förderung von umweltfreundlichen und klimaneutralen Bussen für den öffentlichen Verkehr geprüft. #klimapolitik #öffentlicherverkehr #öv
https://t.co/bawu96466O",danken massnahmen finanzielle förderung umweltfreundlich klimaneutralen bussen öffentlich verkehr prüfen klimapolitik öffentlicherverkehr öv,,,,,,,,,,,,,,,,,,,,,,,,,,,,,,,,,,,,,,,,,,,,,,,,,"{'Dank': 0.14500000000000002, 'der': 0.11, 'werden': 0, 'Massnahmen': 0.13, 'für': 0.16, 'die': 0.11, 'finanzielle': 0.12, 'Förderung': 0.105, 'von': 0, 'umweltfreundlichen': 0.095, 'und': 0.11, 'klimaneutralen': 0.14, 'Bussen': 0.25, 'den': 0.11, 'öffentlichen': 0.05, 'Verkehr': 0, 'geprüft': 0, 'klimapolitik': 0.15000000000000002, 'öffentlicherverkehr': 0.09, 'öv': 0}",neutral,"[0.84482104, 0.09304588, 0.062133197]",,,,positive
75.0,100.0,86.0,0.5,neutral,"RT @CVP_GR: Die CVP setzt sich für die Digitalisierung, die Sicherheit, gute Verbindungen im öffentlichen Verkehr und weniger Bürokratie ei…",cvp setzen digitalisierung sicherheit gut verbindungen öffentlich verkehr wenig bürokratie ei,,,,,,,,,,,,,,,,,,,,,,,,,,,,,,,,,,"{'Die': 0.5, 'CVP': 0.52, 'setzt': 0, 'sich': 0, 'für': 0, 'die': 0.5, 'Digitalisierung': 0, 'Sicherheit': 0.59, 'gute': 0, 'Verbindungen': 0, 'im': 0, 'öffentlichen': 0.15, 'Verkehr': 0, 'und': 0.24, 'weniger': 0, 'Bürokratie': 0.45, 'ei': 0, '…': 0}",positive,"[0.006862989, 0.0025661753, 0.9905709]",,,,,,,"{'Die': 0.12, 'CVP': 0.08, 'setzt': 0, 'sich': 0, 'für': 0, 'die': 0.12, 'Digitalisierung': 0, 'Sicherheit': 1.0, 'gute': 0, 'Verbindungen': 0, 'im': 0, 'öffentlichen': 0.03, 'Verkehr': 0, 'und': 0.3, 'weniger': 0, 'Bürokratie': 0.07, 'ei': 0, '…': 0}",positive,"[0.002548604, 0.0013557922, 0.9960956]",,,,"{'Die': 0.12, 'CVP': 0.14, 'setzt': 0, 'sich': 0, 'für': 0, 'die': 0.12, 'Digitalisierung': 0, 'Sicherheit': 0.11, 'gute': 0, 'Verbindungen': 0, 'im': 0, 'öffentlichen': 0.04, 'Verkehr': 0, 'und': 0.26, 'weniger': 0, 'Bürokratie': 0.42, 'ei': 0, '…': 0}",negative,"[0.25470376, 0.49821067, 0.24708559]",,,,positive
50.0,75.0,57.0,0.0,neutral,Besichtigung #Ceneri #Basistunnel in #Camorino mit der #NEAT #Aufsichtsdelegation - eine weitere Bereicherung für den öffentlichen Verkehr in der Schweiz ab Dezember 2020 @info_mobilitaet https://t.co/rsgrmgqNpD,besichtigung ceneri basistunnel camorino neat aufsichtsdelegation weit bereicherung öffentlich verkehr schweiz ab dezember,,,,,,,,,,,,,,,,,,,,,,,,,,,,,,,,,,,,,,,,,,,,,,,,,"{'Besichtigung': 0, 'Ceneri': 0, 'Basistunnel': 0, 'in': 0.16, 'Camorino': 0.09, 'mit': 0.09, 'der': 0.13, 'NEAT': 0.37, 'Aufsichtsdelegation': 0.24, 'eine': 0, 'weitere': 0, 'Bereicherung': 0.44, 'für': 0.49, 'den': 0.13, 'öffentlichen': 0.14, 'Verkehr': 0, 'Schweiz': 0.36, 'ab': 0, 'Dezember': 0.28}",neutral,"[0.49298233, 0.1723615, 0.3346562]",,,,neutral
0.0,0.0,14.0,-0.7,neutral,RT @info_mobilitaet: Der öffentliche Verkehr in der Schweiz ist ein wichtiger Träger des Service public in der Schweiz. LITRA-Präsident Mar…,öffentlich verkehr schweiz wichtig träger service public schweiz litra präsident mar,,,,,,,,,,,,,,,,,,,,,,,,,,,,,,,,,,,,,,,,,,,,,,,,,"{'Der': 0, 'öffentliche': 0.03, 'Verkehr': 0, 'in': 0.04, 'der': 0, 'Schweiz': 0.08, 'ist': 0.19, 'ein': 0, 'wichtiger': 0.2, 'Träger': 0, 'des': 0, 'Service': 0.05, 'public': 0.03, 'LITRA-Präsident': 0.44999999999999996, 'Mar': 0.3, '…': 0}",positive,"[0.13009779, 0.07613461, 0.79376763]",,,,negative
100.0,100.0,100.0,1.0,neutral,#Wiesener #Viadukt und #Landwasserviadukt - hervorragender Familienausflug mit dem öffentlichen Verkehr @info_mobilitaet @Graubunden @historic_rhb @rhaetischebahn @graubuendner @DavosKlosters @Savognin_Info @albula https://t.co/KwKE2KB4hg,wiesener viadukt landwasserviadukt hervorragend familienausflug öffentlich verkehr,,,,,,,,,,,,,,,,,,,,,,,,,,,,,,,,,,,,,,,,,,,,,,,,,"{'Wiesener': 0.13, 'Viadukt': 0, 'und': 0.08, 'Landwasserviadukt': 0.32, 'hervorragender': 1.0, 'Familienausflug': 0.24, 'mit': 0, 'dem': 0, 'öffentlichen': 0.06, 'Verkehr': 0}",positive,"[0.00647546, 0.004235547, 0.98928905]",,,,positive
50.0,75.0,57.0,0.0,neutral,"RT @info_mobilitaet: Prix LITRA: Der Förderpreis für neue Impulse im öffentlichen Verkehr
Er richtet sich an alle Studierenden von Schweize…",prix litra förderpreis neue impulse öffentlich verkehr richten all studierend schweize,,,,,,,,,,,,,,,,,,,,,,,,,,,,,,,,,,,,,,,,,,,,,,,,,"{'Prix': 0, 'LITRA': 0, 'Der': 0.04, 'Förderpreis': 0.08, 'für': 0.06, 'neue': 0.09, 'Impulse': 0, 'im': 0, 'öffentlichen': 0.05, 'Verkehr': 0, 'Er': 0.12, 'richtet': 0, 'sich': 0, 'an': 0, 'alle': 0, 'Studierenden': 0.88, 'von': 0.48, 'Schweize': 0, '…': 0}",neutral,"[0.7754308, 0.14015709, 0.08441211]",,,,neutral
0.0,0.0,0.0,-1.0,negative,RT @info_mobilitaet: Keine Rosenpickerei durch Fernbusse im öffentlichen Verkehr der Schweiz. Der Regionalverkehr soll nicht gefährdet werd…,rosenpickerei fernbusse öffentlich verkehr schweiz regionalverkehr gefährden werd,,,,,,,,,,,,,,,,,,,,,,,,,,,,,,,,,,,,,,,,,,,,,,,,,"{'Keine': 0, 'Rosenpickerei': 0, 'durch': 0, 'Fernbusse': 0.06, 'im': 0, 'öffentlichen': 0.05, 'Verkehr': 1.0, 'der': 0, 'Schweiz': 0.07, 'Der': 0, 'Regionalverkehr': 0.59, 'soll': 0, 'nicht': 0.59, 'gefährdet': 1.0, 'werd': 0, '…': 0}",positive,"[0.16773349, 0.075995445, 0.756271]",,,,negative
50.0,75.0,57.0,0.0,neutral,"RT @info_mobilitaet: Wie ist der öffentliche Verkehr aktuell finanziert, welche Geldflüsse gibt es und wozu dienen sie? Eine Übersicht. htt…",öffentlich verkehr aktuell finanzieren welch geldflüsse geben wozu dienen übersicht htt,,,,,,,,,,,,,,,,,,,,,,,,,,,,,,,,,,,,,,,,,,,,,,,,,"{'Wie': 0, 'ist': 0.08, 'der': 0, 'öffentliche': 0.14, 'Verkehr': 0, 'aktuell': 0, 'finanziert': 0.27, 'welche': 0, 'Geldflüsse': 0.2, 'gibt': 0.08, 'es': 0.08, 'und': 0.16, 'wozu': 0.15000000000000002, 'dienen': 0, 'sie': 0, 'Eine': 0, 'Übersicht': 1.0, 'htt': 0.66, '…': 0}",neutral,"[0.8450193, 0.10730319, 0.047677442]",,,,neutral
100.0,100.0,86.0,0.7,neutral,RT @info_mobilitaet: Vielen Dank für das JA zum NAF! ein wichtiger Beitrag auch für den öffentlichen Verkehr! #abst17 @JAzumNAF https://t.c…,danken ja naf wichtig beitrag öffentlich verkehr abst17,,,,,,,,,,,,,,,,,,,,,,,,,,,,,,,,,,,,,,,,,,,,,,,,,"{'Vielen': 0, 'Dank': 0.06, 'für': 0.07, 'das': 0, 'JA': 0, 'zum': 0.06, 'NAF': 0.1, 'ein': 0, 'wichtiger': 0.09, 'Beitrag': 0.14, 'auch': 0, 'den': 0.06, 'öffentlichen': 0.08, 'Verkehr': 0, 'abst17': 1.0}",positive,"[0.119210415, 0.07060086, 0.8101887]",,,,positive
100.0,100.0,100.0,1.0,neutral,RT @info_mobilitaet: Die LITRA und der Verband öffentlicher Verkehr (VöV) sind sehr erfreut über das klare Ja zum NAF! #naf #abst17 @JAzumN…,litra verbinden öffentlich verkehr vöv erfreuen klaren ja naf naf abst17,,,,,,,,,,,,,,,,,,,,,,,,,,,,,,,,,,,,,,,,,,,,,,,,,"{'Die': 0.29, 'LITRA': 0, 'und': 0.06, 'der': 0.29, 'Verband': 0, 'öffentlicher': 0.05, 'Verkehr': 0, 'VöV': 0, 'sind': 0.11, 'sehr': 0.13, 'erfreut': 0.44, 'über': 0, 'das': 0, 'klare': 0, 'Ja': 0.06, 'zum': 0.44999999999999996, 'NAF': 0.09, 'naf': 0.09, 'abst17': 0.15, '…': 0}",positive,"[0.008262734, 0.0073601906, 0.984377]",,,,positive
50.0,75.0,57.0,0.0,neutral,Öffentlicher Verkehr auf der Strasse #jazumnaf @JAzumNAF #öv #chur #postauto @PostAuto @Churtourismus https://t.co/g6aPfTsCcQ,öffentlich verkehr strasse jazumnaf öv chur postauto,,,,,,,,,,,,,,,,,,,,,,,,,,,,,,,,,,,,,,,,,,,,,,,,,"{'Öffentlicher': 1.0, 'Verkehr': 0, 'auf': 0.25, 'der': 0.24, 'Strasse': 0, 'jazumnaf': 0.41, 'öv': 0, 'chur': 0, 'postauto': 0.2}",positive,"[0.31886712, 0.046077587, 0.6350553]",,,,neutral
100.0,100.0,86.0,0.7,neutral,"RT @info_mobilitaet: VöV und LITRA sagen ja zum NAF, der wichtig für den öffentlichen Verkehr ist. @JAzumNAF https://t.co/XDfPq09FzT",vöv litra sagen ja naf wichtig öffentlich verkehr,,,,,,,,,,,,,,,,,,,,,,,,,,,,,,,,,,,,,,,,,,,,,,,,,"{'VöV': 0, 'und': 0.13, 'LITRA': 0, 'sagen': 0.12, 'ja': 0.13, 'zum': 0.15000000000000002, 'NAF': 0.33, 'der': 0.17, 'wichtig': 0.46, 'für': 0.88, 'den': 0.17, 'öffentlichen': 1.0, 'Verkehr': 0, 'ist': 0.23}",positive,"[0.050713126, 0.010275072, 0.93901175]",,,,positive
50.0,75.0,57.0,0.0,neutral,Der öffentliche Verkehr braucht die Strasse https://t.co/UuL2yYOIrE via @tagesanzeiger,öffentlich verkehr brauchen strasse via,,,,,,,,,,,,,,,,,,,,,,,,,,,,,,,,,,,,,,,,,,,,,,,,,"{'Der': 0.36, 'öffentliche': 0.25, 'Verkehr': 0, 'braucht': 0.49, 'die': 0.36, 'Strasse': 0, 'via': 1.0}",positive,"[0.36918077, 0.02913032, 0.6016889]",,,,neutral
100.0,100.0,100.0,1.0,neutral,RT @Blickch: 94 Prozent finden den öffentlichen Verkehr «zuverlässig»: Niemand liebt den ÖV so innig wie die Schweizer https://t.co/QsyXvyt…,prozent finden öffentlich verkehr zuverlässig niemand lieben öv innig schweizer,,,,,,,,,,,,,,,,,,,,,,,,,,,,,,,,,,,,,,,,,,,,,,,,,"{'Prozent': 1.0, 'finden': 1.0, 'den': 0, 'öffentlichen': 0.1, 'Verkehr': 0, '«': 0, 'zuverlässig': 0, '»': 0, 'Niemand': 0, 'liebt': 0, 'ÖV': 0, 'so': 0, 'innig': 0, 'wie': 0, 'die': 0, 'Schweizer': 0}",positive,"[0.07381011, 0.084473625, 0.84171623]",,,,positive
50.0,75.0,57.0,0.0,neutral,"Mit dem #öffentlichen #Verkehr unterwegs im #Tessin 
#lagomaggiore #FLMS #FART @AutoPostale @CardadaCimetta @asconalocarno @info_mobilitaet https://t.co/zzGpIULXc3",öffentlich verkehr unterwegs tessin lagomaggiore flms fart,,,,,,,,,,,,,,,,,,,,,,,,,,,,,,,,,,,,,,,,,,,,,,,,,"{'Mit': 1.0, 'dem': 0.12, 'öffentlichen': 1.0, 'Verkehr': 0.8, 'unterwegs': 0.15, 'im': 0, 'Tessin': 0, 'lagomaggiore': 0.16, 'FLMS': 0.06, 'FART': 0.15}",neutral,"[0.94275516, 0.031571396, 0.02567347]",,,,neutral
50.0,75.0,57.0,0.0,neutral,Die #Vielfalt des #öffentlichen #Verkehrs in der #Schweiz in #Miniatur @swissminiatur @info_mobilitaet @PostAuto @swissairlines @sbbnews https://t.co/oX4gEmEoXz,vielfalt öffentlich verkehrs schweiz miniatur,,,,,,,,,,,,,,,,,,,,,,,,,,,,,,,,,,,,,,,,,,,,,,,,,"{'Die': 0.25, 'Vielfalt': 0.33, 'des': 0, 'öffentlichen': 0.53, 'Verkehrs': 0, 'in': 0.21, 'der': 0.25, 'Schweiz': 0.31, 'Miniatur': 0.37}",negative,"[0.19042204, 0.63102823, 0.17854968]",,,,neutral
