75.0,75.0,71.0,0.3333333333333333,neutral,"Die vom Bundesrat beschlossene Anpassung der #Jagdverordnung ist reine Kosmetik. Das exponentielle Wachstum des Wolfsbestandes muss wirksam gebremst werden. #Landwirtschaft und #Tourismus leiden im #Berggebiet enorm. Es braucht griffigere Instrumente.
https://t.co/dHkOyQ5vMN",bundesrat beschlossen anpassung jagdverordnung reine kosmetik exponentielle wachstum wolfsbestandes wirksam bremsen landwirtschaft tourismus leiden berggebiet enorm brauchen griffig instrumente,,,,,,,,,,,,,,,,,,,,,,,,,,,,,,,,,,,,,,,,,,,,,,,,,,,,"{'Die': 0.15, 'vom': 0.15, 'Bundesrat': 0.02, 'beschlossene': 0.04, 'Anpassung': 0, 'der': 0.15, 'Jagdverordnung': 0, 'ist': 0.03, 'reine': 0, 'Kosmetik': 0.05, 'Das': 0.15, 'exponentielle': 0.11, 'Wachstum': 0.08, 'des': 0, 'Wolfsbestandes': 0.04, 'muss': 0, 'wirksam': 0, 'gebremst': 0, 'werden': 0, 'Landwirtschaft': 0.41, 'und': 0.16, 'Tourismus': 0.16, 'leiden': 0, 'im': 0, 'Berggebiet': 0.12, 'enorm': 0, 'Es': 0.03, 'braucht': 0, 'griffigere': 0, 'Instrumente': 0.06}",negative,"[0.0043746615, 0.8929158, 0.10270958]",positive
50.0,75.0,57.0,0.0,neutral,"RT @Mitte_Centre: ""Das Freihandelsabkommen birgt kein Risiko für die Schweizer Landwirtschaft. Aus diesem Grund wird das Abkommen mit Indon…",freihandelsabkommen bergen risiko schweizer landwirtschaft grund abkommen indon,,,,,,,,,,,,,,,,,,,,,,,,,,,,,,,,,,,,,,,,,,,,,,,,,,,,"{'Das': 0.02, 'Freihandelsabkommen': 0, 'birgt': 0, 'kein': 0, 'Risiko': 1.0, 'für': 0.03, 'die': 0.02, 'Schweizer': 0.06, 'Landwirtschaft': 0.15, 'Aus': 0, 'diesem': 0.04, 'Grund': 0, 'wird': 0, 'das': 0, 'Abkommen': 0.04, 'mit': 0.02, 'Indon': 0, '…': 0}",positive,"[0.25672263, 0.0116331065, 0.7316443]",neutral
50.0,75.0,57.0,0.0,neutral,RT @BuendnerBauern: Die Alpwirtschaft und Berglandwirtschaft braucht ein JA zum Jagdgsetz @JagdgesetzJa @buendnerjajagdgesetz https://t.co/…,alpwirtschaft berglandwirtschaft brauchen ja jagdgsetz,,,,,,,,,,,,,,,,,,,,,,,,,,,,,,,,,,,,,,,,,,,,,,,,,,,,"{'Die': 0.16, 'Alpwirtschaft': 0.22, 'und': 0.42, 'Berglandwirtschaft': 0.15, 'braucht': 0, 'ein': 0, 'JA': 0.42, 'zum': 0.335, 'Jagdgsetz': 0}",positive,"[0.0067467927, 0.0031004937, 0.99015266]",neutral
0.0,0.0,0.0,-1.0,neutral,"RT @BuendnerBauern: Die Berg- und Alplandwirtschaft bemüht sich sehr um den Herdenschutz mit massiven Mehraufwendungen, aber tektonisch ist…",berg alplandwirtschaft bemühen herdenschutz massiv mehraufwendungen tektonisch,,,,,,,,,,,,,,,,,,,,,,,,,,,,,,,,,,,,,,,,,,,,,,,,,,,,"{'Die': 0.05, 'Berg-': 0, 'und': 0.05, 'Alplandwirtschaft': 0.05, 'bemüht': 0, 'sich': 0, 'sehr': 0.04, 'um': 0, 'den': 0.05, 'Herdenschutz': 0, 'mit': 0.07, 'massiven': 0.1, 'Mehraufwendungen': 0.07, 'aber': 0.79, 'tektonisch': 1.0, 'ist': 1.0, '…': 0}",positive,"[0.0076664286, 0.007774238, 0.98455936]",negative
75.0,100.0,86.0,0.5,neutral,"RT @JagdgesetzJa: Wolfbestand-Zunahme bringt leider immer mehr Konflikte mit Landwirtschaft &amp; Bevölkerung. Es ist richtig, dass Kompetenz z…",wolfbestand zunahme bringen leider immer mehr konflikte landwirtschaft amp bevölkerung richtig kompetenz z,,,,,,,,,,,,,,,,,,,,,,,,,,,,,,,,,,,,,,,,,,,,,,,,,,,,"{'Wolfbestand-Zunahme': 0.185, 'bringt': 0.28, 'leider': 0.22, 'immer': 0, 'mehr': 0.28, 'Konflikte': 1.0, 'mit': 0.51, 'Landwirtschaft': 1.0, 'amp': 0.1, 'Bevölkerung': 0.22, 'Es': 0.05, 'ist': 0.05, 'richtig': 0.16, 'dass': 0.04, 'Kompetenz': 0.08, 'z': 0.51, '…': 0}",positive,"[0.024939856, 0.3670019, 0.6080583]",positive
50.0,75.0,57.0,0.0,neutral,#Helikopter braucht es überall. Auch an der #Agrischa Erlebnis #Landwirtschaft in #Zernez wurden die viefältigen Einsätze der #Helikopterbranche erklärt und aufgezeigt. Danke #Heli #Bernina! @SHA_Swiss @ScuolSamnaun @Graubunden https://t.co/Xi0jqFKnPl,helikopter brauchen überall agrischa erlebnis landwirtschaft zernez viefältigen einsätze helikopterbranche erklären aufzeigen danke heli bernina,,,,,,,,,,,,,,,,,,,,,,,,,,,,,,,,,,,,,,,,,,,,,,,,,,,,"{'Helikopter': 0.08, 'braucht': 0, 'es': 0, 'überall': 0, 'Auch': 0.11, 'an': 0, 'der': 0.04, 'Agrischa': 0, 'Erlebnis': 0, 'Landwirtschaft': 0, 'in': 0.06, 'Zernez': 0.18, 'wurden': 0, 'die': 0.04, 'viefältigen': 0, 'Einsätze': 0, 'Helikopterbranche': 0.08, 'erklärt': 0.13, 'und': 0.06, 'aufgezeigt': 0, 'Danke': 0.665, 'Heli': 0.31, 'Bernina': 0.84}",positive,"[0.22677436, 0.12620121, 0.6470244]",neutral
50.0,75.0,57.0,0.0,neutral,"Nach einem Referat von #Regierungsratskandidat @mcaduff zur Bedeutung der #Landwirtschaft in der #Surselva kämpft Markus #Ritter bei der #CVP Surselva in #Degen engagiert und mit viel Herzblut für Geschlossenheit, Einheit und Einsatz @CVP_PDC @CVP_GR @sbv https://t.co/TTFncyG4ed",referat regierungsratskandidat bedeutung landwirtschaft surselva kämpfen markus ritter cvp surselva degen engagieren herzblut geschlossenheit einheit einsatz,,,,,,,,,,,,,,,,,,,,,,,,,,,,,,,,,,,,,,,,,,,,,,,,,,,,"{'Nach': 0, 'einem': 0, 'Referat': 0, 'von': 0, 'Regierungsratskandidat': 0, 'zur': 0.06, 'Bedeutung': 1.0, 'der': 0.06, 'Landwirtschaft': 1.0, 'in': 0.06, 'Surselva': 0.08, 'kämpft': 0.15, 'Markus': 0.08, 'Ritter': 0.07, 'bei': 0.07, 'CVP': 0.06, 'Degen': 0.06, 'engagiert': 0, 'und': 0.05, 'mit': 0.09, 'viel': 0.055, 'Herzblut': 0.05, 'für': 0.06, 'Geschlossenheit': 0.1, 'Einheit': 0, 'Einsatz': 0}",positive,"[0.010144579, 0.0049389647, 0.98491645]",neutral
50.0,75.0,57.0,0.0,neutral,RT @CVP_PDC: Die CVP-Fraktion diskutierte heute über die Reform der Altersvorsorge und den Zahlungsrahmen für die Landwirtschaft. https://t…,cvp fraktion diskutieren heute reform altersvorsorge zahlungsrahmen landwirtschaft,,,,,,,,,,,,,,,,,,,,,,,,,,,,,,,,,,,,,,,,,,,,,,,,,,,,"{'Die': 0.16, 'CVP-Fraktion': 0, 'diskutierte': 1.0, 'heute': 1.0, 'über': 0, 'die': 0.16, 'Reform': 0.29, 'der': 0.16, 'Altersvorsorge': 0, 'und': 0.26, 'den': 0.16, 'Zahlungsrahmen': 0.21, 'für': 0, 'Landwirtschaft': 0}",neutral,"[0.9656912, 0.004926373, 0.029382335]",neutral
0.0,0.0,0.0,-1.0,neutral,"RT @CVP_PDC: #Milchkuh schadet dem ÖV, zerschiesst Armee, hungert Landwirtschaft aus und haut Bildung um. https://t.co/y1MasqefMH https://t…",milchkuh schaden öv zerschiesst armee hungern landwirtschaft haut bildung,,,,,,,,,,,,,,,,,,,,,,,,,,,,,,,,,,,,,,,,,,,,,,,,,,,,"{'Milchkuh': 0.2, 'schadet': 0.68, 'dem': 0.17, 'ÖV': 0, 'zerschiesst': 1.0, 'Armee': 0.24, 'hungert': 0, 'Landwirtschaft': 0.32, 'aus': 0, 'und': 0.58, 'haut': 0, 'Bildung': 0.18, 'um': 0}",positive,"[0.3469215, 0.03989886, 0.6131797]",negative
