answer_five,answer_four,answer_seven,polarity,sentiment_gs,tweet,tweet_tokens,absa_token_weights_3414,absa_sentiment_3414,absa_scores_3414,absa_token_weights_3415,absa_sentiment_3415,absa_scores_3415,absa_token_weights_3431,absa_sentiment_3431,absa_scores_3431,absa_token_weights_3450,absa_sentiment_3450,absa_scores_3450,absa_token_weights_3458,absa_sentiment_3458,absa_scores_3458,absa_token_weights_3459,absa_sentiment_3459,absa_scores_3459,absa_token_weights_3466,absa_sentiment_3466,absa_scores_3466,absa_token_weights_3468,absa_sentiment_3468,absa_scores_3468,absa_token_weights_3475,absa_sentiment_3475,absa_scores_3475,absa_token_weights_3478,absa_sentiment_3478,absa_scores_3478,absa_token_weights_3479,absa_sentiment_3479,absa_scores_3479,sentiment_tb
50.0,75.0,57.0,0.0,neutral,"@BaSchaffner Great minds think alike 
#nein zur  #Kuendigungsinitiative, #nein zur  Mogelpackung Steuererlass für Einkommen über be 100'000, #nein zum Abschussgesetz, #ja zum Vaterschaftsurlaub",great minds think alike nein kuendigungsinitiative nein mogelpackung steuererlass einkommen be nein abschussgesetz ja vaterschaftsurlaub,"{'Great': 0.08, 'minds': 0.03, 'think': 0.03, 'alike': 0.05, 'nein': 0.23, 'zur': 0.525, 'Kuendigungsinitiative': 0, 'Mogelpackung': 0.04, 'Steuererlass': 0.04, 'für': 0.08, 'Einkommen': 0, 'über': 0.05, 'be': 0, ""100'000"": 0, 'zum': 0.525, 'Abschussgesetz': 0.11, 'ja': 0, 'Vaterschaftsurlaub': 0.7849999999999999}",positive,"[0.0016856064, 0.0012646492, 0.9970497]",,,,,,,,,,,,,,,,,,,,,,,,,,,,,,,neutral
50.0,75.0,57.0,0.0,neutral,"RT @hannesgassert: @spschweiz @papizeit Als Mitgründer eines Unternehmens, das seit über zehn Jahren vier Wochen #Vaterschaftsurlaub gibt,…",mitgründer unternehmens seit zehn jahren vier wochen vaterschaftsurlaub geben,"{'Als': 0, 'Mitgründer': 0, 'eines': 0, 'Unternehmens': 0.17, 'das': 0.07, 'seit': 0, 'über': 0.06, 'zehn': 0.09, 'Jahren': 0.13, 'vier': 0.19, 'Wochen': 0.3, 'Vaterschaftsurlaub': 0.38, 'gibt': 0, '…': 0}",neutral,"[0.96364826, 0.014576299, 0.021775516]",,,,,,,,,,,,,,,,,,,,,,,,,,,,,,,neutral
50.0,75.0,57.0,0.0,neutral,"@morvjn @operationlibero @grunliberale Die UK zeigt mit Brexit, dass man es auch kompliziert machen kann. Die Konsequenzen sind ein Disaster. Das mit den Sozialsystemen ist ein Urban Myth. Wer in der Schweiz arbeitet und in die AHV/ Pensionskasse einzahlt, soll auch eine Rente kriegen.",uk zeigen brexit komplizieren konsequenzen disaster sozialsystemen urban myth wer schweiz arbeiten ahv pensionskasse einzahlen rente kriegen,,,,"{'Die': 0.07, 'UK': 0.04, 'zeigt': 0, 'mit': 0.05, 'Brexit': 0.07, 'dass': 0.09, 'man': 0, 'es': 0.06, 'auch': 1.0, 'kompliziert': 0.04, 'machen': 0, 'kann': 0.03, 'Konsequenzen': 0.12, 'sind': 0.05, 'ein': 0, 'Disaster': 0.73, 'Das': 0.07, 'den': 0.07, 'Sozialsystemen': 0.04, 'ist': 0.06, 'Urban': 0.05, 'Myth': 0.19, 'Wer': 0.16, 'in': 0.05, 'der': 0.07, 'Schweiz': 0.08, 'arbeitet': 0.06, 'und': 0.07, 'die': 0.07, 'AHV': 0.08, 'Pensionskasse': 0.31, 'einzahlt': 0.18, 'soll': 0, 'eine': 0, 'Rente': 0, 'kriegen': 0}",negative,"[0.13378705, 0.83251876, 0.03369424]",,,,,,,,,,,,,,,,,,,,,,,,,,,,neutral
100.0,100.0,86.0,0.7,negative,"@rodochri90 @particleist @alliance_F @StojanovicNenad @operationlibero @laura_zme @KleinerFlavia @AOC Well you might want to check the results on the following
where @operationlibero beat the UDC
Durchsetzungsinitiative
Erleichterte Einbürgerung
NoBillag
Selbstbestimmungsinitiative
Kündigungsinitiative",well you might want to check the results on the following where beat the udc durchsetzungsinitiative erleichtern einbürgerung nobillag selbstbestimmungsinitiative kündigungsinitiative,,,,,,,"{'Well': 0.07, 'you': 0.06, 'might': 0.05, 'want': 0.04, 'to': 0.04, 'check': 0.09, 'the': 0.23, 'results': 0.09, 'on': 0.04, 'following': 0.08, 'where': 0.25, 'beat': 0.26, 'UDC': 0.15, 'Durchsetzungsinitiative': 0.26, 'Erleichterte': 0, 'Einbürgerung': 1.0, 'NoBillag': 0.5, 'Selbstbestimmungsinitiative': 0.34, 'Kündigungsinitiative': 0.25}",positive,"[0.028941257, 0.0071741357, 0.96388465]",,,,,,,,,,,,,,,,,,,,,,,,,positive
100.0,100.0,86.0,0.7,neutral,RT @PKoppenburgCH: ⬅️ #Doppelbürger durch erleichterte Einbürgerung https://t.co/zkWpyilVbW,doppelbürger erleichtern einbürgerung,,,,,,,"{'⬅': 0, '️': 0, 'Doppelbürger': 0, 'durch': 0, 'erleichterte': 0, 'Einbürgerung': 0}",positive,"[0.35463205, 0.013714063, 0.6316539]",,,,,,,,,,,,,,,,,,,,,,,,,positive
50.0,75.0,57.0,0.0,negative,"@BaSchaffner @grunliberale @tagesanzeiger #Lenkungsabgaben funktionieren jetzt schon. 25 Rappen/Liter auf Heizöl und 6 von 10 Heizungssanierungen oder Neubau installieren erneuerbare Energie. Das ist noch nicht genügend, aber das wäre ein Anfang auch beim Treibstoff. #EsistZeit @grunliberale",lenkungsabgaben funktionieren schon rappen liter heizöl heizungssanierungen neubau installieren erneuerbare energie genügen anfang beim treibstoff esistzeit,,,,,,,,,,"{'Lenkungsabgaben': 0.13, 'funktionieren': 0, 'jetzt': 0, 'schon': 0, 'Rappen': 0, 'Liter': 0.1, 'auf': 0.13, 'Heizöl': 0.1, 'und': 0.25, 'von': 0, 'Heizungssanierungen': 0.135, 'oder': 0.26, 'Neubau': 0.16, 'installieren': 1.0, 'erneuerbare': 0.91, 'Energie': 0.52, 'Das': 0, 'ist': 0.11, 'noch': 0.12, 'nicht': 0.41, 'genügend': 0.11, 'aber': 0.05, 'das': 0.07, 'wäre': 0.07, 'ein': 0, 'Anfang': 0, 'auch': 0, 'beim': 0, 'Treibstoff': 0.15, 'EsistZeit': 0}",neutral,"[0.7174256, 0.26532048, 0.017253883]",,,,,,,,,,,,,,,,,,,,,,neutral
100.0,100.0,86.0,0.7,neutral,"Franz und Pietro - Physiker und Arzt im Gespräch.

Energie sparen reicht nicht! Um auf erneuerbare Energien umzusteigen, müssen wir die grossen Treibhausgas Beiträge CO2 neutral machen. 
https://t.co/95bx36bVId
@pietrovernazza @glpzh @glp_sg  #EsistZeit

Heute #Klimademo in Bern! https://t.co/2xCHoiCl0V",franz pietro physiker arzt gespräch energie sparen reichen erneuerbare energien umsteigen müssen grossen treibhausgas beiträge co2 neutral esistzeit heute klimademo bern,,,,,,,,,,"{'Franz': 0.03, 'und': 0.03, 'Pietro': 0.03, 'Physiker': 0, 'Arzt': 0.05, 'im': 0, 'Gespräch': 0.08, 'Energie': 0.1, 'sparen': 0, 'reicht': 0, 'nicht': 0.03, 'Um': 0, 'auf': 0, 'erneuerbare': 0.71, 'Energien': 0.41, 'umzusteigen': 0.535, 'müssen': 0.1, 'wir': 0, 'die': 0.07, 'grossen': 0, 'Treibhausgas': 0.095, 'Beiträge': 0.06, 'CO2': 0.1, 'neutral': 0.09, 'machen': 0, 'EsistZeit': 0, 'Heute': 0.09, 'Klimademo': 0.22, 'in': 0.12, 'Bern': 0.12}",neutral,"[0.46207982, 0.10968096, 0.4282393]",,,,,,,,,,,,,,,,,,,,,,positive
100.0,100.0,86.0,0.7,neutral,"""Barbara Schaffner weiss als Physikerin, was es braucht um ganz von fossilen Brennstoffen auf erneuerbare Energien umzusteigen. Sie ist zielorientiert und man will sie im Team haben."" https://t.co/u8CGGbi1GL",barbara schaffner weiss physikerin brauchen ganz fossil brennstoffen erneuerbare energien umsteigen zielorientiert team,,,,,,,,,,"{'Barbara': 0.04, 'Schaffner': 0.05, 'weiss': 0, 'als': 0.02, 'Physikerin': 0.03, 'was': 0, 'es': 0.07, 'braucht': 0, 'um': 0.02, 'ganz': 0, 'von': 0.41, 'fossilen': 0.13, 'Brennstoffen': 0.36, 'auf': 0.07, 'erneuerbare': 1.0, 'Energien': 0.36, 'umzusteigen': 0.8400000000000001, 'Sie': 0.1, 'ist': 0.07, 'zielorientiert': 0, 'und': 0.05, 'man': 0, 'will': 0, 'sie': 0.1, 'im': 0, 'Team': 0.08, 'haben': 1.0}",neutral,"[0.6149155, 0.029881243, 0.3552033]",,,,,,,,,,,,,,,,,,,,,,positive
50.0,75.0,57.0,0.0,neutral,"Gratulation an @ChristophSchaer, mein 400 Follower. Christoph produziert erneuerbare Energie auf dem eigenen Dach. Wenn dies alle 1.7 Millionen Wohngebäude in der 🇨🇭 machen würden, ergäbe dies 7 TWh oder 10% des Strombedarfs. Zum Vergleich KKW Gösgen ist 8 TWh. @glpzh #EsistZeit",gratulation follower christoph produzieren erneuerbare energie eigen dach all millionen wohngebäude ergeben twh strombedarfs vergleich kkw gösgen twh esistzeit,,,,,,,,,,"{'Gratulation': 0.21, 'an': 0, 'mein': 0.04, 'Follower': 0, 'Christoph': 0.3, 'produziert': 0, 'erneuerbare': 1.0, 'Energie': 0.42, 'auf': 0.12, 'dem': 0.02, 'eigenen': 0.19, 'Dach': 0.13, 'Wenn': 0, 'dies': 0, 'alle': 0, '1.7': 0, 'Millionen': 0, 'Wohngebäude': 0.035, 'in': 0.03, 'der': 0.02, '🇨': 0, '🇭': 0, 'machen': 0, 'würden': 0, 'ergäbe': 0, 'TWh': 0, 'oder': 0, 'des': 0, 'Strombedarfs': 0, 'Zum': 0, 'Vergleich': 0, 'KKW': 0, 'Gösgen': 0, 'ist': 0, 'EsistZeit': 0}",positive,"[0.002877928, 0.002327058, 0.994795]",,,,,,,,,,,,,,,,,,,,,,neutral
50.0,75.0,57.0,0.0,neutral,"@grunliberale @glpzh Vorname: Aletsch, Nachnahme: Gletscher, Lebenserwartung: ohne Apollo Programm fürs Klima &lt; 81 Jahre, mit voller Umstellung auf erneuerbare Energien &gt; 1000 Jahre. Werde ich überleben? Es hängt von Dir ab
https://t.co/1p8kjw720q
#EsistZeit @grunliberale @glpzh @Knutti_ETH",vorname aletsch nachnahme gletscher lebenserwartung apollo programm fürs klima lt jahre voll umstellung erneuerbare energien gt jahre überleben hängen ab esistzeit,,,,,,,,,,"{'Vorname': 0.02, 'Aletsch': 0.06, 'Nachnahme': 0.0275, 'Gletscher': 0.02, 'Lebenserwartung': 0.035, 'ohne': 0.06, 'Apollo': 0.04, 'Programm': 0.08, 'fürs': 0.03, 'Klima': 0.07, 'lt': 0.04, 'Jahre': 0.11, 'mit': 0.1, 'voller': 0.2, 'Umstellung': 0, 'auf': 0.02, 'erneuerbare': 1.0, 'Energien': 0, 'gt': 0.41, 'Werde': 0, 'ich': 0.03, 'überleben': 0.05, 'Es': 0, 'hängt': 0, 'von': 0, 'Dir': 0.2, 'ab': 0, 'EsistZeit': 0}",positive,"[0.010216439, 0.00451352, 0.9852701]",,,,,,,,,,,,,,,,,,,,,,neutral
0.0,0.0,0.0,-1.0,negative,"@beatflach @AZ_Augsburg 100% erneuerbare Energie ist nicht nur möglich, sondern auch dringend nötig",erneuerbare energie möglich dringen nötigen,,,,,,,,,,"{'erneuerbare': 1.0, 'Energie': 1.0, 'ist': 0.04, 'nicht': 0.07, 'nur': 0.08, 'möglich': 0.12, 'sondern': 0, 'auch': 0.04, 'dringend': 0.14, 'nötig': 0}",positive,"[0.005666757, 0.007691546, 0.98664165]",,,,,,,,,,,,,,,,,,,,,,negative
0.0,0.0,14.0,-0.7,negative,RT @JayBadran: So eine Affäre wäre bei uns legal. Darum brauchts endlich Transparenz in Parteien- und KampagnenFinanzierung statt Mauschele…,affäre legal darum brauchts endlich transparenz parteien kampagnenfinanzierung statt mauscheln,,,,,,,,,,,,,"{'So': 0, 'eine': 0, 'Affäre': 0.26, 'wäre': 0.07, 'bei': 0, 'uns': 0.06, 'legal': 0.22, 'Darum': 0, 'brauchts': 0, 'endlich': 0, 'Transparenz': 1.0, 'in': 0.74, 'Parteien-': 0.34, 'und': 0.24, 'KampagnenFinanzierung': 0.655, 'statt': 0.125, 'Mauschele': 0, '…': 0}",positive,"[0.22522897, 0.093311846, 0.6814592]",,,,,,,,,,,,,,,,,,,negative
100.0,100.0,86.0,0.7,negative,"@flluethi @sven_zurich @swissabroad @swissinfo_de Ich habe deine Frage in diesem Artikel beantwortet.
https://t.co/Vmekvbm4Rd
Zudem - E-voting ist nur ein Teil des Problems. Der Versand könnte sicher verbessert werden. Manche Kantone verschicken die Unterlagen zwei Wochen früher, so dass Swiss Abroad diese eher kriegen.",fragen artikel beantworten zudem e voting teil problems versand sichern verbessern manch kantone verschicken unterlagen zwei wochen früh swiss abroad eher kriegen,,,,,,,,,,,,,,,,"{'Ich': 0.04, 'habe': 0, 'deine': 0.08, 'Frage': 0, 'in': 0.03, 'diesem': 0.04, 'Artikel': 0.04, 'beantwortet': 0.08, 'Zudem': 0.03, 'E-voting': 0, 'ist': 0.07, 'nur': 0.15, 'ein': 0, 'Teil': 0.06, 'des': 0, 'Problems': 0, 'Der': 0.05, 'Versand': 0.55, 'könnte': 1.0, 'sicher': 0, 'verbessert': 0.85, 'werden': 0.05, 'Manche': 0.15, 'Kantone': 0.16, 'verschicken': 0.06, 'die': 0.05, 'Unterlagen': 0.05, 'zwei': 0.04, 'Wochen': 0.04, 'früher': 0.05, 'so': 0.04, 'dass': 0.05, 'Swiss': 0.05, 'Abroad': 0.06, 'diese': 0.04, 'eher': 0, 'kriegen': 0}",negative,"[0.009321447, 0.97845227, 0.012226321]",,,,,,,,,,,,,,,,positive
50.0,75.0,57.0,0.0,neutral,RT @SwissCommunity: #Pressemitteilung Der Wegfall des E-Votings führt zu markant tieferer Stimmbeteiligung der Fünften Schweiz: https://t.c…,pressemitteilung wegfall e votings führen markant tief stimmbeteiligung fünft schweiz,,,,,,,,,,,,,,,,"{'Pressemitteilung': 0.21, 'Der': 0.08, 'Wegfall': 0, 'des': 0, 'E-Votings': 0, 'führt': 1.0, 'zu': 1.0, 'markant': 0, 'tieferer': 0, 'Stimmbeteiligung': 0.44, 'der': 0.08, 'Fünften': 0.18, 'Schweiz': 0.21}",negative,"[0.04168048, 0.94721615, 0.011103361]",,,,,,,,,,,,,,,,neutral
50.0,75.0,57.0,0.0,neutral,RT @swissinfo_de: Was bedeutet das faktische Ende der E-Voting-Optionen für die Schweizer Community im Ausland? Der ASO-Präsident nimmt Ste…,bedeuten faktische ende e voting optionen schweizer community ausland aso präsident nehmen ste,,,,,,,,,,,,,,,,"{'Was': 0, 'bedeutet': 0, 'das': 0, 'faktische': 0, 'Ende': 0.1, 'der': 0.78, 'E-Voting-Optionen': 0.14, 'für': 0.12, 'die': 0.78, 'Schweizer': 0.08, 'Community': 0.11, 'im': 0, 'Ausland': 0.18, 'Der': 0.78, 'ASO-Präsident': 0.665, 'nimmt': 1.0, 'Ste': 0, '…': 0}",neutral,"[0.94939667, 0.010119275, 0.04048403]",,,,,,,,,,,,,,,,neutral
0.0,0.0,0.0,-1.0,negative,"@Avenir_Suisse @SchnellFabian @operationlibero @NZahn42 @glpzh @dani_graf @PetBlun @swissinfo_de Mann muss nicht mit allem einverstanden sein, aber dies ist die Diskussion, welche nötig ist. E-Voting hat Potential. 
@SwissCommunity @grunliberale @FDP_Liberalen @CVP_PDC @spschweiz @GrueneCH @BDPSchweiz @SVPch",mann einverstanden diskussion welch nötigen e voting potential,,,,,,,,,,,,,,,,"{'Mann': 0, 'muss': 0.08, 'nicht': 0, 'mit': 0, 'allem': 0.11, 'einverstanden': 0.16, 'sein': 0, 'aber': 0.07, 'dies': 0, 'ist': 0.06, 'die': 0.09, 'Diskussion': 0.13, 'welche': 0, 'nötig': 0, 'E-Voting': 0, 'hat': 0, 'Potential': 1.0}",positive,"[0.17461114, 0.1774544, 0.6479345]",,,,,,,,,,,,,,,,negative
100.0,100.0,100.0,1.0,neutral,"Eine sehr willkommene Analyse von @Avenir_Suisse zur digitalen Demokratie. E-Id, E-Collecting, E-Voting gehen Hand in Hand. Sicherheit vor Tempo, aber kein Stillstand. @SchnellFabian @operationlibero @NZahn42 @glpzh  @dani_graf @PetBlun @swissinfo_de 
https://t.co/fLGiy4TAJk",willkommene analyse digital demokratie e id e collecting e voting gehen hand hand sicherheit tempo stillstand,,,,,,,,,,,,,,,,"{'Eine': 0, 'sehr': 0.09, 'willkommene': 0.14, 'Analyse': 0.09, 'von': 0.12, 'zur': 0.09, 'digitalen': 0.14, 'Demokratie': 0.38, 'E-Id': 0, 'E-Collecting': 0, 'E-Voting': 0, 'gehen': 0, 'Hand': 0.24, 'in': 0.14, 'Sicherheit': 1.0, 'vor': 1.0, 'Tempo': 0, 'aber': 0.31, 'kein': 0.15, 'Stillstand': 0.34}",positive,"[0.09744277, 0.06027244, 0.8422848]",,,,,,,,,,,,,,,,positive
50.0,75.0,57.0,0.0,neutral,RT @SwissCommunity: Fake News und E-Voting: Matthias Stürmer spricht am 97. #ASOKongress über die Herausforderungen für die Demokratie von…,fake news e voting matthias stürmer sprechen asokongress herausforderungen demokratie,,,,,,,,,,,,,,,,"{'Fake': 0.12, 'News': 0.12, 'und': 0.04, 'E-Voting': 0, 'Matthias': 0.09, 'Stürmer': 0, 'spricht': 0.59, 'am': 0, '97.': 0, 'ASOKongress': 0.43, 'über': 0, 'die': 0.09, 'Herausforderungen': 1.0, 'für': 0.17, 'Demokratie': 0.25, 'von': 0, '…': 0}",negative,"[0.29583508, 0.6149745, 0.08919035]",,,,,,,,,,,,,,,,neutral
50.0,75.0,57.0,0.0,neutral,"RT @SwissCommunity: Kein Genfer E-Voting-System für die eidgenössischen Wahlen: https://t.co/SuND3z6o3v

Pas de système de vote électroniqu…",genfer e voting system eidgenössisch wahlen pas de système de vote électroniqu,,,,,,,,,,,,,,,,"{'Kein': 1.0, 'Genfer': 0.7, 'E-Voting-System': 0, 'für': 0.38, 'die': 0.13, 'eidgenössischen': 0.12, 'Wahlen': 0, 'Pas': 0, 'de': 0, 'système': 0.24, 'vote': 0, 'électroniqu': 0.29, '…': 0}",negative,"[0.415033, 0.47506583, 0.10990108]",,,,,,,,,,,,,,,,neutral
100.0,100.0,86.0,0.7,negative,"Deshalb benötigt die  Schweiz dringend eine E-Id, damit  Abstimmungsmaterial sicher heruntergeladen werden kann. Verbunden mit  E-voting fällt das  Papierproblem fällt, siehe meinen Swissinfo Artikel,  https://t.co/Vmekvbm4Rd  6/",deshalb benötigen schweiz dringen e id abstimmungsmaterial sichern heruntergeladen verbinden e voting fällen papierproblem fällen siehe swissinfo artikel,,,,,,,,,,,,,,,,"{'Deshalb': 0, 'benötigt': 0, 'die': 0.15, 'Schweiz': 0.15, 'dringend': 0.09, 'eine': 0, 'E-Id': 0, 'damit': 0.09, 'Abstimmungsmaterial': 0.09, 'sicher': 0, 'heruntergeladen': 0.1, 'werden': 0, 'kann': 0.05, 'Verbunden': 0, 'mit': 0.13, 'E-voting': 0, 'fällt': 0.14, 'das': 0.06, 'Papierproblem': 0.14500000000000002, 'siehe': 0, 'meinen': 0, 'Swissinfo': 0.44, 'Artikel': 0.76}",negative,"[0.06515826, 0.9208597, 0.013982009]",,,,,,,,,,,,,,,,positive
0.0,0.0,14.0,-0.7,neutral,"Der Kanton Genf zieht sein #EVoting-System schon vor den Wahlen 2019 zurück.
https://t.co/iPY98RDR3F
Dies war leider zu erwarten, obwohl 70% der Schweizer E-voting wollen, https://t.co/Vmekvbm4Rd
Für die Auslandschweizer, welche EVoting brauchen, ist dies ein Schlag ins Gesicht.",kanton genf ziehen evoting system schon wahlen zurück leider erwarten obwohl schweizer e voting auslandschweizer welch evoting brauchen schlag gesicht,,,,,,,,,,,,,,,,"{'Der': 0.02, 'Kanton': 0.01, 'Genf': 0.01, 'zieht': 0, 'sein': 0, 'EVoting-System': 0, 'schon': 0, 'vor': 0.02, 'den': 0.02, 'Wahlen': 0, 'zurück': 0, 'Dies': 0, 'war': 0, 'leider': 0.07, 'zu': 0.04, 'erwarten': 0, 'obwohl': 0.12, 'der': 0.02, 'Schweizer': 0.01, 'E-voting': 0, 'wollen': 0.03, 'Für': 0.01, 'die': 0.02, 'Auslandschweizer': 0.01, 'welche': 0, 'EVoting': 0, 'brauchen': 0.04, 'ist': 0.16, 'dies': 0, 'ein': 0, 'Schlag': 0, 'ins': 0, 'Gesicht': 0.04}",negative,"[0.12240829, 0.8464604, 0.031131329]",,,,,,,,,,,,,,,,negative
50.0,75.0,57.0,0.0,neutral,RT @csa_oceania: Balanced article on evoting by @muheim #evoting #ASO Auslandschweizer zeigen den Weg zum E-Voting - https://t.co/IGhurtFPBB,balanced article on evoting by evoting aso auslandschweizer zeigen e voting,,,,,,,,,,,,,,,,"{'Balanced': 0.65, 'article': 1.0, 'on': 1.0, 'evoting': 0.35, 'by': 0.28, 'ASO': 0.17, 'Auslandschweizer': 0.16, 'zeigen': 0.57, 'den': 0.14, 'Weg': 0, 'zum': 0.115, 'E-Voting': 0}",neutral,"[0.6309249, 0.06791642, 0.30115876]",,,,,,,,,,,,,,,,neutral
50.0,75.0,57.0,0.0,negative,"Auslandschweizer zeigen den Weg zum E-voting, 
siehe mein Artikel auf  Swissinfo https://t.co/gd8DoMnc4e",auslandschweizer zeigen e voting siehe artikel swissinfo,,,,,,,,,,,,,,,,"{'Auslandschweizer': 0.155, 'zeigen': 0.08, 'den': 0.04, 'Weg': 0, 'zum': 0.05, 'E-voting': 0, 'siehe': 0, 'mein': 0.05, 'Artikel': 0.16, 'auf': 0.15, 'Swissinfo': 1.0}",neutral,"[0.5886866, 0.12537137, 0.28594214]",,,,,,,,,,,,,,,,neutral
50.0,75.0,57.0,0.0,negative,"@blog_fdik_org @SwissCEdinburgh @jcschwaab @VincentCroset @martinsteiger @CCC_CH @bglaettli @PriscaKoller @narimoldi @FranzGrueter @zac1967 @pahildbrand @Tamarafuniciell @VincentKeller 1) musst halt lesen. Es braucht beides, E-voting und elektronisches verschicken der Abstimmungs unterlagen
2) Bundesamt fuer Statistik",musst halt lesen brauchen beide e voting elektronisch verschicken abstimmungs unterlagen bundesamt fuer statistik,,,,,,,,,,,,,,,,"{'musst': 0.045, 'halt': 0, 'lesen': 0.11, 'Es': 0, 'braucht': 0, 'beides': 0.08, 'E-voting': 0, 'und': 0.05, 'elektronisches': 0.07, 'verschicken': 0, 'der': 0.08, 'Abstimmungs': 0.07, 'unterlagen': 0.09, 'Bundesamt': 0.395, 'fuer': 0, 'Statistik': 0}",neutral,"[0.7097327, 0.2106071, 0.07966013]",,,,,,,,,,,,,,,,neutral
75.0,75.0,71.0,0.2749999999999999,neutral,"@Anuril @SwissCEdinburgh @jcschwaab @VincentCroset @martinsteiger @CCC_CH @bglaettli @PriscaKoller @narimoldi @FranzGrueter @zac1967 @pahildbrand @Tamarafuniciell @VincentKeller ""... Demokratie in Gefahr"". Das habe ich nie gesagt. Ich will auch sicheres E-voting. Sicher heisst, dass ein Angriff nicht skalierbar ist und entdeckt werden kann. Absolute Sicherheit gibt es nur bei ..., aber lassen wir das.😉",demokratie gefahr nie sagen sicher e voting sichern heisst angreifen skalierbar entdecken absolut sicherheit geben lassen,,,,,,,,,,,,,,,,"{'...': 0, 'Demokratie': 0.06, 'in': 0.03, 'Gefahr': 0.07, 'Das': 0, 'habe': 0, 'ich': 0.02, 'nie': 0, 'gesagt': 0.03, 'Ich': 0.02, 'will': 0, 'auch': 0.04, 'sicheres': 0, 'E-voting': 0, 'Sicher': 0, 'heisst': 0.14, 'dass': 1.0, 'ein': 0, 'Angriff': 0.16, 'nicht': 0.07, 'skalierbar': 0.08, 'ist': 0.14, 'und': 0.04, 'entdeckt': 0, 'werden': 0, 'kann': 0, 'Absolute': 0.15, 'Sicherheit': 0, 'gibt': 0, 'es': 0.14, 'nur': 0.14, 'bei': 0, 'aber': 0.33, 'lassen': 1.0, 'wir': 0, 'das': 1.0}",negative,"[0.17255066, 0.7167878, 0.11066154]",,,,,,,,,,,,,,,,positive
50.0,75.0,57.0,0.0,neutral,"@blog_fdik_org @SwissCEdinburgh @jcschwaab @VincentCroset @martinsteiger @CCC_CH @bglaettli @PriscaKoller @narimoldi @FranzGrueter @zac1967 @pahildbrand @Tamarafuniciell @VincentKeller Die 20% der Auslandschweizer, welche nicht in Europa, in Nordamerika, in Australien und Neuseeland, Japan und Korea wohnen haben Probleme mit der brieflichen Wahl. Diese braucht E-voting und elektronischen Zugang zu den Stimmrechtsausweisen. Fuers letztere braucht es e-ID.",auslandschweizer welch europa nordamerika australien neuseeland japan korea wohnen probleme brieflich wahl brauchen e voting elektronisch zugang stimmrechtsausweisen fuers letzter brauchen e id,,,,,,,,,,,,,,,,"{'Die': 0.07, 'der': 0.07, 'Auslandschweizer': 0.05, 'welche': 0, 'nicht': 0.06, 'in': 0.04, 'Europa': 0.03, 'Nordamerika': 0.025, 'Australien': 0.04, 'und': 0.13, 'Neuseeland': 0.03, 'Japan': 0.09, 'Korea': 0.16, 'wohnen': 0, 'haben': 0.48000000000000004, 'Probleme': 1.0, 'mit': 0.45, 'brieflichen': 0, 'Wahl': 0, 'Diese': 0.61, 'braucht': 0, 'E-voting': 0, 'elektronischen': 0.17, 'Zugang': 0.18, 'zu': 0.05, 'den': 0.07, 'Stimmrechtsausweisen': 0.11499999999999999, 'Fuers': 0, 'letztere': 0.15, 'es': 0, 'e-ID': 0}",negative,"[0.048705768, 0.94446015, 0.0068340846]",,,,,,,,,,,,,,,,neutral
50.0,75.0,57.0,0.0,neutral,"Relevant fuer die Diskussion:
Study reveals huge demand for e-voting in Switzerland
https://t.co/EdEqgwEQMy
@dani_graf will dass der Bund die e-ID entwickelt 
https://t.co/XwWLYOMp8v,
@ChrFolini hat die Schwaechen vom brieflichen abstimmen untersucht
https://t.co/aYpqrRlOPz",relevant fuer diskussion study reveals huge demand for e voting switzerland bund e id entwickeln schwaechen brieflich abstimmen untersuchen,,,,,,,,,,,,,,,,"{'Relevant': 0.11, 'fuer': 0.05, 'die': 0.23, 'Diskussion': 0.13, 'Study': 0.17, 'reveals': 0.16, 'huge': 0.15, 'demand': 0.13, 'for': 0.05, 'e-voting': 0, 'in': 0.03, 'Switzerland': 0.05, 'will': 0, 'dass': 0, 'der': 0.23, 'Bund': 0, 'e-ID': 0, 'entwickelt': 0, 'hat': 0, 'Schwaechen': 1.0, 'vom': 0.23, 'brieflichen': 0, 'abstimmen': 0, 'untersucht': 1.0}",neutral,"[0.5445672, 0.44403553, 0.011397257]",,,,,,,,,,,,,,,,neutral
50.0,75.0,57.0,0.0,neutral,Angriffe erwünscht – die Post lässt Hacker auf das E-Voting-System los https://t.co/4MIMGcjn5v via @nzz,angriffe erwünscht post lässt hacker e voting system los via,,,,,,,,,,,,,,,,"{'Angriffe': 0.31, 'erwünscht': 0, '–': 0, 'die': 0, 'Post': 0, 'lässt': 0, 'Hacker': 0, 'auf': 0, 'das': 0, 'E-Voting-System': 0, 'los': 0, 'via': 0}",negative,"[0.37513933, 0.51084334, 0.11401731]",,,,,,,,,,,,,,,,neutral
50.0,75.0,57.0,0.0,neutral,"RT @LandoltMartin: ...dass die Gegner von E-Voting ausgerechnet über eine digitale Plattform Unterschriften sammeln, hat einen Hauch von Sa…",gegner e voting ausrechnen digitale plattform unterschriften sammeln hauch sa,,,,,,,,,,,,,,,,"{'...': 0, 'dass': 0.25, 'die': 0.09, 'Gegner': 0, 'von': 0, 'E-Voting': 0, 'ausgerechnet': 0.12, 'über': 0, 'eine': 0, 'digitale': 0.06, 'Plattform': 0.17, 'Unterschriften': 0.11, 'sammeln': 0.06, 'hat': 0, 'einen': 0.15, 'Hauch': 0, 'Sa': 0, '…': 0}",positive,"[0.13686116, 0.12048603, 0.7426528]",,,,,,,,,,,,,,,,neutral
0.0,0.0,0.0,-0.85,neutral,RT @IslerRoland: E-Voting Verbot = mit Angst hausieren = kleinbürgerliches Denken https://t.co/RY8ee0p7t9,e voting verbieten angst hausieren kleinbürgerlich denken,,,,,,,,,,,,,,,,"{'E-Voting': 0, 'Verbot': 0.28, 'mit': 0, 'Angst': 0, 'hausieren': 0, 'kleinbürgerliches': 0.78, 'Denken': 0}",negative,"[0.21296868, 0.76222676, 0.024804581]",,,,,,,,,,,,,,,,negative
50.0,75.0,57.0,0.0,neutral,RT @dani_graf: E-Voting Studie Kanton Aargau https://t.co/Vlu0vT3nQc,e voting studie kanton aargau,,,,,,,,,,,,,,,,"{'E-Voting': 0, 'Studie': 0.39, 'Kanton': 0.37, 'Aargau': 0.5}",neutral,"[0.67818147, 0.047535777, 0.2742828]",,,,,,,,,,,,,,,,neutral
50.0,75.0,57.0,0.0,negative,@ErichAschi @lukasmaeder Demokratie ist nicht gratis. Das gilt auch fuer E-voting und E-demokratie,demokratie gratis gelten fuer e voting e demokratie,,,,,,,,,,,,,,,,"{'Demokratie': 0.04, 'ist': 0.13, 'nicht': 1.0, 'gratis': 1.0, 'Das': 0, 'gilt': 0, 'auch': 0.06, 'fuer': 0, 'E-voting': 0, 'und': 0.05, 'E-demokratie': 0}",positive,"[0.4501564, 0.034830168, 0.51501346]",,,,,,,,,,,,,,,,neutral
100.0,100.0,100.0,1.0,negative,"RT @lukasmaeder: Erstaunlich, wie unkritisch der Tagesanzeiger die Aussagen des CCC zu E-Voting übernimmt. Eine Manipulation wurde nicht ge…",erstaunlich unkritisch tagesanzeiger aussagen ccc e voting übernehmen manipulation ge,,,,,,,,,,,,,,,,"{'Erstaunlich': 0, 'wie': 0.06, 'unkritisch': 0, 'der': 0.03, 'Tagesanzeiger': 0, 'die': 0.03, 'Aussagen': 0, 'des': 0, 'CCC': 0.05, 'zu': 0, 'E-Voting': 0, 'übernimmt': 0.07, 'Eine': 0, 'Manipulation': 1.0, 'wurde': 0, 'nicht': 0, 'ge': 0, '…': 0}",neutral,"[0.8196617, 0.12690626, 0.053432062]",,,,,,,,,,,,,,,,positive
0.0,0.0,0.0,-1.0,negative,RT @bfh_digital: Unsorgfältige Recherche: Welche falschen Aussagen @srfnews über das #eVoting im Kanton Genf von den e-Voting-Gegnern des @…,unsorgfältige recherche welch falsch aussagen evoting kanton genf e voting gegnern,,,,,,,,,,,,,,,,"{'Unsorgfältige': 0.17, 'Recherche': 0.1, 'Welche': 0, 'falschen': 0, 'Aussagen': 0, 'über': 0, 'das': 0, 'eVoting': 0.09, 'im': 0, 'Kanton': 0.07, 'Genf': 0.12, 'von': 0, 'den': 0.52, 'e-Voting-Gegnern': 0.32, 'des': 0, '…': 0}",negative,"[0.19731891, 0.44051227, 0.36216888]",,,,,,,,,,,,,,,,negative
