answer_five,answer_four,answer_seven,polarity,sentiment_gs,tweet,tweet_tokens,absa_token_weights_3414,absa_sentiment_3414,absa_scores_3414,absa_token_weights_3467,absa_sentiment_3467,absa_scores_3467,sentiment_tb
50.0,75.0,57.0,0.0,positive,"Endlich geht doch was beim #Vaterschaftsurlaub. Hat gerade Freude an unserem nationalen Parlament SRF: Ein kleiner Schritt hin zur europäischen Normalität

https://t.co/xNU5TzQY80",endlich gehen beim vaterschaftsurlaub gerade freude national parlament srf klein schritt europäisch normalität,"{'Endlich': 0.11, 'geht': 0, 'doch': 0, 'was': 0, 'beim': 0, 'Vaterschaftsurlaub': 0.74, 'Hat': 0, 'gerade': 0, 'Freude': 0, 'an': 0, 'unserem': 0.09, 'nationalen': 0.08, 'Parlament': 0.08, 'SRF': 0.13, 'Ein': 0.05, 'kleiner': 0, 'Schritt': 0.09, 'hin': 0, 'zur': 0, 'europäischen': 0.08, 'Normalität': 0.09}",positive,"[0.03711336, 0.007139109, 0.9557476]",,,,neutral
100.0,100.0,86.0,0.7,negative,"Einfach unverständlich. SRF: Bundesrat lehnt längeren Vaterschaftsurlaub ab. 

https://t.co/eITVdB3eQm",einfach unverständlich srf bundesrat lehnen lang vaterschaftsurlaub ab,"{'Einfach': 0, 'unverständlich': 0.25, 'SRF': 0.1, 'Bundesrat': 0.155, 'lehnt': 1.0, 'längeren': 1.0, 'Vaterschaftsurlaub': 0.7, 'ab': 0}",neutral,"[0.48155782, 0.36196786, 0.15647434]",,,,positive
100.0,100.0,100.0,0.85,neutral,"Klimafreundlich ist auch die EVP! Mit der EVP wird sicher umweltfreundlich gehandelt. #Umweltschutz mit EVP!
#Für den Nächsten! 
#Mit Leidenschaft für Mensch und Umwelt! https://t.co/H8ajp5Oaua",klimafreundlich evp evp sichern umweltfreundlich handeln umweltschutz evp nächst leidenschaft mensch umwelt,,,,"{'Klimafreundlich': 0.07500000000000001, 'ist': 0.06, 'auch': 0.08, 'die': 0.02, 'EVP': 0, 'Mit': 0.1, 'der': 0.02, 'wird': 0, 'sicher': 0, 'umweltfreundlich': 0.085, 'gehandelt': 0, 'Umweltschutz': 0.755, 'mit': 0.1, 'Für': 0.03, 'den': 0.02, 'Nächsten': 0.07, 'Leidenschaft': 0.11, 'für': 0.03, 'Mensch': 0, 'und': 0.03, 'Umwelt': 0.04}",positive,"[0.0005530224, 0.0013654606, 0.99808156]",positive
100.0,100.0,86.0,0.7,neutral,für unseren Umweltschutz eine wichtige Initiative. Unterschreibe heute noch die #Gletscherinitiative. https://t.co/YsFkxPUz51,umweltschutz wichtig initiative unterschreiben heute gletscherinitiative,,,,"{'für': 0.29, 'unseren': 0.19, 'Umweltschutz': 0.305, 'eine': 0, 'wichtige': 1.0, 'Initiative': 0.16, 'Unterschreibe': 0.18, 'heute': 0.11, 'noch': 0, 'die': 0.11, 'Gletscherinitiative': 0.16999999999999998}",positive,"[0.000605968, 0.0011087721, 0.99828523]",positive
