answer_five,answer_four,answer_seven,polarity,sentiment_gs,tweet,tweet_tokens,absa_token_weights_3431,absa_sentiment_3431,absa_scores_3431,absa_token_weights_3436,absa_sentiment_3436,absa_scores_3436,absa_token_weights_3450,absa_sentiment_3450,absa_scores_3450,absa_token_weights_3466,absa_sentiment_3466,absa_scores_3466,absa_token_weights_3468,absa_sentiment_3468,absa_scores_3468,absa_token_weights_3472,absa_sentiment_3472,absa_scores_3472,sentiment_tb
100.0,100.0,86.0,0.7,neutral,RT @Rita_Sauser: Statt über erleichterte #Einbürgerung  sollten wir vielleicht eher über speditive Ausbürgerung diskutieren. #Abst17 #ISIS…,statt erleichtern einbürgerung sollen vielleicht eher speditive ausbürgerung diskutieren abst17 isis,"{'Statt': 0.455, 'über': 0, 'erleichterte': 0, 'Einbürgerung': 1.0, 'sollten': 0.08, 'wir': 0, 'vielleicht': 0.06, 'eher': 0.09, 'speditive': 0.25, 'Ausbürgerung': 0.29, 'diskutieren': 0, 'Abst17': 0.23, 'ISIS': 0.15, '…': 0}",neutral,"[0.6289294, 0.03808568, 0.3329849]",,,,,,,,,,,,,,,,positive
0.0,0.0,14.0,-0.7,neutral,RT @zac1967: Logischerweise müsste die Einbürgerung für jede spätere Generation schwieriger werden.,logischerweise müsste einbürgerung jed spät generation schwierig,"{'Logischerweise': 0, 'müsste': 0.26, 'die': 0, 'Einbürgerung': 0.78, 'für': 0.11, 'jede': 0, 'spätere': 0, 'Generation': 0.12, 'schwieriger': 0.325, 'werden': 0}",negative,"[0.004264614, 0.98630226, 0.009433098]",,,,,,,,,,,,,,,,negative
0.0,0.0,0.0,-1.0,negative,"RT @feusl: Dieser Staat frisst die Hälfte jedes Lohnes - und es gibt Leute die bei minimalen Steuersenkungen ""Gegenfinanzierung"" fordern. #…",staat frisst hälfte jed lohnes geben leute minimal steuersenkungen gegenfinanzierung fordern,,,,"{'Dieser': 0.05, 'Staat': 0.07, 'frisst': 0.06, 'die': 0, 'Hälfte': 0.05, 'jedes': 0, 'Lohnes': 0, 'und': 0.06, 'es': 0, 'gibt': 0.07, 'Leute': 0.07, 'bei': 0, 'minimalen': 1.0, 'Steuersenkungen': 0.655, 'Gegenfinanzierung': 0, 'fordern': 0.36, '…': 0}",neutral,"[0.58794844, 0.38798767, 0.024063827]",,,,,,,,,,,,,negative
50.0,75.0,57.0,0.0,neutral,RT @Wetzelstrom: #Energiewende kein Jobmotor. #McKinsey-Index: Jobverluste bei Erneuerbaren und  energieinten. Industrie. https://t.co/6Ise…,energiewende jobmotor mckinsey index jobverluste erneuerbaren energieinten industrie,,,,,,,"{'Energiewende': 0.17, 'kein': 0, 'Jobmotor': 0.5700000000000001, 'McKinsey-Index': 0, 'Jobverluste': 1.0, 'bei': 0, 'Erneuerbaren': 0.84, 'und': 0.16, 'energieinten': 0.17, 'Industrie': 0.21}",negative,"[0.17909221, 0.6039874, 0.21692044]",,,,,,,,,,neutral
50.0,75.0,57.0,0.0,neutral,"Bei jeder industriellen Revolution veränderte sich die Arbeitswelt! Nichts ungewöhnliches... #Digitalisierung 
https://t.co/HgHITF9rzr",jed industriell revolution verändern arbeitswelt ungewöhnlich digitalisierung,,,,,,,,,,"{'Bei': 0, 'jeder': 0, 'industriellen': 0.07, 'Revolution': 0.12, 'veränderte': 0.12, 'sich': 0, 'die': 0.05, 'Arbeitswelt': 0.06, 'Nichts': 0.17, 'ungewöhnliches': 0.2, '...': 0, 'Digitalisierung': 0}",positive,"[0.44458938, 0.011237058, 0.54417354]",,,,,,,neutral
100.0,100.0,100.0,1.0,neutral,"Ohne Digitalisierungsstrategie, die vom Top Management vorgelebt wird, springt #GenY ab. http://t.co/CEDw3vuzbj http://t.co/aKv8SG7cJi",digitalisierungsstrategie top management vorleben springen geny ab,,,,,,,,,,"{'Ohne': 1.0, 'Digitalisierungsstrategie': 0.89, 'die': 0, 'vom': 0, 'Top': 0.12, 'Management': 0.19, 'vorgelebt': 0.4, 'wird': 0, 'springt': 0, 'GenY': 0.1, 'ab': 0}",neutral,"[0.39352104, 0.33012328, 0.27635574]",,,,,,,positive
100.0,100.0,100.0,1.0,negative,"RT @TobiasInfortuna: So geht Populismus:Man findet die EU zwar gut, streicht aber EU-Beitritt aus Parteiprogramm - wegen Volksmeinung. htt…",gehen populismus finden eu gut streichen eu beitreten parteiprogramm wegen volksmeinung htt,,,,,,,,,,,,,"{'So': 0, 'geht': 0, 'Populismus': 0.15, 'Man': 0, 'findet': 0, 'die': 0.06, 'EU': 0, 'zwar': 0.06, 'gut': 0, 'streicht': 0, 'aber': 0.06, 'EU-Beitritt': 0.18, 'aus': 0, 'Parteiprogramm': 0.08, 'wegen': 0.11, 'Volksmeinung': 0.11499999999999999, 'htt': 1.0, '…': 0}",neutral,"[0.4105854, 0.30454463, 0.28486997]",,,,positive
100.0,100.0,86.0,0.7,neutral,RT @KoeppelRoger: Diese ganze milliardenschwere Klimapolitik ist neben der  Entwicklungshilfe das grösste Konjunkturprogramm der Menschheit…,ganze milliardenschwere klimapolitik neben entwicklungshilfe grösste konjunkturprogramm menschheit,,,,,,,,,,,,,,,,"{'Diese': 0.39, 'ganze': 0.26, 'milliardenschwere': 0.375, 'Klimapolitik': 0.36, 'ist': 1.0, 'neben': 1.0, 'der': 0.41, 'Entwicklungshilfe': 0.29, 'das': 0, 'grösste': 0.87, 'Konjunkturprogramm': 0.245, 'Menschheit': 0.38, '…': 0}",positive,"[0.09038792, 0.022587517, 0.8870245]",positive
