answer_five,answer_four,answer_seven,polarity,sentiment_gs,tweet,tweet_tokens,absa_token_weights_3431,absa_sentiment_3431,absa_scores_3431,absa_token_weights_3462,absa_sentiment_3462,absa_scores_3462,absa_token_weights_3465,absa_sentiment_3465,absa_scores_3465,sentiment_tb
100.0,100.0,100.0,1.0,neutral,"Wahlen in Sursee: 

- 8.62% (!!!) für die Jungen Grünen, neu ein Sitz in der Einbürgerungskommission (Lukas Walther)

-23.77% für G/JG, insgesamt 4 Sitze (+2), zweitstärkste Kraft in Sursee

-Beste Aussicht im 2. Wahlgang für unseren Controlling-Kommissions-Kandidaten!

Wow!",wahlen sursee jung grün neu sitzen einbürgerungskommission lukas walther g jg insgesamt sitze zweitstärkste kraft sursee gut aussicht wahlgang controlling kommissions kandidaten wow,"{'Wahlen': 0, 'in': 0.03, 'Sursee': 0.07, '8.62': 0, 'für': 0.05, 'die': 0.03, 'Jungen': 0, 'Grünen': 0.04, 'neu': 0, 'ein': 0, 'Sitz': 0.04, 'der': 0.03, 'Einbürgerungskommission': 0.05500000000000001, 'Lukas': 0.03, 'Walther': 0.06, '-23.77': 0, 'G': 0.02, 'JG': 0.04, 'insgesamt': 0.03, 'Sitze': 0.18, '+2': 0, 'zweitstärkste': 0.055, 'Kraft': 0, '-Beste': 0, 'Aussicht': 0, 'im': 0, '2.': 0, 'Wahlgang': 0.12, 'unseren': 0.05, 'Controlling-Kommissions-Kandidaten': 0.05500000000000001, 'Wow': 1.0}",positive,"[0.06984199, 0.01597492, 0.9141831]",,,,,,,positive
0.0,0.0,0.0,-1.0,neutral,"@Zoller_Matthias @samuelbeer_ @grunliberale Hören Sie auf, hier Lügen zu verbreiten. KMU und Zuliefererbetriebe sind nicht betroffen - Kriegsmaterial ist genau definiert.",hören lügen verbreiten kmu zuliefererbetriebe betreffen kriegsmaterial genau definieren,,,,"{'Hören': 0, 'Sie': 0, 'auf': 0, 'hier': 0.03, 'Lügen': 0, 'zu': 0, 'verbreiten': 0, 'KMU': 0, 'und': 0.14, 'Zuliefererbetriebe': 0, 'sind': 0.3, 'nicht': 1.0, 'betroffen': 1.0, 'Kriegsmaterial': 0.525, 'ist': 0.26, 'genau': 0, 'definiert': 0.265}",positive,"[0.25988036, 0.014060094, 0.7260596]",,,,negative
50.0,75.0,57.0,0.0,neutral,"Kann jemand den Rechten mal einen Workshop in „Begrifflichkeiten der Wirtschafstheorie“ anbieten?

„Verbote“ und „Umverteilung“ sind Instrumente des Staates, wenn ein Mechanismus in der Marktwirtschaft nicht funktioniert. Mit #Sozialismus hat das herzlich wenig zu tun #CO2Gesetz https://t.co/j0X7W9N4aO",jemand recht mal workshop begrifflichkeiten wirtschafstheorie anbieten verbote umverteilung instrumente staates mechanismus marktwirtschaft funktionieren sozialismus herzlich wenig tun co2gesetz,,,,,,,"{'Kann': 0.01, 'jemand': 0.01, 'den': 0.19, 'Rechten': 0, 'mal': 0, 'einen': 0.25, 'Workshop': 0.01, 'in': 0, '„': 0, 'Begrifflichkeiten': 0, 'der': 0, 'Wirtschafstheorie': 0, '“': 0, 'anbieten': 0, 'Verbote': 0, 'und': 0, 'Umverteilung': 0, 'sind': 0, 'Instrumente': 0, 'des': 0, 'Staates': 0, 'wenn': 0, 'ein': 0, 'Mechanismus': 0, 'Marktwirtschaft': 0, 'nicht': 0, 'funktioniert': 0, 'Mit': 0, 'Sozialismus': 0, 'hat': 0, 'das': 0, 'herzlich': 0, 'wenig': 0, 'zu': 0, 'tun': 0, 'CO2Gesetz': 0}",positive,"[0.2897973, 0.06857784, 0.6416249]",neutral
