answer_five,answer_four,answer_seven,polarity,sentiment_gs,tweet,tweet_tokens,absa_token_weights_3414,absa_sentiment_3414,absa_scores_3414,absa_token_weights_3475,absa_sentiment_3475,absa_scores_3475,absa_token_weights_3479,absa_sentiment_3479,absa_scores_3479,sentiment_tb
50.0,75.0,57.0,0.0,negative,RT @nmasshardt: Bundesrat heute: 1 Milliarde für Olympiakandidatur – Vaterschaftsurlaub ist ihm zu teuer. Wo bleibt die Logik?,bundesrat heute milliarde olympiakandidatur vaterschaftsurlaub teuer bleiben logik,"{'Bundesrat': 0.075, 'heute': 0.05, 'Milliarde': 0.12, 'für': 0.55, 'Olympiakandidatur': 0.12, '–': 0, 'Vaterschaftsurlaub': 0, 'ist': 0, 'ihm': 0, 'zu': 0, 'teuer': 0, 'Wo': 0, 'bleibt': 0, 'die': 0, 'Logik': 0}",negative,"[0.003947654, 0.9895723, 0.0064801746]",,,,,,,neutral
100.0,100.0,86.0,0.7,negative,"RT @ChantalGallade: Vaterschaftsurlaub zu teuer? Dann sparen wir, indem wir die Tage im Militärdienst kürzen. Ganz einfach.",vaterschaftsurlaub teuer sparen tage militärdienst kürzen ganz einfach,"{'Vaterschaftsurlaub': 0.76, 'zu': 0, 'teuer': 1.0, 'Dann': 0.13, 'sparen': 0.23, 'wir': 0, 'indem': 0.11, 'die': 0.06, 'Tage': 0.09, 'im': 0, 'Militärdienst': 0.07500000000000001, 'kürzen': 0, 'Ganz': 0, 'einfach': 0}",negative,"[0.020223131, 0.9441898, 0.03558711]",,,,,,,positive
50.0,75.0,57.0,0.0,neutral,"RT @papizeit: Mehr #PapiZeit jetzt mit männer.ch, Pro Familia und @operationlibero.
http://t.co/cZqsZapKkI #vaterschaftsurlaub http://t.co/…",mehr papizeit männer ch pro familia vaterschaftsurlaub,"{'Mehr': 0.06, 'PapiZeit': 0, 'jetzt': 0.15, 'mit': 0.16, 'männer.ch': 0, 'Pro': 0.09, 'Familia': 0, 'und': 0.14, 'vaterschaftsurlaub': 1.0}",positive,"[0.00782227, 0.0030133817, 0.9891643]",,,,,,,neutral
50.0,75.0,57.0,0.0,neutral,"RT @kathrinbertschy: Buurezmorge im Nationalrat: Bildung, Forschung, Innovation eben mal 5 Mio weggenommen und der Landwirtschaft geschenkt…",buurezmorge nationalrat bildung forschung innovation eben mal mio wegnehmen landwirtschaft schenken,,,,"{'Buurezmorge': 0.42, 'im': 0, 'Nationalrat': 0.155, 'Bildung': 0.42, 'Forschung': 0.47, 'Innovation': 0.77, 'eben': 0, 'mal': 1.0, 'Mio': 0, 'weggenommen': 0.6, 'und': 0.43, 'der': 0.13, 'Landwirtschaft': 0.21, 'geschenkt': 0, '…': 0}",positive,"[0.27168098, 0.14794357, 0.5803755]","{'Buurezmorge': 0.13, 'im': 0, 'Nationalrat': 0.055, 'Bildung': 0.05, 'Forschung': 0.06, 'Innovation': 0.07, 'eben': 0, 'mal': 0.1, 'Mio': 0, 'weggenommen': 0.14, 'und': 0.23, 'der': 0.05, 'Landwirtschaft': 1.0, 'geschenkt': 0, '…': 0}",neutral,"[0.8383802, 0.011171278, 0.15044841]",neutral
50.0,75.0,57.0,0.0,neutral,utiliser les subventions de manière prospective #Landwirtschaft soll nicht nur #Fleischwirtschaft sein. Adieu #Klimaschäden. https://t.co/C3gfuT4uRT,utiliser les subventions de manière prospective landwirtschaft fleischwirtschaft adieu klimaschäden,,,,,,,"{'utiliser': 0.22, 'les': 0.1, 'subventions': 0.1, 'de': 0, 'manière': 0.07, 'prospective': 0.11, 'Landwirtschaft': 0, 'soll': 0, 'nicht': 0, 'nur': 0, 'Fleischwirtschaft': 0, 'sein': 0, 'Adieu': 0, 'Klimaschäden': 0.43500000000000005}",positive,"[0.41213268, 0.11024397, 0.47762337]",neutral
50.0,75.0,57.0,0.0,neutral,RT @grunliberale: Vorstoss @kathrinbertschy Parallele Steuerwelten bei landwirtschaftlichen und nichtlandwirtschaftlichen Wohnhäusern? http…,vorstoss parallele steuerwelten landwirtschaftlich nichtlandwirtschaftlichen wohnhäusern http,,,,,,,"{'Vorstoss': 0, 'Parallele': 0.09, 'Steuerwelten': 0.1, 'bei': 0, 'landwirtschaftlichen': 0.07, 'und': 0.11, 'nichtlandwirtschaftlichen': 0, 'Wohnhäusern': 0.08499999999999999, 'http': 1.0, '…': 0}",neutral,"[0.77145696, 0.006513614, 0.22202942]",neutral
50.0,75.0,57.0,0.0,neutral,"RT @kathrinbertschy: Buurezmorge im Nationalrat: Bildung, Forschung, Innovation eben mal 5 Mio weggenommen und der Landwirtschaft geschenkt…",buurezmorge nationalrat bildung forschung innovation eben mal mio wegnehmen landwirtschaft schenken,,,,"{'Buurezmorge': 0.42, 'im': 0, 'Nationalrat': 0.155, 'Bildung': 0.42, 'Forschung': 0.47, 'Innovation': 0.77, 'eben': 0, 'mal': 1.0, 'Mio': 0, 'weggenommen': 0.6, 'und': 0.43, 'der': 0.13, 'Landwirtschaft': 0.21, 'geschenkt': 0, '…': 0}",positive,"[0.27168098, 0.14794357, 0.5803755]","{'Buurezmorge': 0.13, 'im': 0, 'Nationalrat': 0.055, 'Bildung': 0.05, 'Forschung': 0.06, 'Innovation': 0.07, 'eben': 0, 'mal': 0.1, 'Mio': 0, 'weggenommen': 0.14, 'und': 0.23, 'der': 0.05, 'Landwirtschaft': 1.0, 'geschenkt': 0, '…': 0}",neutral,"[0.8383802, 0.011171278, 0.15044841]",neutral
50.0,75.0,57.0,0.0,neutral,RT @grunliberale: Interview mit unserer Berner Nationalrätin @kathrinbertschy über grünliberale Landwirtschaftspolitik @BauernZeitung1: htt…,interview berner nationalrätin grünliberale landwirtschaftspolitik htt,,,,,,,"{'Interview': 1.0, 'mit': 1.0, 'unserer': 0.35, 'Berner': 0, 'Nationalrätin': 0.38, 'über': 0, 'grünliberale': 0.16, 'Landwirtschaftspolitik': 0.505, 'htt': 0.36, '…': 0}",neutral,"[0.6282867, 0.018575804, 0.3531374]",neutral
