answer_five,answer_four,answer_seven,polarity,sentiment_gs,tweet,tweet_tokens,absa_token_weights_3392,absa_sentiment_3392,absa_scores_3392,absa_token_weights_3412,absa_sentiment_3412,absa_scores_3412,absa_token_weights_3419,absa_sentiment_3419,absa_scores_3419,absa_token_weights_3466,absa_sentiment_3466,absa_scores_3466,absa_token_weights_3479,absa_sentiment_3479,absa_scores_3479,sentiment_tb
50.0,75.0,57.0,0.0,neutral,"RT @JungfreisinnBE: Solange du niemand anderes einschränkst, sollst du dein Leben so führen, wie du dies willst. Du sollst Cannabis konsumi…",solange niemand einschränken sollen leben fahren sollen cannabis konsumi,"{'Solange': 0, 'du': 0, 'niemand': 0, 'anderes': 0, 'einschränkst': 0.13, 'sollst': 0.48, 'dein': 0.03, 'Leben': 0.09, 'so': 0, 'führen': 0.09, 'wie': 0, 'dies': 0, 'willst': 0.06, 'Du': 0, 'Cannabis': 1.0, 'konsumi': 0, '…': 0}",neutral,"[0.8518536, 0.0041250205, 0.14402132]",,,,,,,,,,,,,neutral
50.0,75.0,57.0,0.0,negative,@RonjaJansen Was bitteschön hat das Rentenalter mit der Klimakrise zu tun?!,bitteschön rentenalter klimakrise tun,,,,"{'Was': 0, 'bitteschön': 0, 'hat': 0, 'das': 0, 'Rentenalter': 0.9450000000000001, 'mit': 0.27, 'der': 0.25, 'Klimakrise': 0.245, 'zu': 0.11, 'tun': 0.47}",negative,"[0.13435325, 0.85669917, 0.008947589]",,,,,,,,,,neutral
50.0,75.0,57.0,0.0,neutral,"RT @Simone_Richner: Eine emotionale Debatte, die es unbedingt erneut zu führen gilt! #Organspende @Swisstransplant 
Unterschreibe jetzt und…",emotionale debatte unbedingt erneut fahren gelten organspende unterschreiben,,,,,,,"{'Eine': 0, 'emotionale': 0.11, 'Debatte': 0.19, 'die': 0, 'es': 0, 'unbedingt': 0, 'erneut': 0, 'zu': 0.05, 'führen': 0.05, 'gilt': 0, 'Organspende': 0.145, 'Unterschreibe': 0.48, 'jetzt': 0.25, 'und': 0.58, '…': 0}",positive,"[0.073623, 0.0026441824, 0.9237328]",,,,,,,neutral
50.0,75.0,57.0,0.0,neutral,RT @JungfreisinnBE: Es braucht in Zeiten der Digitalisierung und Polarisierung neue Gefässe um Menschen in die politischen Entscheide einzu…,brauchen zeiten digitalisierung polarisierung neue gefässe menschen politisch entscheide einzu,,,,,,,,,,"{'Es': 0, 'braucht': 0, 'in': 0.06, 'Zeiten': 0.36, 'der': 0, 'Digitalisierung': 0, 'und': 1.0, 'Polarisierung': 1.0, 'neue': 0.09, 'Gefässe': 0.07, 'um': 0, 'Menschen': 0.06, 'die': 0, 'politischen': 0.08, 'Entscheide': 0, 'einzu': 0, '…': 0}",neutral,"[0.5498061, 0.08735474, 0.3628391]",,,,neutral
50.0,75.0,57.0,0.0,neutral,"RT @digital_liberal: Die Digitalisierung ist ein Werkzeug für neue Geschäftsmodelle und neue Kundenbeziehungen.
https://t.co/gOWHlqUnfa",digitalisierung werkzeug neue geschäftsmodelle neue kundenbeziehungen,,,,,,,,,,"{'Die': 0, 'Digitalisierung': 0, 'ist': 0.36, 'ein': 0, 'Werkzeug': 0.32, 'für': 0.09, 'neue': 0.05, 'Geschäftsmodelle': 0.045, 'und': 0.06, 'Kundenbeziehungen': 0.05}",positive,"[0.0038092877, 0.0013069513, 0.9948837]",,,,neutral
50.0,75.0,57.0,0.0,neutral,"RT @JungfreisinnBE: Freiheit, Nachhaltigkeit, Digitalisierung!
Dies sind unserer Kernthemen für die #WahlenBE18!
Jeden Tag stellen wir eine…",freiheit nachhaltigkeit digitalisierung kernthemen wahlenbe18 jed tag stellen,,,,,,,,,,"{'Freiheit': 0.35, 'Nachhaltigkeit': 0.29, 'Digitalisierung': 0, 'Dies': 0, 'sind': 0.12, 'unserer': 0.09, 'Kernthemen': 0.17, 'für': 0.19, 'die': 0, 'WahlenBE18': 0, 'Jeden': 0.87, 'Tag': 0, 'stellen': 0, 'wir': 0, 'eine': 0, '…': 0}",positive,"[0.0032784322, 0.0011848499, 0.9955367]",,,,neutral
50.0,75.0,57.0,0.0,neutral,RT @hs_politik: Schweizer Unternehmer und Verbände aus der Landwirtschaft arbeiten gemeinsam mit der Personalverleihplattform @CoopleSchwei…,schweizer unternehmer verbände landwirtschaft arbeiten gemeinsam personalverleihplattform,,,,,,,,,,,,,"{'Schweizer': 0.53, 'Unternehmer': 0, 'und': 0.27, 'Verbände': 0.36, 'aus': 0, 'der': 0.11, 'Landwirtschaft': 0, 'arbeiten': 0.42, 'gemeinsam': 0.27, 'mit': 0.11, 'Personalverleihplattform': 0, '…': 0}",neutral,"[0.8027974, 0.010066794, 0.18713583]",neutral
