answer_five,answer_four,answer_seven,polarity,sentiment_gs,tweet,tweet_tokens,absa_token_weights_3389,absa_sentiment_3389,absa_scores_3389,absa_token_weights_3392,absa_sentiment_3392,absa_scores_3392,absa_token_weights_3412,absa_sentiment_3412,absa_scores_3412,absa_token_weights_3414,absa_sentiment_3414,absa_scores_3414,absa_token_weights_3433,absa_sentiment_3433,absa_scores_3433,absa_token_weights_3434,absa_sentiment_3434,absa_scores_3434,absa_token_weights_3436,absa_sentiment_3436,absa_scores_3436,absa_token_weights_3459,absa_sentiment_3459,absa_scores_3459,absa_token_weights_3467,absa_sentiment_3467,absa_scores_3467,sentiment_tb
50.0,75.0,57.0,0.0,neutral,"RT @AngeleFlorine: Loooos 💪🏼 #Individualbesteuerung, bezahlbare #Kinderbetreuung &amp; #Elternzeit bzw. #Vaterschaftsurlaub  JETZT https://t.co…",loooos individualbesteuerung bezahlbare kinderbetreuung amp elternzeit bzw vaterschaftsurlaub,"{'Loooos': 0.23, 'Individualbesteuerung': 0.11, 'bezahlbare': 0, 'Kinderbetreuung': 1.0, 'amp': 0.09, 'Elternzeit': 0.05, 'bzw.': 0, 'Vaterschaftsurlaub': 0.06, 'JETZT': 0.07}",positive,"[0.0006137306, 0.001088456, 0.99829787]",,,,,,,"{'Loooos': 0.14, 'Individualbesteuerung': 0.04, 'bezahlbare': 0, 'Kinderbetreuung': 0.07, 'amp': 0.03, 'Elternzeit': 0.53, 'bzw.': 0, 'Vaterschaftsurlaub': 1.0, 'JETZT': 1.0}",neutral,"[0.49650946, 0.15347686, 0.35001367]",,,,,,,,,,,,,,,,neutral
100.0,100.0,86.0,0.7,neutral,"RT @beatflach: Gemeinsam mit den @jglpCH habe ich den Vorstoss ""#Cannabis legalisieren und Steuersubstrat zugunsten der AHV/IV generieren""…",gemeinsam vorstoss cannabis legalisieren steuersubstrat zugunsten ahv iv generieren,,,,"{'Gemeinsam': 0.06, 'mit': 0.03, 'den': 0.07, 'habe': 0, 'ich': 0.06, 'Vorstoss': 0, 'Cannabis': 1.0, 'legalisieren': 0.59, 'und': 0.39, 'Steuersubstrat': 0, 'zugunsten': 0.045, 'der': 0.07, 'AHV': 0.08, 'IV': 0.07, 'generieren': 0.27, '…': 0}",neutral,"[0.9720282, 0.010522331, 0.017449498]",,,,,,,,,,,,,,,,,,,,,,positive
100.0,100.0,100.0,0.85,neutral,RT @doppel_m: Saalabstimmung am @spiritofbern zum Thema Demografie und Arbeitsmarkt: die Mehrheit bevorzugt höheres Rentenalter statt Erhöh…,saalabstimmung thema demografie arbeitsmarkt mehrheit bevorzugen hoch rentenalter statt erhöh,,,,,,,"{'Saalabstimmung': 0, 'am': 0, 'zum': 0.05, 'Thema': 0, 'Demografie': 0, 'und': 0.03, 'Arbeitsmarkt': 0.07, 'die': 0.05, 'Mehrheit': 0.18, 'bevorzugt': 0, 'höheres': 0.35, 'Rentenalter': 1.0, 'statt': 0.215, 'Erhöh': 0.42, '…': 0}",positive,"[0.12355065, 0.029686688, 0.8467627]",,,,,,,,,,,,,,,,,,,positive
100.0,100.0,100.0,1.0,neutral,"Schon 5 Jahre. MannoMann! damals war ich noch Single. Heute bin ich verlobt und es wäre schön, wenn ich vor dem Rentenalter heiraten dürfte. Heiraten. Nicht verpartnern. Ich will den selben rechtlichen Schutz, den ich auch als Ehefrau eines Mannes geniessen würde. #Liebeistliebe https://t.co/EdGYEOKk8G",schon jahre mannomann damals single heute verloben schön rentenalter heiraten dürfen heiraten verpartnern selben rechtlich schutz ehefrau mannes geniessen liebeistliebe,,,,,,,"{'Schon': 0.18, 'Jahre': 0.07, 'MannoMann': 0, 'damals': 0.03, 'war': 0, 'ich': 0.01, 'noch': 0, 'Single': 0.02, 'Heute': 0.04, 'bin': 0, 'verlobt': 0.04, 'und': 0.03, 'es': 0.03, 'wäre': 0.01, 'schön': 0.18, 'wenn': 0.2, 'vor': 1.0, 'dem': 0.02, 'Rentenalter': 0.975, 'heiraten': 0.11, 'dürfte': 0, 'Heiraten': 0.11, 'Nicht': 0.04, 'verpartnern': 0.04, 'Ich': 0.01, 'will': 0, 'den': 0.02, 'selben': 0.05, 'rechtlichen': 0.08, 'Schutz': 0.09, 'auch': 0, 'als': 0.04, 'Ehefrau': 0.02, 'eines': 0, 'Mannes': 0.02, 'geniessen': 0.04, 'würde': 0.01, 'Liebeistliebe': 0.045}",neutral,"[0.9721531, 0.008333763, 0.019513119]",,,,,,,,,,,,,,,,,,,positive
100.0,100.0,86.0,0.7,neutral,RT @grunliberale: Das Ja zum #Vaterschaftsurlaub ist ein wichtiger Schritt in die richtige Richtung. Wir verlangen eine #Elternzeit von 14…,ja vaterschaftsurlaub wichtig schritt richtige richtung verlangen elternzeit,,,,,,,,,,"{'Das': 0.04, 'Ja': 0, 'zum': 0.05, 'Vaterschaftsurlaub': 1.0, 'ist': 0.1, 'ein': 0, 'wichtiger': 0.11, 'Schritt': 0.1, 'in': 0.05, 'die': 0.04, 'richtige': 0.09, 'Richtung': 0.08, 'Wir': 0.73, 'verlangen': 0.06, 'eine': 0, 'Elternzeit': 0.61, 'von': 0, '…': 0}",neutral,"[0.6096362, 0.04763521, 0.34272856]",,,,,,,,,,,,,,,,positive
50.0,75.0,57.0,0.0,neutral,"RT @AngeleFlorine: Loooos 💪🏼 #Individualbesteuerung, bezahlbare #Kinderbetreuung &amp; #Elternzeit bzw. #Vaterschaftsurlaub  JETZT https://t.co…",loooos individualbesteuerung bezahlbare kinderbetreuung amp elternzeit bzw vaterschaftsurlaub,"{'Loooos': 0.23, 'Individualbesteuerung': 0.11, 'bezahlbare': 0, 'Kinderbetreuung': 1.0, 'amp': 0.09, 'Elternzeit': 0.05, 'bzw.': 0, 'Vaterschaftsurlaub': 0.06, 'JETZT': 0.07}",positive,"[0.0006137306, 0.001088456, 0.99829787]",,,,,,,"{'Loooos': 0.14, 'Individualbesteuerung': 0.04, 'bezahlbare': 0, 'Kinderbetreuung': 0.07, 'amp': 0.03, 'Elternzeit': 0.53, 'bzw.': 0, 'Vaterschaftsurlaub': 1.0, 'JETZT': 1.0}",neutral,"[0.49650946, 0.15347686, 0.35001367]",,,,,,,,,,,,,,,,neutral
50.0,75.0,57.0,0.0,negative,"RT @cybersandwich: Indem Ihr den Zugang zur Fortpflanzungsmedizin ausschliesst, zementiert Ihr weiterhin in diskriminierender Weise eine Zw…",zugang fortpflanzungsmedizin ausschliesst zementieren weiterhin diskriminierend weisen zw,,,,,,,,,,,,,"{'Indem': 0.55, 'Ihr': 0, 'den': 0, 'Zugang': 0.22, 'zur': 0.05, 'Fortpflanzungsmedizin': 0.19, 'ausschliesst': 0, 'zementiert': 0, 'weiterhin': 0, 'in': 0.04, 'diskriminierender': 0.31, 'Weise': 0, 'eine': 0, 'Zw': 0, '…': 0}",neutral,"[0.55795306, 0.055068463, 0.38697845]",,,,,,,,,,,,,neutral
50.0,75.0,57.0,0.0,neutral,"@_maltbunt_ Z. Bsp das Recht auf gemeinsame Adoption, Fortpflanzungsmedizin oder Wittwenrende ....",z bsp recht gemeinsam adoption fortpflanzungsmedizin wittwenrende,,,,,,,,,,,,,"{'Z.': 0, 'Bsp': 0, 'das': 0, 'Recht': 0, 'auf': 0, 'gemeinsame': 0, 'Adoption': 0.8, 'Fortpflanzungsmedizin': 0.15000000000000002, 'oder': 0.37, 'Wittwenrende': 0, '....': 0}",positive,"[0.012514284, 0.0015187407, 0.985967]",,,,,,,,,,,,,neutral
50.0,75.0,57.0,0.0,neutral,"RT @Tamarafuniciell: @JupiterKallisto @Blickch Die Themen, die Frauen betreffen wurden ausgelassen: der Zugang zur Fortpflanzungsmedizin, d…",themen frauen betreffen auslassen zugang fortpflanzungsmedizin d,,,,,,,,,,,,,"{'Die': 0.25, 'Themen': 0, 'die': 0.25, 'Frauen': 0.16, 'betreffen': 0, 'wurden': 0, 'ausgelassen': 0.225, 'der': 0.25, 'Zugang': 0.56, 'zur': 0.225, 'Fortpflanzungsmedizin': 0.18, 'd': 0.24, '…': 0}",positive,"[0.24854867, 0.04478485, 0.7066665]",,,,,,,,,,,,,neutral
50.0,75.0,57.0,0.0,neutral,RT @BPWSwitzerland: Die BPW Frauen engagieren sich an vorderster Front für die Lohngleichheit! Der Nationalrat trägt nächste Woche die Vera…,bpw frauen engagieren vorder front lohngleichheit nationalrat tragen nächst woche vera,,,,,,,,,,,,,,,,"{'Die': 0.09, 'BPW': 0.22, 'Frauen': 0.27, 'engagieren': 0, 'sich': 0, 'an': 0, 'vorderster': 0, 'Front': 0, 'für': 0, 'die': 0.09, 'Lohngleichheit': 0.96, 'Der': 0.09, 'Nationalrat': 0.265, 'trägt': 0, 'nächste': 0.07, 'Woche': 0.12, 'Vera': 0.08, '…': 0}",positive,"[0.0048615946, 0.0016389451, 0.9934995]",,,,,,,,,,neutral
50.0,75.0,57.0,0.0,neutral,RT @alliance_F: #Nichtmeinständerat? Morgen geht’s in die 2. Runde der #Lohngleichheit-Debatte im Ständerat. Kriegen die bürgerlichen Herre…,nichtmeinständerat morgen gehen s runden lohngleichheit debatte ständerat kriegen bürgerlich herre,,,,,,,,,,,,,,,,"{'Nichtmeinständerat': 0, 'Morgen': 0.08, 'geht': 0, '’s': 0, 'in': 0.07, 'die': 0.49, '2.': 0, 'Runde': 0.08, 'der': 0.49, 'Lohngleichheit-Debatte': 0.21250000000000002, 'im': 0, 'Ständerat': 0.0925, 'Kriegen': 0, 'bürgerlichen': 0, 'Herre': 0, '…': 0}",neutral,"[0.9323963, 0.0049516927, 0.06265195]",,,,,,,,,,neutral
50.0,75.0,57.0,0.0,neutral,RT @alliance_F: #Lohngleichheit: Morgen berät die Kommission erneut über die Beseitigung von geschlechterdiskriminierenden Löhnen. Jetzt ze…,lohngleichheit morgen beraten kommission erneut beseitigung geschlechterdiskriminierenden löhnen ze,,,,,,,,,,,,,,,,"{'Lohngleichheit': 0.7, 'Morgen': 0.5, 'berät': 0, 'die': 0.05, 'Kommission': 0.14, 'erneut': 0, 'über': 0, 'Beseitigung': 0.09, 'von': 0, 'geschlechterdiskriminierenden': 0.075, 'Löhnen': 0.06, 'Jetzt': 0.11, 'ze': 0, '…': 0}",neutral,"[0.6363946, 0.0074490174, 0.3561563]",,,,,,,,,,neutral
50.0,75.0,57.0,0.0,neutral,RT @BielBienne_off: Die Stadt Biel unterzeichnet die Charta für #Lohngleichheit im öffentlichen Sektor. Als #Arbeitgeberin nimmt die Stadt…,stadt biel unterzeichnen charta lohngleichheit öffentlich sektor arbeitgeberin nehmen stadt,,,,,,,,,,,,,,,,"{'Die': 0.06, 'Stadt': 0.06, 'Biel': 0.17, 'unterzeichnet': 0, 'die': 0.06, 'Charta': 0.59, 'für': 1.0, 'Lohngleichheit': 0.9550000000000001, 'im': 0, 'öffentlichen': 0.11, 'Sektor': 0.18, 'Als': 0, 'Arbeitgeberin': 0.11, 'nimmt': 0.1, '…': 0}",positive,"[0.1684594, 0.0076571372, 0.82388353]",,,,,,,,,,neutral
100.0,100.0,100.0,1.0,neutral,"Es scheint, als hätte der #Ständerat was gut zu machen. Die Sache mit dem Lohn kriegen wir auch noch hin.
#Lohngleichheit #geschlechterkonkordanz #bundesrätinnen https://t.co/4aaWzduBNZ",scheinen ständerat gut sache lohn kriegen lohngleichheit geschlechterkonkordanz bundesrätinnen,,,,,,,,,,,,,,,,"{'Es': 0, 'scheint': 0.05, 'als': 0, 'hätte': 0, 'der': 0.11, 'Ständerat': 0.037500000000000006, 'was': 0, 'gut': 0, 'zu': 0.03, 'machen': 0.03, 'Die': 0.11, 'Sache': 0, 'mit': 0, 'dem': 0.07, 'Lohn': 0, 'kriegen': 0, 'wir': 0, 'auch': 0, 'noch': 0, 'hin': 0, 'Lohngleichheit': 0.56, 'geschlechterkonkordanz': 0.315, 'bundesrätinnen': 0.175}",neutral,"[0.6824852, 0.019107908, 0.2984069]",,,,,,,,,,positive
50.0,75.0,57.0,0.0,neutral,"Frankreich kann, was die Schweiz anfeblich nicht können soll...
#Lohngleichheit https://t.co/siyI2ZmlCB",frankreich schweiz anfeblich lohngleichheit,,,,,,,,,,,,,,,,"{'Frankreich': 0.15, 'kann': 0.12, 'was': 0, 'die': 0, 'Schweiz': 0.15, 'anfeblich': 0, 'nicht': 0.09, 'können': 0.08499999999999999, 'soll': 0, '...': 0, 'Lohngleichheit': 0.71}",positive,"[0.005780722, 0.0013661011, 0.9928532]",,,,,,,,,,neutral
100.0,100.0,100.0,1.0,neutral,RT @BPWSwitzerland: Gut besuchter Anlass mit @ChristaMarkwald zur Lohngleichheit vom BPW Club Bern und der Berner Frauenzentrale mit @cesse…,gut besucht anlass lohngleichheit bpw club bern berner frauenzentrale,,,,,,,,,,,,,,,,"{'Gut': 0, 'besuchter': 0, 'Anlass': 0, 'mit': 0.1, 'zur': 0.07, 'Lohngleichheit': 1.0, 'vom': 0.21, 'BPW': 0.15, 'Club': 0.11, 'Bern': 0.05, 'und': 0.1, 'der': 0.07, 'Berner': 0, 'Frauenzentrale': 0, '…': 0}",positive,"[0.0028508117, 0.0010414806, 0.99610776]",,,,,,,,,,positive
100.0,100.0,86.0,0.7,neutral,"Zitat aus dem heutigen BPW-Anlass: ""die Lohnunterschiede können wirtschaftsfördernd und unbürokratisch behoben werden, in dem die Männerlöhne einfach mal um 20% gekürzt werden."" Das ist doch mal ein Ansatz für die Ständerätliche Kommission! 😁
@BPWSwitzerland #Lohngleichheit",zitat heutig bpw anlass lohnunterschiede wirtschaftsfördernd unbürokratisch beheben männerlöhne einfach mal kürzen mal ansatz ständerätliche kommission lohngleichheit,,,,,,,,,,,,,,,,"{'Zitat': 0.06, 'aus': 0, 'dem': 0.06, 'heutigen': 0.03, 'BPW-Anlass': 0.04, 'die': 0.06, 'Lohnunterschiede': 0.02, 'können': 0.02, 'wirtschaftsfördernd': 0.045, 'und': 0.03, 'unbürokratisch': 0.15, 'behoben': 0, 'werden': 0, 'in': 0.01, 'Männerlöhne': 0.03, 'einfach': 0, 'mal': 0, 'um': 0.02, 'gekürzt': 0, 'Das': 0.06, 'ist': 0.03, 'doch': 0, 'ein': 0, 'Ansatz': 0, 'für': 0.05, 'Ständerätliche': 0, 'Kommission': 0.12, 'Lohngleichheit': 0.55}",positive,"[0.07572373, 0.0033743759, 0.92090195]",,,,,,,,,,positive
50.0,75.0,57.0,0.0,neutral,"Als junge aufstrebende Kaderfrau habe ich keine Worte für das Nicht-Handeln des mehrheitlich ergrauten männlichen Ständerats. Da kann man nur Taten folgen lassen.
#wirsinddochkeineBananenrepublik #jetzterstrecht  #thefutureisfemale #wahlkampf #lohnverhandlung #Lohngleichheit https://t.co/h2os3wINbb",junge aufstrebend kaderfrau worte handeln mehrheitlich ergrauten männlich ständerats taten folgen lassen wirsinddochkeinebananenrepublik jetzterstrecht thefutureisfemale wahlkampf lohnverhandlung lohngleichheit,,,,,,,,,,,,,,,,"{'Als': 0, 'junge': 0, 'aufstrebende': 0.02, 'Kaderfrau': 0, 'habe': 0.02, 'ich': 0.02, 'keine': 0, 'Worte': 0.03, 'für': 0.02, 'das': 0, 'Nicht-Handeln': 0, 'des': 0, 'mehrheitlich': 0.03, 'ergrauten': 0, 'männlichen': 0.02, 'Ständerats': 0.0275, 'Da': 0, 'kann': 0.07, 'man': 0, 'nur': 0.05, 'Taten': 0.04, 'folgen': 0.03, 'lassen': 0, 'wirsinddochkeineBananenrepublik': 0.02, 'jetzterstrecht': 0, 'thefutureisfemale': 0.39, 'wahlkampf': 0.155, 'lohnverhandlung': 0.38, 'Lohngleichheit': 0}",neutral,"[0.6692176, 0.16643423, 0.16434826]",,,,,,,,,,neutral
50.0,75.0,57.0,0.0,neutral,"RT @fschoeni: Nägel mit Köpfen für #Klimaschutz und #Steuersenkung dank @dtruessel, @glp_BE und viel Zustimmung von links und rechts! https…",nägel köpfen klimaschutz steuersenkung danken zustimmung links rechts https,,,,,,,,,,,,,,,,,,,"{'Nägel': 0, 'mit': 0, 'Köpfen': 0, 'für': 0.12, 'Klimaschutz': 0.095, 'und': 0.16, 'Steuersenkung': 0.15, 'dank': 0, 'viel': 0, 'Zustimmung': 0.27, 'von': 0.18, 'links': 0, 'rechts': 0.17, 'https': 1.0, '…': 0}",positive,"[0.028269732, 0.0065358444, 0.9651944]",,,,,,,neutral
50.0,75.0,57.0,0.0,neutral,"An die Digitals hier: wie beurteilt ihr die E-Voting-Geschichte?
#evoting 
«Alle E-Voting-Systeme der Schweiz sind unterwandert» https://t.co/WpCOVOu8Rj",digitals beurteilen e voting geschichte evoting all e voting systeme schweiz unterwandern,,,,,,,,,,,,,,,,,,,,,,"{'An': 0, 'die': 0.03, 'Digitals': 0.06, 'hier': 0.05, 'wie': 0.06, 'beurteilt': 0, 'ihr': 0, 'E-Voting-Geschichte': 0.05, 'evoting': 0, '«': 0, 'Alle': 0, 'E-Voting-Systeme': 0, 'der': 0, 'Schweiz': 0, 'sind': 0, 'unterwandert': 0, '»': 0}",neutral,"[0.6971922, 0.2760743, 0.026733562]",,,,neutral
100.0,100.0,100.0,1.0,neutral,RT @PVuichard: Eigentlich geht es am #WEF18 darum innovative Ideen für vermehrten Umweltschutz zu finden - aber alle reden lieber über Trum…,eigentlich gehen wef18 darum innovative ideen vermehren umweltschutz finden all reden lieb trum,,,,,,,,,,,,,,,,,,,,,,,,,"{'Eigentlich': 0.14, 'geht': 0, 'es': 0.12, 'am': 0, 'WEF18': 0.16, 'darum': 0, 'innovative': 0.88, 'Ideen': 0.59, 'für': 0.57, 'vermehrten': 0, 'Umweltschutz': 0.735, 'zu': 0.06, 'finden': 0, 'aber': 0.3, 'alle': 0.1, 'reden': 0, 'lieber': 0, 'über': 0, 'Trum': 0.09, '…': 0}",positive,"[0.019099586, 0.020367142, 0.96053326]",positive
