answer_five,answer_four,answer_seven,polarity,sentiment_gs,tweet,tweet_tokens,absa_token_weights_3389,absa_sentiment_3389,absa_scores_3389,absa_token_weights_3417,absa_sentiment_3417,absa_scores_3417,absa_token_weights_3431,absa_sentiment_3431,absa_scores_3431,absa_token_weights_3436,absa_sentiment_3436,absa_scores_3436,sentiment_tb
100.0,100.0,100.0,1.0,neutral,"@MinorLili @mscpublizist @NZZ Klimaschutz, Gesundheitswesen, Kinderbetreuung, gemeinnütziges Wohnen. All diese Sachen, wofür sich nur Minderheiten und Randgruppen interessieren und deshalb nicht im Fokus der @NZZ stehen.",klimaschutz gesundheitswesen kinderbetreuung gemeinnützig wohnen all sachen wofür minderheiten randgruppen interessieren deshalb fokus stehen,"{'Klimaschutz': 0.155, 'Gesundheitswesen': 0.28, 'Kinderbetreuung': 1.0, 'gemeinnütziges': 0, 'Wohnen': 0, 'All': 0.1, 'diese': 0, 'Sachen': 0.17, 'wofür': 0, 'sich': 0, 'nur': 0.1, 'Minderheiten': 0.03, 'und': 0.03, 'Randgruppen': 0.04, 'interessieren': 0.03, 'deshalb': 0, 'nicht': 0.06, 'im': 0, 'Fokus': 0.02, 'der': 0.01, 'stehen': 0}",positive,"[0.006851757, 0.0059751174, 0.9871731]",,,,,,,,,,positive
100.0,100.0,100.0,1.0,neutral,"RT @al_zuerich: Endlich realisiert auch @tagi, dass Hochhäuser im gemeinnützigen Wohnungsbau nicht das Gelbe vom Ei sind und der Genossensc…",endlich realisieren hochhäuser gemeinnützig wohnungsbau gelbe ei genossensc,,,,"{'Endlich': 0.11, 'realisiert': 0.59, 'auch': 0, 'dass': 0.18, 'Hochhäuser': 0, 'im': 0, 'gemeinnützigen': 0, 'Wohnungsbau': 0.56, 'nicht': 1.0, 'das': 0.18, 'Gelbe': 1.0, 'vom': 0.05, 'Ei': 0, 'sind': 0.39, 'und': 0.15, 'der': 0.05, 'Genossensc': 0, '…': 0}",neutral,"[0.81251955, 0.09787187, 0.08960861]",,,,,,,positive
75.0,100.0,86.0,0.5,negative,RT @al_zuerich: Die @al_zuerich ist eine dezidierte Befürworterin des kommunalen Wohnungsbaus. Sagt aber am 9.2. trotzdem Nein zum massiv ü…,dezidieren befürworterin kommunal wohnungsbaus sagen trotzdem nein massiv ü,,,,"{'Die': 0, 'ist': 0.19, 'eine': 0, 'dezidierte': 0, 'Befürworterin': 0, 'des': 0, 'kommunalen': 0, 'Wohnungsbaus': 1.0, 'Sagt': 0.11, 'aber': 0.17, 'am': 0, '9.2.': 0, 'trotzdem': 0, 'Nein': 0.05, 'zum': 0.05, 'massiv': 0, 'ü': 0, '…': 0}",positive,"[0.048088577, 0.008659216, 0.9432522]",,,,,,,positive
100.0,100.0,100.0,1.0,negative,RT @al_zuerich: Klartext im @tagesanzeiger zum #Kochareal: JA zum gemeinnützigen Wohnungsbau und NEIN zur Trötzli-Initiative der FDP. @NZZ…,klartext kochareal ja gemeinnützig wohnungsbau nein trötzli initiative fdp,,,,"{'Klartext': 0.11, 'im': 0, 'zum': 0.185, 'Kochareal': 0.32, 'JA': 0.44, 'gemeinnützigen': 0, 'Wohnungsbau': 1.0, 'und': 0.44, 'NEIN': 0.31, 'zur': 0.185, 'Trötzli-Initiative': 0, 'der': 0.19, 'FDP': 0.2, '…': 0}",positive,"[0.0688747, 0.010941818, 0.9201835]",,,,,,,positive
100.0,100.0,86.0,0.7,neutral,"Ich habe soeben das Manifest für ein Grundrecht auf Einbürgerung unterschrieben. Mach mit und unterschreibe auch. Mit unserer Unterstützung bringen wir endlich Bewegung ins Schweizer Bürger_innenrecht, denn dafür ist es höchste Zeit. https://t.co/lR0BPdQev3",soeben manifest grundrecht einbürgerung unterschreiben mach unterschreiben unterstützung bringen endlich bewegung schweizer bürger_innenrecht dafür hoch zeit,,,,,,,"{'Ich': 0.04, 'habe': 0.04, 'soeben': 0.05, 'das': 0.03, 'Manifest': 0, 'für': 0.02, 'ein': 0, 'Grundrecht': 0.765, 'auf': 0, 'Einbürgerung': 1.0, 'unterschrieben': 0.15, 'Mach': 0, 'mit': 0.03, 'und': 0.05, 'unterschreibe': 0.09, 'auch': 0, 'Mit': 0.03, 'unserer': 0.02, 'Unterstützung': 0.06, 'bringen': 0, 'wir': 0, 'endlich': 0, 'Bewegung': 0, 'ins': 0, 'Schweizer': 0.03, 'Bürger_innenrecht': 0.125, 'denn': 0, 'dafür': 0, 'ist': 0.02, 'es': 0.02, 'höchste': 0, 'Zeit': 0.03}",positive,"[0.01790249, 0.0021947585, 0.9799027]",,,,positive
100.0,100.0,100.0,1.0,negative,"Gestern, liebe Kinder, musste ich sehr explizit werden im #GRZH. Menschen, die ihre #Pass qua Geburt geschenkt bekommen haben, wollten den Preis für die #Einbürgerung nicht senken. Weil: Was nicht kostet, nichts Wert ist. #Doppelmoral pur! 🤮
https://t.co/uVekSfPxCm",gestern lieb kinder explizit grzh menschen pass qua geburt schenken bekommen preis einbürgerung senken kosten wert doppelmoral pur,,,,,,,"{'Gestern': 0.03, 'liebe': 0, 'Kinder': 0.03, 'musste': 0.02, 'ich': 0.02, 'sehr': 0.02, 'explizit': 0.04, 'werden': 0, 'im': 0, 'GRZH': 0.04, 'Menschen': 0.04, 'die': 0.05, 'ihre': 0.03, 'Pass': 0.03, 'qua': 0, 'Geburt': 0.06, 'geschenkt': 0.02, 'bekommen': 0.03, 'haben': 0.03, 'wollten': 0.03, 'den': 0.05, 'Preis': 0.09, 'für': 0.3, 'Einbürgerung': 1.0, 'nicht': 0.02, 'senken': 0, 'Weil': 0.05, 'Was': 0, 'kostet': 0, 'nichts': 0, 'Wert': 0, 'ist': 0.02, 'Doppelmoral': 0.05, 'pur': 0, '🤮': 0}",neutral,"[0.7079549, 0.22502606, 0.06701903]",,,,positive
50.0,75.0,57.0,0.0,neutral,"@wylerrebekka @claudio_schmid Punktuelle Geschenke annehmen, um strukturelle Steuersenkungen durchzuwinken? #ichbindochnichtblöd https://t.co/vnuY0wKqmH",punktuelle geschenke annehmen strukturell steuersenkungen durchzuwinken ichbindochnichtblöd,,,,,,,,,,"{'Punktuelle': 0, 'Geschenke': 0.14, 'annehmen': 0, 'um': 0, 'strukturelle': 0.15, 'Steuersenkungen': 0.33, 'durchzuwinken': 0.26, 'ichbindochnichtblöd': 0}",neutral,"[0.95979947, 0.0072903438, 0.032910254]",neutral
100.0,100.0,100.0,0.85,neutral,"#Wahltag ist #Zahltag:

❌ Für genügende KK-Prämien-Unterstützung garantieren
❌ Stadtspitäler fair finanzieren
❌ Geflüchtete menschenwürdig behandeln

✅ «Unerwartet» im Geld schwimmen
✅ Steuersenkungen planen

Darum: Liste 8 wählen. #KRWahl19. #Wahlen https://t.co/KrQcTEaPJ0",wahltag zahltag genügend kk prämien unterstützung garantieren stadtspitäler fair finanzieren geflüchtete menschenwürdig behandeln unerwartet geld schwimmen steuersenkungen planen darum liste wählen krwahl19 wahlen,,,,,,,,,,"{'Wahltag': 0.03, 'ist': 0.04, 'Zahltag': 0, 'Für': 0.05, 'genügende': 0.03, 'KK-Prämien-Unterstützung': 0.0325, 'garantieren': 0.05, 'Stadtspitäler': 0.025, 'fair': 0, 'finanzieren': 0, 'Geflüchtete': 0.07, 'menschenwürdig': 0, 'behandeln': 0.24, '«': 0, 'Unerwartet': 0, '»': 0, 'im': 0, 'Geld': 0, 'schwimmen': 0, 'Steuersenkungen': 0, 'planen': 0, 'Darum': 0, 'Liste': 0, 'wählen': 0, 'KRWahl19.': 0, 'Wahlen': 0}",neutral,"[0.9119537, 0.035645925, 0.05240043]",positive
