answer_five,answer_four,answer_seven,polarity,sentiment_gs,tweet,tweet_tokens,absa_token_weights_3414,absa_sentiment_3414,absa_scores_3414,absa_token_weights_3450,absa_sentiment_3450,absa_scores_3450,absa_token_weights_3466,absa_sentiment_3466,absa_scores_3466,absa_token_weights_3467,absa_sentiment_3467,absa_scores_3467,absa_token_weights_3474,absa_sentiment_3474,absa_scores_3474,absa_token_weights_3478,absa_sentiment_3478,absa_scores_3478,sentiment_tb
100.0,100.0,100.0,0.9,neutral,CVP / PDC / PPD - Der Nationalrat hat soeben der CVP-Lösung von zwei Wochen Vaterschaftsurlaub zugestimmt! Zwei Wochen ermöglichen eine bessere Vereinbarkeit von Familie und Beruf und sind auch für KMU tragbar. https://t.co/t0oDlkCTX7,cvp pdc ppd nationalrat soeben cvp lösung zwei wochen vaterschaftsurlaub zustimmen zwei wochen ermöglichen gut vereinbarkeit familie beruf kmu tragbar,"{'CVP': 1.0, 'PDC': 0.14, 'PPD': 0.12, 'Der': 0.49, 'Nationalrat': 0.15000000000000002, 'hat': 0, 'soeben': 0.06, 'der': 0.49, 'CVP-Lösung': 1.0, 'von': 0, 'zwei': 0.05, 'Wochen': 0.15, 'Vaterschaftsurlaub': 0.48, 'zugestimmt': 0, 'Zwei': 0.05, 'ermöglichen': 0.18, 'eine': 0, 'bessere': 0.07, 'Vereinbarkeit': 0, 'Familie': 0, 'und': 0.16, 'Beruf': 0, 'sind': 0.19, 'auch': 0.07, 'für': 0.09, 'KMU': 0, 'tragbar': 0}",positive,"[0.018752672, 0.0033760823, 0.97787124]",,,,,,,,,,,,,,,,positive
50.0,75.0,57.0,0.0,neutral,RT @CVP_PDC: Die #CVP setzt auf einheimische erneuerbare Energie und denkt auch an künftige Generationen. Das ist Umweltpolitik mit Köpfche…,cvp setzen einheimisch erneuerbare energie denken künftig generationen umweltpolitik köpfche,,,,"{'Die': 0.07, 'CVP': 0.12, 'setzt': 0, 'auf': 0.24, 'einheimische': 1.0, 'erneuerbare': 1.0, 'Energie': 0.43, 'und': 0.19, 'denkt': 0.16, 'auch': 0.21, 'an': 0, 'künftige': 0.13, 'Generationen': 0.17, 'Das': 0.07, 'ist': 0.03, 'Umweltpolitik': 0.09, 'mit': 0.04, 'Köpfche': 0, '…': 0}",positive,"[0.0045238836, 0.001803144, 0.99367297]",,,,,,,,,,,,,neutral
75.0,100.0,86.0,0.5,neutral,"CVP / PDC / PPD - Die CVP setzt auf einheimische erneuerbare Energie und denkt an Greta und an zukünftige Generationen. Mehr Infos zur Klimapolitik der CVP ➡️ https://t.co/HU22rzq1Mn 

Wählen ist die beste Demo. Auch in der Klimapolitik. https://t.co/Sel0dFawgG",cvp pdc ppd cvp setzen einheimisch erneuerbare energie denken greta zukünftig generationen mehr infos klimapolitik cvp wählen gut demo klimapolitik,,,,"{'CVP': 0.04, 'PDC': 0.06, 'PPD': 0.05, 'Die': 0.04, 'setzt': 0, 'auf': 0.02, 'einheimische': 1.0, 'erneuerbare': 1.0, 'Energie': 0.43, 'und': 0.06, 'denkt': 0.17, 'an': 0, 'Greta': 0.06, 'zukünftige': 0.09, 'Generationen': 0.12, 'Mehr': 0.03, 'Infos': 0, 'zur': 0.04, 'Klimapolitik': 0, 'der': 0, '️': 0, 'Wählen': 0, 'ist': 0, 'die': 0, 'beste': 0, 'Demo': 0, 'Auch': 0, 'in': 0}",positive,"[0.010161104, 0.0032780569, 0.98656076]",,,,,,,,,,,,,positive
100.0,100.0,86.0,0.7,neutral,"RT @jcvp_sg: Nun gilt es, die IT-Bildungsoffensive schnell und konsequent umzusetzen. Unser Kanton muss fit für die Digitalisierung gemacht…",gelten it bildungsoffensive schnellen konsequent umsetzen kanton fit digitalisierung,,,,,,,"{'Nun': 0, 'gilt': 0, 'es': 0.01, 'die': 0.04, 'IT-Bildungsoffensive': 0.03, 'schnell': 0, 'und': 0.01, 'konsequent': 0, 'umzusetzen': 0.04, 'Unser': 0.11, 'Kanton': 0.11, 'muss': 0.02, 'fit': 0.46, 'für': 1.0, 'Digitalisierung': 0, 'gemacht': 0, '…': 0}",neutral,"[0.5065751, 0.01860126, 0.47482362]",,,,,,,,,,positive
75.0,100.0,86.0,0.5,neutral,"RT @CVP_GR: Die CVP setzt sich für die Digitalisierung, die Sicherheit, gute Verbindungen im öffentlichen Verkehr und weniger Bürokratie ei…",cvp setzen digitalisierung sicherheit gut verbindungen öffentlich verkehr wenig bürokratie ei,,,,,,,"{'Die': 0.5, 'CVP': 0.52, 'setzt': 0, 'sich': 0, 'für': 0, 'die': 0.5, 'Digitalisierung': 0, 'Sicherheit': 0.59, 'gute': 0, 'Verbindungen': 0, 'im': 0, 'öffentlichen': 0.15, 'Verkehr': 0, 'und': 0.24, 'weniger': 0, 'Bürokratie': 0.45, 'ei': 0, '…': 0}",positive,"[0.006862989, 0.0025661753, 0.9905709]",,,,"{'Die': 0.12, 'CVP': 0.08, 'setzt': 0, 'sich': 0, 'für': 0, 'die': 0.12, 'Digitalisierung': 0, 'Sicherheit': 1.0, 'gute': 0, 'Verbindungen': 0, 'im': 0, 'öffentlichen': 0.03, 'Verkehr': 0, 'und': 0.3, 'weniger': 0, 'Bürokratie': 0.07, 'ei': 0, '…': 0}",positive,"[0.002548604, 0.0013557922, 0.9960956]","{'Die': 0.12, 'CVP': 0.14, 'setzt': 0, 'sich': 0, 'für': 0, 'die': 0.12, 'Digitalisierung': 0, 'Sicherheit': 0.11, 'gute': 0, 'Verbindungen': 0, 'im': 0, 'öffentlichen': 0.04, 'Verkehr': 0, 'und': 0.26, 'weniger': 0, 'Bürokratie': 0.42, 'ei': 0, '…': 0}",negative,"[0.25470376, 0.49821067, 0.24708559]",positive
0.0,0.0,14.0,-0.7,negative,"RT @BinderMarianne: „Wer hats erfunden?
Pioniere der Umweltschutz-Gesetzgebung waren keine Linken. Dass die Schweiz den Umweltschutz früher…",wer hats erfinden pioniere umweltschutz gesetzgebung link schweiz umweltschutz früh,,,,,,,,,,"{'„': 0, 'Wer': 0, 'hats': 0, 'erfunden': 0, 'Pioniere': 0, 'der': 0, 'Umweltschutz-Gesetzgebung': 0, 'waren': 0, 'keine': 0, 'Linken': 0, 'Dass': 0, 'die': 0, 'Schweiz': 0, 'den': 0, 'Umweltschutz': 0, 'früher': 0, '…': 0}",neutral,"[0.7518494, 0.12785967, 0.12029092]",,,,,,,negative
0.0,0.0,14.0,-0.7,neutral,"RT @MullerAltermatt: Es gibt Parteien, die wollen den ""bürgerlichen Umweltschutz"" erfinden. Sorry,Leute, die @CVP_PDC hat das längst getan.…",geben parteien bürgerlich umweltschutz erfinden sorry leute längst tun,,,,,,,,,,"{'Es': 0, 'gibt': 0.08, 'Parteien': 0.18, 'die': 0.07, 'wollen': 0.18, 'den': 0.07, 'bürgerlichen': 0.23, 'Umweltschutz': 0.47, 'erfinden': 1.0, 'Sorry': 0.09, 'Leute': 0, 'hat': 0, 'das': 0.07, 'längst': 0.0225, 'getan': 0.05, '…': 0}",positive,"[0.41177398, 0.12497692, 0.4632491]",,,,,,,negative
75.0,100.0,86.0,0.5,neutral,"RT @CVP_GR: Die CVP setzt sich für die Digitalisierung, die Sicherheit, gute Verbindungen im öffentlichen Verkehr und weniger Bürokratie ei…",cvp setzen digitalisierung sicherheit gut verbindungen öffentlich verkehr wenig bürokratie ei,,,,,,,"{'Die': 0.5, 'CVP': 0.52, 'setzt': 0, 'sich': 0, 'für': 0, 'die': 0.5, 'Digitalisierung': 0, 'Sicherheit': 0.59, 'gute': 0, 'Verbindungen': 0, 'im': 0, 'öffentlichen': 0.15, 'Verkehr': 0, 'und': 0.24, 'weniger': 0, 'Bürokratie': 0.45, 'ei': 0, '…': 0}",positive,"[0.006862989, 0.0025661753, 0.9905709]",,,,"{'Die': 0.12, 'CVP': 0.08, 'setzt': 0, 'sich': 0, 'für': 0, 'die': 0.12, 'Digitalisierung': 0, 'Sicherheit': 1.0, 'gute': 0, 'Verbindungen': 0, 'im': 0, 'öffentlichen': 0.03, 'Verkehr': 0, 'und': 0.3, 'weniger': 0, 'Bürokratie': 0.07, 'ei': 0, '…': 0}",positive,"[0.002548604, 0.0013557922, 0.9960956]","{'Die': 0.12, 'CVP': 0.14, 'setzt': 0, 'sich': 0, 'für': 0, 'die': 0.12, 'Digitalisierung': 0, 'Sicherheit': 0.11, 'gute': 0, 'Verbindungen': 0, 'im': 0, 'öffentlichen': 0.04, 'Verkehr': 0, 'und': 0.26, 'weniger': 0, 'Bürokratie': 0.42, 'ei': 0, '…': 0}",negative,"[0.25470376, 0.49821067, 0.24708559]",positive
75.0,100.0,86.0,0.5,neutral,"RT @CVP_GR: Die CVP setzt sich für die Digitalisierung, die Sicherheit, gute Verbindungen im öffentlichen Verkehr und weniger Bürokratie ei…",cvp setzen digitalisierung sicherheit gut verbindungen öffentlich verkehr wenig bürokratie ei,,,,,,,"{'Die': 0.5, 'CVP': 0.52, 'setzt': 0, 'sich': 0, 'für': 0, 'die': 0.5, 'Digitalisierung': 0, 'Sicherheit': 0.59, 'gute': 0, 'Verbindungen': 0, 'im': 0, 'öffentlichen': 0.15, 'Verkehr': 0, 'und': 0.24, 'weniger': 0, 'Bürokratie': 0.45, 'ei': 0, '…': 0}",positive,"[0.006862989, 0.0025661753, 0.9905709]",,,,"{'Die': 0.12, 'CVP': 0.08, 'setzt': 0, 'sich': 0, 'für': 0, 'die': 0.12, 'Digitalisierung': 0, 'Sicherheit': 1.0, 'gute': 0, 'Verbindungen': 0, 'im': 0, 'öffentlichen': 0.03, 'Verkehr': 0, 'und': 0.3, 'weniger': 0, 'Bürokratie': 0.07, 'ei': 0, '…': 0}",positive,"[0.002548604, 0.0013557922, 0.9960956]","{'Die': 0.12, 'CVP': 0.14, 'setzt': 0, 'sich': 0, 'für': 0, 'die': 0.12, 'Digitalisierung': 0, 'Sicherheit': 0.11, 'gute': 0, 'Verbindungen': 0, 'im': 0, 'öffentlichen': 0.04, 'Verkehr': 0, 'und': 0.26, 'weniger': 0, 'Bürokratie': 0.42, 'ei': 0, '…': 0}",negative,"[0.25470376, 0.49821067, 0.24708559]",positive
